>>> 'Pkg.add("Bio")' log
INFO: Cloning cache of Bio from git://github.com/BioJulia/Bio.jl.git
INFO: Cloning cache of Combinatorics from git://github.com/JuliaMath/Combinatorics.jl.git
INFO: Cloning cache of IndexableBitVectors from git://github.com/BioJulia/IndexableBitVectors.jl.git
INFO: Cloning cache of IntervalTrees from git://github.com/BioJulia/IntervalTrees.jl.git
INFO: Cloning cache of PolynomialFactors from git://github.com/jverzani/PolynomialFactors.jl.git
INFO: Cloning cache of Roots from git://github.com/JuliaMath/Roots.jl.git
INFO: Installing AutoHashEquals v0.0.10
INFO: Installing BinDeps v0.4.7
INFO: Installing Bio v0.3.0
INFO: Installing Blosc v0.2.0
INFO: Installing BufferedStreams v0.3.0
INFO: Installing Calculus v0.2.0
INFO: Installing ColorTypes v0.2.12
INFO: Installing Colors v0.6.9
INFO: Installing Combinatorics v0.2.1
INFO: Installing DiffBase v0.0.4
INFO: Installing Distributions v0.11.1
INFO: Installing FileIO v0.2.2
INFO: Installing FixedPointNumbers v0.2.1
INFO: Installing ForwardDiff v0.3.4
INFO: Installing GZip v0.2.20
INFO: Installing HDF5 v0.7.3
INFO: Installing IndexableBitVectors v0.1.1
INFO: Installing IntervalTrees v0.1.0
INFO: Installing Iterators v0.3.0
INFO: Installing JLD v0.6.9
INFO: Installing LegacyStrings v0.2.0
INFO: Installing Libz v0.2.4
INFO: Installing LightGraphs v0.6.3
INFO: Installing LightXML v0.4.0
INFO: Installing NaNMath v0.2.2
INFO: Installing PDMats v0.5.6
INFO: Installing ParserCombinator v1.7.11
INFO: Installing PolynomialFactors v0.0.3
INFO: Installing Polynomials v0.1.2
INFO: Installing Primes v0.1.2
INFO: Installing Reexport v0.0.3
INFO: Installing Rmath v0.1.6
INFO: Installing Roots v0.3.0
INFO: Installing SHA v0.3.1
INFO: Installing StatsBase v0.12.0
INFO: Installing StatsFuns v0.4.0
INFO: Installing URIParser v0.1.8
INFO: Building Rmath
INFO: Building Blosc
INFO: Building HDF5
INFO: Building LightXML
INFO: Package database updated
INFO: METADATA is out-of-date — you may not have the latest version of Bio
INFO: Use `Pkg.update()` to get the latest versions of your packages

>>> 'Pkg.test("Bio")' log
Julia Version 0.4.7
Commit ae26b25 (2016-09-18 16:17 UTC)
Platform Info:
  System: Linux (x86_64-pc-linux-gnu)
  CPU: Intel(R) Xeon(R) CPU E3-1241 v3 @ 3.50GHz
  WORD_SIZE: 64
           Ubuntu 14.04.5 LTS
  uname: Linux 3.13.0-110-generic #157-Ubuntu SMP Mon Feb 20 11:54:05 UTC 2017 x86_64 x86_64
Memory: 2.9392738342285156 GB (616.59375 MB free)
Uptime: 7416.0 sec
Load Avg:  0.89794921875  0.9775390625  1.02392578125
Intel(R) Xeon(R) CPU E3-1241 v3 @ 3.50GHz: 
       speed         user         nice          sys         idle          irq
#1  3500 MHz     322300 s       7707 s      34322 s     304364 s         20 s
#2  3500 MHz     222648 s        308 s      31068 s     459766 s          0 s

  BLAS: libopenblas (USE64BITINT DYNAMIC_ARCH NO_AFFINITY Nehalem)
  LAPACK: libopenblas64_
  LIBM: libopenlibm
  LLVM: libLLVM-3.3
Environment:
  TERM = vt100
  LD_LIBRARY_PATH = :/usr/local/lib/
  PATH = /usr/local/sbin:/usr/local/bin:/usr/sbin:/usr/bin:/sbin:/bin:/usr/games:/usr/local/games:/home/vagrant/julia/bin/
  JAVA_HOME = /usr/lib/jvm/java-7-oracle
  HOME = /home/vagrant

Package Directory: /home/vagrant/.julia/v0.4
2 required packages:
 - Bio                           0.3.0
 - JSON                          0.8.3
37 additional packages:
 - AutoHashEquals                0.0.10
 - BinDeps                       0.4.7
 - Blosc                         0.2.0
 - BufferedStreams               0.3.0
 - Calculus                      0.2.0
 - ColorTypes                    0.2.12
 - Colors                        0.6.9
 - Combinatorics                 0.2.1
 - Compat                        0.19.0
 - DiffBase                      0.0.4
 - Distributions                 0.11.1
 - FileIO                        0.2.2
 - FixedPointNumbers             0.2.1
 - ForwardDiff                   0.3.4
 - GZip                          0.2.20
 - HDF5                          0.7.3
 - IndexableBitVectors           0.1.1
 - IntervalTrees                 0.1.0
 - Iterators                     0.3.0
 - JLD                           0.6.9
 - LegacyStrings                 0.2.0
 - Libz                          0.2.4
 - LightGraphs                   0.6.3
 - LightXML                      0.4.0
 - NaNMath                       0.2.2
 - PDMats                        0.5.6
 - ParserCombinator              1.7.11
 - PolynomialFactors             0.0.3
 - Polynomials                   0.1.2
 - Primes                        0.1.2
 - Reexport                      0.0.3
 - Rmath                         0.1.6
 - Roots                         0.3.0
 - SHA                           0.3.1
 - StatsBase                     0.12.0
 - StatsFuns                     0.4.0
 - URIParser                     0.1.8
INFO: Computing test dependencies for Bio...
INFO: Cloning cache of YAML from git://github.com/dcjones/YAML.jl.git
INFO: Installing BaseTestNext v0.2.2
INFO: Installing Codecs v0.3.0
INFO: Installing Dates v0.4.4
INFO: Installing YAML v0.1.10
INFO: Testing Bio
WARNING: New definition 
    write(Base.IO, ForwardDiff.Partials) at /home/vagrant/.julia/v0.4/ForwardDiff/src/partials.jl:57
is ambiguous with: 
    write(Base.Base64.Base64EncodePipe, AbstractArray{UInt8, 1}) at base64.jl:89.
To fix, define 
    write(Base.Base64.Base64EncodePipe, ForwardDiff.Partials{N<:Any, UInt8})
before the new definition.
WARNING: New definition 
    write(Base.IO, ForwardDiff.Partials) at /home/vagrant/.julia/v0.4/ForwardDiff/src/partials.jl:57
is ambiguous with: 
    write(Base.Base64.Base64EncodePipe, AbstractArray{UInt8, 1}) at base64.jl:89.
To fix, define 
    write(Base.Base64.Base64EncodePipe, ForwardDiff.Partials{N<:Any, UInt8})
before the new definition.
WARNING: New definition 
    write(Base.IO, ForwardDiff.Partials) at /home/vagrant/.julia/v0.4/ForwardDiff/src/partials.jl:57
is ambiguous with: 
    write(Base.Base64.Base64EncodePipe, AbstractArray{UInt8, 1}) at base64.jl:89.
To fix, define 
    write(Base.Base64.Base64EncodePipe, ForwardDiff.Partials{N<:Any, UInt8})
before the new definition.
WARNING: New definition 
    write(Base.IO, ForwardDiff.Partials) at /home/vagrant/.julia/v0.4/ForwardDiff/src/partials.jl:57
is ambiguous with: 
    write(Base.Base64.Base64EncodePipe, AbstractArray{UInt8, 1}) at base64.jl:89.
To fix, define 
    write(Base.Base64.Base64EncodePipe, ForwardDiff.Partials{N<:Any, UInt8})
before the new definition.
Test Summary: | Pass  Total
Alignments    |  297    297
Test Summary:     | Pass  Total
PairwiseAlignment |  212    212
Test Summary: | Pass  Total
Phylogenies   |  129    129
Test Summary:  | Pass  Total
Misc Functions |    6      6
Test Summary:     | Pass  Total
Dating algorithms |   10     10
Test Summary: | Pass  Total
Strand        |   16     16
Test Summary: | Pass  Total
Interval      |    6      6
Test Summary:      | Pass  Total
IntervalCollection |    7      7
Test Summary:        | Pass  Total
Alphanumeric Sorting |    8      8
Test Summary:  | Pass  Total
IntervalStream |   15     15
Cloning into '/home/vagrant/.julia/v0.4/Bio/test/BioFmtSpecimens'...
Test Summary:    | Pass  Total
Interval Parsing |   14     14
Test Summary: | Pass  Total
BigBed        |   13     13
Test Summary: | Pass  Total
Nucleotides   |  432    432
Test Summary: | Pass  Total
Aminoacids    |  293    293
Test Summary: |  Pass  Total
BioSequence   | 16448  16448
Test Summary:     | Pass  Total
ReferenceSequence |   31     31
Test Summary: | Pass  Total
Composition   |   64     64
Test Summary: | Pass  Total
Kmer          | 7507   7507
Test Summary: | Pass  Total
Search        |  191    191
Test Summary: | Pass  Total
Translation   |   12     12
Test Summary: | Pass  Total
Parsing       |  283    283
Test Summary:  | Pass  Total
Quality scores |   40     40
Test Summary: | Pass  Total
Model         |  242    242
Test Summary: | Pass  Total
Parsing       |  416    416
Test Summary: | Pass  Total
Writing       |  113    113
Test Summary: | Pass  Total
Spatial       |   32     32
BLAST+ blastn: Error During Test
  Test threw an exception of type Base.UVError
  Expression: typeof(blastn(na1,na2)) == Array{BLASTResult,1}
  could not spawn `blastn -query /tmp/tmpq0jsAq -subject /tmp/tmpTVwILE -outfmt 5`: no such file or directory (ENOENT)
   in _jl_spawn at process.jl:262
   in anonymous at process.jl:415
   in setup_stdio at process.jl:403
   in spawn at process.jl:414
   in open at process.jl:478
   in readbytes at process.jl:513
   in blastn at /home/vagrant/.julia/v0.4/Bio/src/tools/blast/blastcommandline.jl:89
   in blastn at /home/vagrant/.julia/v0.4/Bio/src/tools/blast/blastcommandline.jl:95
   in anonymous at /home/vagrant/.julia/v0.4/BaseTestNext/src/BaseTestNext.jl:160
   in do_test at /home/vagrant/.julia/v0.4/BaseTestNext/src/BaseTestNext.jl:181
   [inlined code] from /home/vagrant/.julia/v0.4/Bio/test/tools/runtests.jl:35
   in anonymous at no file:0
   in include at ./boot.jl:261
   in include_from_node1 at ./loading.jl:333
   [inlined code] from /home/vagrant/.julia/v0.4/Bio/test/runtests.jl:27
   in anonymous at no file:0
   in include at ./boot.jl:261
   in include_from_node1 at ./loading.jl:333
   in process_options at ./client.jl:280
   in _start at ./client.jl:378
BLAST+ blastn: Error During Test
  Test threw an exception of type Base.UVError
  Expression: typeof(blastn(na1,[na1,na2])) == Array{BLASTResult,1}
  could not spawn `blastn -query /tmp/tmpExe47Z -subject /tmp/tmpOHGMvl -outfmt 5`: no such file or directory (ENOENT)
   in _jl_spawn at process.jl:262
   in anonymous at process.jl:415
   in setup_stdio at process.jl:403
   in spawn at process.jl:414
   in open at process.jl:478
   in readbytes at process.jl:513
   in blastn at /home/vagrant/.julia/v0.4/Bio/src/tools/blast/blastcommandline.jl:89
   in blastn at /home/vagrant/.julia/v0.4/Bio/src/tools/blast/blastcommandline.jl:100
   in anonymous at /home/vagrant/.julia/v0.4/BaseTestNext/src/BaseTestNext.jl:160
   in do_test at /home/vagrant/.julia/v0.4/BaseTestNext/src/BaseTestNext.jl:181
   [inlined code] from /home/vagrant/.julia/v0.4/Bio/test/tools/runtests.jl:36
   in anonymous at no file:0
   in include at ./boot.jl:261
   in include_from_node1 at ./loading.jl:333
   [inlined code] from /home/vagrant/.julia/v0.4/Bio/test/runtests.jl:27
   in anonymous at no file:0
   in include at ./boot.jl:261
   in include_from_node1 at ./loading.jl:333
   in process_options at ./client.jl:280
   in _start at ./client.jl:378
BLAST+ blastn: Error During Test
  Test threw an exception of type Base.UVError
  Expression: typeof(blastn([na1,na2],[na1,na2])) == Array{BLASTResult,1}
  could not spawn `blastn -query /tmp/tmpPcfhZG -subject /tmp/tmptK20s2 -outfmt 5`: no such file or directory (ENOENT)
   in _jl_spawn at process.jl:262
   in anonymous at process.jl:415
   in setup_stdio at process.jl:403
   in spawn at process.jl:414
   in open at process.jl:478
   in readbytes at process.jl:513
   in blastn at /home/vagrant/.julia/v0.4/Bio/src/tools/blast/blastcommandline.jl:89
   in blastn at /home/vagrant/.julia/v0.4/Bio/src/tools/blast/blastcommandline.jl:114
   in anonymous at /home/vagrant/.julia/v0.4/BaseTestNext/src/BaseTestNext.jl:160
   in do_test at /home/vagrant/.julia/v0.4/BaseTestNext/src/BaseTestNext.jl:181
   [inlined code] from /home/vagrant/.julia/v0.4/Bio/test/tools/runtests.jl:37
   in anonymous at no file:0
   in include at ./boot.jl:261
   in include_from_node1 at ./loading.jl:333
   [inlined code] from /home/vagrant/.julia/v0.4/Bio/test/runtests.jl:27
   in anonymous at no file:0
   in include at ./boot.jl:261
   in include_from_node1 at ./loading.jl:333
   in process_options at ./client.jl:280
   in _start at ./client.jl:378
BLAST+ blastn: Error During Test
  Test threw an exception of type Base.UVError
  Expression: typeof(blastn(na1,nucldb,db=true)) == Array{BLASTResult,1}
  could not spawn `blastn -query /tmp/tmps6k5ho -db /home/vagrant/.julia/v0.4/Bio/test/BioFmtSpecimens/BLASTDB/f002 -outfmt 5`: no such file or directory (ENOENT)
   in _jl_spawn at process.jl:262
   in anonymous at process.jl:415
   in setup_stdio at process.jl:403
   in spawn at process.jl:414
   in open at process.jl:478
   in readbytes at process.jl:513
   in blastn at /home/vagrant/.julia/v0.4/Bio/src/tools/blast/blastcommandline.jl:87
   in blastn at /home/vagrant/.julia/v0.4/Bio/src/tools/blast/blastcommandline.jl:107
   in blastn at /home/vagrant/.julia/v0.4/Bio/src/tools/blast/blastcommandline.jl:105
   in anonymous at /home/vagrant/.julia/v0.4/BaseTestNext/src/BaseTestNext.jl:160
   in do_test at /home/vagrant/.julia/v0.4/BaseTestNext/src/BaseTestNext.jl:181
   [inlined code] from /home/vagrant/.julia/v0.4/Bio/test/tools/runtests.jl:38
   in anonymous at no file:0
   in include at ./boot.jl:261
   in include_from_node1 at ./loading.jl:333
   [inlined code] from /home/vagrant/.julia/v0.4/Bio/test/runtests.jl:27
   in anonymous at no file:0
   in include at ./boot.jl:261
   in include_from_node1 at ./loading.jl:333
   in process_options at ./client.jl:280
   in _start at ./client.jl:378
BLAST+ blastn: Error During Test
  Test threw an exception of type Base.UVError
  Expression: typeof(blastn(na1,fna)) == Array{BLASTResult,1}
  could not spawn `blastn -query /tmp/tmpUqwilK -subject /home/vagrant/.julia/v0.4/Bio/test/BioFmtSpecimens/FASTA/f002.fasta -outfmt 5`: no such file or directory (ENOENT)
   in _jl_spawn at process.jl:262
   in anonymous at process.jl:415
   in setup_stdio at process.jl:403
   in spawn at process.jl:414
   in open at process.jl:478
   in readbytes at process.jl:513
   in blastn at /home/vagrant/.julia/v0.4/Bio/src/tools/blast/blastcommandline.jl:89
   in blastn at /home/vagrant/.julia/v0.4/Bio/src/tools/blast/blastcommandline.jl:109
   in blastn at /home/vagrant/.julia/v0.4/Bio/src/tools/blast/blastcommandline.jl:105
   in anonymous at /home/vagrant/.julia/v0.4/BaseTestNext/src/BaseTestNext.jl:160
   in do_test at /home/vagrant/.julia/v0.4/BaseTestNext/src/BaseTestNext.jl:181
   [inlined code] from /home/vagrant/.julia/v0.4/Bio/test/tools/runtests.jl:39
   in anonymous at no file:0
   in include at ./boot.jl:261
   in include_from_node1 at ./loading.jl:333
   [inlined code] from /home/vagrant/.julia/v0.4/Bio/test/runtests.jl:27
   in anonymous at no file:0
   in include at ./boot.jl:261
   in include_from_node1 at ./loading.jl:333
   in process_options at ./client.jl:280
   in _start at ./client.jl:378
BLAST+ blastn: Error During Test
  Test threw an exception of type Base.UVError
  Expression: typeof(blastn(fna,nucldb,db=true)) == Array{BLASTResult,1}
  could not spawn `blastn -query /home/vagrant/.julia/v0.4/Bio/test/BioFmtSpecimens/FASTA/f002.fasta -db /home/vagrant/.julia/v0.4/Bio/test/BioFmtSpecimens/BLASTDB/f002 -outfmt 5`: no such file or directory (ENOENT)
   in _jl_spawn at process.jl:262
   in anonymous at process.jl:415
   in setup_stdio at process.jl:403
   in spawn at process.jl:414
   in open at process.jl:478
   in readbytes at process.jl:513
   in blastn at /home/vagrant/.julia/v0.4/Bio/src/tools/blast/blastcommandline.jl:87
   in blastn at /home/vagrant/.julia/v0.4/Bio/src/tools/blast/blastcommandline.jl:86
   in anonymous at /home/vagrant/.julia/v0.4/BaseTestNext/src/BaseTestNext.jl:160
   in do_test at /home/vagrant/.julia/v0.4/BaseTestNext/src/BaseTestNext.jl:181
   [inlined code] from /home/vagrant/.julia/v0.4/Bio/test/tools/runtests.jl:40
   in anonymous at no file:0
   in include at ./boot.jl:261
   in include_from_node1 at ./loading.jl:333
   [inlined code] from /home/vagrant/.julia/v0.4/Bio/test/runtests.jl:27
   in anonymous at no file:0
   in include at ./boot.jl:261
   in include_from_node1 at ./loading.jl:333
   in process_options at ./client.jl:280
   in _start at ./client.jl:378
Test Summary: | Error  Total
BLAST+ blastn |     6      6
ERROR: LoadError: LoadError: Some tests did not pass: 0 passed, 0 failed, 6 errored.
 in finish at /home/vagrant/.julia/v0.4/BaseTestNext/src/BaseTestNext.jl:385
 [inlined code] from /home/vagrant/.julia/v0.4/BaseTestNext/src/BaseTestNext.jl:559
 in anonymous at no file:0
 in include at ./boot.jl:261
 in include_from_node1 at ./loading.jl:333
 [inlined code] from /home/vagrant/.julia/v0.4/Bio/test/runtests.jl:27
 in anonymous at no file:0
 in include at ./boot.jl:261
 in include_from_node1 at ./loading.jl:333
 in process_options at ./client.jl:280
 in _start at ./client.jl:378
while loading /home/vagrant/.julia/v0.4/Bio/test/tools/runtests.jl, in expression starting on line 18
while loading /home/vagrant/.julia/v0.4/Bio/test/runtests.jl, in expression starting on line 26
=================================[ ERROR: Bio ]=================================

failed process: Process(`/home/vagrant/julia/bin/julia --check-bounds=yes --code-coverage=none --color=no /home/vagrant/.julia/v0.4/Bio/test/runtests.jl`, ProcessExited(1)) [1]

================================================================================
INFO: Removing BaseTestNext v0.2.2
INFO: Removing Codecs v0.3.0
INFO: Removing Dates v0.4.4
INFO: Removing YAML v0.1.10
ERROR: Bio had test errors
 in error at ./error.jl:21
 in test at pkg/entry.jl:803
 in anonymous at pkg/dir.jl:31
 in cd at file.jl:22
 in cd at pkg/dir.jl:31
 in test at pkg.jl:71
 in process_options at ./client.jl:257
 in _start at ./client.jl:378

>>> End of log
