>>> 'Pkg.add("Bio")' log
INFO: Cloning cache of Bio from https://github.com/BioJulia/Bio.jl.git
INFO: Cloning cache of Combinatorics from https://github.com/JuliaMath/Combinatorics.jl.git
INFO: Cloning cache of IndexableBitVectors from https://github.com/BioJulia/IndexableBitVectors.jl.git
INFO: Cloning cache of IntervalTrees from https://github.com/BioJulia/IntervalTrees.jl.git
INFO: Cloning cache of PolynomialFactors from https://github.com/jverzani/PolynomialFactors.jl.git
INFO: Cloning cache of Roots from https://github.com/JuliaMath/Roots.jl.git
INFO: Installing AutoHashEquals v0.1.1
INFO: Installing BGZFStreams v0.1.3
INFO: Installing BinDeps v0.4.7
INFO: Installing Bio v0.4.7
INFO: Installing Blosc v0.2.0
INFO: Installing BufferedStreams v0.3.2
INFO: Installing Calculus v0.2.2
INFO: Installing ColorTypes v0.3.5
INFO: Installing Colors v0.7.3
INFO: Installing Combinatorics v0.4.0
INFO: Installing DataStructures v0.5.3
INFO: Installing DiffBase v0.1.0
INFO: Installing Distributions v0.12.2
INFO: Installing EzXML v0.4.3
INFO: Installing FileIO v0.3.1
INFO: Installing FixedPointNumbers v0.3.5
INFO: Installing ForwardDiff v0.4.1
INFO: Installing GZip v0.3.0
INFO: Installing HDF5 v0.7.3
INFO: Installing IndexableBitVectors v0.1.1
INFO: Installing IntervalTrees v0.1.0
INFO: Installing Iterators v0.3.0
INFO: Installing JLD v0.6.10
INFO: Installing LegacyStrings v0.2.1
INFO: Installing Libz v0.2.4
INFO: Installing LightGraphs v0.7.3
INFO: Installing LightXML v0.4.0
INFO: Installing NaNMath v0.2.4
INFO: Installing PDMats v0.5.6
INFO: Installing ParserCombinator v1.7.11
INFO: Installing PolynomialFactors v0.0.3
INFO: Installing Polynomials v0.1.3
INFO: Installing Primes v0.1.3
INFO: Installing QuadGK v0.1.1
INFO: Installing Reexport v0.0.3
INFO: Installing Rmath v0.1.6
INFO: Installing Roots v0.3.0
INFO: Installing SHA v0.3.2
INFO: Installing SpecialFunctions v0.1.1
INFO: Installing StatsBase v0.13.1
INFO: Installing StatsFuns v0.4.0
INFO: Installing URIParser v0.1.8
INFO: Building EzXML
INFO: Building Rmath
INFO: Building Blosc
INFO: Building HDF5
INFO: Building LightXML
INFO: Package database updated

>>> 'Pkg.test("Bio")' log
Julia Version 0.5.1
Commit 6445c82 (2017-03-05 13:25 UTC)
Platform Info:
  OS: Linux (x86_64-pc-linux-gnu)
  CPU: Intel(R) Xeon(R) CPU E3-1241 v3 @ 3.50GHz
  WORD_SIZE: 64
           Ubuntu 14.04.5 LTS
  uname: Linux 3.13.0-113-generic #160-Ubuntu SMP Thu Mar 9 09:27:29 UTC 2017 x86_64 x86_64
Memory: 2.9392738342285156 GB (611.90625 MB free)
Uptime: 7882.0 sec
Load Avg:  0.9228515625  0.9755859375  1.0400390625
Intel(R) Xeon(R) CPU E3-1241 v3 @ 3.50GHz: 
       speed         user         nice          sys         idle          irq
#1  3500 MHz     411372 s        125 s      50453 s     239132 s         12 s
#2  3500 MHz     142310 s         28 s      31638 s     594526 s          0 s

  BLAS: libopenblas (USE64BITINT DYNAMIC_ARCH NO_AFFINITY Nehalem)
  LAPACK: libopenblas64_
  LIBM: libopenlibm
  LLVM: libLLVM-3.7.1 (ORCJIT, haswell)
Environment:
  TERM = vt100
  LD_LIBRARY_PATH = :/usr/local/lib/
  PATH = /usr/local/sbin:/usr/local/bin:/usr/sbin:/usr/bin:/sbin:/bin:/usr/games:/usr/local/games:/home/vagrant/julia/bin/
  JAVA_HOME = /usr/lib/jvm/java-7-oracle
  HOME = /home/vagrant

Package Directory: /home/vagrant/.julia/v0.5
2 required packages:
 - Bio                           0.4.7
 - JSON                          0.8.3
42 additional packages:
 - AutoHashEquals                0.1.1
 - BGZFStreams                   0.1.3
 - BinDeps                       0.4.7
 - Blosc                         0.2.0
 - BufferedStreams               0.3.2
 - Calculus                      0.2.2
 - ColorTypes                    0.3.5
 - Colors                        0.7.3
 - Combinatorics                 0.4.0
 - Compat                        0.21.0
 - DataStructures                0.5.3
 - DiffBase                      0.1.0
 - Distributions                 0.12.2
 - EzXML                         0.4.3
 - FileIO                        0.3.1
 - FixedPointNumbers             0.3.5
 - ForwardDiff                   0.4.1
 - GZip                          0.3.0
 - HDF5                          0.7.3
 - IndexableBitVectors           0.1.1
 - IntervalTrees                 0.1.0
 - Iterators                     0.3.0
 - JLD                           0.6.10
 - LegacyStrings                 0.2.1
 - Libz                          0.2.4
 - LightGraphs                   0.7.3
 - LightXML                      0.4.0
 - NaNMath                       0.2.4
 - PDMats                        0.5.6
 - ParserCombinator              1.7.11
 - PolynomialFactors             0.0.3
 - Polynomials                   0.1.3
 - Primes                        0.1.3
 - QuadGK                        0.1.1
 - Reexport                      0.0.3
 - Rmath                         0.1.6
 - Roots                         0.3.0
 - SHA                           0.3.2
 - SpecialFunctions              0.1.1
 - StatsBase                     0.13.1
 - StatsFuns                     0.4.0
 - URIParser                     0.1.8
INFO: Computing test dependencies for Bio...
INFO: Cloning cache of YAML from https://github.com/dcjones/YAML.jl.git
INFO: Installing Codecs v0.3.0
INFO: Installing YAML v0.2.1
INFO: Testing Bio
Test Summary: | Pass  Total
  Alignments  |  302    302
Test Summary:     | Pass  Total
  PairwiseAlignment |  212    212
Cloning into '/home/vagrant/.julia/v0.5/Bio/test/BioFmtSpecimens'...
Test Summary:              | Pass  Total
  High-throughput Sequencing |  237    237
Test Summary: | Pass  Total
  Phylogenies |  129    129
Test Summary:  | Pass  Total
  Misc Functions |    6      6
Test Summary:     | Pass  Total
  Dating algorithms |   20     20
Test Summary: | Pass  Total
  Strand      |   16     16
Test Summary: | Pass  Total
  Interval    |    6      6
Test Summary:      | Pass  Total
  IntervalCollection |    7      7
Test Summary:        | Pass  Total
  Alphanumeric Sorting |    8      8
Test Summary:  | Pass  Total
  IntervalStream |   15     15
Test Summary:    | Pass  Total
  Interval Parsing |   14     14
Test Summary: | Pass  Total
  BigBed      |   13     13
Test Summary: | Pass  Total
  Nucleotides |  442    442
Test Summary: | Pass  Total
  Aminoacids  |  293    293
Test Summary: |  Pass  Total
  BioSequence | 16566  16566
Test Summary:     | Pass  Total
  ReferenceSequence | 3464   3464
Test Summary: | Pass  Total
  Composition |   64     64
Test Summary: | Pass  Total
  Kmer        | 7511   7511
Test Summary: | Pass  Total
  Search      |  191    191
Test Summary: | Pass  Total
  Translation |   12     12
Test Summary: | Pass  Total
  Demultiplexer |  212    212
Test Summary: | Pass  Total
  SeqRecord   |    9      9
Test Summary:       | Pass  Total
  Reading and Writing |  411    411
Test Summary:  | Pass  Total
  Quality scores |   10     10
Test Summary: | Pass  Total
  majorityvote |    4      4
Test Summary:      | Pass  Total
  Counting mutations |   12     12
Test Summary:        | Pass  Total
  Distance Computation |   49     49
Test Summary: | Pass  Total
  Model       |  242    242
Test Summary: | Pass  Total
  Parsing     |  416    416
Test Summary: | Pass  Total
  Writing     |  113    113
Test Summary: | Pass  Total
  Spatial     |   32     32
BLAST+ blastn: Error During Test
  Test threw an exception of type Base.UVError
  Expression: typeof(blastn(na1,na2)) == Array{BLASTResult,1}
  could not spawn `blastn -query /tmp/tmpyLbW6I -subject /tmp/tmpLGOtsi -outfmt 5`: no such file or directory (ENOENT)
   in _jl_spawn(::String, ::Array{String,1}, ::Ptr{Void}, ::Base.Process, ::Base.DevNullStream, ::Base.PipeEndpoint, ::Ptr{Void}) at ./process.jl:321
   in #424 at ./process.jl:478 [inlined]
   in setup_stdio(::Base.##424#425{Cmd,Ptr{Void},Base.Process}, ::Tuple{Base.DevNullStream,Pipe,Base.PipeEndpoint}) at ./process.jl:466
   in #spawn#423(::Nullable{Base.ProcessChain}, ::Function, ::Cmd, ::Tuple{Base.DevNullStream,Pipe,Base.PipeEndpoint}, ::Bool, ::Bool) at ./process.jl:477
   in (::Base.#kw##spawn)(::Array{Any,1}, ::Base.#spawn, ::Cmd, ::Tuple{Base.DevNullStream,Pipe,Base.PipeEndpoint}, ::Bool, ::Bool) at ./<missing>:0
   in open(::Cmd, ::String, ::Base.DevNullStream) at ./process.jl:539
   in read(::Cmd, ::Base.DevNullStream) at ./process.jl:574
   in readstring at ./process.jl:581 [inlined] (repeats 2 times)
   in #readblastXML#2 at /home/vagrant/.julia/v0.5/Bio/src/tools/blast/blastcommandline.jl:73 [inlined]
   in readblastXML at /home/vagrant/.julia/v0.5/Bio/src/tools/blast/blastcommandline.jl:73 [inlined]
   in #blastn#3(::Bool, ::Function, ::String, ::String, ::Array{Any,1}) at /home/vagrant/.julia/v0.5/Bio/src/tools/blast/blastcommandline.jl:88
   in blastn(::Bio.Seq.BioSequence{Bio.Seq.DNAAlphabet{4}}, ::Bio.Seq.BioSequence{Bio.Seq.DNAAlphabet{4}}) at /home/vagrant/.julia/v0.5/Bio/src/tools/blast/blastcommandline.jl:94
   in macro expansion; at /home/vagrant/.julia/v0.5/Bio/test/tools/runtests.jl:29 [inlined]
   in macro expansion; at ./test.jl:674 [inlined]
   in macro expansion; at /home/vagrant/.julia/v0.5/Bio/test/tools/runtests.jl:14 [inlined]
   in anonymous at ./<missing>:?
   in include_from_node1(::String) at ./loading.jl:488
   in macro expansion; at /home/vagrant/.julia/v0.5/Bio/test/runtests.jl:28 [inlined]
   in anonymous at ./<missing>:?
   in include_from_node1(::String) at ./loading.jl:488
   in process_options(::Base.JLOptions) at ./client.jl:265
   in _start() at ./client.jl:321
BLAST+ blastn: Error During Test
  Test threw an exception of type Base.UVError
  Expression: typeof(blastn(na1,[na1,na2])) == Array{BLASTResult,1}
  could not spawn `blastn -query /tmp/tmpoynD36 -subject /tmp/tmpzWH1EV -outfmt 5`: no such file or directory (ENOENT)
   in _jl_spawn(::String, ::Array{String,1}, ::Ptr{Void}, ::Base.Process, ::Base.DevNullStream, ::Base.PipeEndpoint, ::Ptr{Void}) at ./process.jl:321
   in #424 at ./process.jl:478 [inlined]
   in setup_stdio(::Base.##424#425{Cmd,Ptr{Void},Base.Process}, ::Tuple{Base.DevNullStream,Pipe,Base.PipeEndpoint}) at ./process.jl:466
   in #spawn#423(::Nullable{Base.ProcessChain}, ::Function, ::Cmd, ::Tuple{Base.DevNullStream,Pipe,Base.PipeEndpoint}, ::Bool, ::Bool) at ./process.jl:477
   in (::Base.#kw##spawn)(::Array{Any,1}, ::Base.#spawn, ::Cmd, ::Tuple{Base.DevNullStream,Pipe,Base.PipeEndpoint}, ::Bool, ::Bool) at ./<missing>:0
   in open(::Cmd, ::String, ::Base.DevNullStream) at ./process.jl:539
   in read(::Cmd, ::Base.DevNullStream) at ./process.jl:574
   in readstring at ./process.jl:581 [inlined] (repeats 2 times)
   in #readblastXML#2 at /home/vagrant/.julia/v0.5/Bio/src/tools/blast/blastcommandline.jl:73 [inlined]
   in readblastXML at /home/vagrant/.julia/v0.5/Bio/src/tools/blast/blastcommandline.jl:73 [inlined]
   in #blastn#3(::Bool, ::Function, ::String, ::String, ::Array{Any,1}) at /home/vagrant/.julia/v0.5/Bio/src/tools/blast/blastcommandline.jl:88
   in blastn(::Bio.Seq.BioSequence{Bio.Seq.DNAAlphabet{4}}, ::Array{Bio.Seq.BioSequence{Bio.Seq.DNAAlphabet{4}},1}) at /home/vagrant/.julia/v0.5/Bio/src/tools/blast/blastcommandline.jl:99
   in macro expansion; at /home/vagrant/.julia/v0.5/Bio/test/tools/runtests.jl:30 [inlined]
   in macro expansion; at ./test.jl:674 [inlined]
   in macro expansion; at /home/vagrant/.julia/v0.5/Bio/test/tools/runtests.jl:14 [inlined]
   in anonymous at ./<missing>:?
   in include_from_node1(::String) at ./loading.jl:488
   in macro expansion; at /home/vagrant/.julia/v0.5/Bio/test/runtests.jl:28 [inlined]
   in anonymous at ./<missing>:?
   in include_from_node1(::String) at ./loading.jl:488
   in process_options(::Base.JLOptions) at ./client.jl:265
   in _start() at ./client.jl:321
BLAST+ blastn: Error During Test
  Test threw an exception of type Base.UVError
  Expression: typeof(blastn([na1,na2],[na1,na2])) == Array{BLASTResult,1}
  could not spawn `blastn -query /tmp/tmpmBuBnK -subject /tmp/tmpR0Wi6y -outfmt 5`: no such file or directory (ENOENT)
   in _jl_spawn(::String, ::Array{String,1}, ::Ptr{Void}, ::Base.Process, ::Base.DevNullStream, ::Base.PipeEndpoint, ::Ptr{Void}) at ./process.jl:321
   in #424 at ./process.jl:478 [inlined]
   in setup_stdio(::Base.##424#425{Cmd,Ptr{Void},Base.Process}, ::Tuple{Base.DevNullStream,Pipe,Base.PipeEndpoint}) at ./process.jl:466
   in #spawn#423(::Nullable{Base.ProcessChain}, ::Function, ::Cmd, ::Tuple{Base.DevNullStream,Pipe,Base.PipeEndpoint}, ::Bool, ::Bool) at ./process.jl:477
   in (::Base.#kw##spawn)(::Array{Any,1}, ::Base.#spawn, ::Cmd, ::Tuple{Base.DevNullStream,Pipe,Base.PipeEndpoint}, ::Bool, ::Bool) at ./<missing>:0
   in open(::Cmd, ::String, ::Base.DevNullStream) at ./process.jl:539
   in read(::Cmd, ::Base.DevNullStream) at ./process.jl:574
   in readstring at ./process.jl:581 [inlined] (repeats 2 times)
   in #readblastXML#2 at /home/vagrant/.julia/v0.5/Bio/src/tools/blast/blastcommandline.jl:73 [inlined]
   in readblastXML at /home/vagrant/.julia/v0.5/Bio/src/tools/blast/blastcommandline.jl:73 [inlined]
   in #blastn#3(::Bool, ::Function, ::String, ::String, ::Array{Any,1}) at /home/vagrant/.julia/v0.5/Bio/src/tools/blast/blastcommandline.jl:88
   in blastn(::Array{Bio.Seq.BioSequence{Bio.Seq.DNAAlphabet{4}},1}, ::Array{Bio.Seq.BioSequence{Bio.Seq.DNAAlphabet{4}},1}) at /home/vagrant/.julia/v0.5/Bio/src/tools/blast/blastcommandline.jl:113
   in macro expansion; at /home/vagrant/.julia/v0.5/Bio/test/tools/runtests.jl:31 [inlined]
   in macro expansion; at ./test.jl:674 [inlined]
   in macro expansion; at /home/vagrant/.julia/v0.5/Bio/test/tools/runtests.jl:14 [inlined]
   in anonymous at ./<missing>:?
   in include_from_node1(::String) at ./loading.jl:488
   in macro expansion; at /home/vagrant/.julia/v0.5/Bio/test/runtests.jl:28 [inlined]
   in anonymous at ./<missing>:?
   in include_from_node1(::String) at ./loading.jl:488
   in process_options(::Base.JLOptions) at ./client.jl:265
   in _start() at ./client.jl:321
BLAST+ blastn: Error During Test
  Test threw an exception of type Base.UVError
  Expression: typeof(blastn(na1,nucldb,db=true)) == Array{BLASTResult,1}
  could not spawn `blastn -query /tmp/tmppJWvao -db /home/vagrant/.julia/v0.5/Bio/test/BioFmtSpecimens/BLASTDB/f002 -outfmt 5`: no such file or directory (ENOENT)
   in _jl_spawn(::String, ::Array{String,1}, ::Ptr{Void}, ::Base.Process, ::Base.DevNullStream, ::Base.PipeEndpoint, ::Ptr{Void}) at ./process.jl:321
   in #424 at ./process.jl:478 [inlined]
   in setup_stdio(::Base.##424#425{Cmd,Ptr{Void},Base.Process}, ::Tuple{Base.DevNullStream,Pipe,Base.PipeEndpoint}) at ./process.jl:466
   in #spawn#423(::Nullable{Base.ProcessChain}, ::Function, ::Cmd, ::Tuple{Base.DevNullStream,Pipe,Base.PipeEndpoint}, ::Bool, ::Bool) at ./process.jl:477
   in (::Base.#kw##spawn)(::Array{Any,1}, ::Base.#spawn, ::Cmd, ::Tuple{Base.DevNullStream,Pipe,Base.PipeEndpoint}, ::Bool, ::Bool) at ./<missing>:0
   in open(::Cmd, ::String, ::Base.DevNullStream) at ./process.jl:539
   in read(::Cmd, ::Base.DevNullStream) at ./process.jl:574
   in readstring at ./process.jl:581 [inlined] (repeats 2 times)
   in #readblastXML#2 at /home/vagrant/.julia/v0.5/Bio/src/tools/blast/blastcommandline.jl:73 [inlined]
   in readblastXML at /home/vagrant/.julia/v0.5/Bio/src/tools/blast/blastcommandline.jl:73 [inlined]
   in #blastn#3(::Bool, ::Function, ::String, ::String, ::Array{Any,1}) at /home/vagrant/.julia/v0.5/Bio/src/tools/blast/blastcommandline.jl:86
   in (::Bio.Tools.BLAST.#kw##blastn)(::Array{Any,1}, ::Bio.Tools.BLAST.#blastn, ::String, ::String, ::Array{Any,1}) at ./<missing>:0
   in #blastn#4 at /home/vagrant/.julia/v0.5/Bio/src/tools/blast/blastcommandline.jl:106 [inlined]
   in (::Bio.Tools.BLAST.#kw##blastn)(::Array{Any,1}, ::Bio.Tools.BLAST.#blastn, ::Bio.Seq.BioSequence{Bio.Seq.DNAAlphabet{4}}, ::String, ::Array{Any,1}) at ./<missing>:0
   in macro expansion; at /home/vagrant/.julia/v0.5/Bio/test/tools/runtests.jl:32 [inlined]
   in macro expansion; at ./test.jl:674 [inlined]
   in macro expansion; at /home/vagrant/.julia/v0.5/Bio/test/tools/runtests.jl:14 [inlined]
   in anonymous at ./<missing>:?
   in include_from_node1(::String) at ./loading.jl:488
   in macro expansion; at /home/vagrant/.julia/v0.5/Bio/test/runtests.jl:28 [inlined]
   in anonymous at ./<missing>:?
   in include_from_node1(::String) at ./loading.jl:488
   in process_options(::Base.JLOptions) at ./client.jl:265
   in _start() at ./client.jl:321
BLAST+ blastn: Error During Test
  Test threw an exception of type Base.UVError
  Expression: typeof(blastn(na1,fna)) == Array{BLASTResult,1}
  could not spawn `blastn -query /tmp/tmp1rrwCd -subject /home/vagrant/.julia/v0.5/Bio/test/BioFmtSpecimens/FASTA/f002.fasta -outfmt 5`: no such file or directory (ENOENT)
   in _jl_spawn(::String, ::Array{String,1}, ::Ptr{Void}, ::Base.Process, ::Base.DevNullStream, ::Base.PipeEndpoint, ::Ptr{Void}) at ./process.jl:321
   in #424 at ./process.jl:478 [inlined]
   in setup_stdio(::Base.##424#425{Cmd,Ptr{Void},Base.Process}, ::Tuple{Base.DevNullStream,Pipe,Base.PipeEndpoint}) at ./process.jl:466
   in #spawn#423(::Nullable{Base.ProcessChain}, ::Function, ::Cmd, ::Tuple{Base.DevNullStream,Pipe,Base.PipeEndpoint}, ::Bool, ::Bool) at ./process.jl:477
   in (::Base.#kw##spawn)(::Array{Any,1}, ::Base.#spawn, ::Cmd, ::Tuple{Base.DevNullStream,Pipe,Base.PipeEndpoint}, ::Bool, ::Bool) at ./<missing>:0
   in open(::Cmd, ::String, ::Base.DevNullStream) at ./process.jl:539
   in read(::Cmd, ::Base.DevNullStream) at ./process.jl:574
   in readstring at ./process.jl:581 [inlined] (repeats 2 times)
   in #readblastXML#2 at /home/vagrant/.julia/v0.5/Bio/src/tools/blast/blastcommandline.jl:73 [inlined]
   in readblastXML at /home/vagrant/.julia/v0.5/Bio/src/tools/blast/blastcommandline.jl:73 [inlined]
   in #blastn#3(::Bool, ::Function, ::String, ::String, ::Array{Any,1}) at /home/vagrant/.julia/v0.5/Bio/src/tools/blast/blastcommandline.jl:88
   in #blastn#4 at /home/vagrant/.julia/v0.5/Bio/src/tools/blast/blastcommandline.jl:108 [inlined]
   in blastn(::Bio.Seq.BioSequence{Bio.Seq.DNAAlphabet{4}}, ::String, ::Array{Any,1}) at /home/vagrant/.julia/v0.5/Bio/src/tools/blast/blastcommandline.jl:104
   in macro expansion; at /home/vagrant/.julia/v0.5/Bio/test/tools/runtests.jl:33 [inlined]
   in macro expansion; at ./test.jl:674 [inlined]
   in macro expansion; at /home/vagrant/.julia/v0.5/Bio/test/tools/runtests.jl:14 [inlined]
   in anonymous at ./<missing>:?
   in include_from_node1(::String) at ./loading.jl:488
   in macro expansion; at /home/vagrant/.julia/v0.5/Bio/test/runtests.jl:28 [inlined]
   in anonymous at ./<missing>:?
   in include_from_node1(::String) at ./loading.jl:488
   in process_options(::Base.JLOptions) at ./client.jl:265
   in _start() at ./client.jl:321
BLAST+ blastn: Error During Test
  Test threw an exception of type Base.UVError
  Expression: typeof(blastn(fna,nucldb,db=true)) == Array{BLASTResult,1}
  could not spawn `blastn -query /home/vagrant/.julia/v0.5/Bio/test/BioFmtSpecimens/FASTA/f002.fasta -db /home/vagrant/.julia/v0.5/Bio/test/BioFmtSpecimens/BLASTDB/f002 -outfmt 5`: no such file or directory (ENOENT)
   in _jl_spawn(::String, ::Array{String,1}, ::Ptr{Void}, ::Base.Process, ::Base.DevNullStream, ::Base.PipeEndpoint, ::Ptr{Void}) at ./process.jl:321
   in #424 at ./process.jl:478 [inlined]
   in setup_stdio(::Base.##424#425{Cmd,Ptr{Void},Base.Process}, ::Tuple{Base.DevNullStream,Pipe,Base.PipeEndpoint}) at ./process.jl:466
   in #spawn#423(::Nullable{Base.ProcessChain}, ::Function, ::Cmd, ::Tuple{Base.DevNullStream,Pipe,Base.PipeEndpoint}, ::Bool, ::Bool) at ./process.jl:477
   in (::Base.#kw##spawn)(::Array{Any,1}, ::Base.#spawn, ::Cmd, ::Tuple{Base.DevNullStream,Pipe,Base.PipeEndpoint}, ::Bool, ::Bool) at ./<missing>:0
   in open(::Cmd, ::String, ::Base.DevNullStream) at ./process.jl:539
   in read(::Cmd, ::Base.DevNullStream) at ./process.jl:574
   in readstring at ./process.jl:581 [inlined] (repeats 2 times)
   in #readblastXML#2 at /home/vagrant/.julia/v0.5/Bio/src/tools/blast/blastcommandline.jl:73 [inlined]
   in readblastXML at /home/vagrant/.julia/v0.5/Bio/src/tools/blast/blastcommandline.jl:73 [inlined]
   in #blastn#3(::Bool, ::Function, ::String, ::String, ::Array{Any,1}) at /home/vagrant/.julia/v0.5/Bio/src/tools/blast/blastcommandline.jl:86
   in (::Bio.Tools.BLAST.#kw##blastn)(::Array{Any,1}, ::Bio.Tools.BLAST.#blastn, ::String, ::String, ::Array{Any,1}) at ./<missing>:0
   in macro expansion; at /home/vagrant/.julia/v0.5/Bio/test/tools/runtests.jl:34 [inlined]
   in macro expansion; at ./test.jl:674 [inlined]
   in macro expansion; at /home/vagrant/.julia/v0.5/Bio/test/tools/runtests.jl:14 [inlined]
   in anonymous at ./<missing>:?
   in include_from_node1(::String) at ./loading.jl:488
   in macro expansion; at /home/vagrant/.julia/v0.5/Bio/test/runtests.jl:28 [inlined]
   in anonymous at ./<missing>:?
   in include_from_node1(::String) at ./loading.jl:488
   in process_options(::Base.JLOptions) at ./client.jl:265
   in _start() at ./client.jl:321
Test Summary: | Error  Total
  BLAST+ blastn |     6      6
ERROR: LoadError: LoadError: Some tests did not pass: 0 passed, 0 failed, 6 errored, 0 broken.
 in finish(::Base.Test.DefaultTestSet) at ./test.jl:498
 in macro expansion; at ./test.jl:681 [inlined]
 in macro expansion; at /home/vagrant/.julia/v0.5/Bio/test/tools/runtests.jl:14 [inlined]
 in anonymous at ./<missing>:?
 in include_from_node1(::String) at ./loading.jl:488
 in macro expansion; at /home/vagrant/.julia/v0.5/Bio/test/runtests.jl:28 [inlined]
 in anonymous at ./<missing>:?
 in include_from_node1(::String) at ./loading.jl:488
 in process_options(::Base.JLOptions) at ./client.jl:265
 in _start() at ./client.jl:321
while loading /home/vagrant/.julia/v0.5/Bio/test/tools/runtests.jl, in expression starting on line 12
while loading /home/vagrant/.julia/v0.5/Bio/test/runtests.jl, in expression starting on line 27
=================================[ ERROR: Bio ]=================================

failed process: Process(`/home/vagrant/julia/bin/julia -Cx86-64 -J/home/vagrant/julia/lib/julia/sys.so --compile=yes --depwarn=yes --check-bounds=yes --code-coverage=none --color=no --compilecache=yes /home/vagrant/.julia/v0.5/Bio/test/runtests.jl`, ProcessExited(1)) [1]

================================================================================
INFO: Removing Codecs v0.3.0
INFO: Removing YAML v0.2.1
ERROR: Bio had test errors
 in #test#61(::Bool, ::Function, ::Array{AbstractString,1}) at ./pkg/entry.jl:749
 in (::Base.Pkg.Entry.#kw##test)(::Array{Any,1}, ::Base.Pkg.Entry.#test, ::Array{AbstractString,1}) at ./<missing>:0
 in (::Base.Pkg.Dir.##2#3{Array{Any,1},Base.Pkg.Entry.#test,Tuple{Array{AbstractString,1}}})() at ./pkg/dir.jl:31
 in cd(::Base.Pkg.Dir.##2#3{Array{Any,1},Base.Pkg.Entry.#test,Tuple{Array{AbstractString,1}}}, ::String) at ./file.jl:59
 in #cd#1(::Array{Any,1}, ::Function, ::Function, ::Array{AbstractString,1}, ::Vararg{Array{AbstractString,1},N}) at ./pkg/dir.jl:31
 in (::Base.Pkg.Dir.#kw##cd)(::Array{Any,1}, ::Base.Pkg.Dir.#cd, ::Function, ::Array{AbstractString,1}, ::Vararg{Array{AbstractString,1},N}) at ./<missing>:0
 in #test#3(::Bool, ::Function, ::String, ::Vararg{String,N}) at ./pkg/pkg.jl:258
 in test(::String, ::Vararg{String,N}) at ./pkg/pkg.jl:258
 in eval(::Module, ::Any) at ./boot.jl:234
 in process_options(::Base.JLOptions) at ./client.jl:242
 in _start() at ./client.jl:321

>>> End of log
