>>> 'Pkg.add("BioSymbols")' log
INFO: Cloning cache of BioSymbols from https://github.com/BioJulia/BioSymbols.jl.git
INFO: Installing BioSymbols v1.0.0
INFO: Package database updated

>>> 'Pkg.test("BioSymbols")' log
Julia Version 0.6.0-pre.beta.9
Commit ceb0674 (2017-04-02 01:04 UTC)
Platform Info:
  OS: Linux (x86_64-pc-linux-gnu)
  CPU: Intel(R) Xeon(R) CPU E3-1241 v3 @ 3.50GHz
  WORD_SIZE: 64
           Ubuntu 14.04.5 LTS
  uname: Linux 3.13.0-115-generic #162-Ubuntu SMP Fri Mar 24 16:03:51 UTC 2017 x86_64 x86_64
Memory: 2.9392738342285156 GB (479.28515625 MB free)
Uptime: 7694.0 sec
Load Avg:  1.02978515625  1.06298828125  1.013671875
Intel(R) Xeon(R) CPU E3-1241 v3 @ 3.50GHz: 
       speed         user         nice          sys         idle          irq
#1  3500 MHz     398699 s         63 s      34462 s     245975 s         12 s
#2  3500 MHz     122254 s         93 s      20567 s     607265 s          0 s

  BLAS: libopenblas (USE64BITINT DYNAMIC_ARCH NO_AFFINITY Nehalem)
  LAPACK: libopenblas64_
  LIBM: libopenlibm
  LLVM: libLLVM-3.9.1 (ORCJIT, haswell)
Environment:
  TERM = vt100
  LD_LIBRARY_PATH = :/usr/local/lib/
  PATH = /usr/local/sbin:/usr/local/bin:/usr/sbin:/usr/bin:/sbin:/bin:/usr/games:/usr/local/games:/home/vagrant/julia/bin/
  JAVA_HOME = /usr/lib/jvm/java-7-oracle
  HOME = /home/vagrant

Package Directory: /home/vagrant/.julia/v0.6
2 required packages:
 - BioSymbols                    1.0.0
 - JSON                          0.8.3
1 additional packages:
 - Compat                        0.21.0
INFO: Testing BioSymbols
WARNING: takebuf_string(b) is deprecated, use String(take!(b)) instead.
Stacktrace:
 [1] depwarn(::String, ::Symbol) at ./deprecated.jl:64
 [2] takebuf_string(::Base.AbstractIOBuffer{Array{UInt8,1}}) at ./deprecated.jl:51
 [3] macro expansion at /home/vagrant/.julia/v0.6/BioSymbols/test/runtests.jl:292 [inlined]
 [4] macro expansion at ./test.jl:853 [inlined]
 [5] macro expansion at /home/vagrant/.julia/v0.6/BioSymbols/test/runtests.jl:0 [inlined]
 [6] macro expansion at ./test.jl:853 [inlined]
 [7] macro expansion at /home/vagrant/.julia/v0.6/BioSymbols/test/runtests.jl:0 [inlined]
 [8] macro expansion at ./test.jl:853 [inlined]
 [9] anonymous at ./<missing>:?
 [10] include_from_node1(::String) at ./loading.jl:539
 [11] include(::String) at ./sysimg.jl:14
 [12] process_options(::Base.JLOptions) at ./client.jl:305
 [13] _start() at ./client.jl:371
while loading /home/vagrant/.julia/v0.6/BioSymbols/test/runtests.jl, in expression starting on line 5
WARNING: takebuf_string(b) is deprecated, use String(take!(b)) instead.
Stacktrace:
 [1] depwarn(::String, ::Symbol) at ./deprecated.jl:64
 [2] takebuf_string(::Base.AbstractIOBuffer{Array{UInt8,1}}) at ./deprecated.jl:51
 [3] macro expansion at /home/vagrant/.julia/v0.6/BioSymbols/test/runtests.jl:301 [inlined]
 [4] macro expansion at ./test.jl:853 [inlined]
 [5] macro expansion at /home/vagrant/.julia/v0.6/BioSymbols/test/runtests.jl:0 [inlined]
 [6] macro expansion at ./test.jl:853 [inlined]
 [7] macro expansion at /home/vagrant/.julia/v0.6/BioSymbols/test/runtests.jl:0 [inlined]
 [8] macro expansion at ./test.jl:853 [inlined]
 [9] anonymous at ./<missing>:?
 [10] include_from_node1(::String) at ./loading.jl:539
 [11] include(::String) at ./sysimg.jl:14
 [12] process_options(::Base.JLOptions) at ./client.jl:305
 [13] _start() at ./client.jl:371
while loading /home/vagrant/.julia/v0.6/BioSymbols/test/runtests.jl, in expression starting on line 5
WARNING: takebuf_string(b) is deprecated, use String(take!(b)) instead.
Stacktrace:
 [1] depwarn(::String, ::Symbol) at ./deprecated.jl:64
 [2] takebuf_string(::Base.AbstractIOBuffer{Array{UInt8,1}}) at ./deprecated.jl:51
 [3] macro expansion at /home/vagrant/.julia/v0.6/BioSymbols/test/runtests.jl:311 [inlined]
 [4] macro expansion at ./test.jl:853 [inlined]
 [5] macro expansion at /home/vagrant/.julia/v0.6/BioSymbols/test/runtests.jl:0 [inlined]
 [6] macro expansion at ./test.jl:853 [inlined]
 [7] macro expansion at /home/vagrant/.julia/v0.6/BioSymbols/test/runtests.jl:0 [inlined]
 [8] macro expansion at ./test.jl:853 [inlined]
 [9] anonymous at ./<missing>:?
 [10] include_from_node1(::String) at ./loading.jl:539
 [11] include(::String) at ./sysimg.jl:14
 [12] process_options(::Base.JLOptions) at ./client.jl:305
 [13] _start() at ./client.jl:371
while loading /home/vagrant/.julia/v0.6/BioSymbols/test/runtests.jl, in expression starting on line 5
WARNING: takebuf_string(b) is deprecated, use String(take!(b)) instead.
Stacktrace:
 [1] depwarn(::String, ::Symbol) at ./deprecated.jl:64
 [2] takebuf_string(::Base.AbstractIOBuffer{Array{UInt8,1}}) at ./deprecated.jl:51
 [3] macro expansion at /home/vagrant/.julia/v0.6/BioSymbols/test/runtests.jl:320 [inlined]
 [4] macro expansion at ./test.jl:853 [inlined]
 [5] macro expansion at /home/vagrant/.julia/v0.6/BioSymbols/test/runtests.jl:0 [inlined]
 [6] macro expansion at ./test.jl:853 [inlined]
 [7] macro expansion at /home/vagrant/.julia/v0.6/BioSymbols/test/runtests.jl:0 [inlined]
 [8] macro expansion at ./test.jl:853 [inlined]
 [9] anonymous at ./<missing>:?
 [10] include_from_node1(::String) at ./loading.jl:539
 [11] include(::String) at ./sysimg.jl:14
 [12] process_options(::Base.JLOptions) at ./client.jl:305
 [13] _start() at ./client.jl:371
while loading /home/vagrant/.julia/v0.6/BioSymbols/test/runtests.jl, in expression starting on line 5
Test Summary: | Pass  Total
NucleicAcids  |  348    348
WARNING: takebuf_string(b) is deprecated, use String(take!(b)) instead.
Stacktrace:
 [1] depwarn(::String, ::Symbol) at ./deprecated.jl:64
 [2] takebuf_string(::Base.AbstractIOBuffer{Array{UInt8,1}}) at ./deprecated.jl:51
 [3] macro expansion at /home/vagrant/.julia/v0.6/BioSymbols/test/runtests.jl:398 [inlined]
 [4] macro expansion at ./test.jl:853 [inlined]
 [5] macro expansion at /home/vagrant/.julia/v0.6/BioSymbols/test/runtests.jl:0 [inlined]
 [6] macro expansion at ./test.jl:853 [inlined]
 [7] macro expansion at /home/vagrant/.julia/v0.6/BioSymbols/test/runtests.jl:0 [inlined]
 [8] macro expansion at ./test.jl:853 [inlined]
 [9] anonymous at ./<missing>:?
 [10] include_from_node1(::String) at ./loading.jl:539
 [11] include(::String) at ./sysimg.jl:14
 [12] process_options(::Base.JLOptions) at ./client.jl:305
 [13] _start() at ./client.jl:371
while loading /home/vagrant/.julia/v0.6/BioSymbols/test/runtests.jl, in expression starting on line 341
WARNING: takebuf_string(b) is deprecated, use String(take!(b)) instead.
Stacktrace:
 [1] depwarn(::String, ::Symbol) at ./deprecated.jl:64
 [2] takebuf_string(::Base.AbstractIOBuffer{Array{UInt8,1}}) at ./deprecated.jl:51
 [3] macro expansion at /home/vagrant/.julia/v0.6/BioSymbols/test/runtests.jl:407 [inlined]
 [4] macro expansion at ./test.jl:853 [inlined]
 [5] macro expansion at /home/vagrant/.julia/v0.6/BioSymbols/test/runtests.jl:0 [inlined]
 [6] macro expansion at ./test.jl:853 [inlined]
 [7] macro expansion at /home/vagrant/.julia/v0.6/BioSymbols/test/runtests.jl:0 [inlined]
 [8] macro expansion at ./test.jl:853 [inlined]
 [9] anonymous at ./<missing>:?
 [10] include_from_node1(::String) at ./loading.jl:539
 [11] include(::String) at ./sysimg.jl:14
 [12] process_options(::Base.JLOptions) at ./client.jl:305
 [13] _start() at ./client.jl:371
while loading /home/vagrant/.julia/v0.6/BioSymbols/test/runtests.jl, in expression starting on line 341
Test Summary: | Pass  Total
Aminoacids    |  233    233
INFO: BioSymbols tests passed

>>> End of log
