>>> 'Pkg.add("Chemfiles")' log
INFO: Cloning cache of Chemfiles from https://github.com/chemfiles/Chemfiles.jl.git
INFO: Installing BinDeps v0.6.0
INFO: Installing Chemfiles v0.7.4
INFO: Installing Conda v0.7.0
INFO: Installing SHA v0.5.2
INFO: Installing URIParser v0.2.0
INFO: Building Conda
INFO: Building Chemfiles
Fetching package metadata .............
Solving package specifications: .

Package plan for installation in environment /home/vagrant/.julia/v0.6/Conda/deps/usr:

The following NEW packages will be INSTALLED:

    chemfiles-lib: 0.7.4-1               conda-forge

The following packages will be SUPERSEDED by a higher-priority channel:

    conda:         4.3.30-py27h6ae6dc7_0             --> 4.3.29-py27_0 conda-forge
    conda-env:     2.6.0-h36134e3_1                  --> 2.6.0-0       conda-forge

chemfiles-lib-   0% |                              | ETA:  --:--:--   0.00  B/schemfiles-lib-   2% |                               | ETA:  0:00:00   1.27 MB/schemfiles-lib-   4% |#                              | ETA:  0:00:00   1.25 MB/schemfiles-lib-   6% |#                              | ETA:  0:00:00   1.23 MB/schemfiles-lib-   8% |##                             | ETA:  0:00:00   1.62 MB/schemfiles-lib-  10% |###                            | ETA:  0:00:00   1.51 MB/schemfiles-lib-  12% |###                            | ETA:  0:00:00   1.47 MB/schemfiles-lib-  14% |####                           | ETA:  0:00:00   1.69 MB/schemfiles-lib-  16% |#####                          | ETA:  0:00:00   1.63 MB/schemfiles-lib-  18% |#####                          | ETA:  0:00:00   1.82 MB/schemfiles-lib-  20% |######                         | ETA:  0:00:00   1.76 MB/schemfiles-lib-  22% |######                         | ETA:  0:00:00   1.92 MB/schemfiles-lib-  24% |#######                        | ETA:  0:00:00   1.85 MB/schemfiles-lib-  26% |########                       | ETA:  0:00:00   2.00 MB/schemfiles-lib-  28% |########                       | ETA:  0:00:00   2.14 MB/schemfiles-lib-  30% |#########                      | ETA:  0:00:00   2.29 MB/schemfiles-lib-  32% |##########                     | ETA:  0:00:00   2.19 MB/schemfiles-lib-  34% |##########                     | ETA:  0:00:00   2.31 MB/schemfiles-lib-  36% |###########                    | ETA:  0:00:00   2.44 MB/schemfiles-lib-  38% |############                   | ETA:  0:00:00   2.57 MB/schemfiles-lib-  40% |############                   | ETA:  0:00:00   2.70 MB/schemfiles-lib-  43% |#############                  | ETA:  0:00:00   2.59 MB/schemfiles-lib-  45% |#############                  | ETA:  0:00:00   2.69 MB/schemfiles-lib-  47% |##############                 | ETA:  0:00:00   2.81 MB/schemfiles-lib-  49% |###############                | ETA:  0:00:00   2.92 MB/schemfiles-lib-  51% |###############                | ETA:  0:00:00   3.03 MB/schemfiles-lib-  53% |################               | ETA:  0:00:00   2.91 MB/schemfiles-lib-  55% |#################              | ETA:  0:00:00   3.01 MB/schemfiles-lib-  57% |#################              | ETA:  0:00:00   3.11 MB/schemfiles-lib-  59% |##################             | ETA:  0:00:00   3.21 MB/schemfiles-lib-  61% |###################            | ETA:  0:00:00   3.31 MB/schemfiles-lib-  63% |###################            | ETA:  0:00:00   3.41 MB/schemfiles-lib-  65% |####################           | ETA:  0:00:00   3.28 MB/schemfiles-lib-  67% |####################           | ETA:  0:00:00   3.36 MB/schemfiles-lib-  69% |#####################          | ETA:  0:00:00   3.45 MB/schemfiles-lib-  71% |######################         | ETA:  0:00:00   3.54 MB/schemfiles-lib-  73% |######################         | ETA:  0:00:00   3.63 MB/schemfiles-lib-  75% |#######################        | ETA:  0:00:00   3.72 MB/schemfiles-lib-  77% |########################       | ETA:  0:00:00   3.82 MB/schemfiles-lib-  79% |########################       | ETA:  0:00:00   3.68 MB/schemfiles-lib-  81% |#########################      | ETA:  0:00:00   3.75 MB/schemfiles-lib-  83% |##########################     | ETA:  0:00:00   3.82 MB/schemfiles-lib-  86% |##########################     | ETA:  0:00:00   3.91 MB/schemfiles-lib-  88% |###########################    | ETA:  0:00:00   3.99 MB/schemfiles-lib-  90% |###########################    | ETA:  0:00:00   4.07 MB/schemfiles-lib-  92% |############################   | ETA:  0:00:00   4.15 MB/schemfiles-lib-  94% |#############################  | ETA:  0:00:00   4.06 MB/schemfiles-lib-  96% |#############################  | ETA:  0:00:00   4.13 MB/schemfiles-lib-  98% |############################## | ETA:  0:00:00   4.21 MB/schemfiles-lib- 100% |###############################| ETA:  0:00:00   4.28 MB/schemfiles-lib- 100% |###############################| Time: 0:00:00   4.27 MB/s
conda-env-2.6.   0% |                              | ETA:  --:--:--   0.00  B/sconda-env-2.6. 100% |###############################| Time: 0:00:00   1.38 MB/sconda-env-2.6. 100% |###############################| Time: 0:00:00   1.00 MB/s
conda-4.3.29-p   0% |                              | ETA:  --:--:--   0.00  B/sconda-4.3.29-p   3% |                               | Time: 0:00:00  14.38 MB/sconda-4.3.29-p   6% |#                              | Time: 0:00:00  20.20 MB/sconda-4.3.29-p   9% |##                             | Time: 0:00:00  24.49 MB/sconda-4.3.29-p  12% |###                            | Time: 0:00:00  27.44 MB/sconda-4.3.29-p  15% |####                           | Time: 0:00:00  29.64 MB/sconda-4.3.29-p  18% |#####                          | Time: 0:00:00  31.50 MB/sconda-4.3.29-p  22% |######                         | Time: 0:00:00  33.04 MB/sconda-4.3.29-p  25% |#######                        | Time: 0:00:00  10.41 MB/sconda-4.3.29-p  28% |########                       | Time: 0:00:00  10.79 MB/sconda-4.3.29-p  31% |#########                      | Time: 0:00:00  11.27 MB/sconda-4.3.29-p  34% |##########                     | Time: 0:00:00  11.95 MB/sconda-4.3.29-p  37% |###########                    | Time: 0:00:00  12.70 MB/sconda-4.3.29-p  41% |############                   | Time: 0:00:00  13.42 MB/sconda-4.3.29-p  44% |#############                  | Time: 0:00:00  14.14 MB/sconda-4.3.29-p  47% |##############                 | Time: 0:00:00  14.82 MB/sconda-4.3.29-p  50% |###############                | Time: 0:00:00  15.41 MB/sconda-4.3.29-p  53% |################               | Time: 0:00:00  10.05 MB/sconda-4.3.29-p  56% |#################              | Time: 0:00:00  10.42 MB/sconda-4.3.29-p  60% |##################             | Time: 0:00:00  10.79 MB/sconda-4.3.29-p  63% |###################            | Time: 0:00:00  11.25 MB/sconda-4.3.29-p  66% |####################           | Time: 0:00:00  11.65 MB/sconda-4.3.29-p  69% |#####################          | Time: 0:00:00  12.05 MB/sconda-4.3.29-p  72% |######################         | Time: 0:00:00  12.44 MB/sconda-4.3.29-p  75% |#######################        | Time: 0:00:00  12.83 MB/sconda-4.3.29-p  78% |########################       | Time: 0:00:00  13.18 MB/sconda-4.3.29-p  82% |#########################      | Time: 0:00:00  13.54 MB/sconda-4.3.29-p  85% |##########################     | Time: 0:00:00  13.89 MB/sconda-4.3.29-p  88% |###########################    | Time: 0:00:00  11.52 MB/sconda-4.3.29-p  91% |############################   | Time: 0:00:00  11.79 MB/sconda-4.3.29-p  94% |#############################  | Time: 0:00:00  12.04 MB/sconda-4.3.29-p  97% |############################## | Time: 0:00:00  12.31 MB/sconda-4.3.29-p 100% |###############################| Time: 0:00:00  12.48 MB/sconda-4.3.29-p 100% |###############################| Time: 0:00:00  12.40 MB/s
INFO: Package database updated

>>> 'Pkg.test("Chemfiles")' log
Julia Version 0.6.1
Commit 0d7248e2ff (2017-10-24 22:15 UTC)
Platform Info:
  OS: Linux (x86_64-pc-linux-gnu)
  CPU: Intel(R) Xeon(R) CPU E3-1241 v3 @ 3.50GHz
  WORD_SIZE: 64
           Ubuntu 14.04.5 LTS
  uname: Linux 3.13.0-135-generic #184-Ubuntu SMP Wed Oct 18 11:55:51 UTC 2017 x86_64 x86_64
Memory: 2.93927001953125 GB (947.890625 MB free)
Uptime: 25939.0 sec
Load Avg:  0.76318359375  0.91162109375  0.99169921875
Intel(R) Xeon(R) CPU E3-1241 v3 @ 3.50GHz: 
       speed         user         nice          sys         idle          irq
#1  3499 MHz    1548024 s       6681 s      73317 s     570138 s         18 s
#2  3499 MHz     360570 s         94 s      38675 s    2141262 s          0 s

  BLAS: libopenblas (USE64BITINT DYNAMIC_ARCH NO_AFFINITY Nehalem)
  LAPACK: libopenblas64_
  LIBM: libopenlibm
  LLVM: libLLVM-3.9.1 (ORCJIT, haswell)
Environment:
  TERM = vt100
  LD_LIBRARY_PATH = :/usr/local/lib/
  PATH = /usr/local/sbin:/usr/local/bin:/usr/sbin:/usr/bin:/sbin:/bin:/usr/games:/usr/local/games:/home/vagrant/julia/bin/
  JAVA_HOME = /usr/lib/jvm/java-8-openjdk-amd64
  HOME = /home/vagrant

Package Directory: /home/vagrant/.julia/v0.6
2 required packages:
 - Chemfiles                     0.7.4
 - JSON                          0.16.1
5 additional packages:
 - BinDeps                       0.6.0
 - Compat                        0.37.0
 - Conda                         0.7.0
 - SHA                           0.5.2
 - URIParser                     0.2.0
INFO: Testing Chemfiles
Test Summary: | Pass  Total
Generics      |    1      1
WARNING: [chemfiles] Out of bounds residue index 3. Last residue is 0.
Test Summary:   | Pass  Total
Error Functions |    8      8
WARNING: @test_approx_eq_eps is deprecated, use `@test mass(atom) ≈ 4.002602 atol=1.0e-6` instead
Stacktrace:
 [1] depwarn(::String, ::Symbol) at ./deprecated.jl:70
 [2] @test_approx_eq_eps(::ANY, ::ANY, ::ANY) at ./deprecated.jl:1048
 [3] include_from_node1(::String) at ./loading.jl:576
 [4] include(::String) at ./sysimg.jl:14
 [5] main() at /home/vagrant/.julia/v0.6/Chemfiles/test/runtests.jl:15
 [6] include_from_node1(::String) at ./loading.jl:576
 [7] include(::String) at ./sysimg.jl:14
 [8] process_options(::Base.JLOptions) at ./client.jl:305
 [9] _start() at ./client.jl:371
while loading /home/vagrant/.julia/v0.6/Chemfiles/test/Atom.jl, in expression starting on line 1
Test Summary: | Pass  Total
Atom Type     |   13     13
Test Summary: | Pass  Total
Topology type |   32     32
WARNING: @test_approx_eq_eps is deprecated, use `@test cell_matrix(cell) ≈ expected atol=1.0e-10` instead
Stacktrace:
 [1] depwarn(::String, ::Symbol) at ./deprecated.jl:70
 [2] @test_approx_eq_eps(::ANY, ::ANY, ::ANY) at ./deprecated.jl:1048
 [3] include_from_node1(::String) at ./loading.jl:576
 [4] include(::String) at ./sysimg.jl:14
 [5] main() at /home/vagrant/.julia/v0.6/Chemfiles/test/runtests.jl:15
 [6] include_from_node1(::String) at ./loading.jl:576
 [7] include(::String) at ./sysimg.jl:14
 [8] process_options(::Base.JLOptions) at ./client.jl:305
 [9] _start() at ./client.jl:371
while loading /home/vagrant/.julia/v0.6/Chemfiles/test/UnitCell.jl, in expression starting on line 1
Test Summary: | Pass  Total
UnitCell type |   13     13
Test Summary: | Pass  Total
Frame Type    |   17     17
Test Summary:   | Pass  Total
Trajectory type |   20     20
Test Summary:  | Pass  Total
Selection type |   18     18
Test Summary: | Pass  Total
Residue type  |   13     13
INFO: Chemfiles tests passed
INFO: No packages to install, update or remove

>>> End of log
