>>> 'Pkg.add("ImageInTerminal")' log
INFO: Cloning cache of ImageInTerminal from https://github.com/JuliaImages/ImageInTerminal.jl.git
INFO: Installing AxisAlgorithms v0.1.6
INFO: Installing Calculus v0.2.1
INFO: Installing ColorTypes v0.3.4
INFO: Installing ColorVectorSpace v0.4.0
INFO: Installing Colors v0.7.3
INFO: Installing CoordinateTransformations v0.4.0
INFO: Installing Crayons v0.2.0
INFO: Installing DataStructures v0.5.3
INFO: Installing DualNumbers v0.3.0
INFO: Installing FixedPointNumbers v0.3.4
INFO: Installing Graphics v0.1.4
INFO: Installing ImageCore v0.1.4
INFO: Installing ImageInTerminal v0.0.1
INFO: Installing ImageTransformations v0.1.0
INFO: Installing Interpolations v0.3.8
INFO: Installing MappedArrays v0.0.6
INFO: Installing NaNMath v0.2.2
INFO: Installing OffsetArrays v0.2.14
INFO: Installing Ratios v0.0.4
INFO: Installing Reexport v0.0.3
INFO: Installing Rotations v0.3.5
INFO: Installing ShowItLikeYouBuildIt v0.0.1
INFO: Installing SpecialFunctions v0.1.1
INFO: Installing StaticArrays v0.3.0
INFO: Installing StatsBase v0.13.1
INFO: Installing WoodburyMatrices v0.2.2
INFO: Package database updated
INFO: METADATA is out-of-date — you may not have the latest version of ImageInTerminal
INFO: Use `Pkg.update()` to get the latest versions of your packages

>>> 'Pkg.test("ImageInTerminal")' log
Julia Version 0.6.0-pre.alpha.100
Commit 9e6b5fd (2017-03-09 02:03 UTC)
Platform Info:
  OS: Linux (x86_64-pc-linux-gnu)
  CPU: Intel(R) Xeon(R) CPU E3-1241 v3 @ 3.50GHz
  WORD_SIZE: 64
           Ubuntu 14.04.5 LTS
  uname: Linux 3.13.0-112-generic #159-Ubuntu SMP Fri Mar 3 15:26:07 UTC 2017 x86_64 x86_64
Memory: 2.9392738342285156 GB (585.95703125 MB free)
Uptime: 49107.0 sec
Load Avg:  0.96728515625  0.998046875  1.0400390625
Intel(R) Xeon(R) CPU E3-1241 v3 @ 3.50GHz: 
       speed         user         nice          sys         idle          irq
#1  3500 MHz    2136373 s       6594 s     221580 s    2105697 s         82 s
#2  3500 MHz     948570 s        109 s     135524 s    3688528 s          1 s

  BLAS: libopenblas (USE64BITINT DYNAMIC_ARCH NO_AFFINITY Nehalem)
  LAPACK: libopenblas64_
  LIBM: libopenlibm
  LLVM: libLLVM-3.9.1 (ORCJIT, haswell)
Environment:
  TERM = vt100
  LD_LIBRARY_PATH = :/usr/local/lib/
  PATH = /usr/local/sbin:/usr/local/bin:/usr/sbin:/usr/bin:/sbin:/bin:/usr/games:/usr/local/games:/home/vagrant/julia/bin/
  JAVA_HOME = /usr/lib/jvm/java-7-oracle
  HOME = /home/vagrant

Package Directory: /home/vagrant/.julia/v0.6
2 required packages:
 - ImageInTerminal               0.0.1
 - JSON                          0.8.3
26 additional packages:
 - AxisAlgorithms                0.1.6
 - Calculus                      0.2.1
 - ColorTypes                    0.3.4
 - ColorVectorSpace              0.4.0
 - Colors                        0.7.3
 - Compat                        0.20.0
 - CoordinateTransformations     0.4.0
 - Crayons                       0.2.0
 - DataStructures                0.5.3
 - DualNumbers                   0.3.0
 - FixedPointNumbers             0.3.4
 - Graphics                      0.1.4
 - ImageCore                     0.1.4
 - ImageTransformations          0.1.0
 - Interpolations                0.3.8
 - MappedArrays                  0.0.6
 - NaNMath                       0.2.2
 - OffsetArrays                  0.2.14
 - Ratios                        0.0.4
 - Reexport                      0.0.3
 - Rotations                     0.3.5
 - ShowItLikeYouBuildIt          0.0.1
 - SpecialFunctions              0.1.1
 - StaticArrays                  0.3.0
 - StatsBase                     0.13.1
 - WoodburyMatrices              0.2.2
INFO: Computing test dependencies for ImageInTerminal...
INFO: Cloning cache of TestImages from https://github.com/JuliaImages/TestImages.jl.git
INFO: Installing AxisArrays v0.0.5
INFO: Installing BinDeps v0.4.7
INFO: Installing FileIO v0.3.0
INFO: Installing ImageMagick v0.2.2
INFO: Installing IntervalSets v0.0.3
INFO: Installing Iterators v0.3.0
INFO: Installing RangeArrays v0.1.2
INFO: Installing SHA v0.3.2
INFO: Installing TestImages v0.2.0
INFO: Installing URIParser v0.1.8
INFO: Installing ZipFile v0.3.0
INFO: Building ImageMagick
INFO: Building TestImages
INFO: Downloading standard test images
INFO: Downloading /home/vagrant/.julia/v0.6/TestImages/deps/../images/cameraman.tif
  % Total    % Received % Xferd  Average Speed   Time    Time     Time  Current
                                 Dload  Upload   Total   Spent    Left  Speed
  0     0    0     0    0     0      0      0 --:--:-- --:--:-- --:--:--     0100   154    0   154    0     0   1659      0 --:--:-- --:--:-- --:--:--  1673
  0     0    0   144    0     0    990      0 --:--:-- --:--:-- --:--:--   990
100   155  100   155    0     0    830      0 --:--:-- --:--:-- --:--:--   830
100  256k  100  256k    0     0   979k      0 --:--:-- --:--:-- --:--:--  979k
INFO: Downloading /home/vagrant/.julia/v0.6/TestImages/deps/../images/house.tif
  % Total    % Received % Xferd  Average Speed   Time    Time     Time  Current
                                 Dload  Upload   Total   Spent    Left  Speed
  0     0    0     0    0     0      0      0 --:--:-- --:--:-- --:--:--     0100   150    0   150    0     0   1538      0 --:--:-- --:--:-- --:--:--  1546
  0     0    0   140    0     0    937      0 --:--:-- --:--:-- --:--:--   937
100   151  100   151    0     0    762      0 --:--:-- --:--:-- --:--:--   762
100  512k  100  512k    0     0  1442k      0 --:--:-- --:--:-- --:--:-- 1442k
INFO: Downloading /home/vagrant/.julia/v0.6/TestImages/deps/../images/jetplane.tif
  % Total    % Received % Xferd  Average Speed   Time    Time     Time  Current
                                 Dload  Upload   Total   Spent    Left  Speed
  0     0    0     0    0     0      0      0 --:--:-- --:--:-- --:--:--     0100   153    0   153    0     0   1756      0 --:--:-- --:--:-- --:--:--  1758
  0     0    0     0    0     0      0      0 --:--:-- --:--:-- --:--:--     0  0     0    0   143    0     0   1095      0 --:--:-- --:--:-- --:--:--  139k
100   154  100   154    0     0    841      0 --:--:-- --:--:-- --:--:--   841
100  512k  100  512k    0     0  1676k      0 --:--:-- --:--:-- --:--:-- 1676k
INFO: Downloading /home/vagrant/.julia/v0.6/TestImages/deps/../images/lake.tif
  % Total    % Received % Xferd  Average Speed   Time    Time     Time  Current
                                 Dload  Upload   Total   Spent    Left  Speed
  0     0    0     0    0     0      0      0 --:--:-- --:--:-- --:--:--     0100   149    0   149    0     0   1619      0 --:--:-- --:--:-- --:--:--  1637
  0     0    0   139    0     0    932      0 --:--:-- --:--:-- --:--:--   932
100   150  100   150    0     0    922      0 --:--:-- --:--:-- --:--:--   922
100  512k  100  512k    0     0  1175k      0 --:--:-- --:--:-- --:--:-- 1175k
INFO: Downloading /home/vagrant/.julia/v0.6/TestImages/deps/../images/lena_color_256.tif
  % Total    % Received % Xferd  Average Speed   Time    Time     Time  Current
                                 Dload  Upload   Total   Spent    Left  Speed
  0     0    0     0    0     0      0      0 --:--:-- --:--:-- --:--:--     0100   159    0   159    0     0   1777      0 --:--:-- --:--:-- --:--:--  1786
  0     0    0   149    0     0   1158      0 --:--:-- --:--:-- --:--:--  1158
100   160  100   160    0     0    896      0 --:--:-- --:--:-- --:--:--   896
100  192k  100  192k    0     0   789k      0 --:--:-- --:--:-- --:--:--  789k
INFO: Downloading /home/vagrant/.julia/v0.6/TestImages/deps/../images/lena_color_512.tif
  % Total    % Received % Xferd  Average Speed   Time    Time     Time  Current
                                 Dload  Upload   Total   Spent    Left  Speed
  0     0    0     0    0     0      0      0 --:--:-- --:--:-- --:--:--     0100   159    0   159    0     0   1710      0 --:--:-- --:--:-- --:--:--  1728
  0     0    0     0    0     0      0      0 --:--:-- --:--:-- --:--:--     0  0     0    0   149    0     0   1047      0 --:--:-- --:--:-- --:--:-- 74500
100   160  100   160    0     0    857      0 --:--:-- --:--:-- --:--:--   857
100  769k  100  769k    0     0  1620k      0 --:--:-- --:--:-- --:--:-- 1620k
INFO: Downloading /home/vagrant/.julia/v0.6/TestImages/deps/../images/lena_gray_256.tif
  % Total    % Received % Xferd  Average Speed   Time    Time     Time  Current
                                 Dload  Upload   Total   Spent    Left  Speed
  0     0    0     0    0     0      0      0 --:--:-- --:--:-- --:--:--     0100   158    0   158    0     0   1911      0 --:--:-- --:--:-- --:--:--  1926
  0     0    0   148    0     0   1181      0 --:--:-- --:--:-- --:--:--  1181
100   159  100   159    0     0   1143      0 --:--:-- --:--:-- --:--:--  1143
100 65798  100 65798    0     0   232k      0 --:--:-- --:--:-- --:--:--  232k
INFO: Downloading /home/vagrant/.julia/v0.6/TestImages/deps/../images/lena_gray_512.tif
  % Total    % Received % Xferd  Average Speed   Time    Time     Time  Current
                                 Dload  Upload   Total   Spent    Left  Speed
  0     0    0     0    0     0      0      0 --:--:-- --:--:-- --:--:--     0100   158    0   158    0     0   2004      0 --:--:-- --:--:-- --:--:--  2025
  0     0    0   148    0     0   1201      0 --:--:-- --:--:-- --:--:--  1201
100   159  100   159    0     0    924      0 --:--:-- --:--:-- --:--:--   924
100  256k  100  256k    0     0  1055k      0 --:--:-- --:--:-- --:--:-- 1055k
INFO: Downloading /home/vagrant/.julia/v0.6/TestImages/deps/../images/livingroom.tif
  % Total    % Received % Xferd  Average Speed   Time    Time     Time  Current
                                 Dload  Upload   Total   Spent    Left  Speed
  0     0    0     0    0     0      0      0 --:--:-- --:--:-- --:--:--     0100   155    0   155    0     0   1572      0 --:--:-- --:--:-- --:--:--  1565100   155    0   155    0     0   1570      0 --:--:-- --:--:-- --:--:--  1565
  0     0    0   145    0     0   1037      0 --:--:-- --:--:-- --:--:--  1037
100   156  100   156    0     0    832      0 --:--:-- --:--:-- --:--:--   832
100  256k  100  256k    0     0   762k      0 --:--:-- --:--:-- --:--:--  762k
INFO: Downloading /home/vagrant/.julia/v0.6/TestImages/deps/../images/mandril_color.tif
  % Total    % Received % Xferd  Average Speed   Time    Time     Time  Current
                                 Dload  Upload   Total   Spent    Left  Speed
  0     0    0     0    0     0      0      0 --:--:-- --:--:-- --:--:--     0100   158    0   158    0     0   1823      0 --:--:-- --:--:-- --:--:--  1837
  0     0    0   148    0     0   1077      0 --:--:-- --:--:-- --:--:--  1077
100   159  100   159    0     0   1036      0 --:--:-- --:--:-- --:--:--  1036
100  768k  100  768k    0     0  2758k      0 --:--:-- --:--:-- --:--:-- 2758k
INFO: Downloading /home/vagrant/.julia/v0.6/TestImages/deps/../images/mandril_gray.tif
  % Total    % Received % Xferd  Average Speed   Time    Time     Time  Current
                                 Dload  Upload   Total   Spent    Left  Speed
  0     0    0     0    0     0      0      0 --:--:-- --:--:-- --:--:--     0100   157    0   157    0     0   1881      0 --:--:-- --:--:-- --:--:--  1891
  0     0    0   147    0     0   1245      0 --:--:-- --:--:-- --:--:--  1245
100   158  100   158    0     0    901      0 --:--:-- --:--:-- --:--:--   901
100  256k  100  256k    0     0   784k      0 --:--:-- --:--:-- --:--:--  784k
INFO: Downloading /home/vagrant/.julia/v0.6/TestImages/deps/../images/mandrill.tiff
  % Total    % Received % Xferd  Average Speed   Time    Time     Time  Current
                                 Dload  Upload   Total   Spent    Left  Speed
  0     0    0     0    0     0      0      0 --:--:-- --:--:-- --:--:--     0100   154    0   154    0     0   1634      0 --:--:-- --:--:-- --:--:--  1638
  0     0    0     0    0     0      0      0 --:--:-- --:--:-- --:--:--     0  0     0    0   144    0     0    943      0 --:--:-- --:--:-- --:--:-- 24000
100   155  100   155    0     0    731      0 --:--:-- --:--:-- --:--:--   731
100  768k  100  768k    0     0  2222k      0 --:--:-- --:--:-- --:--:-- 2222k
INFO: Downloading /home/vagrant/.julia/v0.6/TestImages/deps/../images/peppers_color.tif
  % Total    % Received % Xferd  Average Speed   Time    Time     Time  Current
                                 Dload  Upload   Total   Spent    Left  Speed
  0     0    0     0    0     0      0      0 --:--:-- --:--:-- --:--:--     0100   158    0   158    0     0   1992      0 --:--:-- --:--:-- --:--:--  2000
  0     0    0   148    0     0   1103      0 --:--:-- --:--:-- --:--:--  1103
100   159  100   159    0     0   1048      0 --:--:-- --:--:-- --:--:--  1048
100  514k  100  514k    0     0  1881k      0 --:--:-- --:--:-- --:--:-- 1881k
INFO: Downloading /home/vagrant/.julia/v0.6/TestImages/deps/../images/peppers_gray.tif
  % Total    % Received % Xferd  Average Speed   Time    Time     Time  Current
                                 Dload  Upload   Total   Spent    Left  Speed
  0     0    0     0    0     0      0      0 --:--:-- --:--:-- --:--:--     0100   157    0   157    0     0   1751      0 --:--:-- --:--:-- --:--:--  1764
  0     0    0   147    0     0   1147      0 --:--:-- --:--:-- --:--:--  1147
100   158  100   158    0     0    868      0 --:--:-- --:--:-- --:--:--   868
100  512k  100  512k    0     0  1945k      0 --:--:-- --:--:-- --:--:-- 1945k
INFO: Downloading /home/vagrant/.julia/v0.6/TestImages/deps/../images/pirate.tif
  % Total    % Received % Xferd  Average Speed   Time    Time     Time  Current
                                 Dload  Upload   Total   Spent    Left  Speed
  0     0    0     0    0     0      0      0 --:--:-- --:--:-- --:--:--     0100   151    0   151    0     0   1365      0 --:--:-- --:--:-- --:--:--  1372
  0     0    0   141    0     0    917      0 --:--:-- --:--:-- --:--:--   917
100   152  100   152    0     0    885      0 --:--:-- --:--:-- --:--:--   885
  0     0    0     0    0     0      0      0 --:--:-- --:--:-- --:--:--     0100  256k  100  256k    0     0   642k      0 --:--:-- --:--:-- --:--:-- 11.3M
INFO: Downloading /home/vagrant/.julia/v0.6/TestImages/deps/../images/walkbridge.tif
  % Total    % Received % Xferd  Average Speed   Time    Time     Time  Current
                                 Dload  Upload   Total   Spent    Left  Speed
  0     0    0     0    0     0      0      0 --:--:-- --:--:-- --:--:--     0100   155    0   155    0     0   1566      0 --:--:-- --:--:-- --:--:--  1581
  0     0    0   145    0     0    939      0 --:--:-- --:--:-- --:--:--   939
100   156  100   156    0     0    664      0 --:--:-- --:--:-- --:--:--   664
100  512k  100  512k    0     0  1163k      0 --:--:-- --:--:-- --:--:-- 1163k
INFO: Downloading /home/vagrant/.julia/v0.6/TestImages/deps/../images/woman_blonde.tif
  % Total    % Received % Xferd  Average Speed   Time    Time     Time  Current
                                 Dload  Upload   Total   Spent    Left  Speed
  0     0    0     0    0     0      0      0 --:--:-- --:--:-- --:--:--     0100   157    0   157    0     0   1713      0 --:--:-- --:--:-- --:--:--  1725
  0     0    0   147    0     0    896      0 --:--:-- --:--:-- --:--:--   896
100   158  100   158    0     0    891      0 --:--:-- --:--:-- --:--:--   891
100  256k  100  256k    0     0   893k      0 --:--:-- --:--:-- --:--:--  893k
INFO: Downloading /home/vagrant/.julia/v0.6/TestImages/deps/../images/woman_darkhair.tif
  % Total    % Received % Xferd  Average Speed   Time    Time     Time  Current
                                 Dload  Upload   Total   Spent    Left  Speed
  0     0    0     0    0     0      0      0 --:--:-- --:--:-- --:--:--     0  0     0    0     0    0     0      0      0 --:--:-- --:--:-- --:--:--     0100   159    0   159    0     0    718      0 --:--:-- --:--:-- --:--:--   716
  0     0    0   149    0     0    560      0 --:--:-- --:--:-- --:--:--   560
100   160  100   160    0     0    489      0 --:--:-- --:--:-- --:--:--   489
100  256k  100  256k    0     0   644k      0 --:--:-- --:--:-- --:--:--  644k
INFO: Download Completed.
INFO: Testing ImageInTerminal

WARNING: deprecated syntax "abstract TermColorDepth" at /home/vagrant/.julia/v0.6/ImageInTerminal/src/colorant2ansi.jl:2.
Use "abstract type TermColorDepth end" instead.

WARNING: deprecated syntax "abstract ImageEncoder" at /home/vagrant/.julia/v0.6/ImageInTerminal/src/encodeimg.jl:3.
Use "abstract type ImageEncoder end" instead.
INFO: Could not find lighthouse in directory. Checking if it exists in the online repository.
INFO: Found lighthouse in the online repository. Downloading to the images directory.
  % Total    % Received % Xferd  Average Speed   Time    Time     Time  Current
                                 Dload  Upload   Total   Spent    Left  Speed
  0     0    0     0    0     0      0      0 --:--:-- --:--:-- --:--:--     0100   145    0   145    0     0   1656      0 --:--:-- --:--:-- --:--:--  1666
100   156  100   156    0     0   1018      0 --:--:-- --:--:-- --:--:--  1018
100  622k  100  622k    0     0  1570k      0 --:--:-- --:--:-- --:--:-- 1570k
INFO: Could not find toucan in directory. Checking if it exists in the online repository.
INFO: Found toucan in the online repository. Downloading to the images directory.
  % Total    % Received % Xferd  Average Speed   Time    Time     Time  Current
                                 Dload  Upload   Total   Spent    Left  Speed
  0     0    0     0    0     0      0      0 --:--:-- --:--:-- --:--:--     0100   141    0   141    0     0   1543      0 --:--:-- --:--:-- --:--:--  1549
100   152  100   152    0     0   1429      0 --:--:-- --:--:-- --:--:--  1429
100 28353  100 28353    0     0   169k      0 --:--:-- --:--:-- --:--:--  169k
Test Summary:        | Pass  Total
tst_colorant2ansi.jl |  126    126
gray square: Test Failed
  Expression: res[1] == "\e[0m\e[38;5;232;48;5;248m▀\e[38;5;239;48;5;255m▀\e[0m"
   Evaluated: "▀▀" == "\e[0m\e[38;5;232;48;5;248m▀\e[38;5;239;48;5;255m▀\e[0m"
Stacktrace:
 [1] macro expansion at /home/vagrant/.julia/v0.6/ImageInTerminal/test/tst_encodeimg.jl:19 [inlined]
 [2] macro expansion at ./test.jl:853 [inlined]
 [3] macro expansion at /home/vagrant/.julia/v0.6/ImageInTerminal/test/tst_encodeimg.jl:0 [inlined]
 [4] macro expansion at ./test.jl:853 [inlined]
 [5] anonymous at ./<missing>:?
transparent gray square: Test Failed
  Expression: res[1] == "\e[0m\e[38;5;232;48;5;248m▀\e[38;5;239;48;5;255m▀\e[0m"
   Evaluated: "▀▀" == "\e[0m\e[38;5;232;48;5;248m▀\e[38;5;239;48;5;255m▀\e[0m"
Stacktrace:
 [1] macro expansion at /home/vagrant/.julia/v0.6/ImageInTerminal/test/tst_encodeimg.jl:29 [inlined]
 [2] macro expansion at ./test.jl:853 [inlined]
 [3] macro expansion at /home/vagrant/.julia/v0.6/ImageInTerminal/test/tst_encodeimg.jl:0 [inlined]
 [4] macro expansion at ./test.jl:853 [inlined]
 [5] anonymous at ./<missing>:?
camera man: Error During Test
  Got an exception of type UndefVarError outside of a @test
  UndefVarError: res not defined
  Stacktrace:
   [1] macro expansion at /home/vagrant/.julia/v0.6/ImageInTerminal/test/tst_encodeimg.jl:40 [inlined]
   [2] macro expansion at ./test.jl:853 [inlined]
   [3] macro expansion at /home/vagrant/.julia/v0.6/ImageInTerminal/test/tst_encodeimg.jl:0 [inlined]
   [4] macro expansion at ./test.jl:853 [inlined]
   [5] anonymous at ./<missing>:?
   [6] include_from_node1(::String) at ./loading.jl:539
   [7] include(::String) at ./sysimg.jl:14
   [8] macro expansion at /home/vagrant/.julia/v0.6/ImageInTerminal/test/runtests.jl:73 [inlined]
   [9] macro expansion at ./test.jl:853 [inlined]
   [10] macro expansion at /home/vagrant/.julia/v0.6/ImageInTerminal/test/runtests.jl:0 [inlined]
   [11] anonymous at ./<missing>:?
   [12] include_from_node1(::String) at ./loading.jl:539
   [13] include(::String) at ./sysimg.jl:14
   [14] process_options(::Base.JLOptions) at ./client.jl:305
   [15] _start() at ./client.jl:371
lighthouse: Error During Test
  Got an exception of type UndefVarError outside of a @test
  UndefVarError: res not defined
  Stacktrace:
   [1] macro expansion at /home/vagrant/.julia/v0.6/ImageInTerminal/test/tst_encodeimg.jl:59 [inlined]
   [2] macro expansion at ./test.jl:853 [inlined]
   [3] macro expansion at /home/vagrant/.julia/v0.6/ImageInTerminal/test/tst_encodeimg.jl:0 [inlined]
   [4] macro expansion at ./test.jl:853 [inlined]
   [5] anonymous at ./<missing>:?
   [6] include_from_node1(::String) at ./loading.jl:539
   [7] include(::String) at ./sysimg.jl:14
   [8] macro expansion at /home/vagrant/.julia/v0.6/ImageInTerminal/test/runtests.jl:73 [inlined]
   [9] macro expansion at ./test.jl:853 [inlined]
   [10] macro expansion at /home/vagrant/.julia/v0.6/ImageInTerminal/test/runtests.jl:0 [inlined]
   [11] anonymous at ./<missing>:?
   [12] include_from_node1(::String) at ./loading.jl:539
   [13] include(::String) at ./sysimg.jl:14
   [14] process_options(::Base.JLOptions) at ./client.jl:305
   [15] _start() at ./client.jl:371
toucan: Error During Test
  Got an exception of type UndefVarError outside of a @test
  UndefVarError: res not defined
  Stacktrace:
   [1] macro expansion at /home/vagrant/.julia/v0.6/ImageInTerminal/test/tst_encodeimg.jl:66 [inlined]
   [2] macro expansion at ./test.jl:853 [inlined]
   [3] macro expansion at /home/vagrant/.julia/v0.6/ImageInTerminal/test/tst_encodeimg.jl:0 [inlined]
   [4] macro expansion at ./test.jl:853 [inlined]
   [5] anonymous at ./<missing>:?
   [6] include_from_node1(::String) at ./loading.jl:539
   [7] include(::String) at ./sysimg.jl:14
   [8] macro expansion at /home/vagrant/.julia/v0.6/ImageInTerminal/test/runtests.jl:73 [inlined]
   [9] macro expansion at ./test.jl:853 [inlined]
   [10] macro expansion at /home/vagrant/.julia/v0.6/ImageInTerminal/test/runtests.jl:0 [inlined]
   [11] anonymous at ./<missing>:?
   [12] include_from_node1(::String) at ./loading.jl:539
   [13] include(::String) at ./sysimg.jl:14
   [14] process_options(::Base.JLOptions) at ./client.jl:305
   [15] _start() at ./client.jl:371
gray square: Test Failed
  Expression: res[1] == "\e[0m\e[38;5;232m██\e[38;5;239m██\e[0m"
   Evaluated: "████" == "\e[0m\e[38;5;232m██\e[38;5;239m██\e[0m"
Stacktrace:
 [1] macro expansion at /home/vagrant/.julia/v0.6/ImageInTerminal/test/tst_encodeimg.jl:79 [inlined]
 [2] macro expansion at ./test.jl:853 [inlined]
 [3] macro expansion at /home/vagrant/.julia/v0.6/ImageInTerminal/test/tst_encodeimg.jl:0 [inlined]
 [4] macro expansion at ./test.jl:853 [inlined]
 [5] anonymous at ./<missing>:?
gray square: Test Failed
  Expression: res[2] == "\e[0m\e[38;5;248m██\e[38;5;255m██\e[0m"
   Evaluated: "████" == "\e[0m\e[38;5;248m██\e[38;5;255m██\e[0m"
Stacktrace:
 [1] macro expansion at /home/vagrant/.julia/v0.6/ImageInTerminal/test/tst_encodeimg.jl:80 [inlined]
 [2] macro expansion at ./test.jl:853 [inlined]
 [3] macro expansion at /home/vagrant/.julia/v0.6/ImageInTerminal/test/tst_encodeimg.jl:0 [inlined]
 [4] macro expansion at ./test.jl:853 [inlined]
 [5] anonymous at ./<missing>:?
transparent gray square: Test Failed
  Expression: res[1] == "\e[0m\e[38;5;232m██\e[38;5;239m▓▓\e[0m"
   Evaluated: "██▓▓" == "\e[0m\e[38;5;232m██\e[38;5;239m▓▓\e[0m"
Stacktrace:
 [1] macro expansion at /home/vagrant/.julia/v0.6/ImageInTerminal/test/tst_encodeimg.jl:88 [inlined]
 [2] macro expansion at ./test.jl:853 [inlined]
 [3] macro expansion at /home/vagrant/.julia/v0.6/ImageInTerminal/test/tst_encodeimg.jl:0 [inlined]
 [4] macro expansion at ./test.jl:853 [inlined]
 [5] anonymous at ./<missing>:?
transparent gray square: Test Failed
  Expression: res[2] == "\e[0m\e[38;5;248m░░\e[38;5;255m⋅⋅\e[0m"
   Evaluated: "░░⋅⋅" == "\e[0m\e[38;5;248m░░\e[38;5;255m⋅⋅\e[0m"
Stacktrace:
 [1] macro expansion at /home/vagrant/.julia/v0.6/ImageInTerminal/test/tst_encodeimg.jl:89 [inlined]
 [2] macro expansion at ./test.jl:853 [inlined]
 [3] macro expansion at /home/vagrant/.julia/v0.6/ImageInTerminal/test/tst_encodeimg.jl:0 [inlined]
 [4] macro expansion at ./test.jl:853 [inlined]
 [5] anonymous at ./<missing>:?
camera man: Error During Test
  Got an exception of type UndefVarError outside of a @test
  UndefVarError: res not defined
  Stacktrace:
   [1] macro expansion at /home/vagrant/.julia/v0.6/ImageInTerminal/test/tst_encodeimg.jl:98 [inlined]
   [2] macro expansion at ./test.jl:853 [inlined]
   [3] macro expansion at /home/vagrant/.julia/v0.6/ImageInTerminal/test/tst_encodeimg.jl:0 [inlined]
   [4] macro expansion at ./test.jl:853 [inlined]
   [5] anonymous at ./<missing>:?
   [6] include_from_node1(::String) at ./loading.jl:539
   [7] include(::String) at ./sysimg.jl:14
   [8] macro expansion at /home/vagrant/.julia/v0.6/ImageInTerminal/test/runtests.jl:73 [inlined]
   [9] macro expansion at ./test.jl:853 [inlined]
   [10] macro expansion at /home/vagrant/.julia/v0.6/ImageInTerminal/test/runtests.jl:0 [inlined]
   [11] anonymous at ./<missing>:?
   [12] include_from_node1(::String) at ./loading.jl:539
   [13] include(::String) at ./sysimg.jl:14
   [14] process_options(::Base.JLOptions) at ./client.jl:305
   [15] _start() at ./client.jl:371
lighthouse: Error During Test
  Got an exception of type UndefVarError outside of a @test
  UndefVarError: res not defined
  Stacktrace:
   [1] macro expansion at /home/vagrant/.julia/v0.6/ImageInTerminal/test/tst_encodeimg.jl:105 [inlined]
   [2] macro expansion at ./test.jl:853 [inlined]
   [3] macro expansion at /home/vagrant/.julia/v0.6/ImageInTerminal/test/tst_encodeimg.jl:0 [inlined]
   [4] macro expansion at ./test.jl:853 [inlined]
   [5] anonymous at ./<missing>:?
   [6] include_from_node1(::String) at ./loading.jl:539
   [7] include(::String) at ./sysimg.jl:14
   [8] macro expansion at /home/vagrant/.julia/v0.6/ImageInTerminal/test/runtests.jl:73 [inlined]
   [9] macro expansion at ./test.jl:853 [inlined]
   [10] macro expansion at /home/vagrant/.julia/v0.6/ImageInTerminal/test/runtests.jl:0 [inlined]
   [11] anonymous at ./<missing>:?
   [12] include_from_node1(::String) at ./loading.jl:539
   [13] include(::String) at ./sysimg.jl:14
   [14] process_options(::Base.JLOptions) at ./client.jl:305
   [15] _start() at ./client.jl:371
toucan: Error During Test
  Got an exception of type UndefVarError outside of a @test
  UndefVarError: res not defined
  Stacktrace:
   [1] macro expansion at /home/vagrant/.julia/v0.6/ImageInTerminal/test/tst_encodeimg.jl:112 [inlined]
   [2] macro expansion at ./test.jl:853 [inlined]
   [3] macro expansion at /home/vagrant/.julia/v0.6/ImageInTerminal/test/tst_encodeimg.jl:0 [inlined]
   [4] macro expansion at ./test.jl:853 [inlined]
   [5] anonymous at ./<missing>:?
   [6] include_from_node1(::String) at ./loading.jl:539
   [7] include(::String) at ./sysimg.jl:14
   [8] macro expansion at /home/vagrant/.julia/v0.6/ImageInTerminal/test/runtests.jl:73 [inlined]
   [9] macro expansion at ./test.jl:853 [inlined]
   [10] macro expansion at /home/vagrant/.julia/v0.6/ImageInTerminal/test/runtests.jl:0 [inlined]
   [11] anonymous at ./<missing>:?
   [12] include_from_node1(::String) at ./loading.jl:539
   [13] include(::String) at ./sysimg.jl:14
   [14] process_options(::Base.JLOptions) at ./client.jl:305
   [15] _start() at ./client.jl:371
gray square: Test Failed
  Expression: res[1] == "\e[0m\e[38;2;0;0;0;48;2;178;178;178m▀\e[38;2;76;76;76;48;2;255;255;255m▀\e[0m"
   Evaluated: "▀▀" == "\e[0m\e[38;2;0;0;0;48;2;178;178;178m▀\e[38;2;76;76;76;48;2;255;255;255m▀\e[0m"
Stacktrace:
 [1] macro expansion at /home/vagrant/.julia/v0.6/ImageInTerminal/test/tst_encodeimg.jl:125 [inlined]
 [2] macro expansion at ./test.jl:853 [inlined]
 [3] macro expansion at /home/vagrant/.julia/v0.6/ImageInTerminal/test/tst_encodeimg.jl:0 [inlined]
 [4] macro expansion at ./test.jl:853 [inlined]
 [5] anonymous at ./<missing>:?
transparent gray square: Test Failed
  Expression: res[1] == "\e[0m\e[38;2;0;0;0;48;2;178;178;178m▀\e[38;2;76;76;76;48;2;255;255;255m▀\e[0m"
   Evaluated: "▀▀" == "\e[0m\e[38;2;0;0;0;48;2;178;178;178m▀\e[38;2;76;76;76;48;2;255;255;255m▀\e[0m"
Stacktrace:
 [1] macro expansion at /home/vagrant/.julia/v0.6/ImageInTerminal/test/tst_encodeimg.jl:135 [inlined]
 [2] macro expansion at ./test.jl:853 [inlined]
 [3] macro expansion at /home/vagrant/.julia/v0.6/ImageInTerminal/test/tst_encodeimg.jl:0 [inlined]
 [4] macro expansion at ./test.jl:853 [inlined]
 [5] anonymous at ./<missing>:?
camera man: Error During Test
  Got an exception of type UndefVarError outside of a @test
  UndefVarError: res not defined
  Stacktrace:
   [1] macro expansion at /home/vagrant/.julia/v0.6/ImageInTerminal/test/tst_encodeimg.jl:146 [inlined]
   [2] macro expansion at ./test.jl:853 [inlined]
   [3] macro expansion at /home/vagrant/.julia/v0.6/ImageInTerminal/test/tst_encodeimg.jl:0 [inlined]
   [4] macro expansion at ./test.jl:853 [inlined]
   [5] anonymous at ./<missing>:?
   [6] include_from_node1(::String) at ./loading.jl:539
   [7] include(::String) at ./sysimg.jl:14
   [8] macro expansion at /home/vagrant/.julia/v0.6/ImageInTerminal/test/runtests.jl:73 [inlined]
   [9] macro expansion at ./test.jl:853 [inlined]
   [10] macro expansion at /home/vagrant/.julia/v0.6/ImageInTerminal/test/runtests.jl:0 [inlined]
   [11] anonymous at ./<missing>:?
   [12] include_from_node1(::String) at ./loading.jl:539
   [13] include(::String) at ./sysimg.jl:14
   [14] process_options(::Base.JLOptions) at ./client.jl:305
   [15] _start() at ./client.jl:371
lighthouse: Error During Test
  Got an exception of type UndefVarError outside of a @test
  UndefVarError: res not defined
  Stacktrace:
   [1] macro expansion at /home/vagrant/.julia/v0.6/ImageInTerminal/test/tst_encodeimg.jl:159 [inlined]
   [2] macro expansion at ./test.jl:853 [inlined]
   [3] macro expansion at /home/vagrant/.julia/v0.6/ImageInTerminal/test/tst_encodeimg.jl:0 [inlined]
   [4] macro expansion at ./test.jl:853 [inlined]
   [5] anonymous at ./<missing>:?
   [6] include_from_node1(::String) at ./loading.jl:539
   [7] include(::String) at ./sysimg.jl:14
   [8] macro expansion at /home/vagrant/.julia/v0.6/ImageInTerminal/test/runtests.jl:73 [inlined]
   [9] macro expansion at ./test.jl:853 [inlined]
   [10] macro expansion at /home/vagrant/.julia/v0.6/ImageInTerminal/test/runtests.jl:0 [inlined]
   [11] anonymous at ./<missing>:?
   [12] include_from_node1(::String) at ./loading.jl:539
   [13] include(::String) at ./sysimg.jl:14
   [14] process_options(::Base.JLOptions) at ./client.jl:305
   [15] _start() at ./client.jl:371
toucan: Error During Test
  Got an exception of type UndefVarError outside of a @test
  UndefVarError: res not defined
  Stacktrace:
   [1] macro expansion at /home/vagrant/.julia/v0.6/ImageInTerminal/test/tst_encodeimg.jl:166 [inlined]
   [2] macro expansion at ./test.jl:853 [inlined]
   [3] macro expansion at /home/vagrant/.julia/v0.6/ImageInTerminal/test/tst_encodeimg.jl:0 [inlined]
   [4] macro expansion at ./test.jl:853 [inlined]
   [5] anonymous at ./<missing>:?
   [6] include_from_node1(::String) at ./loading.jl:539
   [7] include(::String) at ./sysimg.jl:14
   [8] macro expansion at /home/vagrant/.julia/v0.6/ImageInTerminal/test/runtests.jl:73 [inlined]
   [9] macro expansion at ./test.jl:853 [inlined]
   [10] macro expansion at /home/vagrant/.julia/v0.6/ImageInTerminal/test/runtests.jl:0 [inlined]
   [11] anonymous at ./<missing>:?
   [12] include_from_node1(::String) at ./loading.jl:539
   [13] include(::String) at ./sysimg.jl:14
   [14] process_options(::Base.JLOptions) at ./client.jl:305
   [15] _start() at ./client.jl:371
gray square: Test Failed
  Expression: res[1] == "\e[0m\e[38;2;0;0;0m██\e[38;2;76;76;76m██\e[0m"
   Evaluated: "████" == "\e[0m\e[38;2;0;0;0m██\e[38;2;76;76;76m██\e[0m"
Stacktrace:
 [1] macro expansion at /home/vagrant/.julia/v0.6/ImageInTerminal/test/tst_encodeimg.jl:179 [inlined]
 [2] macro expansion at ./test.jl:853 [inlined]
 [3] macro expansion at /home/vagrant/.julia/v0.6/ImageInTerminal/test/tst_encodeimg.jl:0 [inlined]
 [4] macro expansion at ./test.jl:853 [inlined]
 [5] anonymous at ./<missing>:?
gray square: Test Failed
  Expression: res[2] == "\e[0m\e[38;2;178;178;178m██\e[38;2;255;255;255m██\e[0m"
   Evaluated: "████" == "\e[0m\e[38;2;178;178;178m██\e[38;2;255;255;255m██\e[0m"
Stacktrace:
 [1] macro expansion at /home/vagrant/.julia/v0.6/ImageInTerminal/test/tst_encodeimg.jl:180 [inlined]
 [2] macro expansion at ./test.jl:853 [inlined]
 [3] macro expansion at /home/vagrant/.julia/v0.6/ImageInTerminal/test/tst_encodeimg.jl:0 [inlined]
 [4] macro expansion at ./test.jl:853 [inlined]
 [5] anonymous at ./<missing>:?
transparent gray square: Test Failed
  Expression: res[1] == "\e[0m\e[38;2;0;0;0m██\e[38;2;76;76;76m▓▓\e[0m"
   Evaluated: "██▓▓" == "\e[0m\e[38;2;0;0;0m██\e[38;2;76;76;76m▓▓\e[0m"
Stacktrace:
 [1] macro expansion at /home/vagrant/.julia/v0.6/ImageInTerminal/test/tst_encodeimg.jl:188 [inlined]
 [2] macro expansion at ./test.jl:853 [inlined]
 [3] macro expansion at /home/vagrant/.julia/v0.6/ImageInTerminal/test/tst_encodeimg.jl:0 [inlined]
 [4] macro expansion at ./test.jl:853 [inlined]
 [5] anonymous at ./<missing>:?
transparent gray square: Test Failed
  Expression: res[2] == "\e[0m\e[38;2;178;178;178m░░\e[38;2;255;255;255m⋅⋅\e[0m"
   Evaluated: "░░⋅⋅" == "\e[0m\e[38;2;178;178;178m░░\e[38;2;255;255;255m⋅⋅\e[0m"
Stacktrace:
 [1] macro expansion at /home/vagrant/.julia/v0.6/ImageInTerminal/test/tst_encodeimg.jl:189 [inlined]
 [2] macro expansion at ./test.jl:853 [inlined]
 [3] macro expansion at /home/vagrant/.julia/v0.6/ImageInTerminal/test/tst_encodeimg.jl:0 [inlined]
 [4] macro expansion at ./test.jl:853 [inlined]
 [5] anonymous at ./<missing>:?
camera man: Error During Test
  Got an exception of type UndefVarError outside of a @test
  UndefVarError: res not defined
  Stacktrace:
   [1] macro expansion at /home/vagrant/.julia/v0.6/ImageInTerminal/test/tst_encodeimg.jl:198 [inlined]
   [2] macro expansion at ./test.jl:853 [inlined]
   [3] macro expansion at /home/vagrant/.julia/v0.6/ImageInTerminal/test/tst_encodeimg.jl:0 [inlined]
   [4] macro expansion at ./test.jl:853 [inlined]
   [5] anonymous at ./<missing>:?
   [6] include_from_node1(::String) at ./loading.jl:539
   [7] include(::String) at ./sysimg.jl:14
   [8] macro expansion at /home/vagrant/.julia/v0.6/ImageInTerminal/test/runtests.jl:73 [inlined]
   [9] macro expansion at ./test.jl:853 [inlined]
   [10] macro expansion at /home/vagrant/.julia/v0.6/ImageInTerminal/test/runtests.jl:0 [inlined]
   [11] anonymous at ./<missing>:?
   [12] include_from_node1(::String) at ./loading.jl:539
   [13] include(::String) at ./sysimg.jl:14
   [14] process_options(::Base.JLOptions) at ./client.jl:305
   [15] _start() at ./client.jl:371
lighthouse: Error During Test
  Got an exception of type UndefVarError outside of a @test
  UndefVarError: res not defined
  Stacktrace:
   [1] macro expansion at /home/vagrant/.julia/v0.6/ImageInTerminal/test/tst_encodeimg.jl:205 [inlined]
   [2] macro expansion at ./test.jl:853 [inlined]
   [3] macro expansion at /home/vagrant/.julia/v0.6/ImageInTerminal/test/tst_encodeimg.jl:0 [inlined]
   [4] macro expansion at ./test.jl:853 [inlined]
   [5] anonymous at ./<missing>:?
   [6] include_from_node1(::String) at ./loading.jl:539
   [7] include(::String) at ./sysimg.jl:14
   [8] macro expansion at /home/vagrant/.julia/v0.6/ImageInTerminal/test/runtests.jl:73 [inlined]
   [9] macro expansion at ./test.jl:853 [inlined]
   [10] macro expansion at /home/vagrant/.julia/v0.6/ImageInTerminal/test/runtests.jl:0 [inlined]
   [11] anonymous at ./<missing>:?
   [12] include_from_node1(::String) at ./loading.jl:539
   [13] include(::String) at ./sysimg.jl:14
   [14] process_options(::Base.JLOptions) at ./client.jl:305
   [15] _start() at ./client.jl:371
toucan: Error During Test
  Got an exception of type UndefVarError outside of a @test
  UndefVarError: res not defined
  Stacktrace:
   [1] macro expansion at /home/vagrant/.julia/v0.6/ImageInTerminal/test/tst_encodeimg.jl:212 [inlined]
   [2] macro expansion at ./test.jl:853 [inlined]
   [3] macro expansion at /home/vagrant/.julia/v0.6/ImageInTerminal/test/tst_encodeimg.jl:0 [inlined]
   [4] macro expansion at ./test.jl:853 [inlined]
   [5] anonymous at ./<missing>:?
   [6] include_from_node1(::String) at ./loading.jl:539
   [7] include(::String) at ./sysimg.jl:14
   [8] macro expansion at /home/vagrant/.julia/v0.6/ImageInTerminal/test/runtests.jl:73 [inlined]
   [9] macro expansion at ./test.jl:853 [inlined]
   [10] macro expansion at /home/vagrant/.julia/v0.6/ImageInTerminal/test/runtests.jl:0 [inlined]
   [11] anonymous at ./<missing>:?
   [12] include_from_node1(::String) at ./loading.jl:539
   [13] include(::String) at ./sysimg.jl:14
   [14] process_options(::Base.JLOptions) at ./client.jl:305
   [15] _start() at ./client.jl:371
gray line: Test Failed
  Expression: res[1] == "\e[0m\e[38;5;232m█\e[38;5;239m█\e[38;5;248m█\e[38;5;255m█\e[0m"
   Evaluated: "████" == "\e[0m\e[38;5;232m█\e[38;5;239m█\e[38;5;248m█\e[38;5;255m█\e[0m"
Stacktrace:
 [1] macro expansion at /home/vagrant/.julia/v0.6/ImageInTerminal/test/tst_encodeimg.jl:225 [inlined]
 [2] macro expansion at ./test.jl:853 [inlined]
 [3] macro expansion at /home/vagrant/.julia/v0.6/ImageInTerminal/test/tst_encodeimg.jl:0 [inlined]
 [4] macro expansion at ./test.jl:853 [inlined]
 [5] anonymous at ./<missing>:?
transparent gray line: Test Failed
  Expression: res[1] == "\e[0m\e[38;5;232m█\e[38;5;239m▓\e[38;5;248m░\e[38;5;255m⋅\e[0m"
   Evaluated: "█▓░⋅" == "\e[0m\e[38;5;232m█\e[38;5;239m▓\e[38;5;248m░\e[38;5;255m⋅\e[0m"
Stacktrace:
 [1] macro expansion at /home/vagrant/.julia/v0.6/ImageInTerminal/test/tst_encodeimg.jl:233 [inlined]
 [2] macro expansion at ./test.jl:853 [inlined]
 [3] macro expansion at /home/vagrant/.julia/v0.6/ImageInTerminal/test/tst_encodeimg.jl:0 [inlined]
 [4] macro expansion at ./test.jl:853 [inlined]
 [5] anonymous at ./<missing>:?
rgb line: Test Failed
  Expression: res[1] == "\e[0m\e[38;5;21m█\e[38;5;56m█\e[38;5;91m█\e[38;5;91m█\e[38;5;126m█\e[38;5;126m█\e[38;5;161m█\e[38;5;196m█\e[0m"
   Evaluated: "████████" == "\e[0m\e[38;5;21m█\e[38;5;56m█\e[38;5;91m█\e[38;5;91m█\e[38;5;126m█\e[38;5;126m█\e[38;5;161m█\e[38;5;196m█\e[0m"
Stacktrace:
 [1] macro expansion at /home/vagrant/.julia/v0.6/ImageInTerminal/test/tst_encodeimg.jl:241 [inlined]
 [2] macro expansion at ./test.jl:853 [inlined]
 [3] macro expansion at /home/vagrant/.julia/v0.6/ImageInTerminal/test/tst_encodeimg.jl:0 [inlined]
 [4] macro expansion at ./test.jl:853 [inlined]
 [5] anonymous at ./<missing>:?
gray line: Test Failed
  Expression: res[1] == "\e[0m\e[38;5;232m██ \e[0m … \e[38;5;255m██ \e[0m"
   Evaluated: "██  … ██ " == "\e[0m\e[38;5;232m██ \e[0m … \e[38;5;255m██ \e[0m"
Stacktrace:
 [1] macro expansion at /home/vagrant/.julia/v0.6/ImageInTerminal/test/tst_encodeimg.jl:254 [inlined]
 [2] macro expansion at ./test.jl:853 [inlined]
 [3] macro expansion at /home/vagrant/.julia/v0.6/ImageInTerminal/test/tst_encodeimg.jl:0 [inlined]
 [4] macro expansion at ./test.jl:853 [inlined]
 [5] anonymous at ./<missing>:?
gray line: Test Failed
  Expression: res[1] == "\e[0m\e[38;5;232m██ \e[38;5;239m██ \e[38;5;248m██ \e[38;5;255m██ \e[0m"
   Evaluated: "██ ██ ██ ██ " == "\e[0m\e[38;5;232m██ \e[38;5;239m██ \e[38;5;248m██ \e[38;5;255m██ \e[0m"
Stacktrace:
 [1] macro expansion at /home/vagrant/.julia/v0.6/ImageInTerminal/test/tst_encodeimg.jl:260 [inlined]
 [2] macro expansion at ./test.jl:853 [inlined]
 [3] macro expansion at /home/vagrant/.julia/v0.6/ImageInTerminal/test/tst_encodeimg.jl:0 [inlined]
 [4] macro expansion at ./test.jl:853 [inlined]
 [5] anonymous at ./<missing>:?
transparent gray line: Test Failed
  Expression: res[1] == "\e[0m\e[38;5;232m██ \e[0m … \e[38;5;255m⋅⋅ \e[0m"
   Evaluated: "██  … ⋅⋅ " == "\e[0m\e[38;5;232m██ \e[0m … \e[38;5;255m⋅⋅ \e[0m"
Stacktrace:
 [1] macro expansion at /home/vagrant/.julia/v0.6/ImageInTerminal/test/tst_encodeimg.jl:268 [inlined]
 [2] macro expansion at ./test.jl:853 [inlined]
 [3] macro expansion at /home/vagrant/.julia/v0.6/ImageInTerminal/test/tst_encodeimg.jl:0 [inlined]
 [4] macro expansion at ./test.jl:853 [inlined]
 [5] anonymous at ./<missing>:?
transparent gray line: Test Failed
  Expression: res[1] == "\e[0m\e[38;5;232m██ \e[38;5;239m▓▓ \e[38;5;248m░░ \e[38;5;255m⋅⋅ \e[0m"
   Evaluated: "██ ▓▓ ░░ ⋅⋅ " == "\e[0m\e[38;5;232m██ \e[38;5;239m▓▓ \e[38;5;248m░░ \e[38;5;255m⋅⋅ \e[0m"
Stacktrace:
 [1] macro expansion at /home/vagrant/.julia/v0.6/ImageInTerminal/test/tst_encodeimg.jl:274 [inlined]
 [2] macro expansion at ./test.jl:853 [inlined]
 [3] macro expansion at /home/vagrant/.julia/v0.6/ImageInTerminal/test/tst_encodeimg.jl:0 [inlined]
 [4] macro expansion at ./test.jl:853 [inlined]
 [5] anonymous at ./<missing>:?
rgb line: Test Failed
  Expression: res[1] == "\e[0m\e[38;5;21m██ \e[0m … \e[38;5;196m██ \e[0m"
   Evaluated: "██  … ██ " == "\e[0m\e[38;5;21m██ \e[0m … \e[38;5;196m██ \e[0m"
Stacktrace:
 [1] macro expansion at /home/vagrant/.julia/v0.6/ImageInTerminal/test/tst_encodeimg.jl:282 [inlined]
 [2] macro expansion at ./test.jl:853 [inlined]
 [3] macro expansion at /home/vagrant/.julia/v0.6/ImageInTerminal/test/tst_encodeimg.jl:0 [inlined]
 [4] macro expansion at ./test.jl:853 [inlined]
 [5] anonymous at ./<missing>:?
rgb line: Test Failed
  Expression: res[1] == "\e[0m\e[38;5;21m██ \e[38;5;21m██ \e[38;5;56m██ \e[0m … \e[38;5;161m██ \e[38;5;196m██ \e[38;5;196m██ \e[0m"
   Evaluated: "██ ██ ██  … ██ ██ ██ " == "\e[0m\e[38;5;21m██ \e[38;5;21m██ \e[38;5;56m██ \e[0m … \e[38;5;161m██ \e[38;5;196m██ \e[38;5;196m██ \e[0m"
Stacktrace:
 [1] macro expansion at /home/vagrant/.julia/v0.6/ImageInTerminal/test/tst_encodeimg.jl:288 [inlined]
 [2] macro expansion at ./test.jl:853 [inlined]
 [3] macro expansion at /home/vagrant/.julia/v0.6/ImageInTerminal/test/tst_encodeimg.jl:0 [inlined]
 [4] macro expansion at ./test.jl:853 [inlined]
 [5] anonymous at ./<missing>:?
gray line: Test Failed
  Expression: res[1] == "\e[0m\e[38;2;0;0;0m█\e[38;2;76;76;76m█\e[38;2;178;178;178m█\e[38;2;255;255;255m█\e[0m"
   Evaluated: "████" == "\e[0m\e[38;2;0;0;0m█\e[38;2;76;76;76m█\e[38;2;178;178;178m█\e[38;2;255;255;255m█\e[0m"
Stacktrace:
 [1] macro expansion at /home/vagrant/.julia/v0.6/ImageInTerminal/test/tst_encodeimg.jl:301 [inlined]
 [2] macro expansion at ./test.jl:853 [inlined]
 [3] macro expansion at /home/vagrant/.julia/v0.6/ImageInTerminal/test/tst_encodeimg.jl:0 [inlined]
 [4] macro expansion at ./test.jl:853 [inlined]
 [5] anonymous at ./<missing>:?
transparent gray line: Test Failed
  Expression: res[1] == "\e[0m\e[38;2;0;0;0m█\e[38;2;76;76;76m▓\e[38;2;178;178;178m░\e[38;2;255;255;255m⋅\e[0m"
   Evaluated: "█▓░⋅" == "\e[0m\e[38;2;0;0;0m█\e[38;2;76;76;76m▓\e[38;2;178;178;178m░\e[38;2;255;255;255m⋅\e[0m"
Stacktrace:
 [1] macro expansion at /home/vagrant/.julia/v0.6/ImageInTerminal/test/tst_encodeimg.jl:309 [inlined]
 [2] macro expansion at ./test.jl:853 [inlined]
 [3] macro expansion at /home/vagrant/.julia/v0.6/ImageInTerminal/test/tst_encodeimg.jl:0 [inlined]
 [4] macro expansion at ./test.jl:853 [inlined]
 [5] anonymous at ./<missing>:?
rgb line: Test Failed
  Expression: res[1] == "\e[0m\e[38;2;10;0;245m█\e[38;2;44;0;211m█\e[38;2;77;0;178m█\e[38;2;111;0;144m█\e[38;2;144;0;111m█\e[38;2;178;0;77m█\e[38;2;211;0;44m█\e[38;2;245;0;10m█\e[0m"
   Evaluated: "████████" == "\e[0m\e[38;2;10;0;245m█\e[38;2;44;0;211m█\e[38;2;77;0;178m█\e[38;2;111;0;144m█\e[38;2;144;0;111m█\e[38;2;178;0;77m█\e[38;2;211;0;44m█\e[38;2;245;0;10m█\e[0m"
Stacktrace:
 [1] macro expansion at /home/vagrant/.julia/v0.6/ImageInTerminal/test/tst_encodeimg.jl:317 [inlined]
 [2] macro expansion at ./test.jl:853 [inlined]
 [3] macro expansion at /home/vagrant/.julia/v0.6/ImageInTerminal/test/tst_encodeimg.jl:0 [inlined]
 [4] macro expansion at ./test.jl:853 [inlined]
 [5] anonymous at ./<missing>:?
gray line: Test Failed
  Expression: res[1] == "\e[0m\e[38;2;0;0;0m██ \e[0m … \e[38;2;255;255;255m██ \e[0m"
   Evaluated: "██  … ██ " == "\e[0m\e[38;2;0;0;0m██ \e[0m … \e[38;2;255;255;255m██ \e[0m"
Stacktrace:
 [1] macro expansion at /home/vagrant/.julia/v0.6/ImageInTerminal/test/tst_encodeimg.jl:330 [inlined]
 [2] macro expansion at ./test.jl:853 [inlined]
 [3] macro expansion at /home/vagrant/.julia/v0.6/ImageInTerminal/test/tst_encodeimg.jl:0 [inlined]
 [4] macro expansion at ./test.jl:853 [inlined]
 [5] anonymous at ./<missing>:?
gray line: Test Failed
  Expression: res[1] == "\e[0m\e[38;2;0;0;0m██ \e[38;2;76;76;76m██ \e[38;2;178;178;178m██ \e[38;2;255;255;255m██ \e[0m"
   Evaluated: "██ ██ ██ ██ " == "\e[0m\e[38;2;0;0;0m██ \e[38;2;76;76;76m██ \e[38;2;178;178;178m██ \e[38;2;255;255;255m██ \e[0m"
Stacktrace:
 [1] macro expansion at /home/vagrant/.julia/v0.6/ImageInTerminal/test/tst_encodeimg.jl:336 [inlined]
 [2] macro expansion at ./test.jl:853 [inlined]
 [3] macro expansion at /home/vagrant/.julia/v0.6/ImageInTerminal/test/tst_encodeimg.jl:0 [inlined]
 [4] macro expansion at ./test.jl:853 [inlined]
 [5] anonymous at ./<missing>:?
transparent gray line: Test Failed
  Expression: res[1] == "\e[0m\e[38;2;0;0;0m██ \e[0m … \e[38;2;255;255;255m⋅⋅ \e[0m"
   Evaluated: "██  … ⋅⋅ " == "\e[0m\e[38;2;0;0;0m██ \e[0m … \e[38;2;255;255;255m⋅⋅ \e[0m"
Stacktrace:
 [1] macro expansion at /home/vagrant/.julia/v0.6/ImageInTerminal/test/tst_encodeimg.jl:344 [inlined]
 [2] macro expansion at ./test.jl:853 [inlined]
 [3] macro expansion at /home/vagrant/.julia/v0.6/ImageInTerminal/test/tst_encodeimg.jl:0 [inlined]
 [4] macro expansion at ./test.jl:853 [inlined]
 [5] anonymous at ./<missing>:?
transparent gray line: Test Failed
  Expression: res[1] == "\e[0m\e[38;2;0;0;0m██ \e[38;2;76;76;76m▓▓ \e[38;2;178;178;178m░░ \e[38;2;255;255;255m⋅⋅ \e[0m"
   Evaluated: "██ ▓▓ ░░ ⋅⋅ " == "\e[0m\e[38;2;0;0;0m██ \e[38;2;76;76;76m▓▓ \e[38;2;178;178;178m░░ \e[38;2;255;255;255m⋅⋅ \e[0m"
Stacktrace:
 [1] macro expansion at /home/vagrant/.julia/v0.6/ImageInTerminal/test/tst_encodeimg.jl:350 [inlined]
 [2] macro expansion at ./test.jl:853 [inlined]
 [3] macro expansion at /home/vagrant/.julia/v0.6/ImageInTerminal/test/tst_encodeimg.jl:0 [inlined]
 [4] macro expansion at ./test.jl:853 [inlined]
 [5] anonymous at ./<missing>:?
rgb line: Test Failed
  Expression: res[1] == "\e[0m\e[38;2;0;0;255m██ \e[0m … \e[38;2;255;0;0m██ \e[0m"
   Evaluated: "██  … ██ " == "\e[0m\e[38;2;0;0;255m██ \e[0m … \e[38;2;255;0;0m██ \e[0m"
Stacktrace:
 [1] macro expansion at /home/vagrant/.julia/v0.6/ImageInTerminal/test/tst_encodeimg.jl:358 [inlined]
 [2] macro expansion at ./test.jl:853 [inlined]
 [3] macro expansion at /home/vagrant/.julia/v0.6/ImageInTerminal/test/tst_encodeimg.jl:0 [inlined]
 [4] macro expansion at ./test.jl:853 [inlined]
 [5] anonymous at ./<missing>:?
rgb line: Test Failed
  Expression: res[1] == "\e[0m\e[38;2;0;0;255m██ \e[38;2;13;0;242m██ \e[38;2;27;0;228m██ \e[0m … \e[38;2;228;0;27m██ \e[38;2;242;0;13m██ \e[38;2;255;0;0m██ \e[0m"
   Evaluated: "██ ██ ██  … ██ ██ ██ " == "\e[0m\e[38;2;0;0;255m██ \e[38;2;13;0;242m██ \e[38;2;27;0;228m██ \e[0m … \e[38;2;228;0;27m██ \e[38;2;242;0;13m██ \e[38;2;255;0;0m██ \e[0m"
Stacktrace:
 [1] macro expansion at /home/vagrant/.julia/v0.6/ImageInTerminal/test/tst_encodeimg.jl:364 [inlined]
 [2] macro expansion at ./test.jl:853 [inlined]
 [3] macro expansion at /home/vagrant/.julia/v0.6/ImageInTerminal/test/tst_encodeimg.jl:0 [inlined]
 [4] macro expansion at ./test.jl:853 [inlined]
 [5] anonymous at ./<missing>:?
Test Summary:               | Pass  Fail  Error  Total
tst_encodeimg.jl            |  147    30     12    189
  _charof                   |    5                   5
  encodeimg 256 small       |   17     2      3     22
    gray square             |    4     1             5
    transparent gray square |    4     1             5
    camera man              |    3            1      4
    lighthouse              |    3            1      4
    toucan                  |    3            1      4
  encodeimg 256 big         |   17     4      3     24
    gray square             |    4     2             6
    transparent gray square |    4     2             6
    camera man              |    3            1      4
    lighthouse              |    3            1      4
    toucan                  |    3            1      4
  encodeimg 24bit small     |   17     2      3     22
    gray square             |    4     1             5
    transparent gray square |    4     1             5
    camera man              |    3            1      4
    lighthouse              |    3            1      4
    toucan                  |    3            1      4
  encodeimg 24bit big       |   17     4      3     24
    gray square             |    4     2             6
    transparent gray square |    4     2             6
    camera man              |    3            1      4
    lighthouse              |    3            1      4
    toucan                  |    3            1      4
  encodeimg 256 small       |   12     3            15
    gray line               |    4     1             5
    transparent gray line   |    4     1             5
    rgb line                |    4     1             5
  encodeimg 256 big         |   24     6            30
    gray line               |    8     2            10
    transparent gray line   |    8     2            10
    rgb line                |    8     2            10
  encodeimg 24bit small     |   12     3            15
    gray line               |    4     1             5
    transparent gray line   |    4     1             5
    rgb line                |    4     1             5
  encodeimg 24bit big       |   24     6            30
    gray line               |    8     2            10
    transparent gray line   |    8     2            10
    rgb line                |    8     2            10
ERROR: LoadError: Some tests did not pass: 147 passed, 30 failed, 12 errored, 0 broken.
while loading /home/vagrant/.julia/v0.6/ImageInTerminal/test/runtests.jl, in expression starting on line 71
===========================[ ERROR: ImageInTerminal ]===========================

failed process: Process(`/home/vagrant/julia/bin/julia -Cx86-64 -J/home/vagrant/julia/lib/julia/sys.so --compile=yes --depwarn=yes --check-bounds=yes --code-coverage=none --color=no --compilecache=yes /home/vagrant/.julia/v0.6/ImageInTerminal/test/runtests.jl`, ProcessExited(1)) [1]

================================================================================
INFO: Removing AxisArrays v0.0.5
INFO: Removing BinDeps v0.4.7
INFO: Removing FileIO v0.3.0
INFO: Removing ImageMagick v0.2.2
INFO: Removing IntervalSets v0.0.3
INFO: Removing Iterators v0.3.0
INFO: Removing RangeArrays v0.1.2
INFO: Removing SHA v0.3.2
INFO: Removing TestImages v0.2.0
INFO: Removing URIParser v0.1.8
INFO: Removing ZipFile v0.3.0
ERROR: ImageInTerminal had test errors

>>> End of log
