>>> 'Pkg.add("MultipleTesting")' log
INFO: Cloning cache of MultipleTesting from https://github.com/juliangehring/MultipleTesting.jl.git
INFO: Installing BinDeps v0.4.5
INFO: Installing Calculus v0.2.0
INFO: Installing DataStructures v0.5.2
INFO: Installing Distributions v0.12.0
INFO: Installing MultipleTesting v0.1.0
INFO: Installing PDMats v0.5.6
INFO: Installing QuadGK v0.1.1
INFO: Installing Rmath v0.1.6
INFO: Installing SHA v0.3.1
INFO: Installing SpecialFunctions v0.1.0
INFO: Installing StatsBase v0.13.1
INFO: Installing StatsFuns v0.4.0
INFO: Installing URIParser v0.1.8
INFO: Building Rmath
WARNING: Array{T}(::Type{T}, m::Int) is deprecated, use Array{T}(m) instead.
Stacktrace:
 [1] depwarn(::String, ::Symbol) at ./deprecated.jl:62
 [2] Array(::Type{Tuple{BinDeps.DependencyProvider,Dict{Symbol,Any}}}, ::Int64) at ./deprecated.jl:50
 [3] #_library_dependency#21(::Array{Any,1}, ::Function, ::BinDeps.PackageContext, ::String) at /home/vagrant/.julia/v0.6/BinDeps/src/dependencies.jl:60
 [4] (::BinDeps.#kw##_library_dependency)(::Array{Any,1}, ::BinDeps.#_library_dependency, ::BinDeps.PackageContext, ::String) at ./<missing>:0
 [5] #library_dependency#1(::Array{Any,1}, ::Function, ::String, ::Vararg{String,N} where N) at /home/vagrant/.julia/v0.6/BinDeps/src/dependencies.jl:86
 [6] (::__anon__.#kw##library_dependency)(::Array{Any,1}, ::__anon__.#library_dependency, ::String, ::Vararg{String,N} where N) at ./<missing>:0
 [7] include_from_node1(::String) at ./loading.jl:539
 [8] include(::String) at ./sysimg.jl:14
 [9] evalfile(::String, ::Array{String,1}) at ./loading.jl:573 (repeats 2 times)
 [10] cd(::##2#4, ::String) at ./file.jl:69
 [11] (::##1#3)(::IOStream) at ./none:12
 [12] open(::##1#3, ::String, ::String) at ./iostream.jl:152
 [13] eval(::Module, ::Any) at ./boot.jl:236
 [14] process_options(::Base.JLOptions) at ./client.jl:281
 [15] _start() at ./client.jl:366
while loading /home/vagrant/.julia/v0.6/Rmath/deps/build.jl, in expression starting on line 5
WARNING: Array{T}(::Type{T}, m::Int) is deprecated, use Array{T}(m) instead.
Stacktrace:
 [1] depwarn(::String, ::Symbol) at ./deprecated.jl:62
 [2] Array(::Type{Tuple{BinDeps.DependencyHelper,Dict{Symbol,Any}}}, ::Int64) at ./deprecated.jl:50
 [3] #_library_dependency#21(::Array{Any,1}, ::Function, ::BinDeps.PackageContext, ::String) at /home/vagrant/.julia/v0.6/BinDeps/src/dependencies.jl:60
 [4] (::BinDeps.#kw##_library_dependency)(::Array{Any,1}, ::BinDeps.#_library_dependency, ::BinDeps.PackageContext, ::String) at ./<missing>:0
 [5] #library_dependency#1(::Array{Any,1}, ::Function, ::String, ::Vararg{String,N} where N) at /home/vagrant/.julia/v0.6/BinDeps/src/dependencies.jl:86
 [6] (::__anon__.#kw##library_dependency)(::Array{Any,1}, ::__anon__.#library_dependency, ::String, ::Vararg{String,N} where N) at ./<missing>:0
 [7] include_from_node1(::String) at ./loading.jl:539
 [8] include(::String) at ./sysimg.jl:14
 [9] evalfile(::String, ::Array{String,1}) at ./loading.jl:573 (repeats 2 times)
 [10] cd(::##2#4, ::String) at ./file.jl:69
 [11] (::##1#3)(::IOStream) at ./none:12
 [12] open(::##1#3, ::String, ::String) at ./iostream.jl:152
 [13] eval(::Module, ::Any) at ./boot.jl:236
 [14] process_options(::Base.JLOptions) at ./client.jl:281
 [15] _start() at ./client.jl:366
while loading /home/vagrant/.julia/v0.6/Rmath/deps/build.jl, in expression starting on line 5
WARNING: takebuf_string(b) is deprecated, use String(take!(b)) instead.
Stacktrace:
 [1] depwarn(::String, ::Symbol) at ./deprecated.jl:62
 [2] takebuf_string(::Base.AbstractIOBuffer{Array{UInt8,1}}) at ./deprecated.jl:50
 [3] macro expansion at /home/vagrant/.julia/v0.6/BinDeps/src/dependencies.jl:887 [inlined]
 [4] anonymous at ./<missing>:?
 [5] include_from_node1(::String) at ./loading.jl:539
 [6] include(::String) at ./sysimg.jl:14
 [7] evalfile(::String, ::Array{String,1}) at ./loading.jl:573 (repeats 2 times)
 [8] cd(::##2#4, ::String) at ./file.jl:69
 [9] (::##1#3)(::IOStream) at ./none:12
 [10] open(::##1#3, ::String, ::String) at ./iostream.jl:152
 [11] eval(::Module, ::Any) at ./boot.jl:236
 [12] process_options(::Base.JLOptions) at ./client.jl:281
 [13] _start() at ./client.jl:366
while loading /home/vagrant/.julia/v0.6/Rmath/deps/build.jl, in expression starting on line 43
INFO: Package database updated

>>> 'Pkg.test("MultipleTesting")' log
Julia Version 0.6.0-dev.2635
Commit dc2459d (2017-02-13 07:46 UTC)
Platform Info:
  OS: Linux (x86_64-pc-linux-gnu)
  CPU: Intel(R) Xeon(R) CPU E3-1241 v3 @ 3.50GHz
  WORD_SIZE: 64
           Ubuntu 14.04.5 LTS
  uname: Linux 3.13.0-108-generic #155-Ubuntu SMP Wed Jan 11 16:58:52 UTC 2017 x86_64 x86_64
Memory: 2.9392738342285156 GB (519.31640625 MB free)
Uptime: 5331.0 sec
Load Avg:  0.9501953125  0.99072265625  1.029296875
Intel(R) Xeon(R) CPU E3-1241 v3 @ 3.50GHz: 
       speed         user         nice          sys         idle          irq
#1  3499 MHz     256204 s       5140 s      29165 s     189571 s         13 s
#2  3499 MHz      79598 s       2556 s      16149 s     419184 s          0 s

  BLAS: libopenblas (USE64BITINT DYNAMIC_ARCH NO_AFFINITY Nehalem)
  LAPACK: libopenblas64_
  LIBM: libopenlibm
  LLVM: libLLVM-3.9.1 (ORCJIT, haswell)
Environment:
  TERM = vt100
  LD_LIBRARY_PATH = :/usr/local/lib/
  PATH = /usr/local/sbin:/usr/local/bin:/usr/sbin:/usr/bin:/sbin:/bin:/usr/games:/usr/local/games:/home/vagrant/julia/bin/
  JAVA_HOME = /usr/lib/jvm/java-7-oracle
  HOME = /home/vagrant

Package Directory: /home/vagrant/.julia/v0.6
2 required packages:
 - JSON                          0.8.3
 - MultipleTesting               0.1.0
13 additional packages:
 - BinDeps                       0.4.5
 - Calculus                      0.2.0
 - Compat                        0.18.0
 - DataStructures                0.5.2
 - Distributions                 0.12.0
 - PDMats                        0.5.6
 - QuadGK                        0.1.1
 - Rmath                         0.1.6
 - SHA                           0.3.1
 - SpecialFunctions              0.1.0
 - StatsBase                     0.13.1
 - StatsFuns                     0.4.0
 - URIParser                     0.1.8
INFO: Testing MultipleTesting
WARNING: min{T1 <: Real}(x::AbstractArray{T1}, y::Real) is deprecated, use min.(x, y) instead.
Stacktrace:
 [1] depwarn(::String, ::Symbol) at ./deprecated.jl:62
 [2] min(::Array{Float64,1}, ::Float64) at ./deprecated.jl:50
 [3] benjamini_hochberg(::Array{Float64,1}) at /home/vagrant/.julia/v0.6/MultipleTesting/src/pval-adjustment.jl:27
 [4] adjust(::Array{Float64,1}, ::MultipleTesting.BenjaminiHochberg) at /home/vagrant/.julia/v0.6/MultipleTesting/src/pval-adjustment.jl:16
 [5] macro expansion at /home/vagrant/.julia/v0.6/MultipleTesting/test/test-pval-adjustment.jl:57 [inlined]
 [6] macro expansion at ./test.jl:913 [inlined]
 [7] macro expansion at /home/vagrant/.julia/v0.6/MultipleTesting/test/test-pval-adjustment.jl:27 [inlined]
 [8] macro expansion at ./test.jl:852 [inlined]
 [9] anonymous at ./<missing>:?
 [10] include_from_node1(::String) at ./loading.jl:539
 [11] include(::String) at ./sysimg.jl:14
 [12] macro expansion at /home/vagrant/.julia/v0.6/MultipleTesting/test/runtests.jl:11 [inlined]
 [13] anonymous at ./<missing>:?
 [14] include_from_node1(::String) at ./loading.jl:539
 [15] include(::String) at ./sysimg.jl:14
 [16] process_options(::Base.JLOptions) at ./client.jl:300
 [17] _start() at ./client.jl:366
while loading /home/vagrant/.julia/v0.6/MultipleTesting/test/test-pval-adjustment.jl, in expression starting on line 7
WARNING: min{T1 <: Real}(x::AbstractArray{T1}, y::Real) is deprecated, use min.(x, y) instead.
Stacktrace:
 [1] depwarn(::String, ::Symbol) at ./deprecated.jl:62
 [2] min(::Array{Float64,1}, ::Float64) at ./deprecated.jl:50
 [3] sidak(::Array{Float64,1}) at /home/vagrant/.julia/v0.6/MultipleTesting/src/pval-adjustment.jl:176
 [4] adjust(::Array{Float64,1}, ::MultipleTesting.Sidak) at /home/vagrant/.julia/v0.6/MultipleTesting/src/pval-adjustment.jl:172
 [5] macro expansion at /home/vagrant/.julia/v0.6/MultipleTesting/test/test-pval-adjustment.jl:53 [inlined]
 [6] macro expansion at ./test.jl:913 [inlined]
 [7] macro expansion at /home/vagrant/.julia/v0.6/MultipleTesting/test/test-pval-adjustment.jl:27 [inlined]
 [8] macro expansion at ./test.jl:852 [inlined]
 [9] anonymous at ./<missing>:?
 [10] include_from_node1(::String) at ./loading.jl:539
 [11] include(::String) at ./sysimg.jl:14
 [12] macro expansion at /home/vagrant/.julia/v0.6/MultipleTesting/test/runtests.jl:11 [inlined]
 [13] anonymous at ./<missing>:?
 [14] include_from_node1(::String) at ./loading.jl:539
 [15] include(::String) at ./sysimg.jl:14
 [16] process_options(::Base.JLOptions) at ./client.jl:300
 [17] _start() at ./client.jl:366
while loading /home/vagrant/.julia/v0.6/MultipleTesting/test/test-pval-adjustment.jl, in expression starting on line 7
WARNING: log{T <: Number}(x::AbstractArray{T}) is deprecated, use log.(x) instead.
Stacktrace:
 [1] depwarn(::String, ::Symbol) at ./deprecated.jl:62
 [2] log(::Array{Float64,1}) at ./deprecated.jl:50
 [3] forwardstop(::Array{Float64,1}) at /home/vagrant/.julia/v0.6/MultipleTesting/src/pval-adjustment.jl:187
 [4] adjust(::Array{Float64,1}, ::MultipleTesting.ForwardStop) at /home/vagrant/.julia/v0.6/MultipleTesting/src/pval-adjustment.jl:182
 [5] macro expansion at /home/vagrant/.julia/v0.6/MultipleTesting/test/test-pval-adjustment.jl:57 [inlined]
 [6] macro expansion at ./test.jl:913 [inlined]
 [7] macro expansion at /home/vagrant/.julia/v0.6/MultipleTesting/test/test-pval-adjustment.jl:27 [inlined]
 [8] macro expansion at ./test.jl:852 [inlined]
 [9] anonymous at ./<missing>:?
 [10] include_from_node1(::String) at ./loading.jl:539
 [11] include(::String) at ./sysimg.jl:14
 [12] macro expansion at /home/vagrant/.julia/v0.6/MultipleTesting/test/runtests.jl:11 [inlined]
 [13] anonymous at ./<missing>:?
 [14] include_from_node1(::String) at ./loading.jl:539
 [15] include(::String) at ./sysimg.jl:14
 [16] process_options(::Base.JLOptions) at ./client.jl:300
 [17] _start() at ./client.jl:366
while loading /home/vagrant/.julia/v0.6/MultipleTesting/test/test-pval-adjustment.jl, in expression starting on line 7
WARNING: min{T1 <: Real}(x::AbstractArray{T1}, y::Real) is deprecated, use min.(x, y) instead.
Stacktrace:
 [1] depwarn(::String, ::Symbol) at ./deprecated.jl:62
 [2] min(::Array{Float64,1}, ::Float64) at ./deprecated.jl:50
 [3] forwardstop(::Array{Float64,1}) at /home/vagrant/.julia/v0.6/MultipleTesting/src/pval-adjustment.jl:189
 [4] adjust(::Array{Float64,1}, ::MultipleTesting.ForwardStop) at /home/vagrant/.julia/v0.6/MultipleTesting/src/pval-adjustment.jl:182
 [5] macro expansion at /home/vagrant/.julia/v0.6/MultipleTesting/test/test-pval-adjustment.jl:57 [inlined]
 [6] macro expansion at ./test.jl:913 [inlined]
 [7] macro expansion at /home/vagrant/.julia/v0.6/MultipleTesting/test/test-pval-adjustment.jl:27 [inlined]
 [8] macro expansion at ./test.jl:852 [inlined]
 [9] anonymous at ./<missing>:?
 [10] include_from_node1(::String) at ./loading.jl:539
 [11] include(::String) at ./sysimg.jl:14
 [12] macro expansion at /home/vagrant/.julia/v0.6/MultipleTesting/test/runtests.jl:11 [inlined]
 [13] anonymous at ./<missing>:?
 [14] include_from_node1(::String) at ./loading.jl:539
 [15] include(::String) at ./sysimg.jl:14
 [16] process_options(::Base.JLOptions) at ./client.jl:300
 [17] _start() at ./client.jl:366
while loading /home/vagrant/.julia/v0.6/MultipleTesting/test/test-pval-adjustment.jl, in expression starting on line 7
WARNING: min{T1 <: Real}(x::AbstractArray{T1}, y::Real) is deprecated, use min.(x, y) instead.
Stacktrace:
 [1] depwarn(::String, ::Symbol) at ./deprecated.jl:62
 [2] min(::Array{Float64,1}, ::Float64) at ./deprecated.jl:50
 [3] bonferroni(::Array{Float64,1}) at /home/vagrant/.julia/v0.6/MultipleTesting/src/pval-adjustment.jl:10
 [4] adjust(::Array{Float64,1}, ::MultipleTesting.Bonferroni) at /home/vagrant/.julia/v0.6/MultipleTesting/src/pval-adjustment.jl:6
 [5] macro expansion at /home/vagrant/.julia/v0.6/MultipleTesting/test/test-pval-adjustment.jl:53 [inlined]
 [6] macro expansion at ./test.jl:913 [inlined]
 [7] macro expansion at /home/vagrant/.julia/v0.6/MultipleTesting/test/test-pval-adjustment.jl:27 [inlined]
 [8] macro expansion at ./test.jl:852 [inlined]
 [9] anonymous at ./<missing>:?
 [10] include_from_node1(::String) at ./loading.jl:539
 [11] include(::String) at ./sysimg.jl:14
 [12] macro expansion at /home/vagrant/.julia/v0.6/MultipleTesting/test/runtests.jl:11 [inlined]
 [13] anonymous at ./<missing>:?
 [14] include_from_node1(::String) at ./loading.jl:539
 [15] include(::String) at ./sysimg.jl:14
 [16] process_options(::Base.JLOptions) at ./client.jl:300
 [17] _start() at ./client.jl:366
while loading /home/vagrant/.julia/v0.6/MultipleTesting/test/test-pval-adjustment.jl, in expression starting on line 7
WARNING: min{T1 <: Real}(x::AbstractArray{T1}, y::Real) is deprecated, use min.(x, y) instead.
Stacktrace:
 [1] depwarn(::String, ::Symbol) at ./deprecated.jl:62
 [2] min(::Array{Float64,1}, ::Float64) at ./deprecated.jl:50
 [3] benjamini_liu(::Array{Float64,1}) at /home/vagrant/.julia/v0.6/MultipleTesting/src/pval-adjustment.jl:88
 [4] adjust(::Array{Float64,1}, ::MultipleTesting.BenjaminiLiu) at /home/vagrant/.julia/v0.6/MultipleTesting/src/pval-adjustment.jl:77
 [5] macro expansion at /home/vagrant/.julia/v0.6/MultipleTesting/test/test-pval-adjustment.jl:57 [inlined]
 [6] macro expansion at ./test.jl:913 [inlined]
 [7] macro expansion at /home/vagrant/.julia/v0.6/MultipleTesting/test/test-pval-adjustment.jl:27 [inlined]
 [8] macro expansion at ./test.jl:852 [inlined]
 [9] anonymous at ./<missing>:?
 [10] include_from_node1(::String) at ./loading.jl:539
 [11] include(::String) at ./sysimg.jl:14
 [12] macro expansion at /home/vagrant/.julia/v0.6/MultipleTesting/test/runtests.jl:11 [inlined]
 [13] anonymous at ./<missing>:?
 [14] include_from_node1(::String) at ./loading.jl:539
 [15] include(::String) at ./sysimg.jl:14
 [16] process_options(::Base.JLOptions) at ./client.jl:300
 [17] _start() at ./client.jl:366
while loading /home/vagrant/.julia/v0.6/MultipleTesting/test/test-pval-adjustment.jl, in expression starting on line 7
WARNING: min{T1 <: Real}(x::AbstractArray{T1}, y::Real) is deprecated, use min.(x, y) instead.
Stacktrace:
 [1] depwarn(::String, ::Symbol) at ./deprecated.jl:62
 [2] min(::Array{Float64,1}, ::Float64) at ./deprecated.jl:50
 [3] holm(::Array{Float64,1}) at /home/vagrant/.julia/v0.6/MultipleTesting/src/pval-adjustment.jl:136
 [4] adjust(::Array{Float64,1}, ::MultipleTesting.Holm) at /home/vagrant/.julia/v0.6/MultipleTesting/src/pval-adjustment.jl:125
 [5] macro expansion at /home/vagrant/.julia/v0.6/MultipleTesting/test/test-pval-adjustment.jl:57 [inlined]
 [6] macro expansion at ./test.jl:913 [inlined]
 [7] macro expansion at /home/vagrant/.julia/v0.6/MultipleTesting/test/test-pval-adjustment.jl:27 [inlined]
 [8] macro expansion at ./test.jl:852 [inlined]
 [9] anonymous at ./<missing>:?
 [10] include_from_node1(::String) at ./loading.jl:539
 [11] include(::String) at ./sysimg.jl:14
 [12] macro expansion at /home/vagrant/.julia/v0.6/MultipleTesting/test/runtests.jl:11 [inlined]
 [13] anonymous at ./<missing>:?
 [14] include_from_node1(::String) at ./loading.jl:539
 [15] include(::String) at ./sysimg.jl:14
 [16] process_options(::Base.JLOptions) at ./client.jl:300
 [17] _start() at ./client.jl:366
while loading /home/vagrant/.julia/v0.6/MultipleTesting/test/test-pval-adjustment.jl, in expression starting on line 7
WARNING: min{T1 <: Real}(x::AbstractArray{T1}, y::Real) is deprecated, use min.(x, y) instead.
Stacktrace:
 [1] depwarn(::String, ::Symbol) at ./deprecated.jl:62
 [2] min(::Array{Float64,1}, ::Float64) at ./deprecated.jl:50
 [3] benjamini_yekutieli(::Array{Float64,1}) at /home/vagrant/.julia/v0.6/MultipleTesting/src/pval-adjustment.jl:66
 [4] adjust(::Array{Float64,1}, ::MultipleTesting.BenjaminiYekutieli) at /home/vagrant/.julia/v0.6/MultipleTesting/src/pval-adjustment.jl:55
 [5] macro expansion at /home/vagrant/.julia/v0.6/MultipleTesting/test/test-pval-adjustment.jl:57 [inlined]
 [6] macro expansion at ./test.jl:913 [inlined]
 [7] macro expansion at /home/vagrant/.julia/v0.6/MultipleTesting/test/test-pval-adjustment.jl:27 [inlined]
 [8] macro expansion at ./test.jl:852 [inlined]
 [9] anonymous at ./<missing>:?
 [10] include_from_node1(::String) at ./loading.jl:539
 [11] include(::String) at ./sysimg.jl:14
 [12] macro expansion at /home/vagrant/.julia/v0.6/MultipleTesting/test/runtests.jl:11 [inlined]
 [13] anonymous at ./<missing>:?
 [14] include_from_node1(::String) at ./loading.jl:539
 [15] include(::String) at ./sysimg.jl:14
 [16] process_options(::Base.JLOptions) at ./client.jl:300
 [17] _start() at ./client.jl:366
while loading /home/vagrant/.julia/v0.6/MultipleTesting/test/test-pval-adjustment.jl, in expression starting on line 7
WARNING: min{T1 <: Real}(x::AbstractArray{T1}, y::Real) is deprecated, use min.(x, y) instead.
Stacktrace:
 [1] depwarn(::String, ::Symbol) at ./deprecated.jl:62
 [2] min(::Array{Float64,1}, ::Float64) at ./deprecated.jl:50
 [3] hommel(::Array{Float64,1}) at /home/vagrant/.julia/v0.6/MultipleTesting/src/pval-adjustment.jl:161
 [4] adjust(::Array{Float64,1}, ::MultipleTesting.Hommel) at /home/vagrant/.julia/v0.6/MultipleTesting/src/pval-adjustment.jl:145
 [5] macro expansion at /home/vagrant/.julia/v0.6/MultipleTesting/test/test-pval-adjustment.jl:57 [inlined]
 [6] macro expansion at ./test.jl:913 [inlined]
 [7] macro expansion at /home/vagrant/.julia/v0.6/MultipleTesting/test/test-pval-adjustment.jl:27 [inlined]
 [8] macro expansion at ./test.jl:852 [inlined]
 [9] anonymous at ./<missing>:?
 [10] include_from_node1(::String) at ./loading.jl:539
 [11] include(::String) at ./sysimg.jl:14
 [12] macro expansion at /home/vagrant/.julia/v0.6/MultipleTesting/test/runtests.jl:11 [inlined]
 [13] anonymous at ./<missing>:?
 [14] include_from_node1(::String) at ./loading.jl:539
 [15] include(::String) at ./sysimg.jl:14
 [16] process_options(::Base.JLOptions) at ./client.jl:300
 [17] _start() at ./client.jl:366
while loading /home/vagrant/.julia/v0.6/MultipleTesting/test/test-pval-adjustment.jl, in expression starting on line 7
WARNING: max{T1 <: Real, T2 <: Real}(x::AbstractArray{T1}, y::AbstractArray{T2}) is deprecated, use max.(x, y) instead.
Stacktrace:
 [1] depwarn(::String, ::Symbol) at ./deprecated.jl:62
 [2] max(::Array{Float64,1}, ::Array{Float64,1}) at ./deprecated.jl:50
 [3] hommel(::Array{Float64,1}) at /home/vagrant/.julia/v0.6/MultipleTesting/src/pval-adjustment.jl:163
 [4] adjust(::Array{Float64,1}, ::MultipleTesting.Hommel) at /home/vagrant/.julia/v0.6/MultipleTesting/src/pval-adjustment.jl:145
 [5] macro expansion at /home/vagrant/.julia/v0.6/MultipleTesting/test/test-pval-adjustment.jl:57 [inlined]
 [6] macro expansion at ./test.jl:913 [inlined]
 [7] macro expansion at /home/vagrant/.julia/v0.6/MultipleTesting/test/test-pval-adjustment.jl:27 [inlined]
 [8] macro expansion at ./test.jl:852 [inlined]
 [9] anonymous at ./<missing>:?
 [10] include_from_node1(::String) at ./loading.jl:539
 [11] include(::String) at ./sysimg.jl:14
 [12] macro expansion at /home/vagrant/.julia/v0.6/MultipleTesting/test/runtests.jl:11 [inlined]
 [13] anonymous at ./<missing>:?
 [14] include_from_node1(::String) at ./loading.jl:539
 [15] include(::String) at ./sysimg.jl:14
 [16] process_options(::Base.JLOptions) at ./client.jl:300
 [17] _start() at ./client.jl:366
while loading /home/vagrant/.julia/v0.6/MultipleTesting/test/test-pval-adjustment.jl, in expression starting on line 7
WARNING: max{T1 <: Real, T2 <: Real}(x::AbstractArray{T1}, y::AbstractArray{T2}) is deprecated, use max.(x, y) instead.
Stacktrace:
 [1] depwarn(::String, ::Symbol) at ./deprecated.jl:62
 [2] max(::Array{Float64,1}, ::Array{Float64,1}) at ./deprecated.jl:50
 [3] hommel(::Array{Float64,1}) at /home/vagrant/.julia/v0.6/MultipleTesting/src/pval-adjustment.jl:165
 [4] adjust(::Array{Float64,1}, ::MultipleTesting.Hommel) at /home/vagrant/.julia/v0.6/MultipleTesting/src/pval-adjustment.jl:145
 [5] macro expansion at /home/vagrant/.julia/v0.6/MultipleTesting/test/test-pval-adjustment.jl:57 [inlined]
 [6] macro expansion at ./test.jl:913 [inlined]
 [7] macro expansion at /home/vagrant/.julia/v0.6/MultipleTesting/test/test-pval-adjustment.jl:27 [inlined]
 [8] macro expansion at ./test.jl:852 [inlined]
 [9] anonymous at ./<missing>:?
 [10] include_from_node1(::String) at ./loading.jl:539
 [11] include(::String) at ./sysimg.jl:14
 [12] macro expansion at /home/vagrant/.julia/v0.6/MultipleTesting/test/runtests.jl:11 [inlined]
 [13] anonymous at ./<missing>:?
 [14] include_from_node1(::String) at ./loading.jl:539
 [15] include(::String) at ./sysimg.jl:14
 [16] process_options(::Base.JLOptions) at ./client.jl:300
 [17] _start() at ./client.jl:366
while loading /home/vagrant/.julia/v0.6/MultipleTesting/test/test-pval-adjustment.jl, in expression starting on line 7
WARNING: min{T1 <: Real}(x::AbstractArray{T1}, y::Real) is deprecated, use min.(x, y) instead.
Stacktrace:
 [1] depwarn(::String, ::Symbol) at ./deprecated.jl:62
 [2] min(::Array{Float64,1}, ::Float64) at ./deprecated.jl:50
 [3] hochberg(::Array{Float64,1}) at /home/vagrant/.julia/v0.6/MultipleTesting/src/pval-adjustment.jl:116
 [4] adjust(::Array{Float64,1}, ::MultipleTesting.Hochberg) at /home/vagrant/.julia/v0.6/MultipleTesting/src/pval-adjustment.jl:105
 [5] macro expansion at /home/vagrant/.julia/v0.6/MultipleTesting/test/test-pval-adjustment.jl:57 [inlined]
 [6] macro expansion at ./test.jl:913 [inlined]
 [7] macro expansion at /home/vagrant/.julia/v0.6/MultipleTesting/test/test-pval-adjustment.jl:27 [inlined]
 [8] macro expansion at ./test.jl:852 [inlined]
 [9] anonymous at ./<missing>:?
 [10] include_from_node1(::String) at ./loading.jl:539
 [11] include(::String) at ./sysimg.jl:14
 [12] macro expansion at /home/vagrant/.julia/v0.6/MultipleTesting/test/runtests.jl:11 [inlined]
 [13] anonymous at ./<missing>:?
 [14] include_from_node1(::String) at ./loading.jl:539
 [15] include(::String) at ./sysimg.jl:14
 [16] process_options(::Base.JLOptions) at ./client.jl:300
 [17] _start() at ./client.jl:366
while loading /home/vagrant/.julia/v0.6/MultipleTesting/test/test-pval-adjustment.jl, in expression starting on line 7
Test Summary:      | Pass  Total
p-Value adjustment |   71     71
WARNING: min{T1 <: Real}(x::AbstractArray{T1}, y::Real) is deprecated, use min.(x, y) instead.
Stacktrace:
 [1] depwarn(::String, ::Symbol) at ./deprecated.jl:62
 [2] min(::Array{Float64,1}, ::Float64) at ./deprecated.jl:50
 [3] benjamini_hochberg(::Array{Float64,1}) at /home/vagrant/.julia/v0.6/MultipleTesting/src/pval-adjustment.jl:27
 [4] benjamini_hochberg(::Array{Float64,1}, ::Float64) at /home/vagrant/.julia/v0.6/MultipleTesting/src/pval-adjustment.jl:48
 [5] macro expansion at /home/vagrant/.julia/v0.6/MultipleTesting/test/test-pval-pi0-adjustment.jl:41 [inlined]
 [6] macro expansion at ./test.jl:852 [inlined]
 [7] macro expansion at /home/vagrant/.julia/v0.6/MultipleTesting/test/test-pval-pi0-adjustment.jl:10 [inlined]
 [8] macro expansion at ./test.jl:852 [inlined]
 [9] anonymous at ./<missing>:?
 [10] include_from_node1(::String) at ./loading.jl:539
 [11] include(::String) at ./sysimg.jl:14
 [12] macro expansion at /home/vagrant/.julia/v0.6/MultipleTesting/test/runtests.jl:11 [inlined]
 [13] anonymous at ./<missing>:?
 [14] include_from_node1(::String) at ./loading.jl:539
 [15] include(::String) at ./sysimg.jl:14
 [16] process_options(::Base.JLOptions) at ./client.jl:300
 [17] _start() at ./client.jl:366
while loading /home/vagrant/.julia/v0.6/MultipleTesting/test/test-pval-pi0-adjustment.jl, in expression starting on line 7
q-value pFDR: Test Failed
  Expression: isapprox(m(pval1, pi0, true), ref, atol=1.0e-6)
Stacktrace:
 [1] macro expansion at /home/vagrant/.julia/v0.6/MultipleTesting/test/test-pval-pi0-adjustment.jl:108 [inlined]
 [2] macro expansion at ./test.jl:852 [inlined]
 [3] macro expansion at /home/vagrant/.julia/v0.6/MultipleTesting/test/test-pval-pi0-adjustment.jl:10 [inlined]
 [4] macro expansion at ./test.jl:852 [inlined]
 [5] anonymous at ./<missing>:?
Test Summary:         | Pass  Fail  Total
p-Value π0 adjustment |   33     1     34
  benjamini_hochberg  |   17           17
  q-value             |    9            9
  q-value pFDR        |    7     1      8
ERROR: LoadError: LoadError: Some tests did not pass: 33 passed, 1 failed, 0 errored, 0 broken.
while loading /home/vagrant/.julia/v0.6/MultipleTesting/test/test-pval-pi0-adjustment.jl, in expression starting on line 7
while loading /home/vagrant/.julia/v0.6/MultipleTesting/test/runtests.jl, in expression starting on line 9
===========================[ ERROR: MultipleTesting ]===========================

failed process: Process(`/home/vagrant/julia/bin/julia -Cx86-64 -J/home/vagrant/julia/lib/julia/sys.so --compile=yes --depwarn=yes --check-bounds=yes --code-coverage=none --color=no --compilecache=yes /home/vagrant/.julia/v0.6/MultipleTesting/test/runtests.jl`, ProcessExited(1)) [1]

================================================================================
ERROR: MultipleTesting had test errors

>>> End of log
