>>> 'Pkg.add("NLsolve")' log
INFO: Cloning cache of NLsolve from git://github.com/JuliaNLSolvers/NLsolve.jl.git
INFO: Installing Calculus v0.2.2
INFO: Installing DiffBase v0.0.5
INFO: Installing Distances v0.3.2
INFO: Installing ForwardDiff v0.3.5
INFO: Installing LineSearches v0.1.5
INFO: Installing NLsolve v0.9.1
INFO: Installing NaNMath v0.2.4
INFO: Installing Optim v0.7.8
INFO: Installing PositiveFactorizations v0.0.4
INFO: Package database updated

>>> 'Pkg.test("NLsolve")' log
Julia Version 0.4.7
Commit ae26b25 (2016-09-18 16:17 UTC)
Platform Info:
  System: Linux (x86_64-pc-linux-gnu)
  CPU: Intel(R) Xeon(R) CPU E3-1241 v3 @ 3.50GHz
  WORD_SIZE: 64
           Ubuntu 14.04.5 LTS
  uname: Linux 3.13.0-113-generic #160-Ubuntu SMP Thu Mar 9 09:27:29 UTC 2017 x86_64 x86_64
Memory: 2.9392738342285156 GB (444.15625 MB free)
Uptime: 11172.0 sec
Load Avg:  0.9345703125  1.03662109375  1.32177734375
Intel(R) Xeon(R) CPU E3-1241 v3 @ 3.50GHz: 
       speed         user         nice          sys         idle          irq
#1  3507 MHz     504320 s       4880 s      44907 s     457535 s         18 s
#2  3507 MHz     336132 s       3009 s      42035 s     702288 s          0 s

  BLAS: libopenblas (USE64BITINT DYNAMIC_ARCH NO_AFFINITY Nehalem)
  LAPACK: libopenblas64_
  LIBM: libopenlibm
  LLVM: libLLVM-3.3
Environment:
  TERM = vt100
  LD_LIBRARY_PATH = :/usr/local/lib/
  PATH = /usr/local/sbin:/usr/local/bin:/usr/sbin:/usr/bin:/sbin:/bin:/usr/games:/usr/local/games:/home/vagrant/julia/bin/
  JAVA_HOME = /usr/lib/jvm/java-7-oracle
  HOME = /home/vagrant

Package Directory: /home/vagrant/.julia/v0.4
2 required packages:
 - JSON                          0.8.3
 - NLsolve                       0.9.1
9 additional packages:
 - Calculus                      0.2.2
 - Compat                        0.21.0
 - DiffBase                      0.0.5
 - Distances                     0.3.2
 - ForwardDiff                   0.3.5
 - LineSearches                  0.1.5
 - NaNMath                       0.2.4
 - Optim                         0.7.8
 - PositiveFactorizations        0.0.4
INFO: Computing test dependencies for NLsolve...
INFO: Installing BaseTestNext v0.2.2
INFO: Testing NLsolve
WARNING: New definition 
    write(Base.IO, ForwardDiff.Partials) at /home/vagrant/.julia/v0.4/ForwardDiff/src/partials.jl:57
is ambiguous with: 
    write(Base.Base64.Base64EncodePipe, AbstractArray{UInt8, 1}) at base64.jl:89.
To fix, define 
    write(Base.Base64.Base64EncodePipe, ForwardDiff.Partials{N<:Any, UInt8})
before the new definition.
WARNING: New definition 
    write(Base.IO, ForwardDiff.Partials) at /home/vagrant/.julia/v0.4/ForwardDiff/src/partials.jl:57
is ambiguous with: 
    write(Base.Base64.Base64EncodePipe, AbstractArray{UInt8, 1}) at base64.jl:89.
To fix, define 
    write(Base.Base64.Base64EncodePipe, ForwardDiff.Partials{N<:Any, UInt8})
before the new definition.
WARNING: New definition 
    write(Base.IO, ForwardDiff.Partials) at /home/vagrant/.julia/v0.4/ForwardDiff/src/partials.jl:57
is ambiguous with: 
    write(Base.Base64.Base64EncodePipe, AbstractArray{UInt8, 1}) at base64.jl:89.
To fix, define 
    write(Base.Base64.Base64EncodePipe, ForwardDiff.Partials{N<:Any, UInt8})
before the new definition.
WARNING: New definition 
    write(Base.IO, ForwardDiff.Partials) at /home/vagrant/.julia/v0.4/ForwardDiff/src/partials.jl:57
is ambiguous with: 
    write(Base.Base64.Base64EncodePipe, AbstractArray{UInt8, 1}) at base64.jl:89.
To fix, define 
    write(Base.Base64.Base64EncodePipe, ForwardDiff.Partials{N<:Any, UInt8})
before the new definition.
Running tests:
WARNING: DifferentiableFunction(args...) is deprecated, use OnceDifferentiable(args...) instead.
 in depwarn at deprecated.jl:73
 in DifferentiableFunction at deprecated.jl:50
 in newton_ at /home/vagrant/.julia/v0.4/NLsolve/src/newton.jl:103
 in newton at /home/vagrant/.julia/v0.4/NLsolve/src/newton.jl:160
 in nlsolve at /home/vagrant/.julia/v0.4/NLsolve/src/nlsolve_func_defs.jl:21
 [inlined code] from /home/vagrant/.julia/v0.4/NLsolve/test/2by2.jl:39
 in anonymous at no file:0
 in include at ./boot.jl:261
 in include_from_node1 at ./loading.jl:333
 [inlined code] from /home/vagrant/.julia/v0.4/NLsolve/test/runtests.jl:27
 in anonymous at no file:0
 in include at ./boot.jl:261
 in include_from_node1 at ./loading.jl:333
 in process_options at ./client.jl:280
 in _start at ./client.jl:378
while loading /home/vagrant/.julia/v0.4/NLsolve/test/2by2.jl, in expression starting on line 3
WARNING: DifferentiableFunction(args...) is deprecated, use OnceDifferentiable(args...) instead.
 in depwarn at deprecated.jl:73
 in DifferentiableFunction at deprecated.jl:50
 in newton_ at /home/vagrant/.julia/v0.4/NLsolve/src/newton.jl:103
 in newton at /home/vagrant/.julia/v0.4/NLsolve/src/newton.jl:160
 in nlsolve at /home/vagrant/.julia/v0.4/NLsolve/src/nlsolve_func_defs.jl:21
 [inlined code] from /home/vagrant/.julia/v0.4/NLsolve/test/2by2.jl:42
 in anonymous at no file:0
 in include at ./boot.jl:261
 in include_from_node1 at ./loading.jl:333
 [inlined code] from /home/vagrant/.julia/v0.4/NLsolve/test/runtests.jl:27
 in anonymous at no file:0
 in include at ./boot.jl:261
 in include_from_node1 at ./loading.jl:333
 in process_options at ./client.jl:280
 in _start at ./client.jl:378
while loading /home/vagrant/.julia/v0.4/NLsolve/test/2by2.jl, in expression starting on line 3
Test Summary: | Pass  Total
2by2          |   15     15
Test Summary:     | Pass  Total
finite_difference |    1      1
Function                                          Dim    NFEV    NJEV   Final inf-norm     total time
--------------------------------------------------------------------------------------
Rosenbrock-trust_region                             2      30      17     0.000000e+00   8.690707e-03
Rosenbrock-trust_region-AD                          2      30      17     0.000000e+00   3.896695e-01
Rosenbrock-newton                                   2       3       2     8.881784e-15   1.006297e-02
Rosenbrock-newton-AD                                2       3       2     8.881784e-15   5.951630e-04
Powell singular-trust_region                        4      17      17     2.945101e-09   1.789660e-02
Powell singular-trust_region-AD                     4      17      17     2.945101e-09   2.599499e-01
Powell singular-newton                              4      17      16     2.945101e-09   4.752700e-04
Powell singular-newton-AD                           4      17      16     2.945101e-09   6.625200e-04
Powell badly scaled-trust_region                    2      15      14     7.051804e-12   1.329758e-02
Powell badly scaled-trust_region-AD                 2      15      14     7.051804e-12   4.015934e-02
Powell badly scaled-newton                          2      13      12     1.573341e-11   5.462400e-04
Powell badly scaled-newton-AD                       2      13      12     1.573341e-11   5.915600e-04
Wood-trust_region                                   4      19      15     1.152565e-10   2.918591e-02
Wood-trust_region-AD                                4      19      15     1.152340e-10   4.753607e-02
Wood-newton                                         4      15      14     6.972201e-14   6.546350e-04
Wood-newton-AD                                      4      15      14     4.884981e-14   5.500250e-04
Helical Valley-trust_region                         3      10       9     1.110223e-14   2.241832e-02
Helical Valley-trust_region-AD                      3      10       9     1.110223e-14   3.114982e-01
Helical Valley-newton                               3      11      10     1.145685e-14   4.966540e-04
Helical Valley-newton-AD                            3      11      10     1.145685e-14   4.409910e-04
Watson-trust_region                                 6      20      16     3.012954e-13   4.255071e-02
Watson-trust_region-AD                              6      20      16     2.916643e-13   3.794958e-01
Watson-newton                                       6      13      12     3.212777e-13   6.839220e-04
Watson-newton-AD                                    6      13      12     3.186063e-13   9.134045e-03
Watson-trust_region                                 9      17      17     1.633317e-12   8.973330e-04
Watson-trust_region-AD                              9      17      17     1.618360e-12   5.197210e-01
Watson-newton                                       9      14      13     8.726530e-15   7.340210e-04
Watson-newton-AD                                    9      14      13     6.129168e-14   1.609595e-03
Chebyquad-trust_region                              5       8       5     9.143861e-09   1.533685e-02
Chebyquad-trust_region-AD                           5       8       5     9.143861e-09   2.168573e-01
Chebyquad-trust_region                              6      13       8     7.320533e-16   1.679810e-04
Chebyquad-trust_region-AD                           6      13       8     7.320533e-16   2.009693e-02
Chebyquad-trust_region                              7      10       6     6.329061e-10   2.439540e-04
Chebyquad-trust_region-AD                           7      10       6     6.329061e-10   1.921839e-01
Chebyquad-trust_region                              9      14       8     1.621966e-14   2.606040e-04
Chebyquad-trust_region-AD                           9      14       8     1.621966e-14   5.576857e-02
Brown almost-linear-trust_region                   10       5       5     3.382331e-09   9.041243e-02
Brown almost-linear-trust_region-AD                10       5       5     3.382331e-09   5.145566e-01
Brown almost-linear-trust_region                   30       4       4     8.883263e-09   8.676220e-04
Brown almost-linear-trust_region-AD                30       4       4     8.883263e-09   1.313632e-03
Brown almost-linear-trust_region                   40       4       4     1.570839e-09   1.147393e-03
Brown almost-linear-trust_region-AD                40       4       4     1.570839e-09   1.438323e-03
Discrete boundary value-trust_region               10       4       4     2.636780e-16   2.839052e-02
Discrete boundary value-trust_region-AD            10       4       4     2.636780e-16   1.563565e-01
Discrete boundary value-newton                     10       4       3     2.636780e-16   5.540160e-04
Discrete boundary value-newton-AD                  10       4       3     2.636780e-16   6.361030e-04
Discrete integral equation-trust_region             1       4       4     8.540391e-14   3.555234e-02
Discrete integral equation-trust_region-AD          1       4       4     8.540391e-14   2.963598e-01
Discrete integral equation-newton                   1       4       3     8.540391e-14   5.905380e-04
Discrete integral equation-newton-AD                1       4       3     8.540391e-14   5.375520e-04
Discrete integral equation-trust_region            10       4       4     2.720046e-15   4.217490e-04
Discrete integral equation-trust_region-AD         10       4       4     2.720046e-15   1.034109e-01
Discrete integral equation-newton                  10       4       3     2.720046e-15   4.067480e-04
Discrete integral equation-newton-AD               10       4       3     2.720046e-15   4.608000e-04
Trigonometric-trust_region                         10      14       8     1.204299e-10   2.388058e-02
Trigonometric-trust_region-AD                      10      14       8     1.204299e-10   9.513187e-02
Variably dimensioned-trust_region                  10      15      15     1.323497e-12   2.141296e-02
Variably dimensioned-trust_region-AD               10      15      15     1.323497e-12   3.755209e-02
Variably dimensioned-newton                        10      15      14     1.323497e-12   6.228940e-04
Variably dimensioned-newton-AD                     10      15      14     1.323497e-12   6.283750e-04
Broyden tridiagonal-trust_region                   10       5       5     7.548402e-10   1.762586e-02
Broyden tridiagonal-trust_region-AD                10       5       5     7.548402e-10   4.395485e-02
Broyden tridiagonal-newton                         10       5       4     7.548402e-10   3.255750e-04
Broyden tridiagonal-newton-AD                      10       5       4     7.548402e-10   4.016930e-04
Broyden banded-trust_region                        10       6       6     9.359466e-09   2.525008e-02
Broyden banded-trust_region-AD                     10       6       6     9.359466e-09   7.354438e-02
Broyden banded-newton                              10       6       5     9.359466e-09   4.353660e-04
Broyden banded-newton-AD                           10       6       5     9.359466e-09   5.369280e-04
Test Summary: | Pass  Total
minpack       |   68     68
Test Summary: | Pass  Total
iface         |   11     11
Test Summary:     | Pass  Total
already converged |    6      6
Test Summary: | Pass  Total
autodiff      |    2      2
Test Summary: | Pass  Total
mcp_josephy   |   18     18
Test Summary: | 
difficult_mcp | No tests
WARNING: DifferentiableFunction(args...) is deprecated, use OnceDifferentiable(args...) instead.
 in depwarn at deprecated.jl:73
 in DifferentiableFunction at deprecated.jl:50
 in newton_ at /home/vagrant/.julia/v0.4/NLsolve/src/newton.jl:103
 in newton at /home/vagrant/.julia/v0.4/NLsolve/src/newton.jl:160
 in nlsolve at /home/vagrant/.julia/v0.4/NLsolve/src/nlsolve_func_defs.jl:21
 [inlined code] from /home/vagrant/.julia/v0.4/NLsolve/test/sparse.jl:27
 in anonymous at no file:0
 in include at ./boot.jl:261
 in include_from_node1 at ./loading.jl:333
 [inlined code] from /home/vagrant/.julia/v0.4/NLsolve/test/runtests.jl:27
 in anonymous at no file:0
 in include at ./boot.jl:261
 in include_from_node1 at ./loading.jl:333
 in process_options at ./client.jl:280
 in _start at ./client.jl:378
while loading /home/vagrant/.julia/v0.4/NLsolve/test/sparse.jl, in expression starting on line 4
Test Summary: | Pass  Total
sparse        |   10     10
Test Summary: | Pass  Total
throws        |    4      4
Test Summary: | Pass  Total
f_g_counts    |    4      4
Test Summary: | Pass  Total
no linesearch |    1      1
INFO: NLsolve tests passed
INFO: Removing BaseTestNext v0.2.2

>>> End of log
