>>> 'Pkg.add("NLsolve")' log
INFO: Cloning cache of NLsolve from git://github.com/JuliaNLSolvers/NLsolve.jl.git
INFO: Installing Calculus v0.2.2
INFO: Installing DiffBase v0.0.5
INFO: Installing Distances v0.3.2
INFO: Installing ForwardDiff v0.3.5
INFO: Installing LineSearches v0.1.5
INFO: Installing NLsolve v0.9.1
INFO: Installing NaNMath v0.2.4
INFO: Installing Optim v0.7.8
INFO: Installing PositiveFactorizations v0.0.4
INFO: Package database updated

>>> 'Pkg.test("NLsolve")' log
Julia Version 0.4.7
Commit ae26b25 (2016-09-18 16:17 UTC)
Platform Info:
  System: Linux (x86_64-pc-linux-gnu)
  CPU: Intel(R) Xeon(R) CPU E3-1241 v3 @ 3.50GHz
  WORD_SIZE: 64
           Ubuntu 14.04.5 LTS
  uname: Linux 3.13.0-115-generic #162-Ubuntu SMP Fri Mar 24 16:03:51 UTC 2017 x86_64 x86_64
Memory: 2.9392738342285156 GB (455.30078125 MB free)
Uptime: 10699.0 sec
Load Avg:  1.0078125  1.10888671875  1.4033203125
Intel(R) Xeon(R) CPU E3-1241 v3 @ 3.50GHz: 
       speed         user         nice          sys         idle          irq
#1  3499 MHz     500652 s         59 s      41474 s     419526 s         16 s
#2  3499 MHz     317334 s         96 s      35551 s     680515 s          0 s

  BLAS: libopenblas (USE64BITINT DYNAMIC_ARCH NO_AFFINITY Nehalem)
  LAPACK: libopenblas64_
  LIBM: libopenlibm
  LLVM: libLLVM-3.3
Environment:
  TERM = vt100
  LD_LIBRARY_PATH = :/usr/local/lib/
  PATH = /usr/local/sbin:/usr/local/bin:/usr/sbin:/usr/bin:/sbin:/bin:/usr/games:/usr/local/games:/home/vagrant/julia/bin/
  JAVA_HOME = /usr/lib/jvm/java-7-oracle
  HOME = /home/vagrant

Package Directory: /home/vagrant/.julia/v0.4
2 required packages:
 - JSON                          0.8.3
 - NLsolve                       0.9.1
9 additional packages:
 - Calculus                      0.2.2
 - Compat                        0.21.0
 - DiffBase                      0.0.5
 - Distances                     0.3.2
 - ForwardDiff                   0.3.5
 - LineSearches                  0.1.5
 - NaNMath                       0.2.4
 - Optim                         0.7.8
 - PositiveFactorizations        0.0.4
INFO: Computing test dependencies for NLsolve...
INFO: Installing BaseTestNext v0.2.2
INFO: Testing NLsolve
WARNING: New definition 
    write(Base.IO, ForwardDiff.Partials) at /home/vagrant/.julia/v0.4/ForwardDiff/src/partials.jl:57
is ambiguous with: 
    write(Base.Base64.Base64EncodePipe, AbstractArray{UInt8, 1}) at base64.jl:89.
To fix, define 
    write(Base.Base64.Base64EncodePipe, ForwardDiff.Partials{N<:Any, UInt8})
before the new definition.
WARNING: New definition 
    write(Base.IO, ForwardDiff.Partials) at /home/vagrant/.julia/v0.4/ForwardDiff/src/partials.jl:57
is ambiguous with: 
    write(Base.Base64.Base64EncodePipe, AbstractArray{UInt8, 1}) at base64.jl:89.
To fix, define 
    write(Base.Base64.Base64EncodePipe, ForwardDiff.Partials{N<:Any, UInt8})
before the new definition.
WARNING: New definition 
    write(Base.IO, ForwardDiff.Partials) at /home/vagrant/.julia/v0.4/ForwardDiff/src/partials.jl:57
is ambiguous with: 
    write(Base.Base64.Base64EncodePipe, AbstractArray{UInt8, 1}) at base64.jl:89.
To fix, define 
    write(Base.Base64.Base64EncodePipe, ForwardDiff.Partials{N<:Any, UInt8})
before the new definition.
WARNING: New definition 
    write(Base.IO, ForwardDiff.Partials) at /home/vagrant/.julia/v0.4/ForwardDiff/src/partials.jl:57
is ambiguous with: 
    write(Base.Base64.Base64EncodePipe, AbstractArray{UInt8, 1}) at base64.jl:89.
To fix, define 
    write(Base.Base64.Base64EncodePipe, ForwardDiff.Partials{N<:Any, UInt8})
before the new definition.
Running tests:
WARNING: DifferentiableFunction(args...) is deprecated, use OnceDifferentiable(args...) instead.
 in depwarn at deprecated.jl:73
 in DifferentiableFunction at deprecated.jl:50
 in newton_ at /home/vagrant/.julia/v0.4/NLsolve/src/newton.jl:103
 in newton at /home/vagrant/.julia/v0.4/NLsolve/src/newton.jl:160
 in nlsolve at /home/vagrant/.julia/v0.4/NLsolve/src/nlsolve_func_defs.jl:21
 [inlined code] from /home/vagrant/.julia/v0.4/NLsolve/test/2by2.jl:39
 in anonymous at no file:0
 in include at ./boot.jl:261
 in include_from_node1 at ./loading.jl:333
 [inlined code] from /home/vagrant/.julia/v0.4/NLsolve/test/runtests.jl:27
 in anonymous at no file:0
 in include at ./boot.jl:261
 in include_from_node1 at ./loading.jl:333
 in process_options at ./client.jl:280
 in _start at ./client.jl:378
while loading /home/vagrant/.julia/v0.4/NLsolve/test/2by2.jl, in expression starting on line 3
WARNING: DifferentiableFunction(args...) is deprecated, use OnceDifferentiable(args...) instead.
 in depwarn at deprecated.jl:73
 in DifferentiableFunction at deprecated.jl:50
 in newton_ at /home/vagrant/.julia/v0.4/NLsolve/src/newton.jl:103
 in newton at /home/vagrant/.julia/v0.4/NLsolve/src/newton.jl:160
 in nlsolve at /home/vagrant/.julia/v0.4/NLsolve/src/nlsolve_func_defs.jl:21
 [inlined code] from /home/vagrant/.julia/v0.4/NLsolve/test/2by2.jl:42
 in anonymous at no file:0
 in include at ./boot.jl:261
 in include_from_node1 at ./loading.jl:333
 [inlined code] from /home/vagrant/.julia/v0.4/NLsolve/test/runtests.jl:27
 in anonymous at no file:0
 in include at ./boot.jl:261
 in include_from_node1 at ./loading.jl:333
 in process_options at ./client.jl:280
 in _start at ./client.jl:378
while loading /home/vagrant/.julia/v0.4/NLsolve/test/2by2.jl, in expression starting on line 3
Test Summary: | Pass  Total
2by2          |   15     15
Test Summary:     | Pass  Total
finite_difference |    1      1
Function                                          Dim    NFEV    NJEV   Final inf-norm     total time
--------------------------------------------------------------------------------------
Rosenbrock-trust_region                             2      30      17     0.000000e+00   8.724171e-03
Rosenbrock-trust_region-AD                          2      30      17     0.000000e+00   3.994952e-01
Rosenbrock-newton                                   2       3       2     8.881784e-15   1.007571e-02
Rosenbrock-newton-AD                                2       3       2     8.881784e-15   6.756150e-04
Powell singular-trust_region                        4      17      17     2.945101e-09   1.974551e-02
Powell singular-trust_region-AD                     4      17      17     2.945101e-09   2.762483e-01
Powell singular-newton                              4      17      16     2.945101e-09   5.747670e-04
Powell singular-newton-AD                           4      17      16     2.945101e-09   6.620710e-04
Powell badly scaled-trust_region                    2      15      14     7.051804e-12   1.450591e-02
Powell badly scaled-trust_region-AD                 2      15      14     7.051804e-12   4.825523e-02
Powell badly scaled-newton                          2      13      12     1.573341e-11   5.218060e-04
Powell badly scaled-newton-AD                       2      13      12     1.573341e-11   6.604300e-04
Wood-trust_region                                   4      19      15     1.152565e-10   3.033736e-02
Wood-trust_region-AD                                4      19      15     1.152340e-10   6.225099e-02
Wood-newton                                         4      15      14     6.972201e-14   5.238680e-04
Wood-newton-AD                                      4      15      14     4.884981e-14   5.903490e-04
Helical Valley-trust_region                         3      10       9     1.110223e-14   3.687156e-02
Helical Valley-trust_region-AD                      3      10       9     1.110223e-14   3.205250e-01
Helical Valley-newton                               3      11      10     1.145685e-14   3.554930e-04
Helical Valley-newton-AD                            3      11      10     1.145685e-14   6.788120e-04
Watson-trust_region                                 6      20      16     3.012954e-13   6.887820e-02
Watson-trust_region-AD                              6      20      16     2.916643e-13   3.509878e-01
Watson-newton                                       6      13      12     3.212777e-13   4.482280e-04
Watson-newton-AD                                    6      13      12     3.186063e-13   7.128380e-03
Watson-trust_region                                 9      17      17     1.633317e-12   6.627550e-04
Watson-trust_region-AD                              9      17      17     1.618360e-12   5.241749e-01
Watson-newton                                       9      14      13     8.726530e-15   6.774180e-04
Watson-newton-AD                                    9      14      13     6.129168e-14   2.674317e-03
Chebyquad-trust_region                              5       8       5     9.143861e-09   2.650775e-02
Chebyquad-trust_region-AD                           5       8       5     9.143861e-09   2.974752e-01
Chebyquad-trust_region                              6      13       8     7.320533e-16   4.591930e-04
Chebyquad-trust_region-AD                           6      13       8     7.320533e-16   2.924987e-02
Chebyquad-trust_region                              7      10       6     6.329061e-10   2.652670e-04
Chebyquad-trust_region-AD                           7      10       6     6.329061e-10   3.013919e-01
Chebyquad-trust_region                              9      14       8     1.621966e-14   1.704560e-04
Chebyquad-trust_region-AD                           9      14       8     1.621966e-14   6.430236e-02
Brown almost-linear-trust_region                   10       5       5     3.382331e-09   7.119422e-02
Brown almost-linear-trust_region-AD                10       5       5     3.382331e-09   2.969996e-01
Brown almost-linear-trust_region                   30       4       4     8.883263e-09   1.693770e-03
Brown almost-linear-trust_region-AD                30       4       4     8.883263e-09   1.100081e-03
Brown almost-linear-trust_region                   40       4       4     1.570839e-09   1.039833e-03
Brown almost-linear-trust_region-AD                40       4       4     1.570839e-09   9.920540e-04
Discrete boundary value-trust_region               10       4       4     2.636780e-16   2.605681e-02
Discrete boundary value-trust_region-AD            10       4       4     2.636780e-16   1.398256e-01
Discrete boundary value-newton                     10       4       3     2.636780e-16   3.922720e-04
Discrete boundary value-newton-AD                  10       4       3     2.636780e-16   4.291000e-04
Discrete integral equation-trust_region             1       4       4     8.540391e-14   3.199331e-02
Discrete integral equation-trust_region-AD          1       4       4     8.540391e-14   2.600443e-01
Discrete integral equation-newton                   1       4       3     8.540391e-14   3.808680e-04
Discrete integral equation-newton-AD                1       4       3     8.540391e-14   3.087140e-04
Discrete integral equation-trust_region            10       4       4     2.720046e-15   1.742410e-04
Discrete integral equation-trust_region-AD         10       4       4     2.720046e-15   8.817986e-02
Discrete integral equation-newton                  10       4       3     2.720046e-15   5.165040e-04
Discrete integral equation-newton-AD               10       4       3     2.720046e-15   6.962700e-04
Trigonometric-trust_region                         10      14       8     1.204299e-10   2.348780e-02
Trigonometric-trust_region-AD                      10      14       8     1.204299e-10   8.882018e-02
Variably dimensioned-trust_region                  10      15      15     1.323497e-12   3.420608e-02
Variably dimensioned-trust_region-AD               10      15      15     1.323497e-12   3.882897e-02
Variably dimensioned-newton                        10      15      14     1.323497e-12   4.003440e-04
Variably dimensioned-newton-AD                     10      15      14     1.323497e-12   6.558340e-04
Broyden tridiagonal-trust_region                   10       5       5     7.548402e-10   1.997889e-02
Broyden tridiagonal-trust_region-AD                10       5       5     7.548402e-10   5.554322e-02
Broyden tridiagonal-newton                         10       5       4     7.548402e-10   3.596850e-04
Broyden tridiagonal-newton-AD                      10       5       4     7.548402e-10   5.877140e-04
Broyden banded-trust_region                        10       6       6     9.359466e-09   2.494455e-02
Broyden banded-trust_region-AD                     10       6       6     9.359466e-09   6.421053e-02
Broyden banded-newton                              10       6       5     9.359466e-09   3.413300e-04
Broyden banded-newton-AD                           10       6       5     9.359466e-09   4.923770e-04
Test Summary: | Pass  Total
minpack       |   68     68
Test Summary: | Pass  Total
iface         |   11     11
Test Summary:     | Pass  Total
already converged |    6      6
Test Summary: | Pass  Total
autodiff      |    2      2
Test Summary: | Pass  Total
mcp_josephy   |   18     18
Test Summary: | 
difficult_mcp | No tests
WARNING: DifferentiableFunction(args...) is deprecated, use OnceDifferentiable(args...) instead.
 in depwarn at deprecated.jl:73
 in DifferentiableFunction at deprecated.jl:50
 in newton_ at /home/vagrant/.julia/v0.4/NLsolve/src/newton.jl:103
 in newton at /home/vagrant/.julia/v0.4/NLsolve/src/newton.jl:160
 in nlsolve at /home/vagrant/.julia/v0.4/NLsolve/src/nlsolve_func_defs.jl:21
 [inlined code] from /home/vagrant/.julia/v0.4/NLsolve/test/sparse.jl:27
 in anonymous at no file:0
 in include at ./boot.jl:261
 in include_from_node1 at ./loading.jl:333
 [inlined code] from /home/vagrant/.julia/v0.4/NLsolve/test/runtests.jl:27
 in anonymous at no file:0
 in include at ./boot.jl:261
 in include_from_node1 at ./loading.jl:333
 in process_options at ./client.jl:280
 in _start at ./client.jl:378
while loading /home/vagrant/.julia/v0.4/NLsolve/test/sparse.jl, in expression starting on line 4
Test Summary: | Pass  Total
sparse        |   10     10
Test Summary: | Pass  Total
throws        |    4      4
Test Summary: | Pass  Total
f_g_counts    |    4      4
Test Summary: | Pass  Total
no linesearch |    1      1
INFO: NLsolve tests passed
INFO: Removing BaseTestNext v0.2.2

>>> End of log
