>>> 'Pkg.add("NLsolve")' log
INFO: Cloning cache of NLsolve from git://github.com/EconForge/NLsolve.jl.git
INFO: Installing Calculus v0.2.1
INFO: Installing DiffBase v0.0.4
INFO: Installing Distances v0.3.2
INFO: Installing ForwardDiff v0.3.4
INFO: Installing LineSearches v0.1.5
INFO: Installing NLsolve v0.9.1
INFO: Installing NaNMath v0.2.2
INFO: Installing Optim v0.7.8
INFO: Installing PositiveFactorizations v0.0.4
INFO: Package database updated

>>> 'Pkg.test("NLsolve")' log
Julia Version 0.4.7
Commit ae26b25 (2016-09-18 16:17 UTC)
Platform Info:
  System: Linux (x86_64-pc-linux-gnu)
  CPU: Intel(R) Xeon(R) CPU E3-1241 v3 @ 3.50GHz
  WORD_SIZE: 64
           Ubuntu 14.04.5 LTS
  uname: Linux 3.13.0-112-generic #159-Ubuntu SMP Fri Mar 3 15:26:07 UTC 2017 x86_64 x86_64
Memory: 2.9392738342285156 GB (425.453125 MB free)
Uptime: 10379.0 sec
Load Avg:  1.005859375  1.10009765625  1.48095703125
Intel(R) Xeon(R) CPU E3-1241 v3 @ 3.50GHz: 
       speed         user         nice          sys         idle          irq
#1  3500 MHz     487344 s         37 s      44557 s     399637 s         32 s
#2  3500 MHz     320647 s       5383 s      39522 s     630012 s          0 s

  BLAS: libopenblas (USE64BITINT DYNAMIC_ARCH NO_AFFINITY Nehalem)
  LAPACK: libopenblas64_
  LIBM: libopenlibm
  LLVM: libLLVM-3.3
Environment:
  TERM = vt100
  LD_LIBRARY_PATH = :/usr/local/lib/
  PATH = /usr/local/sbin:/usr/local/bin:/usr/sbin:/usr/bin:/sbin:/bin:/usr/games:/usr/local/games:/home/vagrant/julia/bin/
  JAVA_HOME = /usr/lib/jvm/java-7-oracle
  HOME = /home/vagrant

Package Directory: /home/vagrant/.julia/v0.4
2 required packages:
 - JSON                          0.8.3
 - NLsolve                       0.9.1
9 additional packages:
 - Calculus                      0.2.1
 - Compat                        0.20.0
 - DiffBase                      0.0.4
 - Distances                     0.3.2
 - ForwardDiff                   0.3.4
 - LineSearches                  0.1.5
 - NaNMath                       0.2.2
 - Optim                         0.7.8
 - PositiveFactorizations        0.0.4
INFO: Computing test dependencies for NLsolve...
INFO: Installing BaseTestNext v0.2.2
INFO: Testing NLsolve
WARNING: New definition 
    write(Base.IO, ForwardDiff.Partials) at /home/vagrant/.julia/v0.4/ForwardDiff/src/partials.jl:57
is ambiguous with: 
    write(Base.Base64.Base64EncodePipe, AbstractArray{UInt8, 1}) at base64.jl:89.
To fix, define 
    write(Base.Base64.Base64EncodePipe, ForwardDiff.Partials{N<:Any, UInt8})
before the new definition.
WARNING: New definition 
    write(Base.IO, ForwardDiff.Partials) at /home/vagrant/.julia/v0.4/ForwardDiff/src/partials.jl:57
is ambiguous with: 
    write(Base.Base64.Base64EncodePipe, AbstractArray{UInt8, 1}) at base64.jl:89.
To fix, define 
    write(Base.Base64.Base64EncodePipe, ForwardDiff.Partials{N<:Any, UInt8})
before the new definition.
WARNING: New definition 
    write(Base.IO, ForwardDiff.Partials) at /home/vagrant/.julia/v0.4/ForwardDiff/src/partials.jl:57
is ambiguous with: 
    write(Base.Base64.Base64EncodePipe, AbstractArray{UInt8, 1}) at base64.jl:89.
To fix, define 
    write(Base.Base64.Base64EncodePipe, ForwardDiff.Partials{N<:Any, UInt8})
before the new definition.
WARNING: New definition 
    write(Base.IO, ForwardDiff.Partials) at /home/vagrant/.julia/v0.4/ForwardDiff/src/partials.jl:57
is ambiguous with: 
    write(Base.Base64.Base64EncodePipe, AbstractArray{UInt8, 1}) at base64.jl:89.
To fix, define 
    write(Base.Base64.Base64EncodePipe, ForwardDiff.Partials{N<:Any, UInt8})
before the new definition.
Running tests:
WARNING: DifferentiableFunction(args...) is deprecated, use OnceDifferentiable(args...) instead.
 in depwarn at deprecated.jl:73
 in DifferentiableFunction at deprecated.jl:50
 in newton_ at /home/vagrant/.julia/v0.4/NLsolve/src/newton.jl:103
 in newton at /home/vagrant/.julia/v0.4/NLsolve/src/newton.jl:160
 in nlsolve at /home/vagrant/.julia/v0.4/NLsolve/src/nlsolve_func_defs.jl:21
 [inlined code] from /home/vagrant/.julia/v0.4/NLsolve/test/2by2.jl:39
 in anonymous at no file:0
 in include at ./boot.jl:261
 in include_from_node1 at ./loading.jl:333
 [inlined code] from /home/vagrant/.julia/v0.4/NLsolve/test/runtests.jl:27
 in anonymous at no file:0
 in include at ./boot.jl:261
 in include_from_node1 at ./loading.jl:333
 in process_options at ./client.jl:280
 in _start at ./client.jl:378
while loading /home/vagrant/.julia/v0.4/NLsolve/test/2by2.jl, in expression starting on line 3
WARNING: DifferentiableFunction(args...) is deprecated, use OnceDifferentiable(args...) instead.
 in depwarn at deprecated.jl:73
 in DifferentiableFunction at deprecated.jl:50
 in newton_ at /home/vagrant/.julia/v0.4/NLsolve/src/newton.jl:103
 in newton at /home/vagrant/.julia/v0.4/NLsolve/src/newton.jl:160
 in nlsolve at /home/vagrant/.julia/v0.4/NLsolve/src/nlsolve_func_defs.jl:21
 [inlined code] from /home/vagrant/.julia/v0.4/NLsolve/test/2by2.jl:42
 in anonymous at no file:0
 in include at ./boot.jl:261
 in include_from_node1 at ./loading.jl:333
 [inlined code] from /home/vagrant/.julia/v0.4/NLsolve/test/runtests.jl:27
 in anonymous at no file:0
 in include at ./boot.jl:261
 in include_from_node1 at ./loading.jl:333
 in process_options at ./client.jl:280
 in _start at ./client.jl:378
while loading /home/vagrant/.julia/v0.4/NLsolve/test/2by2.jl, in expression starting on line 3
Test Summary: | Pass  Total
2by2          |   15     15
Test Summary:     | Pass  Total
finite_difference |    1      1
Function                                          Dim    NFEV    NJEV   Final inf-norm     total time
--------------------------------------------------------------------------------------
Rosenbrock-trust_region                             2      30      17     0.000000e+00   9.346709e-03
Rosenbrock-trust_region-AD                          2      30      17     0.000000e+00   4.030192e-01
Rosenbrock-newton                                   2       3       2     8.881784e-15   1.058253e-02
Rosenbrock-newton-AD                                2       3       2     8.881784e-15   6.975130e-04
Powell singular-trust_region                        4      17      17     2.945101e-09   2.199778e-02
Powell singular-trust_region-AD                     4      17      17     2.945101e-09   2.644308e-01
Powell singular-newton                              4      17      16     2.945101e-09   6.107990e-04
Powell singular-newton-AD                           4      17      16     2.945101e-09   7.040110e-04
Powell badly scaled-trust_region                    2      15      14     7.051804e-12   1.443781e-02
Powell badly scaled-trust_region-AD                 2      15      14     7.051804e-12   4.420447e-02
Powell badly scaled-newton                          2      13      12     1.573341e-11   3.858910e-04
Powell badly scaled-newton-AD                       2      13      12     1.573341e-11   5.547230e-04
Wood-trust_region                                   4      19      15     1.152565e-10   3.178675e-02
Wood-trust_region-AD                                4      19      15     1.152340e-10   6.617910e-02
Wood-newton                                         4      15      14     6.972201e-14   6.750020e-04
Wood-newton-AD                                      4      15      14     4.884981e-14   4.173150e-04
Helical Valley-trust_region                         3      10       9     1.110223e-14   1.983411e-02
Helical Valley-trust_region-AD                      3      10       9     1.110223e-14   2.442403e-01
Helical Valley-newton                               3      11      10     1.145685e-14   4.038630e-04
Helical Valley-newton-AD                            3      11      10     1.145685e-14   4.407890e-04
Watson-trust_region                                 6      20      16     3.012954e-13   5.270494e-02
Watson-trust_region-AD                              6      20      16     2.916643e-13   2.968375e-01
Watson-newton                                       6      13      12     3.212777e-13   5.364980e-04
Watson-newton-AD                                    6      13      12     3.186063e-13   8.782840e-03
Watson-trust_region                                 9      17      17     1.633317e-12   9.499410e-04
Watson-trust_region-AD                              9      17      17     1.618360e-12   4.225694e-01
Watson-newton                                       9      14      13     8.726530e-15   8.491650e-04
Watson-newton-AD                                    9      14      13     6.129168e-14   2.786799e-03
Chebyquad-trust_region                              5       8       5     9.143861e-09   2.482477e-02
Chebyquad-trust_region-AD                           5       8       5     9.143861e-09   2.830676e-01
Chebyquad-trust_region                              6      13       8     7.320533e-16   3.164210e-04
Chebyquad-trust_region-AD                           6      13       8     7.320533e-16   3.468030e-02
Chebyquad-trust_region                              7      10       6     6.329061e-10   2.014280e-04
Chebyquad-trust_region-AD                           7      10       6     6.329061e-10   3.114194e-01
Chebyquad-trust_region                              9      14       8     1.621966e-14   3.837100e-04
Chebyquad-trust_region-AD                           9      14       8     1.621966e-14   7.267164e-02
Brown almost-linear-trust_region                   10       5       5     3.382331e-09   9.696215e-02
Brown almost-linear-trust_region-AD                10       5       5     3.382331e-09   4.773298e-01
Brown almost-linear-trust_region                   30       4       4     8.883263e-09   2.949947e-03
Brown almost-linear-trust_region-AD                30       4       4     8.883263e-09   8.885430e-04
Brown almost-linear-trust_region                   40       4       4     1.570839e-09   9.787540e-04
Brown almost-linear-trust_region-AD                40       4       4     1.570839e-09   9.999140e-04
Discrete boundary value-trust_region               10       4       4     2.636780e-16   3.068718e-02
Discrete boundary value-trust_region-AD            10       4       4     2.636780e-16   1.488574e-01
Discrete boundary value-newton                     10       4       3     2.636780e-16   4.173460e-04
Discrete boundary value-newton-AD                  10       4       3     2.636780e-16   5.191570e-04
Discrete integral equation-trust_region             1       4       4     8.540391e-14   3.757597e-02
Discrete integral equation-trust_region-AD          1       4       4     8.540391e-14   2.733642e-01
Discrete integral equation-newton                   1       4       3     8.540391e-14   2.645820e-04
Discrete integral equation-newton-AD                1       4       3     8.540391e-14   3.988200e-04
Discrete integral equation-trust_region            10       4       4     2.720046e-15   1.813490e-04
Discrete integral equation-trust_region-AD         10       4       4     2.720046e-15   9.636941e-02
Discrete integral equation-newton                  10       4       3     2.720046e-15   3.791620e-04
Discrete integral equation-newton-AD               10       4       3     2.720046e-15   7.605590e-04
Trigonometric-trust_region                         10      14       8     1.204299e-10   2.512761e-02
Trigonometric-trust_region-AD                      10      14       8     1.204299e-10   1.008722e-01
Variably dimensioned-trust_region                  10      15      15     1.323497e-12   2.677483e-02
Variably dimensioned-trust_region-AD               10      15      15     1.323497e-12   5.125494e-02
Variably dimensioned-newton                        10      15      14     1.323497e-12   3.372610e-04
Variably dimensioned-newton-AD                     10      15      14     1.323497e-12   4.689310e-04
Broyden tridiagonal-trust_region                   10       5       5     7.548402e-10   1.806317e-02
Broyden tridiagonal-trust_region-AD                10       5       5     7.548402e-10   4.705991e-02
Broyden tridiagonal-newton                         10       5       4     7.548402e-10   2.789860e-04
Broyden tridiagonal-newton-AD                      10       5       4     7.548402e-10   4.129510e-04
Broyden banded-trust_region                        10       6       6     9.359466e-09   2.426719e-02
Broyden banded-trust_region-AD                     10       6       6     9.359466e-09   6.305063e-02
Broyden banded-newton                              10       6       5     9.359466e-09   3.016120e-04
Broyden banded-newton-AD                           10       6       5     9.359466e-09   4.282020e-04
Test Summary: | Pass  Total
minpack       |   68     68
Test Summary: | Pass  Total
iface         |   11     11
Test Summary:     | Pass  Total
already converged |    6      6
Test Summary: | Pass  Total
autodiff      |    2      2
Test Summary: | Pass  Total
mcp_josephy   |   18     18
Test Summary: | 
difficult_mcp | No tests
WARNING: DifferentiableFunction(args...) is deprecated, use OnceDifferentiable(args...) instead.
 in depwarn at deprecated.jl:73
 in DifferentiableFunction at deprecated.jl:50
 in newton_ at /home/vagrant/.julia/v0.4/NLsolve/src/newton.jl:103
 in newton at /home/vagrant/.julia/v0.4/NLsolve/src/newton.jl:160
 in nlsolve at /home/vagrant/.julia/v0.4/NLsolve/src/nlsolve_func_defs.jl:21
 [inlined code] from /home/vagrant/.julia/v0.4/NLsolve/test/sparse.jl:27
 in anonymous at no file:0
 in include at ./boot.jl:261
 in include_from_node1 at ./loading.jl:333
 [inlined code] from /home/vagrant/.julia/v0.4/NLsolve/test/runtests.jl:27
 in anonymous at no file:0
 in include at ./boot.jl:261
 in include_from_node1 at ./loading.jl:333
 in process_options at ./client.jl:280
 in _start at ./client.jl:378
while loading /home/vagrant/.julia/v0.4/NLsolve/test/sparse.jl, in expression starting on line 4
Test Summary: | Pass  Total
sparse        |   10     10
Test Summary: | Pass  Total
throws        |    4      4
Test Summary: | Pass  Total
f_g_counts    |    4      4
Test Summary: | Pass  Total
no linesearch |    1      1
INFO: NLsolve tests passed
INFO: Removing BaseTestNext v0.2.2

>>> End of log
