>>> 'Pkg.add("PATHSolver")' log
INFO: Cloning cache of PATHSolver from git://github.com/chkwon/PATHSolver.jl.git
INFO: Installing BinDeps v0.4.7
INFO: Installing Calculus v0.2.2
INFO: Installing DiffBase v0.0.5
INFO: Installing ForwardDiff v0.3.5
INFO: Installing NaNMath v0.2.4
INFO: Installing PATHSolver v0.0.6
INFO: Installing SHA v0.3.2
INFO: Installing URIParser v0.1.8
INFO: Building PATHSolver
INFO: Attempting to Create directory /home/vagrant/.julia/v0.4/PATHSolver/deps/usr/lib
INFO: Attempting to Create directory /home/vagrant/.julia/v0.4/PATHSolver/deps/src
INFO: Changing Directory to /home/vagrant/.julia/v0.4/PATHSolver/deps/src
INFO: Attempting to Create directory /home/vagrant/.julia/v0.4/PATHSolver/deps/downloads
INFO: Changing Directory to /home/vagrant/.julia/v0.4/PATHSolver/deps/src
INFO: Downloading file https://github.com/ampl/pathlib/archive/4.7.03.tar.gz
INFO: Changing Directory to /home/vagrant/.julia/v0.4/PATHSolver/deps/src
  % Total    % Received % Xferd  Average Speed   Time    Time     Time  Current
                                 Dload  Upload   Total   Spent    Left  Speed
  0     0    0     0    0     0      0      0 --:--:-- --:--:-- --:--:--     0100   120    0   120    0     0   1337      0 --:--:-- --:--:-- --:--:--  1348
  4 3750k    4  151k    0     0   115k      0  0:00:32  0:00:01  0:00:31  115k 64 3750k   64 2409k    0     0  1746k      0  0:00:02  0:00:01  0:00:01 30.6M100 3750k  100 3750k    0     0  2663k      0  0:00:01  0:00:01 --:--:-- 34.7M
INFO: Changing Directory to /home/vagrant/.julia/v0.4/PATHSolver/deps/src
INFO: Done downloading file https://github.com/ampl/pathlib/archive/4.7.03.tar.gz
INFO: Changing Directory to /home/vagrant/.julia/v0.4/PATHSolver/deps/src
INFO: Attempting to Create directory /home/vagrant/.julia/v0.4/PATHSolver/deps
INFO: Directory /home/vagrant/.julia/v0.4/PATHSolver/deps already created
INFO: Changing Directory to /home/vagrant/.julia/v0.4/PATHSolver/deps/src
INFO: Attempting to Create directory /home/vagrant/.julia/v0.4/PATHSolver/deps/downloads
INFO: Directory /home/vagrant/.julia/v0.4/PATHSolver/deps/downloads already created
INFO: Downloading file https://github.com/chkwon/PathJulia/archive/0.0.7.tar.gz
  % Total    % Received % Xferd  Average Speed   Time    Time     Time  Current
                                 Dload  Upload   Total   Spent    Left  Speed
  0     0    0     0    0     0      0      0 --:--:-- --:--:-- --:--:--     0100   123    0   123    0     0   1346      0 --:--:-- --:--:-- --:--:--  1351
  0     0    0  491k    0     0  1374k      0 --:--:-- --:--:-- --:--:-- 1374k
INFO: Done downloading file https://github.com/chkwon/PathJulia/archive/0.0.7.tar.gz
INFO: Attempting to Create directory /home/vagrant/.julia/v0.4/PATHSolver/deps
INFO: Directory /home/vagrant/.julia/v0.4/PATHSolver/deps already created
INFO: Changing Directory to /home/vagrant/.julia/v0.4/PATHSolver/deps/src
INFO: Changing Directory to /home/vagrant/.julia/v0.4/PATHSolver/deps/src
INFO: Changing Directory to /home/vagrant/.julia/v0.4/PATHSolver/deps/src
INFO: Changing Directory to /home/vagrant/.julia/v0.4/PATHSolver/deps/src
INFO: Changing Directory to /home/vagrant/.julia/v0.4/PATHSolver/deps/src/PathJulia/src
gcc -I../../pathlib/include -m64 -shared -fPIC -Wl,-soname,libpath47julia.so -o libpath47julia.so pathjulia.c Standalone_Path.c ../../pathlib/lib/linux64/libpath47.a -lm
mkdir -p ../lib/linux64
mv libpath47julia.so ../lib/linux64/
INFO: Changing Directory to /home/vagrant/.julia/v0.4/PATHSolver/deps/src/PathJulia/src
INFO: Package database updated
INFO: METADATA is out-of-date — you may not have the latest version of PATHSolver
INFO: Use `Pkg.update()` to get the latest versions of your packages

>>> 'Pkg.test("PATHSolver")' log
Julia Version 0.4.7
Commit ae26b25 (2016-09-18 16:17 UTC)
Platform Info:
  System: Linux (x86_64-pc-linux-gnu)
  CPU: Intel(R) Xeon(R) CPU E3-1241 v3 @ 3.50GHz
  WORD_SIZE: 64
           Ubuntu 14.04.5 LTS
  uname: Linux 3.13.0-113-generic #160-Ubuntu SMP Thu Mar 9 09:27:29 UTC 2017 x86_64 x86_64
Memory: 2.9392738342285156 GB (1175.71875 MB free)
Uptime: 15750.0 sec
Load Avg:  1.0419921875  1.06884765625  1.0029296875
Intel(R) Xeon(R) CPU E3-1241 v3 @ 3.50GHz: 
       speed         user         nice          sys         idle          irq
#1  3496 MHz     750060 s       5768 s      58553 s     604479 s         24 s
#2  3496 MHz     482710 s       2016 s      49847 s     989669 s          0 s

  BLAS: libopenblas (USE64BITINT DYNAMIC_ARCH NO_AFFINITY Nehalem)
  LAPACK: libopenblas64_
  LIBM: libopenlibm
  LLVM: libLLVM-3.3
Environment:
  TERM = vt100
  LD_LIBRARY_PATH = :/usr/local/lib/
  PATH = /usr/local/sbin:/usr/local/bin:/usr/sbin:/usr/bin:/sbin:/bin:/usr/games:/usr/local/games:/home/vagrant/julia/bin/
  JAVA_HOME = /usr/lib/jvm/java-7-oracle
  HOME = /home/vagrant

Package Directory: /home/vagrant/.julia/v0.4
2 required packages:
 - JSON                          0.8.3
 - PATHSolver                    0.0.6
8 additional packages:
 - BinDeps                       0.4.7
 - Calculus                      0.2.2
 - Compat                        0.21.0
 - DiffBase                      0.0.5
 - ForwardDiff                   0.3.5
 - NaNMath                       0.2.4
 - SHA                           0.3.2
 - URIParser                     0.1.8
INFO: Testing PATHSolver
WARNING: New definition 
    write(Base.IO, ForwardDiff.Partials) at /home/vagrant/.julia/v0.4/ForwardDiff/src/partials.jl:57
is ambiguous with: 
    write(Base.Base64.Base64EncodePipe, AbstractArray{UInt8, 1}) at base64.jl:89.
To fix, define 
    write(Base.Base64.Base64EncodePipe, ForwardDiff.Partials{N<:Any, UInt8})
before the new definition.
WARNING: New definition 
    write(Base.IO, ForwardDiff.Partials) at /home/vagrant/.julia/v0.4/ForwardDiff/src/partials.jl:57
is ambiguous with: 
    write(Base.Base64.Base64EncodePipe, AbstractArray{UInt8, 1}) at base64.jl:89.
To fix, define 
    write(Base.Base64.Base64EncodePipe, ForwardDiff.Partials{N<:Any, UInt8})
before the new definition.
status = :Solved
z = [2.8,0.0,0.8,1.2]
f = [0.0,0.40000000000000013,4.440892098500626e-16,0.0]
-------------------------------------------------------
status = :Solved
z = [2.8,0.0,0.8,1.2]
f = [0.0,0.40000000000000013,4.440892098500626e-16,0.0]
Path 4.7.03: Standalone-C Link
4 row/cols, 12 non-zeros, 75.00% dense.

Reading options file path.opt
 > convergence_tolerance 1e-2
 > output yes
 > time_limit 3600
Read of options file complete.

Path 4.7.03 (Wed May 28 13:11:13 2014)
Written by Todd Munson, Steven Dirkse, and Michael Ferris

INITIAL POINT STATISTICS
Maximum of X. . . . . . . . . .  0.0000e+00 var: (x[    1])
Maximum of F. . . . . . . . . .  6.0000e+00 eqn: (f[    4])
Maximum of Grad F . . . . . . .  4.0000e+00 eqn: (f[    4])
                                            var: (x[    4])

INITIAL JACOBIAN NORM STATISTICS
Maximum Row Norm. . . . . . . .  9.0000e+00 eqn: (f[    4])
Minimum Row Norm. . . . . . . .  2.0000e+00 eqn: (f[    1])
Maximum Column Norm . . . . . .  9.0000e+00 var: (x[    4])
Minimum Column Norm . . . . . .  2.0000e+00 var: (x[    1])

Crash Log
major  func  diff  size  residual    step       prox   (label)
    0     0             1.2295e+01             0.0e+00 (f[    4])
    1     2     4     2 1.0267e+01  8.0e-01    0.0e+00 (f[    1])
    2     3     2     4 8.4839e-01  1.0e+00    0.0e+00 (f[    4])
    3     4     0     3 4.4409e-16  1.0e+00    0.0e+00 (f[    3])
pn_search terminated: no basis change.

Major Iteration Log
major minor  func  grad  residual    step  type prox    inorm  (label)
    0     0     5     4 4.4409e-16           I 0.0e+00 4.4e-16 (f[    3])

FINAL STATISTICS
Inf-Norm of Complementarity . .  3.5527e-16 eqn: (f[    3])
Inf-Norm of Normal Map. . . . .  4.4409e-16 eqn: (f[    3])
Inf-Norm of Minimum Map . . . .  4.4409e-16 eqn: (f[    3])
Inf-Norm of Fischer Function. .  4.4409e-16 eqn: (f[    3])
Inf-Norm of Grad Fischer Fcn. .  8.8818e-16 eqn: (f[    3])
Two-Norm of Grad Fischer Fcn. .  1.4043e-15

FINAL POINT STATISTICS
Maximum of X. . . . . . . . . .  2.8000e+00 var: (x[    1])
Maximum of F. . . . . . . . . .  4.0000e-01 eqn: (f[    2])
Maximum of Grad F . . . . . . .  4.0000e+00 eqn: (f[    4])
                                            var: (x[    4])

 ** EXIT - solution found.

Major Iterations. . . . 0
Minor Iterations. . . . 0
Restarts. . . . . . . . 0
Crash Iterations. . . . 3
Gradient Steps. . . . . 0
Function Evaluations. . 5
Gradient Evaluations. . 4
Basis Time. . . . . . . 0.000000
Total Time. . . . . . . 0.057509
Residual. . . . . . . . 4.440892e-16
Residual of 4.44089e-16 is OK
Path 4.7.03: Standalone-C Link
4 row/cols, 12 non-zeros, 75.00% dense.

Reading options file path.opt
 > convergence_tolerance 1e-2
Read of options file complete.

Path 4.7.03 (Wed May 28 13:11:13 2014)
Written by Todd Munson, Steven Dirkse, and Michael Ferris

 ** EXIT - solution found.
Residual of 4.44089e-16 is OK
INFO: PATHSolver tests passed

>>> End of log
