>>> 'Pkg.add("PhyloNetworks")' log
INFO: Cloning cache of Compose from https://github.com/GiovineItalia/Compose.jl.git
INFO: Cloning cache of CoupledFields from https://github.com/Mattriks/CoupledFields.jl.git
INFO: Cloning cache of DiffEqDiffTools from https://github.com/JuliaDiffEq/DiffEqDiffTools.jl.git
INFO: Cloning cache of GLM from https://github.com/JuliaStats/GLM.jl.git
INFO: Cloning cache of Gadfly from https://github.com/GiovineItalia/Gadfly.jl.git
INFO: Cloning cache of Hexagons from https://github.com/GiovineItalia/Hexagons.jl.git
INFO: Cloning cache of Juno from https://github.com/JunoLab/Juno.jl.git
INFO: Cloning cache of KernelDensity from https://github.com/JuliaStats/KernelDensity.jl.git
INFO: Cloning cache of LineSearches from https://github.com/JuliaNLSolvers/LineSearches.jl.git
INFO: Cloning cache of Loess from https://github.com/JuliaStats/Loess.jl.git
INFO: Cloning cache of Measures from https://github.com/JuliaGraphics/Measures.jl.git
INFO: Cloning cache of Media from https://github.com/JunoLab/Media.jl.git
INFO: Cloning cache of NLSolversBase from https://github.com/JuliaNLSolvers/NLSolversBase.jl.git
INFO: Cloning cache of NLopt from https://github.com/JuliaOpt/NLopt.jl.git
INFO: Cloning cache of NullableArrays from https://github.com/JuliaStats/NullableArrays.jl.git
INFO: Cloning cache of Nulls from https://github.com/JuliaData/Nulls.jl.git
INFO: Cloning cache of Optim from https://github.com/JuliaNLSolvers/Optim.jl.git
INFO: Cloning cache of PhyloNetworks from https://github.com/crsl4/PhyloNetworks.jl.git
INFO: Cloning cache of PositiveFactorizations from https://github.com/timholy/PositiveFactorizations.jl.git
INFO: Cloning cache of Showoff from https://github.com/JuliaGraphics/Showoff.jl.git
INFO: Installing AxisAlgorithms v0.2.0
INFO: Installing AxisArrays v0.2.1
INFO: Installing BinDeps v0.8.7
INFO: Installing Calculus v0.2.2
INFO: Installing CategoricalArrays v0.2.3
INFO: Installing ColorTypes v0.6.7
INFO: Installing Colors v0.8.2
INFO: Installing Combinatorics v0.6.0
INFO: Installing CommonSubexpressions v0.1.0
INFO: Installing Compose v0.5.5
INFO: Installing Contour v0.4.0
INFO: Installing CoupledFields v0.0.1
INFO: Installing DataArrays v0.6.2
INFO: Installing DataFrames v0.10.1
INFO: Installing DataStructures v0.7.4
INFO: Installing DiffEqDiffTools v0.4.0
INFO: Installing DiffResults v0.0.3
INFO: Installing DiffRules v0.0.4
INFO: Installing Distances v0.5.0
INFO: Installing Distributions v0.15.0
INFO: Installing DualNumbers v0.3.0
INFO: Installing FileIO v0.7.0
INFO: Installing FixedPointNumbers v0.4.6
INFO: Installing ForwardDiff v0.7.4
INFO: Installing GLM v0.8.1
INFO: Installing GZip v0.3.0
INFO: Installing Gadfly v0.6.5
INFO: Installing Hexagons v0.1.0
INFO: Installing Interpolations v0.7.3
INFO: Installing IntervalSets v0.2.0
INFO: Installing IterTools v0.2.1
INFO: Installing Juno v0.4.0
INFO: Installing KernelDensity v0.4.1
INFO: Installing LineSearches v3.2.5
INFO: Installing Loess v0.3.0
INFO: Installing MacroTools v0.4.0
INFO: Installing MathProgBase v0.7.0
INFO: Installing Measures v0.1.0
INFO: Installing Media v0.3.0
INFO: Installing Missings v0.2.8
INFO: Installing NLSolversBase v4.3.0
INFO: Installing NLopt v0.3.6
INFO: Installing NaNMath v0.3.1
INFO: Installing NamedArrays v0.7.0
INFO: Installing NullableArrays v0.1.2
INFO: Installing Nulls v0.1.2
INFO: Installing Optim v0.14.0
INFO: Installing PDMats v0.8.0
INFO: Installing Parameters v0.8.1
INFO: Installing PhyloNetworks v0.6.0
INFO: Installing Polynomials v0.2.2
INFO: Installing PositiveFactorizations v0.1.0
INFO: Installing QuadGK v0.2.1
INFO: Installing RCall v0.8.1
INFO: Installing RangeArrays v0.2.0
INFO: Installing Ratios v0.2.0
INFO: Installing Reexport v0.1.0
INFO: Installing Rmath v0.3.2
INFO: Installing SHA v0.5.6
INFO: Installing ShowItLikeYouBuildIt v0.2.0
INFO: Installing Showoff v0.1.1
INFO: Installing SortingAlgorithms v0.2.0
INFO: Installing SpecialFunctions v0.3.8
INFO: Installing StaticArrays v0.7.0
INFO: Installing StatsBase v0.20.1
INFO: Installing StatsFuns v0.5.0
INFO: Installing URIParser v0.3.1
INFO: Installing WoodburyMatrices v0.2.2
INFO: Building SpecialFunctions
INFO: Building Rmath
INFO: Building NLopt
Installing dependency libnlopt0 via `sudo apt-get install libnlopt0`:
Reading package lists...
Building dependency tree...
Reading state information...
The following NEW packages will be installed:
  libnlopt0
0 upgraded, 1 newly installed, 0 to remove and 0 not upgraded.
Need to get 161 kB of archives.
After this operation, 468 kB of additional disk space will be used.
Get:1 http://archive.ubuntu.com/ubuntu/ trusty/universe libnlopt0 amd64 2.4.1+dfsg-1ubuntu1 [161 kB]
dpkg-preconfigure: unable to re-open stdin: No such file or directory
Fetched 161 kB in 0s (366 kB/s)
Selecting previously unselected package libnlopt0:amd64.
(Reading database ... 73869 files and directories currently installed.)
Preparing to unpack .../libnlopt0_2.4.1+dfsg-1ubuntu1_amd64.deb ...
Unpacking libnlopt0:amd64 (2.4.1+dfsg-1ubuntu1) ...
Setting up libnlopt0:amd64 (2.4.1+dfsg-1ubuntu1) ...
Processing triggers for libc-bin (2.19-0ubuntu6.14) ...
INFO: Package database updated

>>> 'Pkg.test("PhyloNetworks")' log
Julia Version 0.6.2
Commit d386e40c17 (2017-12-13 18:08 UTC)
Platform Info:
  OS: Linux (x86_64-pc-linux-gnu)
  CPU: Intel(R) Xeon(R) CPU E3-1241 v3 @ 3.50GHz
  WORD_SIZE: 64
           Ubuntu 14.04.5 LTS
  uname: Linux 3.13.0-143-generic #192-Ubuntu SMP Tue Feb 27 10:45:36 UTC 2018 x86_64 x86_64
Memory: 2.939197540283203 GB (1073.92578125 MB free)
Uptime: 12738.0 sec
Load Avg:  0.9208984375  0.89453125  0.8701171875
Intel(R) Xeon(R) CPU E3-1241 v3 @ 3.50GHz: 
       speed         user         nice          sys         idle          irq
#1  3503 MHz     602799 s         83 s      53571 s     455609 s         15 s
#2  3503 MHz     186630 s         68 s      25610 s    1033032 s          0 s

  BLAS: libopenblas (USE64BITINT DYNAMIC_ARCH NO_AFFINITY Nehalem)
  LAPACK: libopenblas64_
  LIBM: libopenlibm
  LLVM: libLLVM-3.9.1 (ORCJIT, haswell)
Environment:
  TERM = vt100
  LD_LIBRARY_PATH = :/usr/local/lib/
  PATH = /usr/local/sbin:/usr/local/bin:/usr/sbin:/usr/bin:/sbin:/bin:/usr/games:/usr/local/games:/home/vagrant/julia/bin/
  JAVA_HOME = /usr/lib/jvm/java-8-openjdk-amd64
  HOME = /home/vagrant

Package Directory: /home/vagrant/.julia/v0.6
2 required packages:
 - JSON                          0.17.2
 - PhyloNetworks                 0.6.0
69 additional packages:
 - AxisAlgorithms                0.2.0
 - AxisArrays                    0.2.1
 - BinDeps                       0.8.7
 - Calculus                      0.2.2
 - CategoricalArrays             0.2.3
 - ColorTypes                    0.6.7
 - Colors                        0.8.2
 - Combinatorics                 0.6.0
 - CommonSubexpressions          0.1.0
 - Compat                        0.63.0
 - Compose                       0.5.5
 - Contour                       0.4.0
 - CoupledFields                 0.0.1
 - DataArrays                    0.6.2
 - DataFrames                    0.10.1
 - DataStructures                0.7.4
 - DiffEqDiffTools               0.4.0
 - DiffResults                   0.0.3
 - DiffRules                     0.0.4
 - Distances                     0.5.0
 - Distributions                 0.15.0
 - DualNumbers                   0.3.0
 - FileIO                        0.7.0
 - FixedPointNumbers             0.4.6
 - ForwardDiff                   0.7.4
 - GLM                           0.8.1
 - GZip                          0.3.0
 - Gadfly                        0.6.5
 - Hexagons                      0.1.0
 - Interpolations                0.7.3
 - IntervalSets                  0.2.0
 - IterTools                     0.2.1
 - Juno                          0.4.0
 - KernelDensity                 0.4.1
 - LineSearches                  3.2.5
 - Loess                         0.3.0
 - MacroTools                    0.4.0
 - MathProgBase                  0.7.0
 - Measures                      0.1.0
 - Media                         0.3.0
 - Missings                      0.2.8
 - NLSolversBase                 4.3.0
 - NLopt                         0.3.6
 - NaNMath                       0.3.1
 - NamedArrays                   0.7.0
 - NullableArrays                0.1.2
 - Nullables                     0.0.5
 - Nulls                         0.1.2
 - Optim                         0.14.0
 - PDMats                        0.8.0
 - Parameters                    0.8.1
 - Polynomials                   0.2.2
 - PositiveFactorizations        0.1.0
 - QuadGK                        0.2.1
 - RCall                         0.8.1
 - RangeArrays                   0.2.0
 - Ratios                        0.2.0
 - Reexport                      0.1.0
 - Rmath                         0.3.2
 - SHA                           0.5.6
 - ShowItLikeYouBuildIt          0.2.0
 - Showoff                       0.1.1
 - SortingAlgorithms             0.2.0
 - SpecialFunctions              0.3.8
 - StaticArrays                  0.7.0
 - StatsBase                     0.20.1
 - StatsFuns                     0.5.0
 - URIParser                     0.3.1
 - WoodburyMatrices              0.2.2
INFO: Testing PhyloNetworks
WARNING: could not import Juno.Hiccup into Gadfly
WARNING: Method definition promote_rule(Type{T}, Type{Any}) in module Nulls at /home/vagrant/.julia/v0.6/Nulls/src/Nulls.jl:29 overwritten in module Missings at /home/vagrant/.julia/v0.6/Missings/src/Missings.jl:52.
WARNING: Method definition ==(Base.Nullable{S}, Base.Nullable{T}) in module Base at nullable.jl:238 overwritten in module NullableArrays at /home/vagrant/.julia/v0.6/NullableArrays/src/operators.jl:99.
WARNING: Method definition ==(Base.Nullable{S}, Base.Nullable{T}) in module Base at nullable.jl:238 overwritten in module NullableArrays at /home/vagrant/.julia/v0.6/NullableArrays/src/operators.jl:99.
INFO: Using R installation at /usr/lib/R
WARNING: Method definition promote_rule(Type{T}, Type{Any}) in module Missings at /home/vagrant/.julia/v0.6/Missings/src/Missings.jl:52 overwritten in module Nulls at /home/vagrant/.julia/v0.6/Nulls/src/Nulls.jl:29.
WARNING: Method definition ==(Base.Nullable{S}, Base.Nullable{T}) in module Base at nullable.jl:238 overwritten in module NullableArrays at /home/vagrant/.julia/v0.6/NullableArrays/src/operators.jl:99.
WARNING: Method definition promote_rule(Type{T}, Type{Any}) in module Missings at /home/vagrant/.julia/v0.6/Missings/src/Missings.jl:52 overwritten in module Nulls at /home/vagrant/.julia/v0.6/Nulls/src/Nulls.jl:29.
WARNING: Method definition ==(Base.Nullable{S}, Base.Nullable{T}) in module Base at nullable.jl:238 overwritten in module NullableArrays at /home/vagrant/.julia/v0.6/NullableArrays/src/operators.jl:99.
WARNING: PhyloNetworks.CHECKNET is true: will slow snaq! down.
PhyloNetworks.CHECKNET = true
INFO: starting test_5taxon_readTopology.jl
running F
hybrid edges for hybrid node 3 have missing gamma's, set default: 0.9,0.1
running G
hybrid edges for hybrid node 5 have missing gamma's, set default: 0.9,0.1
running H
hybrid edges for hybrid node 3 have missing gamma's, set default: 0.9,0.1
running J
hybrid edges for hybrid node 2 have missing gamma's, set default: 0.9,0.1
running I
hybrid edges for hybrid node 3 have missing gamma's, set default: 0.9,0.1
	[1m[32mPASSED[0m: test_5taxon_readTopology.jl
INFO: starting test_calculateExpCF.jl
------ Case G ----------
hybrid edges for hybrid node 5 have missing gamma's, set default: 0.9,0.1
------ Case F Bad diamond I ----------
------ Case I Bad diamond II ----------
hybrid edges for hybrid node 3 have missing gamma's, set default: 0.9,0.1
	[1m[32mPASSED[0m: test_calculateExpCF.jl
INFO: starting test_calculateExpCF2.jl
hybrid edges for hybrid node 5 have missing gamma's, set default: 0.9,0.1
	[1m[32mPASSED[0m: test_calculateExpCF2.jl
INFO: starting test_hasEdge.jl
----- Case G ------
hybrid edges for hybrid node 5 have missing gamma's, set default: 0.9,0.1
----- Case F: bad diamond ------
----- Case I: bad diamondII ------
hybrid edges for hybrid node 3 have missing gamma's, set default: 0.9,0.1
	[1m[32mPASSED[0m: test_hasEdge.jl
INFO: starting test_parameters.jl
running F
hybrid edges for hybrid node 3 have missing gamma's, set default: 0.9,0.1
---- Case F
[0.1, 0.163142, 0.0632121]
[8, 31, 32]
running G
hybrid edges for hybrid node 5 have missing gamma's, set default: 0.9,0.1
---- Case G
[0.1, 0.2, 0.1, 1.0]
[7, 3, 6, 9]
running H
hybrid edges for hybrid node 3 have missing gamma's, set default: 0.9,0.1
---- Case H
[0.1, 1.0, 1.0, 1.0]
[4, 3, 5, 7]
running J
hybrid edges for hybrid node 2 have missing gamma's, set default: 0.9,0.1
---- Case J
[0.1, 1.0, 1.0, 1.0]
[8, 4, 6, 10]
running I
hybrid edges for hybrid node 3 have missing gamma's, set default: 0.9,0.1
---- Case I
[0.1, 2.0, 1.0, 1.0, 1.0]
[9, 4, 6, 9, 10]
	[1m[32mPASSED[0m: test_parameters.jl
INFO: starting test_correctLik.jl
passed tree example
passed optTopRun1! on tree
hybrid edges for hybrid node 5 have missing gamma's, set default: 0.9,0.1
passed computation of likelihood
passed estimation of net
optimization of topology, BL and inheritance probabilities using:
 hmax = 1,
 tolerance parameters: ftolRel=0.01, ftolAbs=0.01,
                       xtolAbs=0.01, xtolRel=0.01.
 max number of failed proposals = 10, liktolAbs = 1.0e-6.
rootname for files: snaq
BEGIN: 2 runs on starting tree (6,4,((7)11#H1:::0.9,((11#H1:::0.1,8):1.0,10):0.1):0.2);
2018-04-03 3:37:28.218
seed: 1234 for run 1, 2018-04-03 3:37:33.994
seed: 59084 for run 2, 2018-04-03 3:37:36.129
elapsed time: 5.294652011 seconds
best network and networks with different hybrid/gene flow directions printed to .networks file

MaxNet is ((10,((8,7):0.0)11#H1:0.0::0.8774612464700255):1.3946505134583596,4,(11#H1:4.2643850360986955::0.12253875352997447,6):0.0); 
with -loglik 0.1790506853703442
WARNING: Method definition promote_rule(Type{T}, Type{Any}) in module Missings at /home/vagrant/.julia/v0.6/Missings/src/Missings.jl:52 overwritten in module Nulls at /home/vagrant/.julia/v0.6/Nulls/src/Nulls.jl:29.
WARNING: Method definition ==(Base.Nullable{S}, Base.Nullable{T}) in module Base at nullable.jl:238 overwritten in module NullableArrays at /home/vagrant/.julia/v0.6/NullableArrays/src/operators.jl:99.
optimization of topology, BL and inheritance probabilities using:
 hmax = 1,
 tolerance parameters: ftolRel=0.01, ftolAbs=0.01,
                       xtolAbs=0.01, xtolRel=0.01.
 max number of failed proposals = 10, liktolAbs = 1.0e-6.
rootname for files: snaq
BEGIN: 2 runs on starting tree (6,4,((7)11#H1:::0.9,((11#H1:::0.1,8):1.0,10):0.1):0.2);
       using 2 processors
2018-04-03 3:38:2.65
	From worker 2:	seed: 1234 for run 1, 2018-04-03 3:38:8.823
	From worker 2:	seed: 59084 for run 2, 2018-04-03 3:38:22.484
elapsed time: 21.12855186 seconds
best network and networks with different hybrid/gene flow directions printed to .networks file

MaxNet is ((10,((8,7):0.0)11#H1:0.0::0.8774612464700255):1.3946505134583596,4,(11#H1:4.2643850360986955::0.12253875352997447,6):0.0); 
with -loglik 0.1790506853703442
snaq! in serial and in parallel: Error During Test
  Got an exception of type MethodError outside of a @test
  MethodError: all(::Base.Distributed.##75#78, ::Array{Any,1}) is ambiguous. Candidates:
    all(f, A::AbstractArray{#s3,N} where N where #s3>:Nulls.Null) in Nulls at /home/vagrant/.julia/v0.6/Nulls/src/Nulls.jl:221
    all(f, A::AbstractArray{#s18,N} where N where #s18>:Missings.Missing) in Missings at /home/vagrant/.julia/v0.6/Missings/src/Missings.jl:190
  Possible fix, define
    all(::Any, ::AbstractArray{#s18,N} where N where #s18>:Union{Missings.Missing, Nulls.Null})
  Stacktrace:
   [1] _rmprocs(::Array{Int64,1}, ::Int64) at ./distributed/cluster.jl:800
   [2] #rmprocs#70(::Int64, ::Function, ::Array{Int64,1}, ::Vararg{Array{Int64,1},N} where N) at ./distributed/cluster.jl:775
   [3] macro expansion at /home/vagrant/.julia/v0.6/PhyloNetworks/test/test_correctLik.jl:76 [inlined]
   [4] macro expansion at ./test.jl:860 [inlined]
   [5] anonymous at ./<missing>:?
   [6] include_from_node1(::String) at ./loading.jl:576
   [7] include(::String) at ./sysimg.jl:14
   [8] macro expansion at /home/vagrant/.julia/v0.6/PhyloNetworks/test/runtests.jl:91 [inlined]
   [9] anonymous at ./<missing>:?
   [10] include_from_node1(::String) at ./loading.jl:576
   [11] include(::String) at ./sysimg.jl:14
   [12] process_options(::Base.JLOptions) at ./client.jl:305
   [13] _start() at ./client.jl:371
Test Summary:                   | Error  Total
snaq! in serial and in parallel |     1      1
	[1m[31mFAILED[0m: test_correctLik.jl
INFO: starting test_partition.jl
(3,(4,(5,(((6,(7,#H11:::0.2227763931131359):0.5081880994066508):1.0,((8,(9)#H11:::0.7772236068868641):1.0,10):1.0):0.9561820134835957,#H13:0.0::0.28555825607592755):0.04381798651640434):1.0):1.0,((1,2):0.011459257289162528)#H13:0.9885407427108375::0.7144417439240724);
	[1m[32mPASSED[0m: test_partition.jl
INFO: starting test_partition2.jl
	[1m[32mPASSED[0m: test_partition2.jl
INFO: starting test_deleteHybridizationUpdate.jl
starting first hybridization
(1:1.0,2:1.0,(3:1.0,(4:1.0,(5:1.0,((6:1.0,(7:0.4918119005933492,#H11:0.0::0.2227763931131359):0.5081880994066508):1.0,((8:1.0,(9:0.7497438380865815)#H11:0.2502561619134185::0.7772236068868641):1.0,10:1.0):1.0):1.0):1.0):1.0):1.0);
starting second hybridization
(3,(4,(5,(((6,(7,#H11:::0.2227763931131359):0.5081880994066508):1.0,((8,(9)#H11:::0.7772236068868641):1.0,10):1.0):0.9561820134835957,#H13:0.0::0.28555825607592755):0.04381798651640434):1.0):1.0,((1,2):0.011459257289162528)#H13:0.9885407427108375::0.7144417439240724);
starting deletion of second hybridization
(1:1.0,2:1.0,(3:1.0,(4:1.0,(5:1.0,((6:1.0,(7:0.4918119005933492,#H11:0.0::0.2227763931131359):0.5081880994066508):1.0,((8:1.0,(9:0.7497438380865815)#H11:0.2502561619134185::0.7772236068868641):1.0,10:1.0):1.0):1.0):1.0):1.0):1.0);
starting deletion of first hybridization
	[1m[32mPASSED[0m: test_deleteHybridizationUpdate.jl
INFO: starting test_add2hyb.jl
hybrid edges for hybrid node 3 have missing gamma's, set default: 0.9,0.1
	[1m[32mPASSED[0m: test_add2hyb.jl
INFO: starting test_optBLparts.jl
--------- Case G --------------
hybrid edges for hybrid node 5 have missing gamma's, set default: 0.9,0.1
WARNING: imported binding for error overwritten in module Main
x is [0.3, 1.0, 1.5, 2.0] all changed-----------
x is [0.1, 0.2, 0.1, 2.0] changing t9 only-----------
x is [0.3, 0.2, 0.1, 2.0] changing gamma and t9 only-----------
---- calculate expCF for [0.3, 0.2, 0.1, 2.0]
--------- Case F Bad Diamond I --------------
x is [0.4, 0.2, 0.1] all changed-----------
x is [0.1, 0.2, 0.1] changing gammaz1, gammaz2 only-----------
---- calculate expCF for [0.3, 0.2, 0.1]
--------- Case I Bad Diamond II --------------
hybrid edges for hybrid node 3 have missing gamma's, set default: 0.9,0.1
x is [0.2, 0.2, 0.1, 0.1, 0.1] all changed-----------
x is [0.1, 0.2, 1.0, 1.0, 1.0] changing t3 only-----------
---- calculate expCF for [0.2, 0.2, 0.1, 0.1, 0.1]
	[1m[32mPASSED[0m: test_optBLparts.jl
INFO: starting test_undirectedOtherNetworks.jl
	[1m[32mPASSED[0m: test_undirectedOtherNetworks.jl
INFO: starting test_orderings_plot.jl
Testing directEdges! and re-rootings on a tree, then on a network with h=2
INFO: node 6 is a leaf. Will create a new node if needed, to set taxon "M" as outgroup.
RootMismatch: non-leaf node 5 had 0 children.
Could be a hybrid whose parents' direction conflicts with the root.
isChild1 and containRoot were updated for a subset of edges in the network only.
Reverting to old root position.
the rootmismatch about node 5 is good and expected.
INFO: node 1 is a leaf. Will create a new node if needed, to set taxon "Ag" as outgroup.
INFO: node 1 is a leaf. Will create a new node if needed, to set taxon "Ag" as outgroup.
INFO: node 10 is a leaf. Will create a new node if needed, to set taxon "Ap" as outgroup.
RootMismatch: non-leaf node 9 had 0 children.
Could be a hybrid whose parents' direction conflicts with the root.
isChild1 and containRoot were updated for a subset of edges in the network only.
Reverting to old root position.
RootMismatch: direction (isChild1) of hybrid edge 17 conflicts with the root.
isChild1 and containRoot were updated for a subset of edges in the network only.
Reverting to old root position.
INFO: node 12 is a leaf. Will create a new node if needed, to set taxon "10" as outgroup.
Testing preorder! on a tree, then on a network with h=2
Testing cladewiseorder! on a tree, then on a network with h=2
Testing plot() on a tree, then on a network with h=2 and various options
At least one non-missing edge length: plotting any NA length as 1.0
(A message is normal here: about missing BL being given length 1.0)
Testing rotate! to change the order of children edges at a given node
	[1m[32mPASSED[0m: test_orderings_plot.jl
INFO: starting test_compareNetworks.jl
Testing deleteHybridEdge!
Testing deleteleaf! (also uses hardwiredClusterDistance and plot)
INFO: node 13 is a leaf. Will create a new node if needed, to set taxon "Xmayae" as outgroup.
INFO: node 13 is a leaf. Will create a new node if needed, to set taxon "Xmayae" as outgroup.
Testing deleteHybridThreshold!
Testing displayedNetworks! and displayedTrees
Testing majorTree and displayedNetworkAt!
Testing tree2Matrix
Testing displayedTrees, hardwiredClusters, hardwiredClusterDistance, displayedNetworkAt!
Testing hardwiredCluster! on single nodes
	[1m[32mPASSED[0m: test_compareNetworks.jl
INFO: starting test_badDiamII.jl
hybrid edges for hybrid node 3 have missing gamma's, set default: 0.9,0.1
	[1m[32mPASSED[0m: test_badDiamII.jl
INFO: starting test_multipleAlleles.jl
INFO: testing sorttaxa!
hybrid edges for hybrid node 3 have missing gamma's, set default: 0.9,0.1
WARNING: net does not have identifiable branch lengths
WARNING: net does not have identifiable branch lengths
WARNING: net does not have identifiable branch lengths
WARNING: net does not have identifiable branch lengths
these 4 warnings are normal: only 4 taxa in network
INFO: testing snaq on multiple alleles
optimization of topology, BL and inheritance probabilities using:
 hmax = 1,
 tolerance parameters: ftolRel=1.0e-6, ftolAbs=1.0e-6,
                       xtolAbs=0.001, xtolRel=0.01.
 max number of failed proposals = 10, liktolAbs = 1.0e-6.
no output files
BEGIN: 1 runs on starting tree ((6,4):0.24875052048637442,((7,7__2):1.0,8):0.0,10);
2018-04-03 3:38:43.065

main seed 1010
seed: 1010 for run 1, 2018-04-03 3:38:43.096
elapsed time: 3.809976229 seconds

MaxNet is ((6,4):0.15250512379899847,(8,(7:0.0,#H7:::0.20106297389811878):0.3246257197485691):0.026752801390547233,(10)#H7:::0.7989370261018812); 
with -loglik 185.27196183960217
((6,4):0.15250512379899847,(8,(7:0.0,#H7:::0.20106297389811878):0.3246257197485691):0.026752801390547233,(10)#H7:::0.7989370261018812); -Ploglik = 185.27196183960217
 Dendroscope: ((6,4):0.15250512379899847,(8,(7:0.0,#H7):0.3246257197485691):0.026752801390547233,(10)#H7);
 Elapsed time: 3.809976229 seconds, 1 attempted runs
-------
List of estimated networks for all runs (sorted by log-pseudolik; the smaller, the better):
 ((6,4):0.15250512379899847,(8,(7:0.0,#H7:::0.20106297389811878):0.3246257197485691):0.026752801390547233,(10)#H7:::0.7989370261018812);, with -loglik 185.27196183960217
-------
optimization of topology, BL and inheritance probabilities using:
 hmax = 1,
 tolerance parameters: ftolRel=1.0e-5, ftolAbs=1.0e-6,
                       xtolAbs=0.0001, xtolRel=0.001.
 max number of failed proposals = 10, liktolAbs = 1.0e-6.
no output files
BEGIN: 1 runs on starting tree ((6,4):0.24875052048637442,((7,7__2):1.0,8):0.0,10);
2018-04-03 3:38:46.885

main seed 8378
seed: 8378 for run 1, 2018-04-03 3:38:46.886
elapsed time: 7.423259744 seconds

MaxNet is ((4,#H7:8.823380618161638::0.4741211491050883):0.6359974199358205,(8,(7:0.0,(6)#H7:0.025196259194903182::0.5258788508949117):0.3635586091987906):0.094633959903954,10); 
with -loglik 174.5867479682584
((4,#H7:8.823380618161638::0.4741211491050883):0.6359974199358205,(8,(7:0.0,(6)#H7:0.025196259194903182::0.5258788508949117):0.3635586091987906):0.094633959903954,10); -Ploglik = 174.5867479682584
 Dendroscope: ((4,#H7:8.823380618161638):0.6359974199358205,(8,(7:0.0,(6)#H7:0.025196259194903182):0.3635586091987906):0.094633959903954,10);
 Elapsed time: 7.423259744 seconds, 1 attempted runs
-------
List of estimated networks for all runs (sorted by log-pseudolik; the smaller, the better):
 ((4,#H7:8.823380618161638::0.4741211491050883):0.6359974199358205,(8,(7:0.0,(6)#H7:0.025196259194903182::0.5258788508949117):0.3635586091987906):0.094633959903954,10);, with -loglik 174.5867479682584
-------
hybrid edges for hybrid node 2 have missing gamma's, set default: 0.9,0.1
	[1m[32mPASSED[0m: test_multipleAlleles.jl
INFO: starting test_bootstrap.jl
INFO: testing hybridBootstrapSupport
INFO: testing bootsnaq from quartet CF intervals
BOOTSTRAP OF SNAQ ESTIMATION
main seed 1234

begin replicate 1
bootstrap data simulation: seed 59084
estimation, 1 run: seed 56623
optimization of topology, BL and inheritance probabilities using:
 hmax = 1,
 tolerance parameters: ftolRel=0.001, ftolAbs=0.001,
                       xtolAbs=0.0001, xtolRel=0.001.
 max number of failed proposals = 2, liktolAbs = 0.01.
no output files
BEGIN: 1 runs on starting tree (2,3,(4,(5,(1,6):0.386):1.19):0.028);
2018-04-03 3:39:0.981

main seed 56623
seed: 56623 for run 1, 2018-04-03 3:39:0.982
elapsed time: 4.707008246 seconds

MaxNet is (4,(((6,#H7:0.0::0.2224209040543935):10.0,2):0.0,((5,1):0.0)#H7:0.0::0.7775790959456065):0.0,3); 
with -loglik 283.51281867356363
(4,(((6,#H7:0.0::0.2224209040543935):10.0,2):0.0,((5,1):0.0)#H7:0.0::0.7775790959456065):0.0,3); -Ploglik = 283.51281867356363
 Dendroscope: (4,(((6,#H7:0.0):10.0,2):0.0,((5,1):0.0)#H7:0.0):0.0,3);
 Elapsed time: 4.707008246 seconds, 1 attempted runs
-------
List of estimated networks for all runs (sorted by log-pseudolik; the smaller, the better):
 (4,(((6,#H7:0.0::0.2224209040543935):10.0,2):0.0,((5,1):0.0)#H7:0.0::0.7775790959456065):0.0,3);, with -loglik 283.51281867356363
-------
(4,(((6,#H7:0.0::0.2224209040543935):10.0,2):0.0,((5,1):0.0)#H7:0.0::0.7775790959456065):0.0,3);

begin replicate 2
bootstrap data simulation: seed 76679
estimation, 1 run: seed 46008
optimization of topology, BL and inheritance probabilities using:
 hmax = 1,
 tolerance parameters: ftolRel=0.001, ftolAbs=0.001,
                       xtolAbs=0.0001, xtolRel=0.001.
 max number of failed proposals = 2, liktolAbs = 0.01.
no output files
BEGIN: 1 runs on starting tree (2,3,(4,(5,(1,6):0.386):1.19):0.028);
2018-04-03 3:39:5.696

main seed 46008
seed: 46008 for run 1, 2018-04-03 3:39:5.698
elapsed time: 0.787707008 seconds

MaxNet is (2,3,((4,5):0.0,(1,6):0.010770363740354224):0.0); 
with -loglik 339.9998274427395
(2,3,((4,5):0.0,(1,6):0.010770363740354224):0.0); -Ploglik = 339.9998274427395
 Dendroscope: (2,3,((4,5):0.0,(1,6):0.010770363740354224):0.0);
 Elapsed time: 0.787707008 seconds, 1 attempted runs
-------
List of estimated networks for all runs (sorted by log-pseudolik; the smaller, the better):
 (2,3,((4,5):0.0,(1,6):0.010770363740354224):0.0);, with -loglik 339.9998274427395
-------
(2,3,((4,5):0.0,(1,6):0.010770363740354224):0.0);
WARNING: Method definition promote_rule(Type{T}, Type{Any}) in module Missings at /home/vagrant/.julia/v0.6/Missings/src/Missings.jl:52 overwritten in module Nulls at /home/vagrant/.julia/v0.6/Nulls/src/Nulls.jl:29.
WARNING: Method definition ==(Base.Nullable{S}, Base.Nullable{T}) in module Base at nullable.jl:238 overwritten in module NullableArrays at /home/vagrant/.julia/v0.6/NullableArrays/src/operators.jl:99.
BOOTSTRAP OF SNAQ ESTIMATION
Will use this network as starting topology for 1 run(s) for each bootstrap replicate:
(2:0.632,3:0.632,(4:0.66,(5:1.85,(1:2.236,6:3.5):0.386):1.19):0.028);
and this other network for 1 run(s):
(5:1.0,(((2:1.0,(1:1.0)#H7:1.0::0.7143969494428192):1.5121337017411736,4:1.0):0.4894187322508883,3:1.0):0.519160762355313,(6:1.0,#H7:1.0::0.2856030505571808):10.0);
will use all quartets on 6 taxa
calculating obsCF from 13 gene trees and for 15 quartets
Reading in quartets...
0+---------------+100%  
  ***************  
main seed 1234

begin replicate 1
bootstrap data simulation: seed 59084
calculating obsCF from 13 gene trees and for 15 quartets
Reading in quartets...
0+---------------+100%  
  ***************  
estimation, 1 run: seed 56623
optimization of topology, BL and inheritance probabilities using:
 hmax = 1,
 tolerance parameters: ftolRel=0.001, ftolAbs=0.001,
                       xtolAbs=0.001, xtolRel=0.01.
 max number of failed proposals = 2, liktolAbs = 1.0e-6.
no output files
BEGIN: 1 runs on starting tree (2,3,(4,(5,(1,6):0.386):1.19):0.028);
       using 2 processors
2018-04-03 3:39:29.098

main seed 56623
	From worker 3:	seed: 56623 for run 1, 2018-04-03 3:39:34.587
elapsed time: 18.366741703 seconds

MaxNet is (((2,((5,#H7:::0.22915935833912088):1.998593370452202,6):1.0762696531287907):0.0,1):0.09533104243453193,4,(3)#H7:::0.7708406416608791); 
with -loglik 237.06689282738034
(((2,((5,#H7:::0.22915935833912088):1.998593370452202,6):1.0762696531287907):0.0,1):0.09533104243453193,4,(3)#H7:::0.7708406416608791); -Ploglik = 237.06689282738034
 Dendroscope: (((2,((5,#H7):1.998593370452202,6):1.0762696531287907):0.0,1):0.09533104243453193,4,(3)#H7);
 Elapsed time: 18.366741703 seconds, 1 attempted runs
-------
List of estimated networks for all runs (sorted by log-pseudolik; the smaller, the better):
 (((2,((5,#H7:::0.22915935833912088):1.998593370452202,6):1.0762696531287907):0.0,1):0.09533104243453193,4,(3)#H7:::0.7708406416608791);, with -loglik 237.06689282738034
-------
estimation, 1 run starting from other net: seed 79402
optimization of topology, BL and inheritance probabilities using:
 hmax = 1,
 tolerance parameters: ftolRel=0.001, ftolAbs=0.001,
                       xtolAbs=0.001, xtolRel=0.01.
 max number of failed proposals = 2, liktolAbs = 1.0e-6.
no output files
BEGIN: 1 runs on starting tree (5,(((2,(1)#H7:::0.7143969494428192):1.5121337017411736,4):0.4894187322508883,3):0.519160762355313,(6,#H7:::0.2856030505571808):10.0);
       using 2 processors
2018-04-03 3:39:47.471

main seed 79402
	From worker 3:	seed: 79402 for run 1, 2018-04-03 3:39:47.488
elapsed time: 4.722981771 seconds

MaxNet is ((((2,(1)#H7:::0.5971820307722733):10.0,4):0.4071615874980453,(6,#H7:::0.4028179692277267):0.30655056997464686):0.0,3,5); 
with -loglik 225.6062247902678
((((2,(1)#H7:::0.5971820307722733):10.0,4):0.4071615874980453,(6,#H7:::0.4028179692277267):0.30655056997464686):0.0,3,5); -Ploglik = 225.6062247902678
 Dendroscope: ((((2,(1)#H7):10.0,4):0.4071615874980453,(6,#H7):0.30655056997464686):0.0,3,5);
 Elapsed time: 4.722981771 seconds, 1 attempted runs
-------
List of estimated networks for all runs (sorted by log-pseudolik; the smaller, the better):
 ((((2,(1)#H7:::0.5971820307722733):10.0,4):0.4071615874980453,(6,#H7:::0.4028179692277267):0.30655056997464686):0.0,3,5);, with -loglik 225.6062247902678
-------
((((2,(1)#H7:::0.5971820307722733):10.0,4):0.4071615874980453,(6,#H7:::0.4028179692277267):0.30655056997464686):0.0,3,5);

begin replicate 2
bootstrap data simulation: seed 76679
calculating obsCF from 13 gene trees and for 15 quartets
Reading in quartets...
0+---------------+100%  
  ***************  
estimation, 1 run: seed 46008
optimization of topology, BL and inheritance probabilities using:
 hmax = 1,
 tolerance parameters: ftolRel=0.001, ftolAbs=0.001,
                       xtolAbs=0.001, xtolRel=0.01.
 max number of failed proposals = 2, liktolAbs = 1.0e-6.
no output files
BEGIN: 1 runs on starting tree (2,3,(4,(5,(1,6):0.386):1.19):0.028);
       using 2 processors
2018-04-03 3:39:52.207

main seed 46008
	From worker 3:	seed: 46008 for run 1, 2018-04-03 3:39:52.218
elapsed time: 0.770006846 seconds

MaxNet is (2,3,(((1,6):0.0,4):0.0,5):0.0); 
with -loglik 797.0223988553574
(2,3,(((1,6):0.0,4):0.0,5):0.0); -Ploglik = 797.0223988553574
 Dendroscope: (2,3,(((1,6):0.0,4):0.0,5):0.0);
 Elapsed time: 0.770006846 seconds, 1 attempted runs
-------
List of estimated networks for all runs (sorted by log-pseudolik; the smaller, the better):
 (2,3,(((1,6):0.0,4):0.0,5):0.0);, with -loglik 797.0223988553574
-------
estimation, 1 run starting from other net: seed 85414
optimization of topology, BL and inheritance probabilities using:
 hmax = 1,
 tolerance parameters: ftolRel=0.001, ftolAbs=0.001,
                       xtolAbs=0.001, xtolRel=0.01.
 max number of failed proposals = 2, liktolAbs = 1.0e-6.
no output files
BEGIN: 1 runs on starting tree (5,(((2,(1)#H7:::0.7143969494428192):1.5121337017411736,4):0.4894187322508883,3):0.519160762355313,(6,#H7:::0.2856030505571808):10.0);
       using 2 processors
2018-04-03 3:39:52.982

main seed 85414
	From worker 3:	seed: 85414 for run 1, 2018-04-03 3:39:52.99
elapsed time: 2.378863254 seconds

MaxNet is (5,(((2,(1)#H7:::0.6914719585449685):2.880560394921559,4):1.4442607966957255,3):7.65805120771595e-6,(6,#H7:::0.3085280414550315):0.19839352937373064); 
with -loglik 270.2579018970267
(5,(((2,(1)#H7:::0.6914719585449685):2.880560394921559,4):1.4442607966957255,3):7.65805120771595e-6,(6,#H7:::0.3085280414550315):0.19839352937373064); -Ploglik = 270.2579018970267
 Dendroscope: (5,(((2,(1)#H7):2.880560394921559,4):1.4442607966957255,3):7.65805120771595e-6,(6,#H7):0.19839352937373064);
 Elapsed time: 2.378863254 seconds, 1 attempted runs
-------
List of estimated networks for all runs (sorted by log-pseudolik; the smaller, the better):
 (5,(((2,(1)#H7:::0.6914719585449685):2.880560394921559,4):1.4442607966957255,3):7.65805120771595e-6,(6,#H7:::0.3085280414550315):0.19839352937373064);, with -loglik 270.2579018970267
-------
(5,(((2,(1)#H7:::0.6914719585449685):2.880560394921559,4):1.4442607966957255,3):7.65805120771595e-6,(6,#H7:::0.3085280414550315):0.19839352937373064);
bootsnaq from bootstrap gene trees, multiple procs: Error During Test
  Got an exception of type MethodError outside of a @test
  MethodError: all(::Base.Distributed.##75#78, ::Array{Any,1}) is ambiguous. Candidates:
    all(f, A::AbstractArray{#s3,N} where N where #s3>:Nulls.Null) in Nulls at /home/vagrant/.julia/v0.6/Nulls/src/Nulls.jl:221
    all(f, A::AbstractArray{#s18,N} where N where #s18>:Missings.Missing) in Missings at /home/vagrant/.julia/v0.6/Missings/src/Missings.jl:190
  Possible fix, define
    all(::Any, ::AbstractArray{#s18,N} where N where #s18>:Union{Missings.Missing, Nulls.Null})
  Stacktrace:
   [1] _rmprocs(::Array{Int64,1}, ::Int64) at ./distributed/cluster.jl:800
   [2] #rmprocs#70(::Int64, ::Function, ::Array{Int64,1}, ::Vararg{Array{Int64,1},N} where N) at ./distributed/cluster.jl:775
   [3] macro expansion at /home/vagrant/.julia/v0.6/PhyloNetworks/test/test_bootstrap.jl:68 [inlined]
   [4] macro expansion at ./test.jl:860 [inlined]
   [5] anonymous at ./<missing>:?
   [6] include_from_node1(::String) at ./loading.jl:576
   [7] include(::String) at ./sysimg.jl:14
   [8] macro expansion at /home/vagrant/.julia/v0.6/PhyloNetworks/test/runtests.jl:91 [inlined]
   [9] anonymous at ./<missing>:?
   [10] include_from_node1(::String) at ./loading.jl:576
   [11] include(::String) at ./sysimg.jl:14
   [12] process_options(::Base.JLOptions) at ./client.jl:305
   [13] _start() at ./client.jl:371
Test Summary:                                      | Pass  Error  Total
bootsnaq from bootstrap gene trees, multiple procs |   13      1     14
	[1m[31mFAILED[0m: test_bootstrap.jl
INFO: starting test_perfectData.jl
hybrid edges for hybrid node 8 have missing gamma's, set default: 0.9,0.1
hybrid edges for hybrid node 15 have missing gamma's, set default: 0.9,0.1
hybrid edges for hybrid node 4 have missing gamma's, set default: 0.9,0.1
	[1m[32mPASSED[0m: test_perfectData.jl
INFO: starting test_lm.jl
WARNING: ccdf(d::UnivariateDistribution, X::AbstractArray) is deprecated, use ccdf.(d, X) instead.
Stacktrace:
 [1] depwarn(::String, ::Symbol) at ./deprecated.jl:70
 [2] ccdf(::Distributions.FDist{Float64}, ::Array{Float64,1}) at ./deprecated.jl:57
 [3] coeftable(::GLM.LinearModel{GLM.LmResp{Array{Float64,1}},GLM.DensePredChol{Float64,Base.LinAlg.Cholesky{Float64,Array{Float64,2}}}}) at /home/vagrant/.julia/v0.6/GLM/src/lm.jl:154
 [4] coeftable at /home/vagrant/.julia/v0.6/PhyloNetworks/src/traits.jl:1081 [inlined]
 [5] show(::Base.AbstractIOBuffer{Array{UInt8,1}}, ::PhyloNetworks.PhyloNetworkLinearModel) at /home/vagrant/.julia/v0.6/PhyloNetworks/src/traits.jl:1197
 [6] showall at ./show.jl:1719 [inlined]
 [7] repr(::PhyloNetworks.PhyloNetworkLinearModel) at ./strings/io.jl:146
 [8] include_from_node1(::String) at ./loading.jl:576
 [9] include(::String) at ./sysimg.jl:14
 [10] macro expansion at /home/vagrant/.julia/v0.6/PhyloNetworks/test/runtests.jl:91 [inlined]
 [11] anonymous at ./<missing>:?
 [12] include_from_node1(::String) at ./loading.jl:576
 [13] include(::String) at ./sysimg.jl:14
 [14] process_options(::Base.JLOptions) at ./client.jl:305
 [15] _start() at ./client.jl:371
while loading /home/vagrant/.julia/v0.6/PhyloNetworks/test/test_lm.jl, in expression starting on line 243
phynetlm = PhyloNetworks.PhyloNetworkLinearModel:

Parameter(s) Estimates:
Sigma2: 0.419632

Coefficients:
     Estimate Std.Error t value Pr(>|t|)
x1    10.1581  0.698781 14.5369   0.0007


WARNING: both StatsBase and Compat export "stderr"; uses of it in module DataFrames must be qualified
WARNING: both GLM and DataFrames export "stderr"; uses of it in module PhyloNetworks must be qualified
Error During Test
  Test threw an exception of type UndefVarError
  Expression: stderr(phynetlm) ≈ sqrt.(diag(((sigma2hat * ntaxa) / (ntaxa - length(betahat))) * inv(XtVyinv * X)))
  UndefVarError: stderr not defined
  Stacktrace:
   [1] stderr(::PhyloNetworks.PhyloNetworkLinearModel) at /home/vagrant/.julia/v0.6/PhyloNetworks/src/traits.jl:1073
   [2] include_from_node1(::String) at ./loading.jl:576
   [3] include(::String) at ./sysimg.jl:14
   [4] macro expansion at /home/vagrant/.julia/v0.6/PhyloNetworks/test/runtests.jl:91 [inlined]
   [5] anonymous at ./<missing>:?
   [6] include_from_node1(::String) at ./loading.jl:576
   [7] include(::String) at ./sysimg.jl:14
   [8] process_options(::Base.JLOptions) at ./client.jl:305
   [9] _start() at ./client.jl:371
	[1m[31mFAILED[0m: test_lm.jl
INFO: starting test_lm_tree.jl
Error During Test
  Test threw an exception of type UndefVarError
  Expression: ≈(stderr(fitBM), [0.3306272978], atol=1.0e-10)
  UndefVarError: stderr not defined
  Stacktrace:
   [1] #stderr#163(::Array{Any,1}, ::Function, ::DataFrames.DataFrameRegressionModel{PhyloNetworks.PhyloNetworkLinearModel,Array{Float64,2}}) at /home/vagrant/.julia/v0.6/DataFrames/src/statsmodels/statsmodel.jl:27
   [2] stderr(::DataFrames.DataFrameRegressionModel{PhyloNetworks.PhyloNetworkLinearModel,Array{Float64,2}}) at /home/vagrant/.julia/v0.6/DataFrames/src/statsmodels/statsmodel.jl:27
   [3] include_from_node1(::String) at ./loading.jl:576
   [4] include(::String) at ./sysimg.jl:14
   [5] macro expansion at /home/vagrant/.julia/v0.6/PhyloNetworks/test/runtests.jl:91 [inlined]
   [6] anonymous at ./<missing>:?
   [7] include_from_node1(::String) at ./loading.jl:576
   [8] include(::String) at ./sysimg.jl:14
   [9] process_options(::Base.JLOptions) at ./client.jl:305
   [10] _start() at ./client.jl:371
	[1m[31mFAILED[0m: test_lm_tree.jl
INFO: starting test_traits.jl
V1 = PhyloNetworks.MatrixTopologicalOrder:
[0.0 0.0 0.0 0.0 0.0 0.0 0.0 0.0 0.0; 0.0 0.5 0.5 0.5 0.5 0.5 0.5 0.5 0.0; 0.0 0.5 1.5 1.5 0.5 1.4 1.4 0.5 0.0; 0.0 0.5 1.5 2.5 0.5 1.4 1.4 0.5 0.0; 0.0 0.5 0.5 0.5 1.5 0.6 0.6 1.5 0.0; 0.0 0.5 1.4 1.4 0.6 2.14 2.14 0.6 0.0; 0.0 0.5 1.4 1.4 0.6 2.14 3.14 0.6 0.0; 0.0 0.5 0.5 0.5 1.5 0.6 0.6 2.5 0.0; 0.0 0.0 0.0 0.0 0.0 0.0 0.0 0.0 0.5]

	[1m[32mPASSED[0m: test_traits.jl
INFO: starting test_simulate.jl
pars = PhyloNetworks.ParamsBM:
Parameters of a BM with fixed root:
mu: 1
Sigma2: 0.1

sim = PhyloNetworks.TraitSimulation:
Trait simulation results on a network with 12 tips, using a BM model, with parameters:
mu: 1
Sigma2: 0.1

	[1m[32mPASSED[0m: test_simulate.jl
INFO: starting test_parsimony.jl
parsimony score: 1
node number => character states on tree (A,(B,(C,D)));
1 (A): [0]
2 (B): [0]
3 (C): [1]
4 (D): [1]
-4: [1]
-3: [0]
-2 (root): [0]
parsimony score: 1
node number => character states on tree (((A,B),C),D);
1 (A): [0]
2 (B): [0]
-4: [0]
4 (C): [1]
-3: [1]
5 (D): [1]
-2 (root): [1]
parsimony score: 2
node number => character states on tree (((A,B),C),D);
1 (A): [0]
2 (B): [1]
-4: [0]
4 (C): [0]
-3: [0]
5 (D): [1]
-2 (root): [0, 1]
node number => character states on tree (((C,B),A),D);
1 (A): [0]
2 (B): [1]
4 (C): [0]
-6: [0]
-3: [0]
5 (D): [1]
-2 (root): [0, 1]
parsimony score: 1
node number => character states on tree (((A,B),C),D);
2 (B): [0]
-4: [0]
4 (C): [1]
-3: [1]
5 (D): [1]
-2 (root): [1]
node number => character states on tree (((C,B),A),D);
2 (B): [0]
4 (C): [1]
-6: [1]
-3: [1]
5 (D): [1]
-2 (root): [1]
Test Summary:                            | Pass  Total
Testing parsimony score & reconstruction |    8      8
	[1m[32mPASSED[0m: test_parsimony.jl
INFO: starting test_plotsRCall.jl
INFO: checking RCall-based plots
At least one non-missing edge length: plotting any NA length as 1.0
(A message is normal here: about missing BL being given length 1.0)
WARNING: Some node numbers in the nodeLabel data frame are not found in the network:
 -1
	[1m[32mPASSED[0m: test_plotsRCall.jl
-------------------------------------
ERROR: LoadError: "Tests failed"
Stacktrace:
 [1] include_from_node1(::String) at ./loading.jl:576
 [2] include(::String) at ./sysimg.jl:14
 [3] process_options(::Base.JLOptions) at ./client.jl:305
 [4] _start() at ./client.jl:371
while loading /home/vagrant/.julia/v0.6/PhyloNetworks/test/runtests.jl, in expression starting on line 101
============================[ ERROR: PhyloNetworks ]============================

failed process: Process(`/home/vagrant/julia/bin/julia -Cx86-64 -J/home/vagrant/julia/lib/julia/sys.so --compile=yes --depwarn=yes --check-bounds=yes --code-coverage=none --color=no --compilecache=yes /home/vagrant/.julia/v0.6/PhyloNetworks/test/runtests.jl`, ProcessExited(1)) [1]

================================================================================
ERROR: PhyloNetworks had test errors

>>> End of log
