>>> 'Pkg.add("PotentialFlow")' log
INFO: Cloning cache of PotentialFlow from https://github.com/darwindarak/PotentialFlow.jl.git
INFO: Installing AxisAlgorithms v0.2.0
INFO: Installing CommonSubexpressions v0.1.0
INFO: Installing DiffResults v0.0.3
INFO: Installing DiffRules v0.0.6
INFO: Installing DocStringExtensions v0.4.5
INFO: Installing Documenter v0.19.1
INFO: Installing DualNumbers v0.4.0
INFO: Installing ForwardDiff v0.7.5
INFO: Installing Interpolations v0.7.3
INFO: Installing MappedArrays v0.0.7
INFO: Installing NaNMath v0.3.1
INFO: Installing PlotUtils v0.4.4
INFO: Installing PotentialFlow v0.0.2
INFO: Installing Ratios v0.2.0
INFO: Installing RecipesBase v0.3.1
INFO: Installing ShowItLikeYouBuildIt v0.2.0
INFO: Installing WoodburyMatrices v0.3.0
INFO: Building SpecialFunctions
INFO: Package database updated
INFO: METADATA is out-of-date — you may not have the latest version of PotentialFlow
INFO: Use `Pkg.update()` to get the latest versions of your packages

>>> 'Pkg.test("PotentialFlow")' log
Julia Version 0.6.4
Commit 9d11f62bcb (2018-07-09 19:09 UTC)
Platform Info:
  OS: Linux (x86_64-pc-linux-gnu)
  CPU: Intel(R) Xeon(R) CPU E3-1241 v3 @ 3.50GHz
  WORD_SIZE: 64
           Ubuntu 14.04.5 LTS
  uname: Linux 3.13.0-143-generic #192-Ubuntu SMP Tue Feb 27 10:45:36 UTC 2018 x86_64 x86_64
Memory: 2.939197540283203 GB (786.6484375 MB free)
Uptime: 17532.0 sec
Load Avg:  0.9970703125  0.99609375  0.9921875
Intel(R) Xeon(R) CPU E3-1241 v3 @ 3.50GHz: 
       speed         user         nice          sys         idle          irq
#1  3516 MHz     971958 s         56 s      76406 s     461748 s          4 s
#2  3516 MHz     197884 s         94 s      29035 s    1499917 s          0 s

  BLAS: libopenblas (USE64BITINT DYNAMIC_ARCH NO_AFFINITY Nehalem MAX_THREADS=16)
  LAPACK: libopenblas64_
  LIBM: libopenlibm
  LLVM: libLLVM-3.9.1 (ORCJIT, haswell)
Environment:
  TERM = vt100
  LD_LIBRARY_PATH = :/usr/local/lib/
  PATH = /usr/local/sbin:/usr/local/bin:/usr/sbin:/usr/bin:/sbin:/bin:/usr/games:/usr/local/games:/home/vagrant/julia/bin/
  JAVA_HOME = /usr/lib/jvm/java-8-openjdk-amd64
  HOME = /home/vagrant

Package Directory: /home/vagrant/.julia/v0.6
3 required packages:
 - JSON                          0.17.2
 - POMDPModels                   0.2.2
 - PotentialFlow                 0.0.2
71 additional packages:
 - AbstractTrees                 0.1.0
 - AssetRegistry                 0.0.2
 - AutoHashEquals                0.2.0
 - AxisAlgorithms                0.2.0
 - BinDeps                       0.8.8
 - BinaryProvider                0.3.3
 - Blink                         0.6.2
 - CPUTime                       0.1.0
 - Calculus                      0.4.0
 - CategoricalArrays             0.3.11
 - CodecZlib                     0.4.3
 - ColorTypes                    0.6.7
 - Colors                        0.8.2
 - CommonSubexpressions          0.1.0
 - Compat                        1.0.0
 - D3Trees                       0.2.0
 - DataFrames                    0.11.7
 - DataStreams                   0.3.6
 - DataStructures                0.8.4
 - DiffResults                   0.0.3
 - DiffRules                     0.0.6
 - DiscreteValueIteration        0.0.0-             master (unregistered)
 - Distributions                 0.15.0
 - DocStringExtensions           0.4.5
 - Documenter                    0.19.1
 - DualNumbers                   0.4.0
 - FixedPointNumbers             0.4.6
 - ForwardDiff                   0.7.5
 - Hiccup                        0.1.1
 - HttpCommon                    0.4.0
 - HttpParser                    0.4.0
 - HttpServer                    0.3.1
 - Interpolations                0.7.3
 - Iterators                     0.3.1
 - LaTeXStrings                  1.0.0
 - Lazy                          0.12.1
 - MCTS                          0.0.0-             master (unregistered)
 - MacroTools                    0.4.2
 - MappedArrays                  0.0.7
 - MbedTLS                       0.5.12
 - Missings                      0.2.10
 - Mustache                      0.3.3
 - Mux                           0.3.1
 - NaNMath                       0.3.1
 - NamedTuples                   4.0.2
 - Nullables                     0.0.6
 - PDMats                        0.8.0
 - POMDPToolbox                  0.2.7
 - POMDPs                        0.6.7
 - Pidfile                       1.0.0
 - PlotUtils                     0.4.4
 - ProgressMeter                 0.5.6
 - QuadGK                        0.3.0
 - Ratios                        0.2.0
 - RecipesBase                   0.3.1
 - Reexport                      0.1.0
 - Requires                      0.4.4
 - Rmath                         0.4.0
 - SHA                           0.5.7
 - ShowItLikeYouBuildIt          0.2.0
 - SortingAlgorithms             0.2.1
 - SpecialFunctions              0.6.0
 - StaticArrays                  0.7.2
 - StatsBase                     0.23.1
 - StatsFuns                     0.6.1
 - TikzPictures                  1.2.0
 - TranscodingStreams            0.5.3
 - URIParser                     0.3.1
 - WeakRefStrings                0.4.7
 - WebSockets                    0.5.0
 - WoodburyMatrices              0.3.0
INFO: Computing test dependencies for PotentialFlow...
INFO: Installing Contour v0.4.0
INFO: Installing DeepDiffs v1.1.0
INFO: Installing GR v0.31.0
INFO: Installing Measures v0.2.0
INFO: Installing NBInclude v2.0.0
INFO: Installing PlotThemes v0.2.0
INFO: Installing Plots v0.17.3
INFO: Installing Showoff v0.2.0
INFO: Installing TestSetExtensions v1.1.1
INFO: Building GR
INFO: Downloading pre-compiled GR 0.31.0 Ubuntu binary
  % Total    % Received % Xferd  Average Speed   Time    Time     Time  Current
                                 Dload  Upload   Total   Spent    Left  Speed
  0     0    0     0    0     0      0      0 --:--:-- --:--:-- --:--:--     0  0     0    0     0    0     0      0      0 --:--:-- --:--:-- --:--:--     0  0 38.8M    0 65536    0     0  46979      0  0:14:26  0:00:01  0:14:25 46979  2 38.8M    2  832k    0     0   352k      0  0:01:52  0:00:02  0:01:50  352k 10 38.8M   10 4096k    0     0  1217k      0  0:00:32  0:00:03  0:00:29 1217k 35 38.8M   35 13.9M    0     0  3296k      0  0:00:12  0:00:04  0:00:08 3295k 73 38.8M   73 28.3M    0     0  5100k      0  0:00:07  0:00:05  0:00:02 5604k 76 38.8M   76 29.7M    0     0  4537k      0  0:00:08  0:00:06  0:00:02 5715k 79 38.8M   79 30.7M    0     0  4093k      0  0:00:09  0:00:07  0:00:02 5747k 81 38.8M   81 31.6M    0     0  3718k      0  0:00:10  0:00:08  0:00:02 5292k 83 38.8M   83 32.2M    0     0  3404k      0  0:00:11  0:00:09  0:00:02 3492k 84 38.8M   84 32.6M    0     0  3119k      0  0:00:12  0:00:10  0:00:02  868k100 38.8M  100 38.8M    0     0  3530k      0  0:00:11  0:00:11 --:--:-- 2044k
INFO: Building Plots
INFO: Testing PotentialFlow

chebyshev: .............................
dispatch: ...............................
notebooks: WARNING: `nbinclude(path)` is deprecated, use `@nbinclude(path)` instead.
Stacktrace:
 [1] depwarn(::String, ::Symbol) at ./deprecated.jl:70
 [2] #nbinclude#2(::Array{Any,1}, ::Function, ::String) at /home/vagrant/.julia/v0.6/NBInclude/src/NBInclude.jl:94
 [3] nbinclude(::String) at /home/vagrant/.julia/v0.6/NBInclude/src/NBInclude.jl:94
 [4] macro expansion at /home/vagrant/.julia/v0.6/PotentialFlow/test/notebooks.jl:13 [inlined]
 [5] macro expansion at ./test.jl:921 [inlined]
 [6] macro expansion at /home/vagrant/.julia/v0.6/PotentialFlow/test/notebooks.jl:12 [inlined]
 [7] macro expansion at ./test.jl:860 [inlined]
 [8] anonymous at ./<missing>:?
 [9] include_from_node1(::String) at ./loading.jl:576
 [10] include(::String) at ./sysimg.jl:14
 [11] macro expansion at /home/vagrant/.julia/v0.6/TestSetExtensions/src/TestSetExtensions.jl:42 [inlined]
 [12] macro expansion at /home/vagrant/.julia/v0.6/PotentialFlow/test/runtests.jl:9 [inlined]
 [13] macro expansion at ./test.jl:860 [inlined]
 [14] anonymous at ./<missing>:?
 [15] include_from_node1(::String) at ./loading.jl:576
 [16] include(::String) at ./sysimg.jl:14
 [17] process_options(::Base.JLOptions) at ./client.jl:305
 [18] _start() at ./client.jl:371
while loading /home/vagrant/.julia/v0.6/PotentialFlow/test/notebooks.jl, in expression starting on line 3
.
=====================================================
Point Source Demo: Error During Test
  Got an exception of type LoadError outside of a @test
  LoadError: MethodError: gradient(::Array{Complex{Float64},1}, ::Array{Int64,1}) is ambiguous. Candidates:
    gradient(f, x::Union{Array{T,1}, T}) where T<:Number in Calculus at /home/vagrant/.julia/v0.6/Calculus/src/derivative.jl:17
    gradient(F::AbstractArray{T,1} where T, h::Array{T,1} where T) in Base.LinAlg at linalg/dense.jl:186
  Possible fix, define
    gradient(::AbstractArray{T,1} where T, ::Array{T<:Number,1})
  Stacktrace:
   [1] gradient(::Array{Complex{Float64},1}) at ./linalg/generic.jl:282
   [2] include_string(::String, ::String) at ./loading.jl:522
   [3] my_include_string(::Module, ::String, ::String, ::String) at /home/vagrant/.julia/v0.6/NBInclude/src/NBInclude.jl:31
   [4] #nbinclude#1(::Bool, ::UnitRange{Int64}, ::Regex, ::Base.#identity, ::Function, ::Module, ::String) at /home/vagrant/.julia/v0.6/NBInclude/src/NBInclude.jl:83
   [5] nbinclude(::Module, ::String) at /home/vagrant/.julia/v0.6/NBInclude/src/NBInclude.jl:54
   [6] #nbinclude#2(::Array{Any,1}, ::Function, ::String) at /home/vagrant/.julia/v0.6/NBInclude/src/NBInclude.jl:95
   [7] nbinclude(::String) at /home/vagrant/.julia/v0.6/NBInclude/src/NBInclude.jl:94
   [8] macro expansion at /home/vagrant/.julia/v0.6/PotentialFlow/test/notebooks.jl:13 [inlined]
   [9] macro expansion at ./test.jl:921 [inlined]
   [10] macro expansion at /home/vagrant/.julia/v0.6/PotentialFlow/test/notebooks.jl:12 [inlined]
   [11] macro expansion at ./test.jl:860 [inlined]
   [12] anonymous at ./<missing>:?
   [13] include_from_node1(::String) at ./loading.jl:576
   [14] include(::String) at ./sysimg.jl:14
   [15] macro expansion at /home/vagrant/.julia/v0.6/TestSetExtensions/src/TestSetExtensions.jl:42 [inlined]
   [16] macro expansion at /home/vagrant/.julia/v0.6/PotentialFlow/test/runtests.jl:9 [inlined]
   [17] macro expansion at ./test.jl:860 [inlined]
   [18] anonymous at ./<missing>:?
   [19] include_from_node1(::String) at ./loading.jl:576
   [20] include(::String) at ./sysimg.jl:14
   [21] process_options(::Base.JLOptions) at ./client.jl:305
   [22] _start() at ./client.jl:371
  while loading /home/vagrant/.julia/v0.6/PotentialFlow/test/../binder/notebooks/Point Source Demo.ipynb:In[16], in expression starting on line 10
=====================================================
...
Plates: ........
=====================================================
Bound Circulation: Error During Test
  Test threw an exception of type MethodError
  Expression: norm(γs - gradient(Γs, step(ss))) / length(ss) < 0.001
  MethodError: gradient(::Array{Float64,1}, ::Array{Float64,1}) is ambiguous. Candidates:
    gradient(f, x::Union{Array{T,1}, T}) where T<:Number in Calculus at /home/vagrant/.julia/v0.6/Calculus/src/derivative.jl:17
    gradient(F::AbstractArray{T,1} where T, h::Array{T,1} where T) in Base.LinAlg at linalg/dense.jl:186
  Possible fix, define
    gradient(::AbstractArray{T,1} where T, ::Array{T<:Number,1})
  Stacktrace:
   [1] gradient(::Array{Float64,1}, ::Float64) at ./linalg/generic.jl:303
   [2] macro expansion at /home/vagrant/.julia/v0.6/PotentialFlow/test/Plates.jl:84 [inlined]
   [3] macro expansion at ./test.jl:860 [inlined]
   [4] macro expansion at /home/vagrant/.julia/v0.6/PotentialFlow/test/Plates.jl:36 [inlined]
   [5] macro expansion at ./test.jl:860 [inlined]
   [6] anonymous at ./<missing>:?
=====================================================
...........................
Sheets: ................................
TimeMarching: 
=====================================================
Forward Euler: Error During Test
  Test threw an exception of type MethodError
  Expression: minimum(gradient(log.(err)) ./ gradient(log.(T))) > 0.9
  MethodError: gradient(::Array{Float64,1}, ::Array{Int64,1}) is ambiguous. Candidates:
    gradient(f, x::Union{Array{T,1}, T}) where T<:Number in Calculus at /home/vagrant/.julia/v0.6/Calculus/src/derivative.jl:17
    gradient(F::AbstractArray{T,1} where T, h::Array{T,1} where T) in Base.LinAlg at linalg/dense.jl:186
  Possible fix, define
    gradient(::AbstractArray{T,1} where T, ::Array{T<:Number,1})
  Stacktrace:
   [1] gradient(::Array{Float64,1}) at ./linalg/generic.jl:282
   [2] macro expansion at /home/vagrant/.julia/v0.6/PotentialFlow/test/TimeMarching.jl:20 [inlined]
   [3] macro expansion at ./test.jl:860 [inlined]
   [4] macro expansion at /home/vagrant/.julia/v0.6/PotentialFlow/test/TimeMarching.jl:7 [inlined]
   [5] macro expansion at ./test.jl:860 [inlined]
   [6] anonymous at ./<missing>:?
=====================================================

=====================================================
RK4: Error During Test
  Test threw an exception of type MethodError
  Expression: minimum(gradient(log.(err)) ./ gradient(log.(T))) > 3.9
  MethodError: gradient(::Array{Float64,1}, ::Array{Int64,1}) is ambiguous. Candidates:
    gradient(f, x::Union{Array{T,1}, T}) where T<:Number in Calculus at /home/vagrant/.julia/v0.6/Calculus/src/derivative.jl:17
    gradient(F::AbstractArray{T,1} where T, h::Array{T,1} where T) in Base.LinAlg at linalg/dense.jl:186
  Possible fix, define
    gradient(::AbstractArray{T,1} where T, ::Array{T<:Number,1})
  Stacktrace:
   [1] gradient(::Array{Float64,1}) at ./linalg/generic.jl:282
   [2] macro expansion at /home/vagrant/.julia/v0.6/PotentialFlow/test/TimeMarching.jl:36 [inlined]
   [3] macro expansion at ./test.jl:860 [inlined]
   [4] macro expansion at /home/vagrant/.julia/v0.6/PotentialFlow/test/TimeMarching.jl:23 [inlined]
   [5] macro expansion at ./test.jl:860 [inlined]
   [6] anonymous at ./<missing>:?
=====================================================

Utils: ...............


Test Summary:               | Pass  Error  Total
All tests                   |  146      4    150
  Chebyshev Routines        |   29            29
  Pairwise Dispatch         |   31            31
  Jupyter notebooks         |    4      1      5
    Pitching Plate - K07    |    1             1
    Point Source Demo       |           1      1
    Translating Plate - 20° |    1             1
    Translating Plate - 60° |    1             1
    Vortex Sheet Roll-up    |    1             1
  Plate                     |   35      1     36
    Singular Interactions   |    4             4
    Bound Circulation       |    4      1      5
    Induced Velocities      |    2             2
    Suction Parameters      |    9             9
    Impulse                 |    3             3
    Advection               |   13            13
  Vortex Sheets             |   32            32
  Time Marching             |           2      2
    Forward Euler           |           1      1
    RK4                     |           1      1
  Utils                     |   15            15
ERROR: LoadError: Some tests did not pass: 146 passed, 0 failed, 4 errored, 0 broken.
while loading /home/vagrant/.julia/v0.6/PotentialFlow/test/runtests.jl, in expression starting on line 8
============================[ ERROR: PotentialFlow ]============================

failed process: Process(`/home/vagrant/julia/bin/julia -Cgeneric -J/home/vagrant/julia/lib/julia/sys.so --compile=yes --depwarn=yes --check-bounds=yes --code-coverage=none --color=no --compilecache=yes /home/vagrant/.julia/v0.6/PotentialFlow/test/runtests.jl`, ProcessExited(1)) [1]

================================================================================
INFO: Removing Contour v0.4.0
INFO: Removing DeepDiffs v1.1.0
INFO: Removing GR v0.31.0
INFO: Removing Measures v0.2.0
INFO: Removing NBInclude v2.0.0
INFO: Removing PlotThemes v0.2.0
INFO: Removing Plots v0.17.3
INFO: Removing Showoff v0.2.0
INFO: Removing TestSetExtensions v1.1.1
ERROR: PotentialFlow had test errors

>>> End of log
