>>> 'Pkg.add("RigidBodyTreeInspector")' log
INFO: Cloning cache of DrakeVisualizer from https://github.com/rdeits/DrakeVisualizer.jl.git
INFO: Cloning cache of Meshing from https://github.com/JuliaGeometry/Meshing.jl.git
INFO: Cloning cache of RigidBodyTreeInspector from https://github.com/rdeits/RigidBodyTreeInspector.jl.git
INFO: Installing AxisAlgorithms v0.3.0
INFO: Installing BufferedStreams v0.4.1
INFO: Installing CMakeWrapper v0.1.0
INFO: Installing CoordinateTransformations v0.5.0
INFO: Installing DocStringExtensions v0.4.5
INFO: Installing DrakeVisualizer v0.3.0
INFO: Installing FileIO v0.9.1
INFO: Installing GeometryTypes v0.4.6
INFO: Installing Interact v0.7.2
INFO: Installing Interpolations v0.8.0
INFO: Installing IterTools v0.2.1
INFO: Installing LCMCore v0.3.0
INFO: Installing LightXML v0.7.0
INFO: Installing LoopThrottle v0.0.2
INFO: Installing MechanismGeometries v0.0.4
INFO: Installing MeshIO v0.1.3
INFO: Installing Meshing v0.3.1
INFO: Installing OffsetArrays v0.6.0
INFO: Installing Parameters v0.9.1
INFO: Installing Ratios v0.2.0
INFO: Installing Reactive v0.7.0
INFO: Installing RigidBodyDynamics v0.7.0
INFO: Installing RigidBodyTreeInspector v0.4.0
INFO: Installing Rotations v0.7.2
INFO: Installing ShowItLikeYouBuildIt v0.2.0
INFO: Installing TypeSortedCollections v0.4.2
INFO: Installing WoodburyMatrices v0.3.0
INFO: Building CMakeWrapper
INFO: Building LCMCore
-I/usr/include/python2.7 -I/usr/include/x86_64-linux-gnu/python2.7  
-I/usr/include/python2.7 -I/usr/include/x86_64-linux-gnu/python2.7  
-I/usr/include/glib-2.0 -I/usr/lib/x86_64-linux-gnu/glib-2.0/include  
-I/usr/include/glib-2.0 -I/usr/lib/x86_64-linux-gnu/glib-2.0/include  
INFO: Building DrakeVisualizer
-I/usr/include/python2.7 -I/usr/include/x86_64-linux-gnu/python2.7  
-I/usr/include/python2.7 -I/usr/include/x86_64-linux-gnu/python2.7  
Installing dependency libqt4-dev via `sudo apt-get install libqt4-dev`:
Reading package lists...
Building dependency tree...
Reading state information...
The following extra packages will be installed:
  libaudio2 libqt4-dbus libqt4-declarative libqt4-designer libqt4-dev-bin
  libqt4-help libqt4-network libqt4-qt3support libqt4-script
  libqt4-scripttools libqt4-sql libqt4-svg libqt4-test libqt4-xml
  libqt4-xmlpatterns libqtcore4 libqtdbus4 libqtgui4 qdbus qt4-linguist-tools
  qt4-qmake qtcore4-l10n
Suggested packages:
  nas libqt4-declarative-folderlistmodel libqt4-declarative-gestures
  libqt4-declarative-particles libqt4-declarative-shaders qt4-qmlviewer
  firebird-dev libmysqlclient-dev libpq-dev libsqlite0-dev libsqlite3-dev
  qt4-dev-tools qt4-doc unixodbc-dev libicu48 qt4-qtconfig
Recommended packages:
  libqt4-opengl-dev libqtwebkit-dev libqt4-sql-mysql libqt4-sql-odbc
  libqt4-sql-psql libqt4-sql-sqlite
The following NEW packages will be installed:
  libaudio2 libqt4-dbus libqt4-declarative libqt4-designer libqt4-dev
  libqt4-dev-bin libqt4-help libqt4-network libqt4-qt3support libqt4-script
  libqt4-scripttools libqt4-sql libqt4-svg libqt4-test libqt4-xml
  libqt4-xmlpatterns libqtcore4 libqtdbus4 libqtgui4 qdbus qt4-linguist-tools
  qt4-qmake qtcore4-l10n
0 upgraded, 23 newly installed, 0 to remove and 4 not upgraded.
Need to get 19.9 MB of archives.
After this operation, 80.9 MB of additional disk space will be used.
Get:1 http://archive.ubuntu.com/ubuntu/ trusty/main libaudio2 amd64 1.9.4-1 [57.1 kB]
Get:2 http://archive.ubuntu.com/ubuntu/ trusty-updates/main qtcore4-l10n all 4:4.8.5+git192-g085f851+dfsg-2ubuntu4.1 [587 kB]
Get:3 http://archive.ubuntu.com/ubuntu/ trusty-updates/main libqtcore4 amd64 4:4.8.5+git192-g085f851+dfsg-2ubuntu4.1 [1,555 kB]
Get:4 http://archive.ubuntu.com/ubuntu/ trusty-updates/main libqt4-xml amd64 4:4.8.5+git192-g085f851+dfsg-2ubuntu4.1 [95.0 kB]
Get:5 http://archive.ubuntu.com/ubuntu/ trusty-updates/main libqtdbus4 amd64 4:4.8.5+git192-g085f851+dfsg-2ubuntu4.1 [180 kB]
Get:6 http://archive.ubuntu.com/ubuntu/ trusty-updates/main libqt4-network amd64 4:4.8.5+git192-g085f851+dfsg-2ubuntu4.1 [543 kB]
Get:7 http://archive.ubuntu.com/ubuntu/ trusty-updates/main libqt4-script amd64 4:4.8.5+git192-g085f851+dfsg-2ubuntu4.1 [776 kB]
Get:8 http://archive.ubuntu.com/ubuntu/ trusty-updates/main libqt4-sql amd64 4:4.8.5+git192-g085f851+dfsg-2ubuntu4.1 [97.4 kB]
Get:9 http://archive.ubuntu.com/ubuntu/ trusty-updates/main libqt4-xmlpatterns amd64 4:4.8.5+git192-g085f851+dfsg-2ubuntu4.1 [1,028 kB]
Get:10 http://archive.ubuntu.com/ubuntu/ trusty-updates/main libqtgui4 amd64 4:4.8.5+git192-g085f851+dfsg-2ubuntu4.1 [4,130 kB]
Get:11 http://archive.ubuntu.com/ubuntu/ trusty-updates/main libqt4-declarative amd64 4:4.8.5+git192-g085f851+dfsg-2ubuntu4.1 [1,076 kB]
Get:12 http://archive.ubuntu.com/ubuntu/ trusty-updates/main libqt4-designer amd64 4:4.8.5+git192-g085f851+dfsg-2ubuntu4.1 [3,596 kB]
Get:13 http://archive.ubuntu.com/ubuntu/ trusty-updates/main libqt4-help amd64 4:4.8.5+git192-g085f851+dfsg-2ubuntu4.1 [202 kB]
Get:14 http://archive.ubuntu.com/ubuntu/ trusty-updates/main libqt4-qt3support amd64 4:4.8.5+git192-g085f851+dfsg-2ubuntu4.1 [1,029 kB]
Get:15 http://archive.ubuntu.com/ubuntu/ trusty-updates/main libqt4-scripttools amd64 4:4.8.5+git192-g085f851+dfsg-2ubuntu4.1 [220 kB]
Get:16 http://archive.ubuntu.com/ubuntu/ trusty-updates/main libqt4-svg amd64 4:4.8.5+git192-g085f851+dfsg-2ubuntu4.1 [137 kB]
Get:17 http://archive.ubuntu.com/ubuntu/ trusty-updates/main libqt4-test amd64 4:4.8.5+git192-g085f851+dfsg-2ubuntu4.1 [60.4 kB]
Get:18 http://archive.ubuntu.com/ubuntu/ trusty-updates/main qdbus amd64 4:4.8.5+git192-g085f851+dfsg-2ubuntu4.1 [28.8 kB]
Get:19 http://archive.ubuntu.com/ubuntu/ trusty-updates/main libqt4-dbus amd64 4:4.8.5+git192-g085f851+dfsg-2ubuntu4.1 [6,438 B]
Get:20 http://archive.ubuntu.com/ubuntu/ trusty-updates/main libqt4-dev-bin amd64 4:4.8.5+git192-g085f851+dfsg-2ubuntu4.1 [1,600 kB]
Get:21 http://archive.ubuntu.com/ubuntu/ trusty-updates/main qt4-linguist-tools amd64 4:4.8.5+git192-g085f851+dfsg-2ubuntu4.1 [827 kB]
Get:22 http://archive.ubuntu.com/ubuntu/ trusty-updates/main qt4-qmake amd64 4:4.8.5+git192-g085f851+dfsg-2ubuntu4.1 [1,231 kB]
Get:23 http://archive.ubuntu.com/ubuntu/ trusty-updates/main libqt4-dev amd64 4:4.8.5+git192-g085f851+dfsg-2ubuntu4.1 [867 kB]
dpkg-preconfigure: unable to re-open stdin: No such file or directory
Fetched 19.9 MB in 4s (4,001 kB/s)
Selecting previously unselected package libaudio2:amd64.
(Reading database ... 80068 files and directories currently installed.)
Preparing to unpack .../libaudio2_1.9.4-1_amd64.deb ...
Unpacking libaudio2:amd64 (1.9.4-1) ...
Selecting previously unselected package qtcore4-l10n.
Preparing to unpack .../qtcore4-l10n_4%3a4.8.5+git192-g085f851+dfsg-2ubuntu4.1_all.deb ...
Unpacking qtcore4-l10n (4:4.8.5+git192-g085f851+dfsg-2ubuntu4.1) ...
Selecting previously unselected package libqtcore4:amd64.
Preparing to unpack .../libqtcore4_4%3a4.8.5+git192-g085f851+dfsg-2ubuntu4.1_amd64.deb ...
Unpacking libqtcore4:amd64 (4:4.8.5+git192-g085f851+dfsg-2ubuntu4.1) ...
Selecting previously unselected package libqt4-xml:amd64.
Preparing to unpack .../libqt4-xml_4%3a4.8.5+git192-g085f851+dfsg-2ubuntu4.1_amd64.deb ...
Unpacking libqt4-xml:amd64 (4:4.8.5+git192-g085f851+dfsg-2ubuntu4.1) ...
Selecting previously unselected package libqtdbus4:amd64.
Preparing to unpack .../libqtdbus4_4%3a4.8.5+git192-g085f851+dfsg-2ubuntu4.1_amd64.deb ...
Unpacking libqtdbus4:amd64 (4:4.8.5+git192-g085f851+dfsg-2ubuntu4.1) ...
Selecting previously unselected package libqt4-network:amd64.
Preparing to unpack .../libqt4-network_4%3a4.8.5+git192-g085f851+dfsg-2ubuntu4.1_amd64.deb ...
Unpacking libqt4-network:amd64 (4:4.8.5+git192-g085f851+dfsg-2ubuntu4.1) ...
Selecting previously unselected package libqt4-script:amd64.
Preparing to unpack .../libqt4-script_4%3a4.8.5+git192-g085f851+dfsg-2ubuntu4.1_amd64.deb ...
Unpacking libqt4-script:amd64 (4:4.8.5+git192-g085f851+dfsg-2ubuntu4.1) ...
Selecting previously unselected package libqt4-sql:amd64.
Preparing to unpack .../libqt4-sql_4%3a4.8.5+git192-g085f851+dfsg-2ubuntu4.1_amd64.deb ...
Unpacking libqt4-sql:amd64 (4:4.8.5+git192-g085f851+dfsg-2ubuntu4.1) ...
Selecting previously unselected package libqt4-xmlpatterns:amd64.
Preparing to unpack .../libqt4-xmlpatterns_4%3a4.8.5+git192-g085f851+dfsg-2ubuntu4.1_amd64.deb ...
Unpacking libqt4-xmlpatterns:amd64 (4:4.8.5+git192-g085f851+dfsg-2ubuntu4.1) ...
Selecting previously unselected package libqtgui4:amd64.
Preparing to unpack .../libqtgui4_4%3a4.8.5+git192-g085f851+dfsg-2ubuntu4.1_amd64.deb ...
Unpacking libqtgui4:amd64 (4:4.8.5+git192-g085f851+dfsg-2ubuntu4.1) ...
Selecting previously unselected package libqt4-declarative:amd64.
Preparing to unpack .../libqt4-declarative_4%3a4.8.5+git192-g085f851+dfsg-2ubuntu4.1_amd64.deb ...
Unpacking libqt4-declarative:amd64 (4:4.8.5+git192-g085f851+dfsg-2ubuntu4.1) ...
Selecting previously unselected package libqt4-designer:amd64.
Preparing to unpack .../libqt4-designer_4%3a4.8.5+git192-g085f851+dfsg-2ubuntu4.1_amd64.deb ...
Unpacking libqt4-designer:amd64 (4:4.8.5+git192-g085f851+dfsg-2ubuntu4.1) ...
Selecting previously unselected package libqt4-help:amd64.
Preparing to unpack .../libqt4-help_4%3a4.8.5+git192-g085f851+dfsg-2ubuntu4.1_amd64.deb ...
Unpacking libqt4-help:amd64 (4:4.8.5+git192-g085f851+dfsg-2ubuntu4.1) ...
Selecting previously unselected package libqt4-qt3support:amd64.
Preparing to unpack .../libqt4-qt3support_4%3a4.8.5+git192-g085f851+dfsg-2ubuntu4.1_amd64.deb ...
Unpacking libqt4-qt3support:amd64 (4:4.8.5+git192-g085f851+dfsg-2ubuntu4.1) ...
Selecting previously unselected package libqt4-scripttools:amd64.
Preparing to unpack .../libqt4-scripttools_4%3a4.8.5+git192-g085f851+dfsg-2ubuntu4.1_amd64.deb ...
Unpacking libqt4-scripttools:amd64 (4:4.8.5+git192-g085f851+dfsg-2ubuntu4.1) ...
Selecting previously unselected package libqt4-svg:amd64.
Preparing to unpack .../libqt4-svg_4%3a4.8.5+git192-g085f851+dfsg-2ubuntu4.1_amd64.deb ...
Unpacking libqt4-svg:amd64 (4:4.8.5+git192-g085f851+dfsg-2ubuntu4.1) ...
Selecting previously unselected package libqt4-test:amd64.
Preparing to unpack .../libqt4-test_4%3a4.8.5+git192-g085f851+dfsg-2ubuntu4.1_amd64.deb ...
Unpacking libqt4-test:amd64 (4:4.8.5+git192-g085f851+dfsg-2ubuntu4.1) ...
Selecting previously unselected package qdbus.
Preparing to unpack .../qdbus_4%3a4.8.5+git192-g085f851+dfsg-2ubuntu4.1_amd64.deb ...
Unpacking qdbus (4:4.8.5+git192-g085f851+dfsg-2ubuntu4.1) ...
Selecting previously unselected package libqt4-dbus:amd64.
Preparing to unpack .../libqt4-dbus_4%3a4.8.5+git192-g085f851+dfsg-2ubuntu4.1_amd64.deb ...
Unpacking libqt4-dbus:amd64 (4:4.8.5+git192-g085f851+dfsg-2ubuntu4.1) ...
Selecting previously unselected package libqt4-dev-bin.
Preparing to unpack .../libqt4-dev-bin_4%3a4.8.5+git192-g085f851+dfsg-2ubuntu4.1_amd64.deb ...
Unpacking libqt4-dev-bin (4:4.8.5+git192-g085f851+dfsg-2ubuntu4.1) ...
Selecting previously unselected package qt4-linguist-tools.
Preparing to unpack .../qt4-linguist-tools_4%3a4.8.5+git192-g085f851+dfsg-2ubuntu4.1_amd64.deb ...
Unpacking qt4-linguist-tools (4:4.8.5+git192-g085f851+dfsg-2ubuntu4.1) ...
Selecting previously unselected package qt4-qmake.
Preparing to unpack .../qt4-qmake_4%3a4.8.5+git192-g085f851+dfsg-2ubuntu4.1_amd64.deb ...
Unpacking qt4-qmake (4:4.8.5+git192-g085f851+dfsg-2ubuntu4.1) ...
Selecting previously unselected package libqt4-dev.
Preparing to unpack .../libqt4-dev_4%3a4.8.5+git192-g085f851+dfsg-2ubuntu4.1_amd64.deb ...
Unpacking libqt4-dev (4:4.8.5+git192-g085f851+dfsg-2ubuntu4.1) ...
Processing triggers for man-db (2.6.7.1-1ubuntu1) ...
Setting up libaudio2:amd64 (1.9.4-1) ...
Setting up qtcore4-l10n (4:4.8.5+git192-g085f851+dfsg-2ubuntu4.1) ...
Setting up libqtcore4:amd64 (4:4.8.5+git192-g085f851+dfsg-2ubuntu4.1) ...
Setting up libqt4-xml:amd64 (4:4.8.5+git192-g085f851+dfsg-2ubuntu4.1) ...
Setting up libqtdbus4:amd64 (4:4.8.5+git192-g085f851+dfsg-2ubuntu4.1) ...
Setting up libqt4-network:amd64 (4:4.8.5+git192-g085f851+dfsg-2ubuntu4.1) ...
Setting up libqt4-script:amd64 (4:4.8.5+git192-g085f851+dfsg-2ubuntu4.1) ...
Setting up libqt4-sql:amd64 (4:4.8.5+git192-g085f851+dfsg-2ubuntu4.1) ...
Setting up libqt4-xmlpatterns:amd64 (4:4.8.5+git192-g085f851+dfsg-2ubuntu4.1) ...
Setting up libqt4-test:amd64 (4:4.8.5+git192-g085f851+dfsg-2ubuntu4.1) ...
Setting up qdbus (4:4.8.5+git192-g085f851+dfsg-2ubuntu4.1) ...
Setting up libqt4-dbus:amd64 (4:4.8.5+git192-g085f851+dfsg-2ubuntu4.1) ...
Setting up qt4-linguist-tools (4:4.8.5+git192-g085f851+dfsg-2ubuntu4.1) ...
Setting up qt4-qmake (4:4.8.5+git192-g085f851+dfsg-2ubuntu4.1) ...
Setting up libqtgui4:amd64 (4:4.8.5+git192-g085f851+dfsg-2ubuntu4.1) ...
Setting up libqt4-declarative:amd64 (4:4.8.5+git192-g085f851+dfsg-2ubuntu4.1) ...
Setting up libqt4-designer:amd64 (4:4.8.5+git192-g085f851+dfsg-2ubuntu4.1) ...
Setting up libqt4-help:amd64 (4:4.8.5+git192-g085f851+dfsg-2ubuntu4.1) ...
Setting up libqt4-qt3support:amd64 (4:4.8.5+git192-g085f851+dfsg-2ubuntu4.1) ...
Setting up libqt4-scripttools:amd64 (4:4.8.5+git192-g085f851+dfsg-2ubuntu4.1) ...
Setting up libqt4-svg:amd64 (4:4.8.5+git192-g085f851+dfsg-2ubuntu4.1) ...
Setting up libqt4-dev-bin (4:4.8.5+git192-g085f851+dfsg-2ubuntu4.1) ...
Setting up libqt4-dev (4:4.8.5+git192-g085f851+dfsg-2ubuntu4.1) ...
Processing triggers for libc-bin (2.19-0ubuntu6.14) ...
Installing dependency libqt4-opengl-dev via `sudo apt-get install libqt4-opengl-dev`:
Reading package lists...
Building dependency tree...
Reading state information...
The following extra packages will be installed:
  libqt4-opengl
The following NEW packages will be installed:
  libqt4-opengl libqt4-opengl-dev
0 upgraded, 2 newly installed, 0 to remove and 4 not upgraded.
Need to get 318 kB of archives.
After this operation, 1,681 kB of additional disk space will be used.
Get:1 http://archive.ubuntu.com/ubuntu/ trusty-updates/main libqt4-opengl amd64 4:4.8.5+git192-g085f851+dfsg-2ubuntu4.1 [295 kB]
Get:2 http://archive.ubuntu.com/ubuntu/ trusty-updates/main libqt4-opengl-dev amd64 4:4.8.5+git192-g085f851+dfsg-2ubuntu4.1 [22.8 kB]
dpkg-preconfigure: unable to re-open stdin: No such file or directory
Fetched 318 kB in 0s (554 kB/s)
Selecting previously unselected package libqt4-opengl:amd64.
(Reading database ... 84017 files and directories currently installed.)
Preparing to unpack .../libqt4-opengl_4%3a4.8.5+git192-g085f851+dfsg-2ubuntu4.1_amd64.deb ...
Unpacking libqt4-opengl:amd64 (4:4.8.5+git192-g085f851+dfsg-2ubuntu4.1) ...
Selecting previously unselected package libqt4-opengl-dev.
Preparing to unpack .../libqt4-opengl-dev_4%3a4.8.5+git192-g085f851+dfsg-2ubuntu4.1_amd64.deb ...
Unpacking libqt4-opengl-dev (4:4.8.5+git192-g085f851+dfsg-2ubuntu4.1) ...
Setting up libqt4-opengl:amd64 (4:4.8.5+git192-g085f851+dfsg-2ubuntu4.1) ...
Setting up libqt4-opengl-dev (4:4.8.5+git192-g085f851+dfsg-2ubuntu4.1) ...
Processing triggers for libc-bin (2.19-0ubuntu6.14) ...
Info: Attempting to create directory /home/vagrant/.julia/v0.6/DrakeVisualizer/deps/downloads
Info: Downloading file https://dl.bintray.com/patmarion/director/director-0.1.0-234-g74cea84-ubuntu-14.04.tar.gz
  % Total    % Received % Xferd  Average Speed   Time    Time     Time  Current
                                 Dload  Upload   Total   Spent    Left  Speed
  0     0    0     0    0     0      0      0 --:--:-- --:--:-- --:--:--     0  0     0    0     0    0     0      0      0 --:--:--  0:00:01 --:--:--     0  0     0    0     0    0     0      0      0 --:--:--  0:00:01 --:--:--     0
 10 77.8M   10 8616k    0     0  3016k      0  0:00:26  0:00:02  0:00:24 3016k 18 77.8M   18 14.1M    0     0  4883k      0  0:00:16  0:00:02  0:00:14 52.9M 36 77.8M   36 28.3M    0     0  7317k      0  0:00:10  0:00:03  0:00:07 17.9M 54 77.8M   54 42.6M    0     0  8790k      0  0:00:09  0:00:04  0:00:05 16.2M 73 77.8M   73 57.2M    0     0  9823k      0  0:00:08  0:00:05  0:00:03 15.6M 89 77.8M   89 69.7M    0     0  10.0M      0  0:00:07  0:00:06  0:00:01 14.9M100 77.8M  100 77.8M    0     0  10.3M      0  0:00:07  0:00:07 --:--:-- 13.9M
Info: Done downloading file https://dl.bintray.com/patmarion/director/director-0.1.0-234-g74cea84-ubuntu-14.04.tar.gz
Info: Attempting to create directory /home/vagrant/.julia/v0.6/DrakeVisualizer/deps/usr
INFO: Building Interact
WARNING: IJulia is not installed. run Pkg.build("Interact")
once you install IJulia to use Interact inside IJulia
INFO: Building LightXML
INFO: Package database updated
INFO: METADATA is out-of-date — you may not have the latest version of RigidBodyTreeInspector
INFO: Use `Pkg.update()` to get the latest versions of your packages

>>> 'Pkg.test("RigidBodyTreeInspector")' log
Julia Version 0.6.4
Commit 9d11f62bcb (2018-07-09 19:09 UTC)
Platform Info:
  OS: Linux (x86_64-pc-linux-gnu)
  CPU: Intel(R) Xeon(R) CPU E3-1241 v3 @ 3.50GHz
  WORD_SIZE: 64
           Ubuntu 14.04.5 LTS
  uname: Linux 3.13.0-143-generic #192-Ubuntu SMP Tue Feb 27 10:45:36 UTC 2018 x86_64 x86_64
Memory: 2.939197540283203 GB (626.87890625 MB free)
Uptime: 36159.0 sec
Load Avg:  0.8330078125  0.90234375  0.9423828125
Intel(R) Xeon(R) CPU E3-1241 v3 @ 3.50GHz: 
       speed         user         nice          sys         idle          irq
#1  3500 MHz    2195524 s       3993 s     167475 s     702342 s         12 s
#2  3500 MHz     378280 s        899 s      52222 s    3140071 s          0 s

  BLAS: libopenblas (USE64BITINT DYNAMIC_ARCH NO_AFFINITY Nehalem MAX_THREADS=16)
  LAPACK: libopenblas64_
  LIBM: libopenlibm
  LLVM: libLLVM-3.9.1 (ORCJIT, haswell)
Environment:
  TERM = vt100
  LD_LIBRARY_PATH = :/usr/local/lib/
  PATH = /usr/local/sbin:/usr/local/bin:/usr/sbin:/usr/bin:/sbin:/bin:/usr/games:/usr/local/games:/home/vagrant/julia/bin/
  JAVA_HOME = /usr/lib/jvm/java-8-openjdk-amd64
  HOME = /home/vagrant

Package Directory: /home/vagrant/.julia/v0.6
3 required packages:
 - JSON                          0.17.2
 - POMDPModels                   0.2.2
 - RigidBodyTreeInspector        0.4.0
89 additional packages:
 - AMG                           0.1.2              master
 - AbstractTrees                 0.1.0
 - AssetRegistry                 0.0.2
 - AutoHashEquals                0.2.0
 - AxisAlgorithms                0.3.0
 - BinDeps                       0.8.8
 - BinaryProvider                0.3.3
 - Blink                         0.7.0
 - BufferedStreams               0.4.1
 - CMakeWrapper                  0.1.0
 - CPUTime                       0.1.0
 - Calculus                      0.4.0
 - CategoricalArrays             0.3.11
 - CodecZlib                     0.4.3
 - ColorTypes                    0.6.7
 - Colors                        0.8.2
 - Compat                        1.0.0
 - CoordinateTransformations     0.5.0
 - D3Trees                       0.2.0
 - DataFrames                    0.11.7
 - DataStreams                   0.3.6
 - DataStructures                0.8.4
 - DiscreteValueIteration        0.0.0-             master (unregistered)
 - Distributions                 0.15.0
 - DocStringExtensions           0.4.5
 - DrakeVisualizer               0.3.0
 - FileIO                        0.9.1
 - FixedPointNumbers             0.4.6
 - FunctionalCollections         0.3.2
 - GeometryTypes                 0.4.6
 - Hiccup                        0.1.1
 - HttpCommon                    0.4.0
 - HttpParser                    0.4.0
 - HttpServer                    0.3.1
 - IncompleteSelectedInversion   0.0.0-             master (unregistered)
 - Interact                      0.7.2
 - Interpolations                0.8.0
 - IterTools                     0.2.1
 - IterativeSolvers              0.6.0
 - Iterators                     0.3.1
 - JSExpr                        0.2.2
 - LCMCore                       0.3.0
 - LaTeXStrings                  1.0.0
 - Lazy                          0.12.1
 - LightXML                      0.7.0
 - LoopThrottle                  0.0.2
 - MCTS                          0.0.0-             master (unregistered)
 - MacroTools                    0.4.2
 - MbedTLS                       0.5.12
 - MechanismGeometries           0.0.4
 - MeshIO                        0.1.3
 - Meshing                       0.3.1
 - Missings                      0.2.10
 - Mustache                      0.3.3
 - Mux                           0.3.1
 - NamedTuples                   4.0.2
 - Nullables                     0.0.6
 - Observables                   0.1.2
 - OffsetArrays                  0.6.0
 - PDMats                        0.8.0
 - POMDPToolbox                  0.2.7
 - POMDPs                        0.6.7
 - Parameters                    0.9.1
 - Pidfile                       1.0.0
 - ProgressMeter                 0.5.6
 - QuadGK                        0.3.0
 - Ratios                        0.2.0
 - Reactive                      0.7.0
 - RecipesBase                   0.3.1
 - Reexport                      0.1.0
 - Requires                      0.4.4
 - RigidBodyDynamics             0.7.0
 - Rmath                         0.4.0
 - Rotations                     0.7.2
 - SHA                           0.5.7
 - ShowItLikeYouBuildIt          0.2.0
 - SortingAlgorithms             0.2.1
 - SpecialFunctions              0.6.0
 - StaticArrays                  0.7.2
 - StatsBase                     0.23.1
 - StatsFuns                     0.6.1
 - TikzPictures                  1.2.0
 - TranscodingStreams            0.5.3
 - TypeSortedCollections         0.4.2
 - URIParser                     0.3.1
 - WeakRefStrings                0.4.7
 - WebIO                         0.2.5
 - WebSockets                    0.5.0
 - WoodburyMatrices              0.3.0
INFO: Computing test dependencies for RigidBodyTreeInspector...
INFO: Cloning cache of IJulia from https://github.com/JuliaLang/IJulia.jl.git
INFO: Cloning cache of ValkyrieRobot from https://github.com/tkoolen/ValkyrieRobot.jl.git
INFO: Cloning cache of ZMQ from https://github.com/JuliaInterop/ZMQ.jl.git
INFO: Installing Conda v1.0.0
INFO: Installing IJulia v1.9.1
INFO: Installing ValkyrieRobot v0.0.2
INFO: Installing VersionParsing v1.1.1
INFO: Installing ZMQ v0.6.3
INFO: Building Conda
INFO: Building MbedTLS
Info: using prebuilt binaries
INFO: Building ZMQ
Info: Downloading https://github.com/JuliaInterop/ZMQBuilder/releases/download/v4.2.5+6/ZMQ.x86_64-linux-gnu.tar.gz to /home/vagrant/.julia/v0.6/ZMQ/deps/usr/downloads/ZMQ.x86_64-linux-gnu.tar.gz...
[10:04:39] [10:04:39] ######################################################################## 100.0%[10:04:39] ######################################################################## 100.0%[10:04:39] ##                                                                         3.8%[10:04:39] ############                                                              16.8%[10:04:39] ######################                                                    31.1%[10:04:39] ################################                                          45.5%[10:04:40] ##########################################                                59.6%[10:04:40] #####################################################                     73.9%[10:04:40] ###############################################################           88.4%[10:04:40] ######################################################################## 100.0%
INFO: Building IJulia
Warning: Could not execute `jupyter --version`.
Info: Installing Jupyter via the Conda package.
Info: Running `conda install -y jupyter` in root environment
Solving environment: ...working... done
jupyter_client-5.2.3 |   59 KB |            |   0% jupyter_client-5.2.3 |   59 KB | ##         |  20% jupyter_client-5.2.3 |   59 KB | ########## | 100% 
webencodings-0.5     |   18 KB |            |   0% webencodings-0.5     |   18 KB | ######7    |  67% webencodings-0.5     |   18 KB | ########## | 100% 
bleach-2.1.3         |   24 KB |            |   0% bleach-2.1.3         |   24 KB | #####      |  50% bleach-2.1.3         |   24 KB | ########## | 100% 
constantly-15.1.0    |    9 KB |            |   0% constantly-15.1.0    |    9 KB | #######5   |  75% constantly-15.1.0    |    9 KB | ########## | 100% 
jinja2-2.10          |   89 KB |            |   0% jinja2-2.10          |   89 KB | #3         |  13% jinja2-2.10          |   89 KB | ########## | 100% 
automat-0.7.0        |   51 KB |            |   0% automat-0.7.0        |   51 KB | ##3        |  24% automat-0.7.0        |   51 KB | ########## | 100% 
ipykernel-4.8.2      |  148 KB |            |   0% ipykernel-4.8.2      |  148 KB | 8          |   8% ipykernel-4.8.2      |  148 KB | ########## | 100% 
pyasn1-modules-0.2.1 |   33 KB |            |   0% pyasn1-modules-0.2.1 |   33 KB | ###6       |  37% pyasn1-modules-0.2.1 |   33 KB | ########## | 100% 
pyasn1-0.4.4         |   46 KB |            |   0% pyasn1-0.4.4         |   46 KB | ########## | 100% 
appdirs-1.4.3        |   11 KB |            |   0% appdirs-1.4.3        |   11 KB | #######5   |  75% appdirs-1.4.3        |   11 KB | ########## | 100% 
ipywidgets-7.3.2     |   91 KB |            |   0% ipywidgets-7.3.2     |   91 KB | #3         |  13% ipywidgets-7.3.2     |   91 KB | ########## | 100% 
jupyter_core-4.4.0   |   44 KB |            |   0% jupyter_core-4.4.0   |   44 KB | ##7        |  28% jupyter_core-4.4.0   |   44 KB | ########## | 100% 
pandoc-2.2.2         | 20.8 MB |            |   0% pandoc-2.2.2         | 20.8 MB |            |   0% pandoc-2.2.2         | 20.8 MB | 2          |   3% pandoc-2.2.2         | 20.8 MB | 6          |   7% pandoc-2.2.2         | 20.8 MB | #1         |  12% pandoc-2.2.2         | 20.8 MB | #7         |  17% pandoc-2.2.2         | 20.8 MB | ##2        |  22% pandoc-2.2.2         | 20.8 MB | ##6        |  27% pandoc-2.2.2         | 20.8 MB | ###1       |  32% pandoc-2.2.2         | 20.8 MB | ###6       |  37% pandoc-2.2.2         | 20.8 MB | ####1      |  42% pandoc-2.2.2         | 20.8 MB | ####6      |  47% pandoc-2.2.2         | 20.8 MB | #####1     |  52% pandoc-2.2.2         | 20.8 MB | #####6     |  57% pandoc-2.2.2         | 20.8 MB | ######2    |  62% pandoc-2.2.2         | 20.8 MB | ######7    |  67% pandoc-2.2.2         | 20.8 MB | #######2   |  72% pandoc-2.2.2         | 20.8 MB | #######7   |  77% pandoc-2.2.2         | 20.8 MB | ########   |  81% pandoc-2.2.2         | 20.8 MB | ########3  |  84% pandoc-2.2.2         | 20.8 MB | ########5  |  86% pandoc-2.2.2         | 20.8 MB | ########7  |  88% pandoc-2.2.2         | 20.8 MB | ########9  |  89% pandoc-2.2.2         | 20.8 MB | #########  |  90% pandoc-2.2.2         | 20.8 MB | #########1 |  91% pandoc-2.2.2         | 20.8 MB | #########1 |  92% pandoc-2.2.2         | 20.8 MB | #########2 |  93% pandoc-2.2.2         | 20.8 MB | #########3 |  93% pandoc-2.2.2         | 20.8 MB | #########4 |  94% pandoc-2.2.2         | 20.8 MB | #########4 |  95% pandoc-2.2.2         | 20.8 MB | #########5 |  95% pandoc-2.2.2         | 20.8 MB | #########6 |  96% pandoc-2.2.2         | 20.8 MB | #########6 |  97% pandoc-2.2.2         | 20.8 MB | #########7 |  97% pandoc-2.2.2         | 20.8 MB | #########7 |  98% pandoc-2.2.2         | 20.8 MB | #########8 |  99% pandoc-2.2.2         | 20.8 MB | #########9 | 100% pandoc-2.2.2         | 20.8 MB | ########## | 100% 
qtconsole-4.3.1      |  149 KB |            |   0% qtconsole-4.3.1      |  149 KB | 8          |   8% qtconsole-4.3.1      |  149 KB | ########## | 100% 
service_identity-17. |   11 KB |            |   0% service_identity-17. |   11 KB | #######5   |  75% service_identity-17. |   11 KB | ########## | 100% 
pandocfilters-1.4.2  |    9 KB |            |   0% pandocfilters-1.4.2  |    9 KB | #######5   |  75% pandocfilters-1.4.2  |    9 KB | ########## | 100% 
notebook-5.6.0       |  7.3 MB |            |   0% notebook-5.6.0       |  7.3 MB |            |   0% notebook-5.6.0       |  7.3 MB | #3         |  14% notebook-5.6.0       |  7.3 MB | ##7        |  28% notebook-5.6.0       |  7.3 MB | ####1      |  42% notebook-5.6.0       |  7.3 MB | #####5     |  56% notebook-5.6.0       |  7.3 MB | #######    |  70% notebook-5.6.0       |  7.3 MB | ########1  |  82% notebook-5.6.0       |  7.3 MB | #########  |  91% notebook-5.6.0       |  7.3 MB | #########7 |  97% notebook-5.6.0       |  7.3 MB | ########## | 100% 
pyhamcrest-1.9.0     |   23 KB |            |   0% pyhamcrest-1.9.0     |   23 KB | #####1     |  51% pyhamcrest-1.9.0     |   23 KB | ########## | 100% 
testpath-0.3.1       |   90 KB |            |   0% testpath-0.3.1       |   90 KB | #3         |  13% testpath-0.3.1       |   90 KB | ########## | 100% 
jupyter_console-5.2. |   34 KB |            |   0% jupyter_console-5.2. |   34 KB | ###4       |  35% jupyter_console-5.2. |   34 KB | ########## | 100% 
jsonschema-2.6.0     |   64 KB |            |   0% jsonschema-2.6.0     |   64 KB | #8         |  19% jsonschema-2.6.0     |   64 KB | ########## | 100% 
zope.interface-4.5.0 |  233 KB |            |   0% zope.interface-4.5.0 |  233 KB | 5          |   5% zope.interface-4.5.0 |  233 KB | ########## | 100% 
mistune-0.8.3        |  873 KB |            |   0% mistune-0.8.3        |  873 KB | 1          |   1% mistune-0.8.3        |  873 KB | ########4  |  84% mistune-0.8.3        |  873 KB | ########## | 100% 
html5lib-1.0.1       |   89 KB |            |   0% html5lib-1.0.1       |   89 KB | #3         |  13% html5lib-1.0.1       |   89 KB | ########## | 100% 
pyzmq-17.1.0         |  1.0 MB |            |   0% pyzmq-17.1.0         |  1.0 MB | 1          |   1% pyzmq-17.1.0         |  1.0 MB | #######9   |  79% pyzmq-17.1.0         |  1.0 MB | #########6 |  96% pyzmq-17.1.0         |  1.0 MB | ########## | 100% 
nbformat-4.4.0       |   91 KB |            |   0% nbformat-4.4.0       |   91 KB | #3         |  13% nbformat-4.4.0       |   91 KB | ########## | 100% 
terminado-0.8.1      |   20 KB |            |   0% terminado-0.8.1      |   20 KB | ########## | 100% 
widgetsnbextension-3 |  1.7 MB |            |   0% widgetsnbextension-3 |  1.7 MB |            |   1% widgetsnbextension-3 |  1.7 MB | ######2    |  63% widgetsnbextension-3 |  1.7 MB | ########1  |  81% widgetsnbextension-3 |  1.7 MB | #########9 | 100% widgetsnbextension-3 |  1.7 MB | ########## | 100% 
incremental-17.5.0   |   14 KB |            |   0% incremental-17.5.0   |   14 KB | #######5   |  75% incremental-17.5.0   |   14 KB | ########## | 100% 
hyperlink-17.3.1     |   28 KB |            |   0% hyperlink-17.3.1     |   28 KB | ####2      |  43% hyperlink-17.3.1     |   28 KB | ########## | 100% 
gmp-6.1.2            |  676 KB |            |   0% gmp-6.1.2            |  676 KB | 1          |   2% gmp-6.1.2            |  676 KB | ########8  |  88% gmp-6.1.2            |  676 KB | ########## | 100% 
markupsafe-1.0       |   32 KB |            |   0% markupsafe-1.0       |   32 KB | ###7       |  38% markupsafe-1.0       |   32 KB | ########## | 100% 
prometheus_client-0. |   26 KB |            |   0% prometheus_client-0. |   26 KB | ####5      |  45% prometheus_client-0. |   26 KB | ########## | 100% 
jupyter-1.0.0        |    6 KB |            |   0% jupyter-1.0.0        |    6 KB | #######5   |  75% jupyter-1.0.0        |    6 KB | ########## | 100% 
entrypoints-0.2.3    |    9 KB |            |   0% entrypoints-0.2.3    |    9 KB | #######5   |  75% entrypoints-0.2.3    |    9 KB | ########## | 100% 
nbconvert-5.3.1      |  320 KB |            |   0% nbconvert-5.3.1      |  320 KB | #1         |  11% nbconvert-5.3.1      |  320 KB | #########8 |  99% nbconvert-5.3.1      |  320 KB | ########## | 100% 
send2trash-1.5.0     |   12 KB |            |   0% send2trash-1.5.0     |   12 KB | ########## | 100% 
twisted-18.7.0       |  4.9 MB |            |   0% twisted-18.7.0       |  4.9 MB |            |   0% twisted-18.7.0       |  4.9 MB | ##1        |  22% twisted-18.7.0       |  4.9 MB | ####3      |  43% twisted-18.7.0       |  4.9 MB | ######5    |  65% twisted-18.7.0       |  4.9 MB | #######9   |  79% twisted-18.7.0       |  4.9 MB | #########  |  90% twisted-18.7.0       |  4.9 MB | #########8 |  98% twisted-18.7.0       |  4.9 MB | ########## | 100% 
## Package Plan ##

  environment location: /home/vagrant/.julia/v0.6/Conda/deps/usr

  added / updated specs: 
    - jupyter


The following packages will be downloaded:

    package                    |            build
    ---------------------------|-----------------
    jupyter_client-5.2.3       |             py_1          59 KB  conda-forge
    webencodings-0.5           |           py36_0          18 KB  conda-forge
    bleach-2.1.3               |             py_0          24 KB  conda-forge
    constantly-15.1.0          |             py_0           9 KB  conda-forge
    jinja2-2.10                |             py_1          89 KB  conda-forge
    automat-0.7.0              |           py36_0          51 KB  conda-forge
    ipykernel-4.8.2            |           py36_0         148 KB  conda-forge
    pyasn1-modules-0.2.1       |             py_0          33 KB  conda-forge
    pyasn1-0.4.4               |             py_0          46 KB  conda-forge
    appdirs-1.4.3              |             py_1          11 KB  conda-forge
    ipywidgets-7.3.2           |             py_0          91 KB  conda-forge
    jupyter_core-4.4.0         |             py_0          44 KB  conda-forge
    pandoc-2.2.2               |                1        20.8 MB  conda-forge
    qtconsole-4.3.1            |           py36_0         149 KB  conda-forge
    service_identity-17.0.0    |             py_0          11 KB  conda-forge
    pandocfilters-1.4.2        |             py_1           9 KB  conda-forge
    notebook-5.6.0             |           py36_0         7.3 MB  conda-forge
    pyhamcrest-1.9.0           |             py_2          23 KB  conda-forge
    testpath-0.3.1             |           py36_0          90 KB  conda-forge
    jupyter_console-5.2.0      |           py36_0          34 KB  conda-forge
    jsonschema-2.6.0           |           py36_1          64 KB  conda-forge
    zope.interface-4.5.0       |   py36h470a237_0         233 KB  conda-forge
    mistune-0.8.3              |   py36h470a237_2         873 KB  conda-forge
    html5lib-1.0.1             |             py_0          89 KB  conda-forge
    pyzmq-17.1.0               |   py36hae99301_0         1.0 MB  conda-forge
    nbformat-4.4.0             |             py_1          91 KB  conda-forge
    terminado-0.8.1            |           py36_0          20 KB  conda-forge
    widgetsnbextension-3.3.1   |           py36_1         1.7 MB  conda-forge
    incremental-17.5.0         |             py_0          14 KB  conda-forge
    hyperlink-17.3.1           |             py_0          28 KB  conda-forge
    gmp-6.1.2                  |       hfc679d8_0         676 KB  conda-forge
    markupsafe-1.0             |           py36_0          32 KB  conda-forge
    prometheus_client-0.3.0    |             py_0          26 KB  conda-forge
    jupyter-1.0.0              |             py_1           6 KB  conda-forge
    entrypoints-0.2.3          |           py36_1           9 KB  conda-forge
    nbconvert-5.3.1            |             py_1         320 KB  conda-forge
    send2trash-1.5.0           |             py_0          12 KB  conda-forge
    twisted-18.7.0             |   py36h470a237_0         4.9 MB  conda-forge
    ------------------------------------------------------------
                                           Total:        39.0 MB

The following NEW packages will be INSTALLED:

    appdirs:            1.4.3-py_1                            conda-forge
    automat:            0.7.0-py36_0                          conda-forge
    bleach:             2.1.3-py_0                            conda-forge
    constantly:         15.1.0-py_0                           conda-forge
    entrypoints:        0.2.3-py36_1                          conda-forge
    gmp:                6.1.2-hfc679d8_0                      conda-forge
    html5lib:           1.0.1-py_0                            conda-forge
    hyperlink:          17.3.1-py_0                           conda-forge
    incremental:        17.5.0-py_0                           conda-forge
    ipykernel:          4.8.2-py36_0                          conda-forge
    ipywidgets:         7.3.2-py_0                            conda-forge
    jinja2:             2.10-py_1                             conda-forge
    jsonschema:         2.6.0-py36_1                          conda-forge
    jupyter:            1.0.0-py_1                            conda-forge
    jupyter_client:     5.2.3-py_1                            conda-forge
    jupyter_console:    5.2.0-py36_0                          conda-forge
    jupyter_core:       4.4.0-py_0                            conda-forge
    markupsafe:         1.0-py36_0                            conda-forge
    mistune:            0.8.3-py36h470a237_2                  conda-forge
    nbconvert:          5.3.1-py_1                            conda-forge
    nbformat:           4.4.0-py_1                            conda-forge
    notebook:           5.6.0-py36_0                          conda-forge
    pandoc:             2.2.2-1                               conda-forge
    pandocfilters:      1.4.2-py_1                            conda-forge
    prometheus_client:  0.3.0-py_0                            conda-forge
    pyasn1:             0.4.4-py_0                            conda-forge
    pyasn1-modules:     0.2.1-py_0                            conda-forge
    pyhamcrest:         1.9.0-py_2                            conda-forge
    pyzmq:              17.1.0-py36hae99301_0                 conda-forge
    qtconsole:          4.3.1-py36_0                          conda-forge
    send2trash:         1.5.0-py_0                            conda-forge
    service_identity:   17.0.0-py_0                           conda-forge
    terminado:          0.8.1-py36_0                          conda-forge
    testpath:           0.3.1-py36_0                          conda-forge
    twisted:            18.7.0-py36h470a237_0                 conda-forge
    webencodings:       0.5-py36_0                            conda-forge
    widgetsnbextension: 3.3.1-py36_1                          conda-forge
    zope.interface:     4.5.0-py36h470a237_0                  conda-forge

The following packages will be DOWNGRADED:

    blas:               1.1-openblas                          conda-forge --> 1.0-mkl              
    numpy:              1.15.0-py36_blas_openblashd3ea46f_200 conda-forge [blas_openblas] --> 1.14.3-py36h28100ab_2
    scipy:              1.1.0-py36_blas_openblash7943236_201  conda-forge [blas_openblas] --> 1.1.0-py36hc49cb51_0 


Downloading and Extracting Packages
Preparing transaction: ...working... done
Verifying transaction: ...working... done
Executing transaction: ...working... Enabling notebook extension jupyter-js-widgets/extension...
      - Validating: [32mOK[0m

done

Info: Found Jupyter version 4.4.0: /home/vagrant/.julia/v0.6/Conda/deps/usr/bin/jupyter
Info: Installing Julia kernelspec julia-0.6
[InstallKernelSpec] Installed kernelspec julia-0.6 in /home/vagrant/.local/share/jupyter/kernels/julia-0.6
INFO: Building LightXML
INFO: Building ValkyrieRobot
  % Total    % Received % Xferd  Average Speed   Time    Time     Time  Current
                                 Dload  Upload   Total   Spent    Left  Speed
  0     0    0     0    0     0      0      0 --:--:-- --:--:-- --:--:--     0100  107k  100  107k    0     0   411k      0 --:--:-- --:--:-- --:--:--  412k
  % Total    % Received % Xferd  Average Speed   Time    Time     Time  Current
                                 Dload  Upload   Total   Spent    Left  Speed
  0     0    0     0    0     0      0      0 --:--:-- --:--:-- --:--:--     0100 26434  100 26434    0     0   229k      0 --:--:-- --:--:-- --:--:--  230k
  % Total    % Received % Xferd  Average Speed   Time    Time     Time  Current
                                 Dload  Upload   Total   Spent    Left  Speed
  0     0    0     0    0     0      0      0 --:--:-- --:--:-- --:--:--     0100 26607  100 26607    0     0   252k      0 --:--:-- --:--:-- --:--:--  254k
  % Total    % Received % Xferd  Average Speed   Time    Time     Time  Current
                                 Dload  Upload   Total   Spent    Left  Speed
  0     0    0     0    0     0      0      0 --:--:-- --:--:-- --:--:--     0100 20504  100 20504    0     0   190k      0 --:--:-- --:--:-- --:--:--  190k
  % Total    % Received % Xferd  Average Speed   Time    Time     Time  Current
                                 Dload  Upload   Total   Spent    Left  Speed
  0     0    0     0    0     0      0      0 --:--:-- --:--:-- --:--:--     0100 20559  100 20559    0     0   188k      0 --:--:-- --:--:-- --:--:--  189k
  % Total    % Received % Xferd  Average Speed   Time    Time     Time  Current
                                 Dload  Upload   Total   Spent    Left  Speed
  0     0    0     0    0     0      0      0 --:--:-- --:--:-- --:--:--     0100 40847  100 40847    0     0   368k      0 --:--:-- --:--:-- --:--:--  369k
  % Total    % Received % Xferd  Average Speed   Time    Time     Time  Current
                                 Dload  Upload   Total   Spent    Left  Speed
  0     0    0     0    0     0      0      0 --:--:-- --:--:-- --:--:--     0100 41170  100 41170    0     0   399k      0 --:--:-- --:--:-- --:--:--  402k
  % Total    % Received % Xferd  Average Speed   Time    Time     Time  Current
                                 Dload  Upload   Total   Spent    Left  Speed
  0     0    0     0    0     0      0      0 --:--:-- --:--:-- --:--:--     0100 26704  100 26704    0     0   264k      0 --:--:-- --:--:-- --:--:--  266k
  % Total    % Received % Xferd  Average Speed   Time    Time     Time  Current
                                 Dload  Upload   Total   Spent    Left  Speed
  0     0    0     0    0     0      0      0 --:--:-- --:--:-- --:--:--     0100 26679  100 26679    0     0   241k      0 --:--:-- --:--:-- --:--:--  243k
  % Total    % Received % Xferd  Average Speed   Time    Time     Time  Current
                                 Dload  Upload   Total   Spent    Left  Speed
  0     0    0     0    0     0      0      0 --:--:-- --:--:-- --:--:--     0  4 40196    4  1919    0     0  18409      0  0:00:02 --:--:--  0:00:02 18276100 40196  100 40196    0     0   350k      0 --:--:-- --:--:-- --:--:--  350k
  % Total    % Received % Xferd  Average Speed   Time    Time     Time  Current
                                 Dload  Upload   Total   Spent    Left  Speed
  0     0    0     0    0     0      0      0 --:--:-- --:--:-- --:--:--     0100 40568  100 40568    0     0   334k      0 --:--:-- --:--:-- --:--:--  335k
  % Total    % Received % Xferd  Average Speed   Time    Time     Time  Current
                                 Dload  Upload   Total   Spent    Left  Speed
  0     0    0     0    0     0      0      0 --:--:-- --:--:-- --:--:--     0100  2733  100  2733    0     0  27255      0 --:--:-- --:--:-- --:--:-- 27606
  % Total    % Received % Xferd  Average Speed   Time    Time     Time  Current
                                 Dload  Upload   Total   Spent    Left  Speed
  0     0    0     0    0     0      0      0 --:--:-- --:--:-- --:--:--     0100  2735  100  2735    0     0  26433      0 --:--:-- --:--:-- --:--:-- 26553
  % Total    % Received % Xferd  Average Speed   Time    Time     Time  Current
                                 Dload  Upload   Total   Spent    Left  Speed
  0     0    0     0    0     0      0      0 --:--:-- --:--:-- --:--:--     0100 12759  100 12759    0     0   123k      0 --:--:-- --:--:-- --:--:--  124k
  % Total    % Received % Xferd  Average Speed   Time    Time     Time  Current
                                 Dload  Upload   Total   Spent    Left  Speed
  0     0    0     0    0     0      0      0 --:--:-- --:--:-- --:--:--     0100 12835  100 12835    0     0   118k      0 --:--:-- --:--:-- --:--:--  119k
  % Total    % Received % Xferd  Average Speed   Time    Time     Time  Current
                                 Dload  Upload   Total   Spent    Left  Speed
  0     0    0     0    0     0      0      0 --:--:-- --:--:-- --:--:--     0100 15793  100 15793    0     0   143k      0 --:--:-- --:--:-- --:--:--  144k
  % Total    % Received % Xferd  Average Speed   Time    Time     Time  Current
                                 Dload  Upload   Total   Spent    Left  Speed
  0     0    0     0    0     0      0      0 --:--:-- --:--:-- --:--:--     0100 15951  100 15951    0     0   142k      0 --:--:-- --:--:-- --:--:--  142k
  % Total    % Received % Xferd  Average Speed   Time    Time     Time  Current
                                 Dload  Upload   Total   Spent    Left  Speed
  0     0    0     0    0     0      0      0 --:--:-- --:--:-- --:--:--     0100 25418  100 25418    0     0   232k      0 --:--:-- --:--:-- --:--:--  234k
  % Total    % Received % Xferd  Average Speed   Time    Time     Time  Current
                                 Dload  Upload   Total   Spent    Left  Speed
  0     0    0     0    0     0      0      0 --:--:-- --:--:-- --:--:--     0  7 25650    7  1921    0     0  21572      0  0:00:01 --:--:--  0:00:01 21584100 25650  100 25650    0     0   262k      0 --:--:-- --:--:-- --:--:--  260k
  % Total    % Received % Xferd  Average Speed   Time    Time     Time  Current
                                 Dload  Upload   Total   Spent    Left  Speed
  0     0    0     0    0     0      0      0 --:--:-- --:--:-- --:--:--     0100  5721  100  5721    0     0  59267      0 --:--:-- --:--:-- --:--:-- 59593
  % Total    % Received % Xferd  Average Speed   Time    Time     Time  Current
                                 Dload  Upload   Total   Spent    Left  Speed
  0     0    0     0    0     0      0      0 --:--:-- --:--:-- --:--:--     0100  6423  100  6423    0     0  52589      0 --:--:-- --:--:-- --:--:-- 53082
  % Total    % Received % Xferd  Average Speed   Time    Time     Time  Current
                                 Dload  Upload   Total   Spent    Left  Speed
  0     0    0     0    0     0      0      0 --:--:-- --:--:-- --:--:--     0100 15870  100 15870    0     0   149k      0 --:--:-- --:--:-- --:--:--  150k
  % Total    % Received % Xferd  Average Speed   Time    Time     Time  Current
                                 Dload  Upload   Total   Spent    Left  Speed
  0     0    0     0    0     0      0      0 --:--:-- --:--:-- --:--:--     0100 16024  100 16024    0     0   143k      0 --:--:-- --:--:-- --:--:--  144k
  % Total    % Received % Xferd  Average Speed   Time    Time     Time  Current
                                 Dload  Upload   Total   Spent    Left  Speed
  0     0    0     0    0     0      0      0 --:--:-- --:--:-- --:--:--     0100 19297  100 19297    0     0   180k      0 --:--:-- --:--:-- --:--:--  181k
  % Total    % Received % Xferd  Average Speed   Time    Time     Time  Current
                                 Dload  Upload   Total   Spent    Left  Speed
  0     0    0     0    0     0      0      0 --:--:-- --:--:-- --:--:--     0100 19383  100 19383    0     0   192k      0 --:--:-- --:--:-- --:--:--  193k
  % Total    % Received % Xferd  Average Speed   Time    Time     Time  Current
                                 Dload  Upload   Total   Spent    Left  Speed
  0     0    0     0    0     0      0      0 --:--:-- --:--:-- --:--:--     0100  8404  100  8404    0     0  74843      0 --:--:-- --:--:-- --:--:-- 75035
  % Total    % Received % Xferd  Average Speed   Time    Time     Time  Current
                                 Dload  Upload   Total   Spent    Left  Speed
  0     0    0     0    0     0      0      0 --:--:-- --:--:-- --:--:--     0100  8518  100  8518    0     0  81136      0 --:--:-- --:--:-- --:--:-- 81903
  % Total    % Received % Xferd  Average Speed   Time    Time     Time  Current
                                 Dload  Upload   Total   Spent    Left  Speed
  0     0    0     0    0     0      0      0 --:--:-- --:--:-- --:--:--     0  0     0    0     0    0     0      0      0 --:--:-- --:--:-- --:--:--     0100 15868  100 15868    0     0   152k      0 --:--:-- --:--:-- --:--:--  151k
  % Total    % Received % Xferd  Average Speed   Time    Time     Time  Current
                                 Dload  Upload   Total   Spent    Left  Speed
  0     0    0     0    0     0      0      0 --:--:-- --:--:-- --:--:--     0100 16022  100 16022    0     0   153k      0 --:--:-- --:--:-- --:--:--  154k
  % Total    % Received % Xferd  Average Speed   Time    Time     Time  Current
                                 Dload  Upload   Total   Spent    Left  Speed
  0     0    0     0    0     0      0      0 --:--:-- --:--:-- --:--:--     0100 19295  100 19295    0     0   126k      0 --:--:-- --:--:-- --:--:--  127k
  % Total    % Received % Xferd  Average Speed   Time    Time     Time  Current
                                 Dload  Upload   Total   Spent    Left  Speed
  0     0    0     0    0     0      0      0 --:--:-- --:--:-- --:--:--     0100 19381  100 19381    0     0   183k      0 --:--:-- --:--:-- --:--:--  185k
  % Total    % Received % Xferd  Average Speed   Time    Time     Time  Current
                                 Dload  Upload   Total   Spent    Left  Speed
  0     0    0     0    0     0      0      0 --:--:-- --:--:-- --:--:--     0100  8402  100  8402    0     0  80758      0 --:--:-- --:--:-- --:--:-- 81572
  % Total    % Received % Xferd  Average Speed   Time    Time     Time  Current
                                 Dload  Upload   Total   Spent    Left  Speed
  0     0    0     0    0     0      0      0 --:--:-- --:--:-- --:--:--     0100  8516  100  8516    0     0  76180      0 --:--:-- --:--:-- --:--:-- 76720
  % Total    % Received % Xferd  Average Speed   Time    Time     Time  Current
                                 Dload  Upload   Total   Spent    Left  Speed
  0     0    0     0    0     0      0      0 --:--:-- --:--:-- --:--:--     0100  6674  100  6674    0     0  64432      0 --:--:-- --:--:-- --:--:-- 64796
  % Total    % Received % Xferd  Average Speed   Time    Time     Time  Current
                                 Dload  Upload   Total   Spent    Left  Speed
  0     0    0     0    0     0      0      0 --:--:-- --:--:-- --:--:--     0100  6676  100  6676    0     0  55885      0 --:--:-- --:--:-- --:--:-- 56100
  % Total    % Received % Xferd  Average Speed   Time    Time     Time  Current
                                 Dload  Upload   Total   Spent    Left  Speed
  0     0    0     0    0     0      0      0 --:--:-- --:--:-- --:--:--     0 17 11059   17  1921    0     0  19470      0 --:--:-- --:--:-- --:--:-- 19404100 11059  100 11059    0     0   108k      0 --:--:-- --:--:-- --:--:--  107k
  % Total    % Received % Xferd  Average Speed   Time    Time     Time  Current
                                 Dload  Upload   Total   Spent    Left  Speed
  0     0    0     0    0     0      0      0 --:--:-- --:--:-- --:--:--     0100 11115  100 11115    0     0   111k      0 --:--:-- --:--:-- --:--:--  111k
  % Total    % Received % Xferd  Average Speed   Time    Time     Time  Current
                                 Dload  Upload   Total   Spent    Left  Speed
  0     0    0     0    0     0      0      0 --:--:-- --:--:-- --:--:--     0100  9581  100  9581    0     0   100k      0 --:--:-- --:--:-- --:--:--  100k
  % Total    % Received % Xferd  Average Speed   Time    Time     Time  Current
                                 Dload  Upload   Total   Spent    Left  Speed
  0     0    0     0    0     0      0      0 --:--:-- --:--:-- --:--:--     0100  9629  100  9629    0     0  78885      0 --:--:-- --:--:-- --:--:-- 79578
  % Total    % Received % Xferd  Average Speed   Time    Time     Time  Current
                                 Dload  Upload   Total   Spent    Left  Speed
  0     0    0     0    0     0      0      0 --:--:-- --:--:-- --:--:--     0100 11297  100 11297    0     0   112k      0 --:--:-- --:--:-- --:--:--  113k
  % Total    % Received % Xferd  Average Speed   Time    Time     Time  Current
                                 Dload  Upload   Total   Spent    Left  Speed
  0     0    0     0    0     0      0      0 --:--:-- --:--:-- --:--:--     0100 11341  100 11341    0     0   124k      0 --:--:-- --:--:-- --:--:--  124k
  % Total    % Received % Xferd  Average Speed   Time    Time     Time  Current
                                 Dload  Upload   Total   Spent    Left  Speed
  0     0    0     0    0     0      0      0 --:--:-- --:--:-- --:--:--     0100 91476  100 91476    0     0   798k      0 --:--:-- --:--:-- --:--:--  804k
  % Total    % Received % Xferd  Average Speed   Time    Time     Time  Current
                                 Dload  Upload   Total   Spent    Left  Speed
  0     0    0     0    0     0      0      0 --:--:-- --:--:-- --:--:--     0100 88471  100 88471    0     0   714k      0 --:--:-- --:--:-- --:--:--  719k
  % Total    % Received % Xferd  Average Speed   Time    Time     Time  Current
                                 Dload  Upload   Total   Spent    Left  Speed
  0     0    0     0    0     0      0      0 --:--:-- --:--:-- --:--:--     0100 21693  100 21693    0     0   207k      0 --:--:-- --:--:-- --:--:--  209k
  % Total    % Received % Xferd  Average Speed   Time    Time     Time  Current
                                 Dload  Upload   Total   Spent    Left  Speed
  0     0    0     0    0     0      0      0 --:--:-- --:--:-- --:--:--     0  5 32764    5  1919    0     0  15534      0  0:00:02 --:--:--  0:00:02 15475100 32764  100 32764    0     0   245k      0 --:--:-- --:--:-- --:--:--  244k
  % Total    % Received % Xferd  Average Speed   Time    Time     Time  Current
                                 Dload  Upload   Total   Spent    Left  Speed
  0     0    0     0    0     0      0      0 --:--:-- --:--:-- --:--:--     0100 24774  100 24774    0     0   203k      0 --:--:-- --:--:-- --:--:--  205k
  % Total    % Received % Xferd  Average Speed   Time    Time     Time  Current
                                 Dload  Upload   Total   Spent    Left  Speed
  0     0    0     0    0     0      0      0 --:--:-- --:--:-- --:--:--     0100  105k  100  105k    0     0   823k      0 --:--:-- --:--:-- --:--:--  826k
  % Total    % Received % Xferd  Average Speed   Time    Time     Time  Current
                                 Dload  Upload   Total   Spent    Left  Speed
  0     0    0     0    0     0      0      0 --:--:-- --:--:-- --:--:--     0100 13191  100 13191    0     0   115k      0 --:--:-- --:--:-- --:--:--  116k
  % Total    % Received % Xferd  Average Speed   Time    Time     Time  Current
                                 Dload  Upload   Total   Spent    Left  Speed
  0     0    0     0    0     0      0      0 --:--:-- --:--:-- --:--:--     0100 13193  100 13193    0     0   141k      0 --:--:-- --:--:-- --:--:--  143k
  % Total    % Received % Xferd  Average Speed   Time    Time     Time  Current
                                 Dload  Upload   Total   Spent    Left  Speed
  0     0    0     0    0     0      0      0 --:--:-- --:--:-- --:--:--     0100 31050  100 31050    0     0   266k      0 --:--:-- --:--:-- --:--:--  268k
  % Total    % Received % Xferd  Average Speed   Time    Time     Time  Current
                                 Dload  Upload   Total   Spent    Left  Speed
  0     0    0     0    0     0      0      0 --:--:-- --:--:-- --:--:--     0100 30992  100 30992    0     0   272k      0 --:--:-- --:--:-- --:--:--  272k
  % Total    % Received % Xferd  Average Speed   Time    Time     Time  Current
                                 Dload  Upload   Total   Spent    Left  Speed
  0     0    0     0    0     0      0      0 --:--:-- --:--:-- --:--:--     0100 95115  100 95115    0     0   743k      0 --:--:-- --:--:-- --:--:--  749k
  % Total    % Received % Xferd  Average Speed   Time    Time     Time  Current
                                 Dload  Upload   Total   Spent    Left  Speed
  0     0    0     0    0     0      0      0 --:--:-- --:--:-- --:--:--     0  2 95647    2  1919    0     0  19103      0  0:00:05 --:--:--  0:00:05 19000100 95647  100 95647    0     0   820k      0 --:--:-- --:--:-- --:--:--  819k
  % Total    % Received % Xferd  Average Speed   Time    Time     Time  Current
                                 Dload  Upload   Total   Spent    Left  Speed
  0     0    0     0    0     0      0      0 --:--:-- --:--:-- --:--:--     0100  165k  100  165k    0     0  1245k      0 --:--:-- --:--:-- --:--:-- 1250k
  % Total    % Received % Xferd  Average Speed   Time    Time     Time  Current
                                 Dload  Upload   Total   Spent    Left  Speed
  0     0    0     0    0     0      0      0 --:--:-- --:--:-- --:--:--     0100  165k  100  165k    0     0  1227k      0 --:--:-- --:--:-- --:--:-- 1232k
  % Total    % Received % Xferd  Average Speed   Time    Time     Time  Current
                                 Dload  Upload   Total   Spent    Left  Speed
  0     0    0     0    0     0      0      0 --:--:-- --:--:-- --:--:--     0100 19938  100 19938    0     0   184k      0 --:--:-- --:--:-- --:--:--  185k
  % Total    % Received % Xferd  Average Speed   Time    Time     Time  Current
                                 Dload  Upload   Total   Spent    Left  Speed
  0     0    0     0    0     0      0      0 --:--:-- --:--:-- --:--:--     0100 17830  100 17830    0     0  92143      0 --:--:-- --:--:-- --:--:-- 92383
  % Total    % Received % Xferd  Average Speed   Time    Time     Time  Current
                                 Dload  Upload   Total   Spent    Left  Speed
  0     0    0     0    0     0      0      0 --:--:-- --:--:-- --:--:--     0100 35956  100 35956    0     0   352k      0 --:--:-- --:--:-- --:--:--  354k
  % Total    % Received % Xferd  Average Speed   Time    Time     Time  Current
                                 Dload  Upload   Total   Spent    Left  Speed
  0     0    0     0    0     0      0      0 --:--:-- --:--:-- --:--:--     0100 93449  100 93449    0     0   709k      0 --:--:-- --:--:-- --:--:--  712k
  % Total    % Received % Xferd  Average Speed   Time    Time     Time  Current
                                 Dload  Upload   Total   Spent    Left  Speed
  0     0    0     0    0     0      0      0 --:--:-- --:--:-- --:--:--     0 14 13739   14  1919    0     0  17640      0 --:--:-- --:--:-- --:--:-- 17605100 13739  100 13739    0     0   117k      0 --:--:-- --:--:-- --:--:--  117k
  % Total    % Received % Xferd  Average Speed   Time    Time     Time  Current
                                 Dload  Upload   Total   Spent    Left  Speed
  0     0    0     0    0     0      0      0 --:--:-- --:--:-- --:--:--     0100 23124  100 23124    0     0   174k      0 --:--:-- --:--:-- --:--:--  175k
INFO: Testing RigidBodyTreeInspector
Test Summary:   |
chain mechanism | No tests
Test Summary:    |
attach mechanism | No tests
Test Summary:            |
simulation and animation | No tests
WARNING: parse_urdf(urdf::AbstractString, mechanism::Mechanism; kwargs...) is deprecated, use visual_elements(mechanism, URDFVisuals(urdf; kwargs...)) instead.
Stacktrace:
 [1] depwarn(::String, ::Symbol) at ./deprecated.jl:70
 [2] #parse_urdf#24(::Array{Any,1}, ::Function, ::String, ::RigidBodyDynamics.Mechanism{Float64}) at ./deprecated.jl:57
 [3] parse_urdf(::String, ::RigidBodyDynamics.Mechanism{Float64}) at ./deprecated.jl:57
 [4] macro expansion at /home/vagrant/.julia/v0.6/RigidBodyTreeInspector/test/runtests.jl:39 [inlined]
 [5] macro expansion at ./test.jl:860 [inlined]
 [6] anonymous at ./<missing>:?
 [7] include_from_node1(::String) at ./loading.jl:576
 [8] include(::String) at ./sysimg.jl:14
 [9] process_options(::Base.JLOptions) at ./client.jl:305
 [10] _start() at ./client.jl:371
while loading /home/vagrant/.julia/v0.6/RigidBodyTreeInspector/test/runtests.jl, in expression starting on line 36
Test Summary:  |
urdf mechanism | No tests
WARNING: parse_urdf(urdf::AbstractString, mechanism::Mechanism; kwargs...) is deprecated, use visual_elements(mechanism, URDFVisuals(urdf; kwargs...)) instead.
Stacktrace:
 [1] depwarn(::String, ::Symbol) at ./deprecated.jl:70
 [2] #parse_urdf#24(::Array{Any,1}, ::Function, ::String, ::RigidBodyDynamics.Mechanism{Float64}) at ./deprecated.jl:57
 [3] parse_urdf(::String, ::RigidBodyDynamics.Mechanism{Float64}) at ./deprecated.jl:57
 [4] macro expansion at /home/vagrant/.julia/v0.6/RigidBodyTreeInspector/test/runtests.jl:49 [inlined]
 [5] macro expansion at ./test.jl:860 [inlined]
 [6] anonymous at ./<missing>:?
 [7] include_from_node1(::String) at ./loading.jl:576
 [8] include(::String) at ./sysimg.jl:14
 [9] process_options(::Base.JLOptions) at ./client.jl:305
 [10] _start() at ./client.jl:371
while loading /home/vagrant/.julia/v0.6/RigidBodyTreeInspector/test/runtests.jl, in expression starting on line 46
Test Summary:          |
visualizer constructor | No tests
WARNING: parse_urdf(urdf::AbstractString, mechanism::Mechanism; kwargs...) is deprecated, use visual_elements(mechanism, URDFVisuals(urdf; kwargs...)) instead.
Stacktrace:
 [1] depwarn(::String, ::Symbol) at ./deprecated.jl:70
 [2] #parse_urdf#24(::Array{Any,1}, ::Function, ::String, ::RigidBodyDynamics.Mechanism{Float64}) at ./deprecated.jl:57
 [3] parse_urdf(::String, ::RigidBodyDynamics.Mechanism{Float64}) at ./deprecated.jl:57
 [4] macro expansion at /home/vagrant/.julia/v0.6/RigidBodyTreeInspector/test/runtests.jl:55 [inlined]
 [5] macro expansion at ./test.jl:860 [inlined]
 [6] anonymous at ./<missing>:?
 [7] include_from_node1(::String) at ./loading.jl:576
 [8] include(::String) at ./sysimg.jl:14
 [9] process_options(::Base.JLOptions) at ./client.jl:305
 [10] _start() at ./client.jl:371
while loading /home/vagrant/.julia/v0.6/RigidBodyTreeInspector/test/runtests.jl, in expression starting on line 52
Test Summary:      |
geometry additions | No tests
[NbConvertApp] Converting notebook ../examples/demo.ipynb to notebook
[NbConvertApp] Executing notebook with kernel: julia-0.6
Starting kernel event loops.
[NbConvertApp] Writing 28431 bytes to ../examples/demo.nbconvert.ipynb
[NbConvertApp] Converting notebook ../examples/urdf.ipynb to notebook
[NbConvertApp] Executing notebook with kernel: julia-0.6
Starting kernel event loops.
[NbConvertApp] Writing 127709 bytes to ../examples/urdf.nbconvert.ipynb
Test Summary: |
notebooks     | No tests
INFO: RigidBodyTreeInspector tests passed
INFO: Removing Conda v1.0.0
INFO: Removing IJulia v1.9.1
INFO: Removing ValkyrieRobot v0.0.2
INFO: Removing VersionParsing v1.1.1
INFO: Removing ZMQ v0.6.3

>>> End of log
