>>> 'Pkg.add("ScikitLearn")' log
INFO: Cloning cache of ScikitLearn from https://github.com/cstjean/ScikitLearn.jl.git
INFO: Installing BinDeps v0.6.0
INFO: Installing Conda v0.7.0
INFO: Installing DataArrays v0.6.2
INFO: Installing DataFrames v0.10.1
INFO: Installing DataStructures v0.6.1
INFO: Installing FileIO v0.5.1
INFO: Installing GZip v0.3.0
INFO: Installing Iterators v0.3.1
INFO: Installing MacroTools v0.3.7
INFO: Installing Parameters v0.7.2
INFO: Installing PyCall v1.14.0
INFO: Installing Reexport v0.0.3
INFO: Installing SHA v0.5.1
INFO: Installing ScikitLearn v0.3.0
INFO: Installing ScikitLearnBase v0.3.0
INFO: Installing SortingAlgorithms v0.1.1
INFO: Installing SpecialFunctions v0.3.1
INFO: Installing StatsBase v0.18.0
INFO: Installing URIParser v0.2.0
INFO: Building Conda
INFO: Building PyCall
INFO: Using the Python distribution in the Conda package by default.
To use a different Python version, set ENV["PYTHON"]="pythoncommand" and re-run Pkg.build("PyCall").
INFO: PyCall is using /home/vagrant/.julia/v0.6/Conda/deps/usr/bin/python (Python 2.7.13) at /home/vagrant/.julia/v0.6/Conda/deps/usr/bin/python, libpython = /home/vagrant/.julia/v0.6/Conda/deps/usr/lib/libpython2.7
INFO: /home/vagrant/.julia/v0.6/PyCall/deps/deps.jl has not changed
INFO: /home/vagrant/.julia/v0.6/PyCall/deps/PYTHON has not changed
INFO: Package database updated
INFO: METADATA is out-of-date — you may not have the latest version of ScikitLearn
INFO: Use `Pkg.update()` to get the latest versions of your packages

>>> 'Pkg.test("ScikitLearn")' log
Julia Version 0.6.0
Commit 9036443 (2017-06-19 13:05 UTC)
Platform Info:
  OS: Linux (x86_64-pc-linux-gnu)
  CPU: Intel(R) Xeon(R) CPU E3-1241 v3 @ 3.50GHz
  WORD_SIZE: 64
           Ubuntu 14.04.5 LTS
  uname: Linux 3.13.0-128-generic #177-Ubuntu SMP Tue Aug 8 11:40:23 UTC 2017 x86_64 x86_64
Memory: 2.9392738342285156 GB (1187.2734375 MB free)
Uptime: 64584.0 sec
Load Avg:  1.02587890625  1.064453125  1.2734375
Intel(R) Xeon(R) CPU E3-1241 v3 @ 3.50GHz: 
       speed         user         nice          sys         idle          irq
#1  3498 MHz    4185444 s       2054 s     189059 s    1044671 s         73 s
#2  3498 MHz     868005 s       4578 s      92634 s    5352498 s          2 s

  BLAS: libopenblas (USE64BITINT DYNAMIC_ARCH NO_AFFINITY Nehalem)
  LAPACK: libopenblas64_
  LIBM: libopenlibm
  LLVM: libLLVM-3.9.1 (ORCJIT, haswell)
Environment:
  TERM = vt100
  LD_LIBRARY_PATH = :/usr/local/lib/
  PATH = /usr/local/sbin:/usr/local/bin:/usr/sbin:/usr/bin:/sbin:/bin:/usr/games:/usr/local/games:/home/vagrant/julia/bin/
  JAVA_HOME = /usr/lib/jvm/java-8-openjdk-amd64
  HOME = /home/vagrant

Package Directory: /home/vagrant/.julia/v0.6
2 required packages:
 - JSON                          0.13.0
 - ScikitLearn                   0.3.0
19 additional packages:
 - BinDeps                       0.6.0
 - Compat                        0.30.0
 - Conda                         0.7.0
 - DataArrays                    0.6.2
 - DataFrames                    0.10.1
 - DataStructures                0.6.1
 - FileIO                        0.5.1
 - GZip                          0.3.0
 - Iterators                     0.3.1
 - MacroTools                    0.3.7
 - Parameters                    0.7.2
 - PyCall                        1.14.0
 - Reexport                      0.0.3
 - SHA                           0.5.1
 - ScikitLearnBase               0.3.0
 - SortingAlgorithms             0.1.1
 - SpecialFunctions              0.3.1
 - StatsBase                     0.18.0
 - URIParser                     0.2.0
INFO: Computing test dependencies for ScikitLearn...
INFO: Cloning cache of DecisionTree from https://github.com/bensadeghi/DecisionTree.jl.git
INFO: Cloning cache of GaussianMixtures from https://github.com/davidavdav/GaussianMixtures.jl.git
INFO: Cloning cache of GaussianProcesses from https://github.com/STOR-i/GaussianProcesses.jl.git
INFO: Installing ArrayViews v0.6.4
INFO: Installing Blosc v0.3.0
INFO: Installing Calculus v0.2.2
INFO: Installing Clustering v0.8.0
INFO: Installing ColorTypes v0.6.1
INFO: Installing Colors v0.8.1
INFO: Installing CommonSubexpressions v0.0.1
INFO: Installing DecisionTree v0.6.2
INFO: Installing DiffBase v0.2.0
INFO: Installing Distances v0.5.0
INFO: Installing Distributions v0.14.2
INFO: Installing FixedPointNumbers v0.4.0
INFO: Installing ForwardDiff v0.5.0
INFO: Installing GaussianMixtures v0.1.0
INFO: Installing GaussianProcesses v0.4.0
INFO: Installing HDF5 v0.8.5
INFO: Installing JLD v0.8.1
INFO: Installing LaTeXStrings v0.2.1
INFO: Installing LegacyStrings v0.2.2
INFO: Installing LineSearches v2.2.1
INFO: Installing LowRankModels v0.2.0
INFO: Installing NBInclude v1.2.0
INFO: Installing NLSolversBase v2.1.3
INFO: Installing NMF v0.2.5
INFO: Installing NaNMath v0.2.6
INFO: Installing NearestNeighbors v0.3.0
INFO: Installing Optim v0.9.3
INFO: Installing PDMats v0.7.0
INFO: Installing PositiveFactorizations v0.0.4
INFO: Installing PyPlot v2.3.2
INFO: Installing QuadGK v0.1.3
INFO: Installing RData v0.1.0
INFO: Installing RDatasets v0.2.0
INFO: Installing RealInterface v0.0.3
INFO: Installing Rmath v0.3.0
INFO: Installing Roots v0.4.1
INFO: Installing StaticArrays v0.6.2
INFO: Installing StatsFuns v0.5.0
INFO: Building Blosc
INFO: Building Rmath
INFO: Building HDF5
WARNING: Compat.ASCIIString is deprecated, use String instead.
  likely near /home/vagrant/.julia/v0.6/HDF5/deps/build.jl:39
INFO: Building Conda
INFO: Building PyCall
INFO: Using the Python distribution in the Conda package by default.
To use a different Python version, set ENV["PYTHON"]="pythoncommand" and re-run Pkg.build("PyCall").
INFO: PyCall is using /home/vagrant/.julia/v0.6/Conda/deps/usr/bin/python (Python 2.7.13) at /home/vagrant/.julia/v0.6/Conda/deps/usr/bin/python, libpython = /home/vagrant/.julia/v0.6/Conda/deps/usr/lib/libpython2.7
INFO: /home/vagrant/.julia/v0.6/PyCall/deps/deps.jl has not changed
INFO: /home/vagrant/.julia/v0.6/PyCall/deps/PYTHON has not changed
INFO: Testing ScikitLearn
INFO: Installing sklearn via the Conda scikit-learn package...
Fetching package metadata ...........
Solving package specifications: .

Package plan for installation in environment /home/vagrant/.julia/v0.6/Conda/deps/usr:

The following NEW packages will be INSTALLED:

    scikit-learn: 0.19.0-py27_blas_openblas_201 conda-forge [blas_openblas]

scikit-learn-0   0% |                              | ETA:  --:--:--   0.00  B/sscikit-learn-0   1% |                               | ETA:  0:00:06   1.86 MB/sscikit-learn-0   2% |                               | ETA:  0:00:04   2.77 MB/sscikit-learn-0   3% |#                              | ETA:  0:00:03   3.35 MB/sscikit-learn-0   4% |#                              | ETA:  0:00:03   4.01 MB/sscikit-learn-0   5% |#                              | ETA:  0:00:02   4.59 MB/sscikit-learn-0   6% |##                             | ETA:  0:00:02   5.10 MB/sscikit-learn-0   7% |##                             | ETA:  0:00:02   5.54 MB/sscikit-learn-0   8% |##                             | ETA:  0:00:01   5.98 MB/sscikit-learn-0  10% |###                            | ETA:  0:00:01   6.61 MB/sscikit-learn-0  11% |###                            | ETA:  0:00:01   6.92 MB/sscikit-learn-0  12% |###                            | ETA:  0:00:01   7.55 MB/sscikit-learn-0  13% |####                           | ETA:  0:00:01   7.80 MB/sscikit-learn-0  14% |####                           | ETA:  0:00:01   8.11 MB/sscikit-learn-0  15% |####                           | ETA:  0:00:01   8.59 MB/sscikit-learn-0  16% |#####                          | ETA:  0:00:01   9.14 MB/sscikit-learn-0  17% |#####                          | ETA:  0:00:01   9.31 MB/sscikit-learn-0  19% |#####                          | ETA:  0:00:01   9.83 MB/sscikit-learn-0  20% |######                         | ETA:  0:00:01   9.96 MB/sscikit-learn-0  21% |######                         | ETA:  0:00:00  10.45 MB/sscikit-learn-0  22% |######                         | ETA:  0:00:00  10.70 MB/sscikit-learn-0  23% |#######                        | ETA:  0:00:00  11.05 MB/sscikit-learn-0  24% |#######                        | ETA:  0:00:00  11.50 MB/sscikit-learn-0  25% |########                       | ETA:  0:00:00  11.67 MB/sscikit-learn-0  26% |########                       | ETA:  0:00:00  12.03 MB/sscikit-learn-0  28% |########                       | ETA:  0:00:00  12.46 MB/sscikit-learn-0  29% |#########                      | ETA:  0:00:00  12.60 MB/sscikit-learn-0  30% |#########                      | ETA:  0:00:00  12.95 MB/sscikit-learn-0  31% |#########                      | ETA:  0:00:00  13.35 MB/sscikit-learn-0  32% |##########                     | ETA:  0:00:00  13.58 MB/sscikit-learn-0  33% |##########                     | ETA:  0:00:00  13.81 MB/sscikit-learn-0  34% |##########                     | ETA:  0:00:00  14.20 MB/sscikit-learn-0  35% |###########                    | ETA:  0:00:00  14.58 MB/sscikit-learn-0  37% |###########                    | ETA:  0:00:00  14.69 MB/sscikit-learn-0  38% |###########                    | ETA:  0:00:00  14.99 MB/sscikit-learn-0  39% |############                   | ETA:  0:00:00  15.36 MB/sscikit-learn-0  40% |############                   | ETA:  0:00:00  15.72 MB/sscikit-learn-0  41% |############                   | ETA:  0:00:00  15.75 MB/sscikit-learn-0  42% |#############                  | ETA:  0:00:00  16.09 MB/sscikit-learn-0  43% |#############                  | ETA:  0:00:00  16.43 MB/sscikit-learn-0  44% |#############                  | ETA:  0:00:00  16.78 MB/sscikit-learn-0  46% |##############                 | ETA:  0:00:00  16.92 MB/sscikit-learn-0  47% |##############                 | ETA:  0:00:00  17.15 MB/sscikit-learn-0  48% |##############                 | ETA:  0:00:00  17.48 MB/sscikit-learn-0  49% |###############                | ETA:  0:00:00  17.81 MB/sscikit-learn-0  50% |###############                | ETA:  0:00:00  18.05 MB/sscikit-learn-0  51% |################               | ETA:  0:00:00  18.15 MB/sscikit-learn-0  52% |################               | ETA:  0:00:00  18.46 MB/sscikit-learn-0  53% |################               | ETA:  0:00:00  18.78 MB/sscikit-learn-0  55% |#################              | ETA:  0:00:00  19.07 MB/sscikit-learn-0  56% |#################              | ETA:  0:00:00  19.24 MB/sscikit-learn-0  57% |#################              | ETA:  0:00:00  19.40 MB/sscikit-learn-0  58% |##################             | ETA:  0:00:00  19.69 MB/sscikit-learn-0  59% |##################             | ETA:  0:00:00  19.99 MB/sscikit-learn-0  60% |##################             | ETA:  0:00:00  20.29 MB/sscikit-learn-0  61% |###################            | ETA:  0:00:00  20.43 MB/sscikit-learn-0  62% |###################            | ETA:  0:00:00  20.58 MB/sscikit-learn-0  64% |###################            | ETA:  0:00:00  20.85 MB/sscikit-learn-0  65% |####################           | ETA:  0:00:00  21.13 MB/sscikit-learn-0  66% |####################           | ETA:  0:00:00  21.36 MB/sscikit-learn-0  67% |####################           | ETA:  0:00:00  21.45 MB/sscikit-learn-0  68% |#####################          | ETA:  0:00:00  21.64 MB/sscikit-learn-0  69% |#####################          | ETA:  0:00:00  21.91 MB/sscikit-learn-0  70% |#####################          | ETA:  0:00:00  22.17 MB/sscikit-learn-0  71% |######################         | ETA:  0:00:00  22.24 MB/sscikit-learn-0  73% |######################         | ETA:  0:00:00  22.36 MB/sscikit-learn-0  74% |#######################        | ETA:  0:00:00  22.62 MB/sscikit-learn-0  75% |#######################        | ETA:  0:00:00  22.87 MB/sscikit-learn-0  76% |#######################        | ETA:  0:00:00  22.92 MB/sscikit-learn-0  77% |########################       | ETA:  0:00:00  22.98 MB/sscikit-learn-0  78% |########################       | ETA:  0:00:00  23.22 MB/sscikit-learn-0  79% |########################       | ETA:  0:00:00  23.35 MB/sscikit-learn-0  80% |#########################      | ETA:  0:00:00  23.46 MB/sscikit-learn-0  82% |#########################      | ETA:  0:00:00  23.56 MB/sscikit-learn-0  83% |#########################      | ETA:  0:00:00  23.77 MB/sscikit-learn-0  84% |##########################     | ETA:  0:00:00  23.92 MB/sscikit-learn-0  85% |##########################     | ETA:  0:00:00  24.15 MB/sscikit-learn-0  86% |##########################     | ETA:  0:00:00  24.39 MB/sscikit-learn-0  87% |###########################    | ETA:  0:00:00  24.63 MB/sscikit-learn-0  88% |###########################    | ETA:  0:00:00  24.85 MB/sscikit-learn-0  89% |###########################    | ETA:  0:00:00  25.08 MB/sscikit-learn-0  91% |############################   | ETA:  0:00:00  25.31 MB/sscikit-learn-0  92% |############################   | ETA:  0:00:00  25.53 MB/sscikit-learn-0  93% |############################   | ETA:  0:00:00  25.76 MB/sscikit-learn-0  94% |#############################  | ETA:  0:00:00  25.99 MB/sscikit-learn-0  95% |#############################  | ETA:  0:00:00  26.22 MB/sscikit-learn-0  96% |#############################  | ETA:  0:00:00  26.44 MB/sscikit-learn-0  97% |############################## | ETA:  0:00:00  26.65 MB/sscikit-learn-0  98% |############################## | ETA:  0:00:00  26.87 MB/sscikit-learn-0 100% |###############################| ETA:  0:00:00  27.07 MB/sscikit-learn-0 100% |###############################| Time: 0:00:00  27.06 MB/s
WARNING: redefining constant SVC
WARNING: redefining constant f_classif
WARNING: The least populated class in y has only 2 members, which is too few. The minimum number of labels for any class cannot be less than n_folds=3.
WARNING: The least populated class in y has only 2 members, which is too few. The minimum number of labels for any class cannot be less than n_folds=3.
WARNING: The least populated class in y has only 2 members, which is too few. The minimum number of labels for any class cannot be less than n_folds=3.
WARNING: The least populated class in y has only 2 members, which is too few. The minimum number of labels for any class cannot be less than n_folds=3.
WARNING: The least populated class in y has only 2 members, which is too few. The minimum number of labels for any class cannot be less than n_folds=3.
WARNING: The least populated class in y has only 2 members, which is too few. The minimum number of labels for any class cannot be less than n_folds=3.
WARNING: The least populated class in y has only 2 members, which is too few. The minimum number of labels for any class cannot be less than n_folds=3.
WARNING: The least populated class in y has only 2 members, which is too few. The minimum number of labels for any class cannot be less than n_folds=3.
WARNING: The least populated class in y has only 2 members, which is too few. The minimum number of labels for any class cannot be less than n_folds=3.
WARNING: The least populated class in y has only 2 members, which is too few. The minimum number of labels for any class cannot be less than n_folds=3.
WARNING: The least populated class in y has only 2 members, which is too few. The minimum number of labels for any class cannot be less than n_folds=3.
WARNING: The least populated class in y has only 2 members, which is too few. The minimum number of labels for any class cannot be less than n_folds=3.
WARNING: The least populated class in y has only 2 members, which is too few. The minimum number of labels for any class cannot be less than n_folds=3.
WARNING: The least populated class in y has only 2 members, which is too few. The minimum number of labels for any class cannot be less than n_folds=3.
WARNING: The least populated class in y has only 2 members, which is too few. The minimum number of labels for any class cannot be less than n_folds=3.
WARNING: The least populated class in y has only 2 members, which is too few. The minimum number of labels for any class cannot be less than n_folds=3.
WARNING: The least populated class in y has only 2 members, which is too few. The minimum number of labels for any class cannot be less than n_folds=3.
WARNING: The least populated class in y has only 2 members, which is too few. The minimum number of labels for any class cannot be less than n_folds=3.
WARNING: The least populated class in y has only 2 members, which is too few. The minimum number of labels for any class cannot be less than n_folds=3.
WARNING: The least populated class in y has only 2 members, which is too few. The minimum number of labels for any class cannot be less than n_folds=3.
WARNING: The least populated class in y has only 2 members, which is too few. The minimum number of labels for any class cannot be less than n_folds=3.
WARNING: redefining constant LogisticRegression
WARNING: @test_approx_eq_eps is deprecated, use `@test cross_val_score(LogisticRegression(random_state=25), X, y; cv=5) ≈ [1.0, 0.96666666667, 0.9333333333, 0.9, 1.0] atol=0.0001` instead
Stacktrace:
 [1] depwarn(::String, ::Symbol) at ./deprecated.jl:70
 [2] @test_approx_eq_eps(::ANY, ::ANY, ::ANY) at ./deprecated.jl:1039
 [3] include_from_node1(::String) at ./loading.jl:569
 [4] include(::String) at ./sysimg.jl:14
 [5] include_from_node1(::String) at ./loading.jl:569
 [6] include(::String) at ./sysimg.jl:14
 [7] process_options(::Base.JLOptions) at ./client.jl:305
 [8] _start() at ./client.jl:371
while loading /home/vagrant/.julia/v0.6/ScikitLearn/test/test_quickstart.jl, in expression starting on line 24
WARNING: redefining constant StandardScaler
WARNING: isna(x::AbstractArray) is deprecated, use isna.(x) instead.
Stacktrace:
 [1] depwarn(::String, ::Symbol) at ./deprecated.jl:70
 [2] isna(::DataArrays.DataArray{Int64,1}) at ./deprecated.jl:57
 [3] _maybe_convert_NA(::ScikitLearn.DataFrameMapper, ::DataFrames.DataFrame) at /home/vagrant/.julia/v0.6/ScikitLearn/src/dataframes.jl:116
 [4] #fit!#13(::Array{Any,1}, ::Function, ::ScikitLearn.DataFrameMapper, ::DataFrames.DataFrame, ::Void) at /home/vagrant/.julia/v0.6/ScikitLearn/src/dataframes.jl:133
 [5] #fit_transform!#16(::Array{Any,1}, ::Function, ::ScikitLearn.DataFrameMapper, ::DataFrames.DataFrame, ::Void) at /home/vagrant/.julia/v0.6/ScikitLearnBase/src/ScikitLearnBase.jl:152
 [6] fit_transform!(::ScikitLearn.DataFrameMapper, ::DataFrames.DataFrame) at /home/vagrant/.julia/v0.6/ScikitLearnBase/src/ScikitLearnBase.jl:152
 [7] include_from_node1(::String) at ./loading.jl:569
 [8] include(::String) at ./sysimg.jl:14
 [9] include_from_node1(::String) at ./loading.jl:569
 [10] include(::String) at ./sysimg.jl:14
 [11] process_options(::Base.JLOptions) at ./client.jl:305
 [12] _start() at ./client.jl:371
while loading /home/vagrant/.julia/v0.6/ScikitLearn/test/test_dataframes.jl, in expression starting on line 32
Testing ../examples/Classifier_Comparison.ipynb
WARNING: No working GUI backend found for matplotlib
/home/vagrant/.julia/v0.6/Conda/deps/usr/lib/python2.7/site-packages/sklearn/cross_validation.py:41: DeprecationWarning: This module was deprecated in version 0.18 in favor of the model_selection module into which all the refactored classes and functions are moved. Also note that the interface of the new CV iterators are different from that of this module. This module will be removed in 0.20.
  "This module will be removed in 0.20.", DeprecationWarning)
Testing ../examples/Classifier_Comparison_Julia.ipynb
WARNING: replacing module Testing
Testing ../examples/Clustering_Comparison.ipynb
WARNING: replacing module Testing
/home/vagrant/.julia/v0.6/Conda/deps/usr/lib/python2.7/site-packages/sklearn/manifold/spectral_embedding_.py:234: UserWarning: Graph is not fully connected, spectral embedding may not work as expected.
  warnings.warn("Graph is not fully connected, spectral embedding"
/home/vagrant/.julia/v0.6/Conda/deps/usr/lib/python2.7/site-packages/sklearn/cluster/hierarchical.py:193: UserWarning: the number of connected components of the connectivity matrix is 2 > 1. Completing it to avoid stopping the tree early.
  affinity='euclidean')
/home/vagrant/.julia/v0.6/Conda/deps/usr/lib/python2.7/site-packages/sklearn/cluster/hierarchical.py:426: UserWarning: the number of connected components of the connectivity matrix is 2 > 1. Completing it to avoid stopping the tree early.
  affinity=affinity)
/home/vagrant/.julia/v0.6/Conda/deps/usr/lib/python2.7/site-packages/sklearn/cluster/hierarchical.py:193: UserWarning: the number of connected components of the connectivity matrix is 3 > 1. Completing it to avoid stopping the tree early.
  affinity='euclidean')
/home/vagrant/.julia/v0.6/Conda/deps/usr/lib/python2.7/site-packages/sklearn/cluster/hierarchical.py:426: UserWarning: the number of connected components of the connectivity matrix is 3 > 1. Completing it to avoid stopping the tree early.
  affinity=affinity)
Testing ../examples/Cross_Validated_Predictions.ipynb
WARNING: replacing module Testing
Testing ../examples/Decision_Tree_Regression.ipynb
WARNING: replacing module Testing
Testing ../examples/Decision_Tree_Regression_Julia.ipynb
WARNING: replacing module Testing
WARNING: sin{T <: Number}(x::AbstractArray{T}) is deprecated, use sin.(x) instead.
Stacktrace:
 [1] depwarn(::String, ::Symbol) at ./deprecated.jl:70
 [2] sin(::Array{Float64,1}) at ./deprecated.jl:57
 [3] include_string(::String, ::String) at ./loading.jl:515
 [4] my_include_string(::String, ::String, ::String) at /home/vagrant/.julia/v0.6/NBInclude/src/NBInclude.jl:31
 [5] #nbinclude#1(::Bool, ::UnitRange{Int64}, ::Regex, ::Base.#identity, ::Function, ::String) at /home/vagrant/.julia/v0.6/NBInclude/src/NBInclude.jl:112
 [6] nbinclude(::String) at /home/vagrant/.julia/v0.6/NBInclude/src/NBInclude.jl:76
 [7] run_examples() at /home/vagrant/.julia/v0.6/ScikitLearn/test/runtests.jl:36
 [8] include_from_node1(::String) at ./loading.jl:569
 [9] include(::String) at ./sysimg.jl:14
 [10] process_options(::Base.JLOptions) at ./client.jl:305
 [11] _start() at ./client.jl:371
while loading /home/vagrant/.julia/v0.6/ScikitLearn/test/../examples/Decision_Tree_Regression_Julia.ipynb:In[1], in expression starting on line 9
Testing ../examples/Density_Estimation.ipynb
WARNING: replacing module Testing
/home/vagrant/.julia/v0.6/Conda/deps/usr/lib/python2.7/site-packages/sklearn/utils/deprecation.py:57: DeprecationWarning: Class GMM is deprecated; The class GMM is deprecated in 0.18 and will be  removed in 0.20. Use class GaussianMixture instead.
  warnings.warn(msg, category=DeprecationWarning)
/home/vagrant/.julia/v0.6/Conda/deps/usr/lib/python2.7/site-packages/sklearn/utils/deprecation.py:75: DeprecationWarning: Function distribute_covar_matrix_to_match_covariance_type is deprecated; The function distribute_covar_matrix_to_match_covariance_typeis deprecated in 0.18 and will be removed in 0.20.
  warnings.warn(msg, category=DeprecationWarning)
/home/vagrant/.julia/v0.6/Conda/deps/usr/lib/python2.7/site-packages/sklearn/utils/deprecation.py:75: DeprecationWarning: Function log_multivariate_normal_density is deprecated; The function log_multivariate_normal_density is deprecated in 0.18 and will be removed in 0.20.
  warnings.warn(msg, category=DeprecationWarning)
/home/vagrant/.julia/v0.6/Conda/deps/usr/lib/python2.7/site-packages/sklearn/utils/deprecation.py:75: DeprecationWarning: Function log_multivariate_normal_density is deprecated; The function log_multivariate_normal_density is deprecated in 0.18 and will be removed in 0.20.
  warnings.warn(msg, category=DeprecationWarning)
/home/vagrant/.julia/v0.6/Conda/deps/usr/lib/python2.7/site-packages/sklearn/utils/deprecation.py:75: DeprecationWarning: Function log_multivariate_normal_density is deprecated; The function log_multivariate_normal_density is deprecated in 0.18 and will be removed in 0.20.
  warnings.warn(msg, category=DeprecationWarning)
/home/vagrant/.julia/v0.6/Conda/deps/usr/lib/python2.7/site-packages/sklearn/utils/deprecation.py:75: DeprecationWarning: Function log_multivariate_normal_density is deprecated; The function log_multivariate_normal_density is deprecated in 0.18 and will be removed in 0.20.
  warnings.warn(msg, category=DeprecationWarning)
/home/vagrant/.julia/v0.6/Conda/deps/usr/lib/python2.7/site-packages/sklearn/utils/deprecation.py:75: DeprecationWarning: Function log_multivariate_normal_density is deprecated; The function log_multivariate_normal_density is deprecated in 0.18 and will be removed in 0.20.
  warnings.warn(msg, category=DeprecationWarning)
/home/vagrant/.julia/v0.6/Conda/deps/usr/lib/python2.7/site-packages/sklearn/utils/deprecation.py:75: DeprecationWarning: Function log_multivariate_normal_density is deprecated; The function log_multivariate_normal_density is deprecated in 0.18 and will be removed in 0.20.
  warnings.warn(msg, category=DeprecationWarning)
Testing ../examples/Feature_Stacker.ipynb
WARNING: replacing module Testing
Fitting 3 folds for each of 18 candidates, totalling 54 fits
[CV] svm__C=0.1, features__univ_select__k=1, features__pca__n_components=1
[CV] svm__C=0.1, features__univ_select__k=1, features__pca__n_components=1, score=0.96078  -  0.0s
[CV] svm__C=0.1, features__univ_select__k=1, features__pca__n_components=1
[CV] svm__C=0.1, features__univ_select__k=1, features__pca__n_components=1, score=0.90196  -  0.0s
[CV] svm__C=0.1, features__univ_select__k=1, features__pca__n_components=1
[CV] svm__C=0.1, features__univ_select__k=1, features__pca__n_components=1, score=0.97917  -  0.0s
[CV] svm__C=1.0, features__univ_select__k=1, features__pca__n_components=1
[CV] svm__C=1.0, features__univ_select__k=1, features__pca__n_components=1, score=0.94118  -  0.0s
[CV] svm__C=1.0, features__univ_select__k=1, features__pca__n_components=1
[CV] svm__C=1.0, features__univ_select__k=1, features__pca__n_components=1, score=0.92157  -  0.0s
[CV] svm__C=1.0, features__univ_select__k=1, features__pca__n_components=1
[CV] svm__C=1.0, features__univ_select__k=1, features__pca__n_components=1, score=0.97917  -  0.0s
[CV] svm__C=10.0, features__univ_select__k=1, features__pca__n_components=1
[CV] svm__C=10.0, features__univ_select__k=1, features__pca__n_components=1, score=0.96078  -  0.0s
[CV] svm__C=10.0, features__univ_select__k=1, features__pca__n_components=1
[CV] svm__C=10.0, features__univ_select__k=1, features__pca__n_components=1, score=0.92157  -  0.0s
[CV] svm__C=10.0, features__univ_select__k=1, features__pca__n_components=1
[CV] svm__C=10.0, features__univ_select__k=1, features__pca__n_components=1, score=0.97917  -  0.0s
[CV] svm__C=0.1, features__univ_select__k=2, features__pca__n_components=1
[CV] svm__C=0.1, features__univ_select__k=2, features__pca__n_components=1, score=0.96078  -  0.0s
[CV] svm__C=0.1, features__univ_select__k=2, features__pca__n_components=1
[CV] svm__C=0.1, features__univ_select__k=2, features__pca__n_components=1, score=0.92157  -  0.0s
[CV] svm__C=0.1, features__univ_select__k=2, features__pca__n_components=1
[CV] svm__C=0.1, features__univ_select__k=2, features__pca__n_components=1, score=0.97917  -  0.0s
[CV] svm__C=1.0, features__univ_select__k=2, features__pca__n_components=1
[CV] svm__C=1.0, features__univ_select__k=2, features__pca__n_components=1, score=0.96078  -  0.0s
[CV] svm__C=1.0, features__univ_select__k=2, features__pca__n_components=1
[CV] svm__C=1.0, features__univ_select__k=2, features__pca__n_components=1, score=0.92157  -  0.0s
[CV] svm__C=1.0, features__univ_select__k=2, features__pca__n_components=1
[CV] svm__C=1.0, features__univ_select__k=2, features__pca__n_components=1, score=1.00000  -  0.0s
[CV] svm__C=10.0, features__univ_select__k=2, features__pca__n_components=1
[CV] svm__C=10.0, features__univ_select__k=2, features__pca__n_components=1, score=0.98039  -  0.0s
[CV] svm__C=10.0, features__univ_select__k=2, features__pca__n_components=1
[CV] svm__C=10.0, features__univ_select__k=2, features__pca__n_components=1, score=0.90196  -  0.0s
[CV] svm__C=10.0, features__univ_select__k=2, features__pca__n_components=1
[CV] svm__C=10.0, features__univ_select__k=2, features__pca__n_components=1, score=1.00000  -  0.0s
[CV] svm__C=0.1, features__univ_select__k=1, features__pca__n_components=2
[CV] svm__C=0.1, features__univ_select__k=1, features__pca__n_components=2, score=0.96078  -  0.0s
[CV] svm__C=0.1, features__univ_select__k=1, features__pca__n_components=2
[CV] svm__C=0.1, features__univ_select__k=1, features__pca__n_components=2, score=0.90196  -  0.0s
[CV] svm__C=0.1, features__univ_select__k=1, features__pca__n_components=2
[CV] svm__C=0.1, features__univ_select__k=1, features__pca__n_components=2, score=0.97917  -  0.0s
[CV] svm__C=1.0, features__univ_select__k=1, features__pca__n_components=2
[CV] svm__C=1.0, features__univ_select__k=1, features__pca__n_components=2, score=0.98039  -  0.0s
[CV] svm__C=1.0, features__univ_select__k=1, features__pca__n_components=2
[CV] svm__C=1.0, features__univ_select__k=1, features__pca__n_components=2, score=0.94118  -  0.0s
[CV] svm__C=1.0, features__univ_select__k=1, features__pca__n_components=2
[CV] svm__C=1.0, features__univ_select__k=1, features__pca__n_components=2, score=0.97917  -  0.0s
[CV] svm__C=10.0, features__univ_select__k=1, features__pca__n_components=2
[CV] svm__C=10.0, features__univ_select__k=1, features__pca__n_components=2, score=0.98039  -  0.0s
[CV] svm__C=10.0, features__univ_select__k=1, features__pca__n_components=2
[CV] svm__C=10.0, features__univ_select__k=1, features__pca__n_components=2, score=0.94118  -  0.0s
[CV] svm__C=10.0, features__univ_select__k=1, features__pca__n_components=2
[CV] svm__C=10.0, features__univ_select__k=1, features__pca__n_components=2, score=0.97917  -  0.0s
[CV] svm__C=0.1, features__univ_select__k=2, features__pca__n_components=2
[CV] svm__C=0.1, features__univ_select__k=2, features__pca__n_components=2, score=0.98039  -  0.0s
[CV] svm__C=0.1, features__univ_select__k=2, features__pca__n_components=2
[CV] svm__C=0.1, features__univ_select__k=2, features__pca__n_components=2, score=0.94118  -  0.0s
[CV] svm__C=0.1, features__univ_select__k=2, features__pca__n_components=2
[CV] svm__C=0.1, features__univ_select__k=2, features__pca__n_components=2, score=0.97917  -  0.0s
[CV] svm__C=1.0, features__univ_select__k=2, features__pca__n_components=2
[CV] svm__C=1.0, features__univ_select__k=2, features__pca__n_components=2, score=1.00000  -  0.0s
[CV] svm__C=1.0, features__univ_select__k=2, features__pca__n_components=2
[CV] svm__C=1.0, features__univ_select__k=2, features__pca__n_components=2, score=0.96078  -  0.0s
[CV] svm__C=1.0, features__univ_select__k=2, features__pca__n_components=2
[CV] svm__C=1.0, features__univ_select__k=2, features__pca__n_components=2, score=0.97917  -  0.0s
[CV] svm__C=10.0, features__univ_select__k=2, features__pca__n_components=2
[CV] svm__C=10.0, features__univ_select__k=2, features__pca__n_components=2, score=0.98039  -  0.0s
[CV] svm__C=10.0, features__univ_select__k=2, features__pca__n_components=2
[CV] svm__C=10.0, features__univ_select__k=2, features__pca__n_components=2, score=0.92157  -  0.0s
[CV] svm__C=10.0, features__univ_select__k=2, features__pca__n_components=2
[CV] svm__C=10.0, features__univ_select__k=2, features__pca__n_components=2, score=1.00000  -  0.0s
[CV] svm__C=0.1, features__univ_select__k=1, features__pca__n_components=3
[CV] svm__C=0.1, features__univ_select__k=1, features__pca__n_components=3, score=0.98039  -  0.0s
[CV] svm__C=0.1, features__univ_select__k=1, features__pca__n_components=3
[CV] svm__C=0.1, features__univ_select__k=1, features__pca__n_components=3, score=0.94118  -  0.0s
[CV] svm__C=0.1, features__univ_select__k=1, features__pca__n_components=3
[CV] svm__C=0.1, features__univ_select__k=1, features__pca__n_components=3, score=0.97917  -  0.0s
[CV] svm__C=1.0, features__univ_select__k=1, features__pca__n_components=3
[CV] svm__C=1.0, features__univ_select__k=1, features__pca__n_components=3, score=1.00000  -  0.0s
[CV] svm__C=1.0, features__univ_select__k=1, features__pca__n_components=3
[CV] svm__C=1.0, features__univ_select__k=1, features__pca__n_components=3, score=0.94118  -  0.0s
[CV] svm__C=1.0, features__univ_select__k=1, features__pca__n_components=3
[CV] svm__C=1.0, features__univ_select__k=1, features__pca__n_components=3, score=0.97917  -  0.0s
[CV] svm__C=10.0, features__univ_select__k=1, features__pca__n_components=3
[CV] svm__C=10.0, features__univ_select__k=1, features__pca__n_components=3, score=1.00000  -  0.0s
[CV] svm__C=10.0, features__univ_select__k=1, features__pca__n_components=3
[CV] svm__C=10.0, features__univ_select__k=1, features__pca__n_components=3, score=0.92157  -  0.0s
[CV] svm__C=10.0, features__univ_select__k=1, features__pca__n_components=3
[CV] svm__C=10.0, features__univ_select__k=1, features__pca__n_components=3, score=1.00000  -  0.0s
[CV] svm__C=0.1, features__univ_select__k=2, features__pca__n_components=3
[CV] svm__C=0.1, features__univ_select__k=2, features__pca__n_components=3, score=0.98039  -  0.0s
[CV] svm__C=0.1, features__univ_select__k=2, features__pca__n_components=3
[CV] svm__C=0.1, features__univ_select__k=2, features__pca__n_components=3, score=0.94118  -  0.0s
[CV] svm__C=0.1, features__univ_select__k=2, features__pca__n_components=3
[CV] svm__C=0.1, features__univ_select__k=2, features__pca__n_components=3, score=0.97917  -  0.0s
[CV] svm__C=1.0, features__univ_select__k=2, features__pca__n_components=3
[CV] svm__C=1.0, features__univ_select__k=2, features__pca__n_components=3, score=1.00000  -  0.0s
[CV] svm__C=1.0, features__univ_select__k=2, features__pca__n_components=3
[CV] svm__C=1.0, features__univ_select__k=2, features__pca__n_components=3, score=0.96078  -  0.0s
[CV] svm__C=1.0, features__univ_select__k=2, features__pca__n_components=3
[CV] svm__C=1.0, features__univ_select__k=2, features__pca__n_components=3, score=0.97917  -  0.0s
[CV] svm__C=10.0, features__univ_select__k=2, features__pca__n_components=3
[CV] svm__C=10.0, features__univ_select__k=2, features__pca__n_components=3, score=1.00000  -  0.0s
[CV] svm__C=10.0, features__univ_select__k=2, features__pca__n_components=3
[CV] svm__C=10.0, features__univ_select__k=2, features__pca__n_components=3, score=0.92157  -  0.0s
[CV] svm__C=10.0, features__univ_select__k=2, features__pca__n_components=3
[CV] svm__C=10.0, features__univ_select__k=2, features__pca__n_components=3, score=1.00000  -  0.0s
ScikitLearn.Skcore.Pipeline(Tuple{Any,Any}[("features", ScikitLearn.Skcore.FeatureUnion(Tuple{Any,Any}[("pca", PyObject PCA(copy=True, iterated_power='auto', n_components=2, random_state=None,
  svd_solver='auto', tol=0.0, whiten=False)), ("univ_select", PyObject SelectKBest(k=2, score_func=<function f_classif at 0x7fa3e03899b0>))], 1, nothing)), ("svm", PyObject SVC(C=1.0, cache_size=200, class_weight=None, coef0=0.0,
  decision_function_shape='ovr', degree=3, gamma='auto', kernel='linear',
  max_iter=-1, probability=False, random_state=None, shrinking=True,
  tol=0.001, verbose=False))], Any[ScikitLearn.Skcore.FeatureUnion(Tuple{Any,Any}[("pca", PyObject PCA(copy=True, iterated_power='auto', n_components=2, random_state=None,
  svd_solver='auto', tol=0.0, whiten=False)), ("univ_select", PyObject SelectKBest(k=2, score_func=<function f_classif at 0x7fa3e03899b0>))], 1, nothing), PyObject SVC(C=1.0, cache_size=200, class_weight=None, coef0=0.0,
  decision_function_shape='ovr', degree=3, gamma='auto', kernel='linear',
  max_iter=-1, probability=False, random_state=None, shrinking=True,
  tol=0.001, verbose=False)])Testing ../examples/Gaussian_Processes_Julia.ipynb
WARNING: replacing module Testing

WARNING: deprecated syntax "typealias MatF64 AbstractMatrix{Float64}" at /home/vagrant/.julia/v0.6/GaussianProcesses/src/GaussianProcesses.jl:15.
Use "const MatF64 = AbstractMatrix{Float64}" instead.

WARNING: deprecated syntax "typealias VecF64 AbstractVector{Float64}" at /home/vagrant/.julia/v0.6/GaussianProcesses/src/GaussianProcesses.jl:16.
Use "const VecF64 = AbstractVector{Float64}" instead.

WARNING: deprecated syntax "abstract Mean" at /home/vagrant/.julia/v0.6/GaussianProcesses/src/means/meanFunctions.jl:6.
Use "abstract type Mean end" instead.

WARNING: deprecated syntax "abstract Kernel" at /home/vagrant/.julia/v0.6/GaussianProcesses/src/kernels/kernels.jl:6.
Use "abstract type Kernel end" instead.

WARNING: deprecated syntax "abstract KernelData" at /home/vagrant/.julia/v0.6/GaussianProcesses/src/kernels/kernels.jl:15.
Use "abstract type KernelData end" instead.

WARNING: deprecated syntax "abstract Stationary<:Kernel" at /home/vagrant/.julia/v0.6/GaussianProcesses/src/kernels/stationary.jl:7.
Use "abstract type Stationary<:Kernel end" instead.

WARNING: deprecated syntax "abstract StationaryData<:KernelData" at /home/vagrant/.julia/v0.6/GaussianProcesses/src/kernels/stationary.jl:8.
Use "abstract type StationaryData<:KernelData end" instead.

WARNING: deprecated syntax "abstract Isotropic<:Stationary" at /home/vagrant/.julia/v0.6/GaussianProcesses/src/kernels/stationary.jl:70.
Use "abstract type Isotropic<:Stationary end" instead.

WARNING: deprecated syntax "abstract StationaryARD<:Stationary" at /home/vagrant/.julia/v0.6/GaussianProcesses/src/kernels/stationary.jl:108.
Use "abstract type StationaryARD<:Stationary end" instead.

WARNING: deprecated syntax "abstract MaternIso<:Isotropic" at /home/vagrant/.julia/v0.6/GaussianProcesses/src/kernels/mat.jl:3.
Use "abstract type MaternIso<:Isotropic end" instead.

WARNING: deprecated syntax "abstract MaternARD<:StationaryARD" at /home/vagrant/.julia/v0.6/GaussianProcesses/src/kernels/mat.jl:4.
Use "abstract type MaternARD<:StationaryARD end" instead.
WARNING: exp{T <: Number}(x::AbstractArray{T}) is deprecated, use exp.(x) instead.
Stacktrace:
 [1] depwarn(::String, ::Symbol) at ./deprecated.jl:70
 [2] exp(::Array{Float64,1}) at ./deprecated.jl:57
 [3] set_params!(::GaussianProcesses.SEIso, ::Array{Float64,1}) at /home/vagrant/.julia/v0.6/GaussianProcesses/src/kernels/se_iso.jl:18
 [4] #set_params!#33(::Array{Any,1}, ::Function, ::GaussianProcesses.SEIso) at /home/vagrant/.julia/v0.6/GaussianProcesses/src/glue/ScikitLearn.jl:93
 [5] (::ScikitLearnBase.#kw##set_params!)(::Array{Any,1}, ::ScikitLearnBase.#set_params!, ::GaussianProcesses.SEIso) at ./<missing>:0
 [6] #set_params!#32(::Array{Any,1}, ::Function, ::GaussianProcesses.GP) at /home/vagrant/.julia/v0.6/GaussianProcesses/src/glue/ScikitLearn.jl:77
 [7] (::ScikitLearnBase.#kw##set_params!)(::Array{Any,1}, ::ScikitLearnBase.#set_params!, ::GaussianProcesses.GP) at ./<missing>:0
 [8] #_fit_and_score#96(::Bool, ::Bool, ::String, ::Function, ::GaussianProcesses.GP, ::Array{Float64,2}, ::Array{Float64,1}, ::Function, ::Array{Int64,1}, ::Array{Int64,1}, ::Int64, ::Dict{Symbol,Any}, ::Dict{Symbol,Any}) at /home/vagrant/.julia/v0.6/ScikitLearn/src/cross_validation.jl:559
 [9] (::ScikitLearn.Skcore.#kw##_fit_and_score)(::Array{Any,1}, ::ScikitLearn.Skcore.#_fit_and_score, ::GaussianProcesses.GP, ::Array{Float64,2}, ::Array{Float64,1}, ::Function, ::Array{Int64,1}, ::Array{Int64,1}, ::Int64, ::Dict{Symbol,Any}, ::Dict{Symbol,Any}) at ./<missing>:0
 [10] (::ScikitLearn.Skcore.##110#113{Dict{Any,Any},ScikitLearn.Skcore.GridSearchCV,Array{Float64,2},Array{Float64,1}})(::Tuple{Array{Int64,1},Array{Int64,1}}) at ./<missing>:0
 [11] collect(::Base.Generator{Array{Tuple{Array{Int64,1},Array{Int64,1}},1},ScikitLearn.Skcore.##110#113{Dict{Any,Any},ScikitLearn.Skcore.GridSearchCV,Array{Float64,2},Array{Float64,1}}}) at ./array.jl:441
 [12] copy!(::Array{Any,1}, ::Base.Generator{ScikitLearn.Skcore.ParameterGrid,ScikitLearn.Skcore.##109#112{ScikitLearn.Skcore.GridSearchCV,Array{Float64,2},Array{Float64,1}}}) at ./abstractarray.jl:572
 [13] _fit!(::ScikitLearn.Skcore.GridSearchCV, ::Array{Float64,2}, ::Array{Float64,1}, ::ScikitLearn.Skcore.ParameterGrid) at /home/vagrant/.julia/v0.6/ScikitLearn/src/grid_search.jl:274
 [14] fit!(::ScikitLearn.Skcore.GridSearchCV, ::Array{Float64,2}, ::Array{Float64,1}) at /home/vagrant/.julia/v0.6/ScikitLearn/src/grid_search.jl:558
 [15] include_string(::String, ::String) at ./loading.jl:515
 [16] my_include_string(::String, ::String, ::String) at /home/vagrant/.julia/v0.6/NBInclude/src/NBInclude.jl:31
 [17] #nbinclude#1(::Bool, ::UnitRange{Int64}, ::Regex, ::Base.#identity, ::Function, ::String) at /home/vagrant/.julia/v0.6/NBInclude/src/NBInclude.jl:112
 [18] nbinclude(::String) at /home/vagrant/.julia/v0.6/NBInclude/src/NBInclude.jl:76
 [19] run_examples() at /home/vagrant/.julia/v0.6/ScikitLearn/test/runtests.jl:36
 [20] include_from_node1(::String) at ./loading.jl:569
 [21] include(::String) at ./sysimg.jl:14
 [22] process_options(::Base.JLOptions) at ./client.jl:305
 [23] _start() at ./client.jl:371
while loading /home/vagrant/.julia/v0.6/ScikitLearn/test/../examples/Gaussian_Processes_Julia.ipynb:In[3], in expression starting on line 1
WARNING: Array{T}(::Type{T}, m::Int) is deprecated, use Array{T}(m) instead.
Stacktrace:
 [1] depwarn(::String, ::Symbol) at ./deprecated.jl:70
 [2] Array(::Type{Float64}, ::Int64) at ./deprecated.jl:57
 [3] #predict#17(::Bool, ::Function, ::GaussianProcesses.GP, ::Array{Float64,2}) at /home/vagrant/.julia/v0.6/GaussianProcesses/src/GP.jl:206
 [4] (::GaussianProcesses.#kw##predict)(::Array{Any,1}, ::GaussianProcesses.#predict, ::GaussianProcesses.GP, ::Array{Float64,2}) at ./<missing>:0
 [5] #predict#29(::Bool, ::Function, ::GaussianProcesses.GP, ::Array{Float64,2}) at /home/vagrant/.julia/v0.6/GaussianProcesses/src/glue/ScikitLearn.jl:10
 [6] score at /home/vagrant/.julia/v0.6/GaussianProcesses/src/glue/ScikitLearn.jl:24 [inlined]
 [7] _score(::GaussianProcesses.GP, ::Array{Float64,2}, ::Array{Float64,1}, ::ScikitLearnBase.#score) at /home/vagrant/.julia/v0.6/ScikitLearn/src/cross_validation.jl:651
 [8] #_fit_and_score#96(::Bool, ::Bool, ::String, ::Function, ::GaussianProcesses.GP, ::Array{Float64,2}, ::Array{Float64,1}, ::Function, ::Array{Int64,1}, ::Array{Int64,1}, ::Int64, ::Dict{Symbol,Any}, ::Dict{Symbol,Any}) at /home/vagrant/.julia/v0.6/ScikitLearn/src/cross_validation.jl:574
 [9] (::ScikitLearn.Skcore.#kw##_fit_and_score)(::Array{Any,1}, ::ScikitLearn.Skcore.#_fit_and_score, ::GaussianProcesses.GP, ::Array{Float64,2}, ::Array{Float64,1}, ::Function, ::Array{Int64,1}, ::Array{Int64,1}, ::Int64, ::Dict{Symbol,Any}, ::Dict{Symbol,Any}) at ./<missing>:0
 [10] (::ScikitLearn.Skcore.##110#113{Dict{Any,Any},ScikitLearn.Skcore.GridSearchCV,Array{Float64,2},Array{Float64,1}})(::Tuple{Array{Int64,1},Array{Int64,1}}) at ./<missing>:0
 [11] collect(::Base.Generator{Array{Tuple{Array{Int64,1},Array{Int64,1}},1},ScikitLearn.Skcore.##110#113{Dict{Any,Any},ScikitLearn.Skcore.GridSearchCV,Array{Float64,2},Array{Float64,1}}}) at ./array.jl:441
 [12] copy!(::Array{Any,1}, ::Base.Generator{ScikitLearn.Skcore.ParameterGrid,ScikitLearn.Skcore.##109#112{ScikitLearn.Skcore.GridSearchCV,Array{Float64,2},Array{Float64,1}}}) at ./abstractarray.jl:572
 [13] _fit!(::ScikitLearn.Skcore.GridSearchCV, ::Array{Float64,2}, ::Array{Float64,1}, ::ScikitLearn.Skcore.ParameterGrid) at /home/vagrant/.julia/v0.6/ScikitLearn/src/grid_search.jl:274
 [14] fit!(::ScikitLearn.Skcore.GridSearchCV, ::Array{Float64,2}, ::Array{Float64,1}) at /home/vagrant/.julia/v0.6/ScikitLearn/src/grid_search.jl:558
 [15] include_string(::String, ::String) at ./loading.jl:515
 [16] my_include_string(::String, ::String, ::String) at /home/vagrant/.julia/v0.6/NBInclude/src/NBInclude.jl:31
 [17] #nbinclude#1(::Bool, ::UnitRange{Int64}, ::Regex, ::Base.#identity, ::Function, ::String) at /home/vagrant/.julia/v0.6/NBInclude/src/NBInclude.jl:112
 [18] nbinclude(::String) at /home/vagrant/.julia/v0.6/NBInclude/src/NBInclude.jl:76
 [19] run_examples() at /home/vagrant/.julia/v0.6/ScikitLearn/test/runtests.jl:36
 [20] include_from_node1(::String) at ./loading.jl:569
 [21] include(::String) at ./sysimg.jl:14
 [22] process_options(::Base.JLOptions) at ./client.jl:305
 [23] _start() at ./client.jl:371
while loading /home/vagrant/.julia/v0.6/ScikitLearn/test/../examples/Gaussian_Processes_Julia.ipynb:In[3], in expression starting on line 1
(get_params(best_gp))[:logNoise] = 2.6
(get_params(best_gp))[:k_lσ] = 4.8
WARNING: Array{T}(::Type{T}, m::Int) is deprecated, use Array{T}(m) instead.
Stacktrace:
 [1] depwarn(::String, ::Symbol) at ./deprecated.jl:70
 [2] Array(::Type{Float64}, ::Int64) at ./deprecated.jl:57
 [3] #predict#17(::Bool, ::Function, ::GaussianProcesses.GP, ::Array{Float64,2}) at /home/vagrant/.julia/v0.6/GaussianProcesses/src/GP.jl:206
 [4] (::GaussianProcesses.#kw##predict)(::Array{Any,1}, ::GaussianProcesses.#predict, ::GaussianProcesses.GP, ::Array{Float64,2}) at ./<missing>:0
 [5] #predict#29(::Bool, ::Function, ::GaussianProcesses.GP, ::Array{Float64,2}) at /home/vagrant/.julia/v0.6/GaussianProcesses/src/glue/ScikitLearn.jl:10
 [6] predict(::GaussianProcesses.GP, ::Array{Float64,2}) at /home/vagrant/.julia/v0.6/GaussianProcesses/src/glue/ScikitLearn.jl:10
 [7] include_string(::String, ::String) at ./loading.jl:515
 [8] my_include_string(::String, ::String, ::String) at /home/vagrant/.julia/v0.6/NBInclude/src/NBInclude.jl:31
 [9] #nbinclude#1(::Bool, ::UnitRange{Int64}, ::Regex, ::Base.#identity, ::Function, ::String) at /home/vagrant/.julia/v0.6/NBInclude/src/NBInclude.jl:112
 [10] nbinclude(::String) at /home/vagrant/.julia/v0.6/NBInclude/src/NBInclude.jl:76
 [11] run_examples() at /home/vagrant/.julia/v0.6/ScikitLearn/test/runtests.jl:36
 [12] include_from_node1(::String) at ./loading.jl:569
 [13] include(::String) at ./sysimg.jl:14
 [14] process_options(::Base.JLOptions) at ./client.jl:305
 [15] _start() at ./client.jl:371
while loading /home/vagrant/.julia/v0.6/ScikitLearn/test/../examples/Gaussian_Processes_Julia.ipynb:In[4], in expression starting on line 2
WARNING: Array{T}(::Type{T}, m::Int) is deprecated, use Array{T}(m) instead.
Stacktrace:
 [1] depwarn(::String, ::Symbol) at ./deprecated.jl:70
 [2] Array(::Type{Float64}, ::Int64) at ./deprecated.jl:57
 [3] #predict#17(::Bool, ::Function, ::GaussianProcesses.GP, ::Array{Float64,2}) at /home/vagrant/.julia/v0.6/GaussianProcesses/src/GP.jl:206
 [4] (::GaussianProcesses.#kw##predict)(::Array{Any,1}, ::GaussianProcesses.#predict, ::GaussianProcesses.GP, ::Array{Float64,2}) at ./<missing>:0
 [5] #predict#29(::Bool, ::Function, ::GaussianProcesses.GP, ::Array{Float64,2}) at /home/vagrant/.julia/v0.6/GaussianProcesses/src/glue/ScikitLearn.jl:10
 [6] predict(::GaussianProcesses.GP, ::Array{Float64,2}) at /home/vagrant/.julia/v0.6/GaussianProcesses/src/glue/ScikitLearn.jl:10
 [7] include_string(::String, ::String) at ./loading.jl:515
 [8] my_include_string(::String, ::String, ::String) at /home/vagrant/.julia/v0.6/NBInclude/src/NBInclude.jl:31
 [9] #nbinclude#1(::Bool, ::UnitRange{Int64}, ::Regex, ::Base.#identity, ::Function, ::String) at /home/vagrant/.julia/v0.6/NBInclude/src/NBInclude.jl:112
 [10] nbinclude(::String) at /home/vagrant/.julia/v0.6/NBInclude/src/NBInclude.jl:76
 [11] run_examples() at /home/vagrant/.julia/v0.6/ScikitLearn/test/runtests.jl:36
 [12] include_from_node1(::String) at ./loading.jl:569
 [13] include(::String) at ./sysimg.jl:14
 [14] process_options(::Base.JLOptions) at ./client.jl:305
 [15] _start() at ./client.jl:371
while loading /home/vagrant/.julia/v0.6/ScikitLearn/test/../examples/Gaussian_Processes_Julia.ipynb:In[4], in expression starting on line 3
WARNING: cos{T <: Number}(x::AbstractArray{T}) is deprecated, use cos.(x) instead.
Stacktrace:
 [1] depwarn(::String, ::Symbol) at ./deprecated.jl:70
 [2] cos(::Array{Float64,1}) at ./deprecated.jl:57
 [3] true_fun(::Array{Float64,1}) at /home/vagrant/.julia/v0.6/ScikitLearn/test/../examples/Gaussian_Processes_Julia.ipynb:In[7]:6
 [4] include_string(::String, ::String) at ./loading.jl:515
 [5] my_include_string(::String, ::String, ::String) at /home/vagrant/.julia/v0.6/NBInclude/src/NBInclude.jl:31
 [6] #nbinclude#1(::Bool, ::UnitRange{Int64}, ::Regex, ::Base.#identity, ::Function, ::String) at /home/vagrant/.julia/v0.6/NBInclude/src/NBInclude.jl:112
 [7] nbinclude(::String) at /home/vagrant/.julia/v0.6/NBInclude/src/NBInclude.jl:76
 [8] run_examples() at /home/vagrant/.julia/v0.6/ScikitLearn/test/runtests.jl:36
 [9] include_from_node1(::String) at ./loading.jl:569
 [10] include(::String) at ./sysimg.jl:14
 [11] process_options(::Base.JLOptions) at ./client.jl:305
 [12] _start() at ./client.jl:371
while loading /home/vagrant/.julia/v0.6/ScikitLearn/test/../examples/Gaussian_Processes_Julia.ipynb:In[7], in expression starting on line 8
WARNING: Array{T}(::Type{T}, m::Int) is deprecated, use Array{T}(m) instead.
Stacktrace:
 [1] depwarn(::String, ::Symbol) at ./deprecated.jl:70
 [2] Array(::Type{Float64}, ::Int64) at ./deprecated.jl:57
 [3] #predict#17(::Bool, ::Function, ::GaussianProcesses.GP, ::Array{Float64,2}) at /home/vagrant/.julia/v0.6/GaussianProcesses/src/GP.jl:206
 [4] (::GaussianProcesses.#kw##predict)(::Array{Any,1}, ::GaussianProcesses.#predict, ::GaussianProcesses.GP, ::Array{Float64,2}) at ./<missing>:0
 [5] #predict#29(::Bool, ::Function, ::GaussianProcesses.GP, ::Array{Float64,2}) at /home/vagrant/.julia/v0.6/GaussianProcesses/src/glue/ScikitLearn.jl:10
 [6] predict(::GaussianProcesses.GP, ::Array{Float64,2}) at /home/vagrant/.julia/v0.6/GaussianProcesses/src/glue/ScikitLearn.jl:10
 [7] include_string(::String, ::String) at ./loading.jl:515
 [8] my_include_string(::String, ::String, ::String) at /home/vagrant/.julia/v0.6/NBInclude/src/NBInclude.jl:31
 [9] #nbinclude#1(::Bool, ::UnitRange{Int64}, ::Regex, ::Base.#identity, ::Function, ::String) at /home/vagrant/.julia/v0.6/NBInclude/src/NBInclude.jl:112
 [10] nbinclude(::String) at /home/vagrant/.julia/v0.6/NBInclude/src/NBInclude.jl:76
 [11] run_examples() at /home/vagrant/.julia/v0.6/ScikitLearn/test/runtests.jl:36
 [12] include_from_node1(::String) at ./loading.jl:569
 [13] include(::String) at ./sysimg.jl:14
 [14] process_options(::Base.JLOptions) at ./client.jl:305
 [15] _start() at ./client.jl:371
while loading /home/vagrant/.julia/v0.6/ScikitLearn/test/../examples/Gaussian_Processes_Julia.ipynb:In[7], in expression starting on line 13
WARNING: cos{T <: Number}(x::AbstractArray{T}) is deprecated, use cos.(x) instead.
Stacktrace:
 [1] depwarn(::String, ::Symbol) at ./deprecated.jl:70
 [2] cos(::StepRangeLen{Float64,Base.TwicePrecision{Float64},Base.TwicePrecision{Float64}}) at ./deprecated.jl:57
 [3] true_fun(::StepRangeLen{Float64,Base.TwicePrecision{Float64},Base.TwicePrecision{Float64}}) at /home/vagrant/.julia/v0.6/ScikitLearn/test/../examples/Gaussian_Processes_Julia.ipynb:In[7]:6
 [4] include_string(::String, ::String) at ./loading.jl:515
 [5] my_include_string(::String, ::String, ::String) at /home/vagrant/.julia/v0.6/NBInclude/src/NBInclude.jl:31
 [6] #nbinclude#1(::Bool, ::UnitRange{Int64}, ::Regex, ::Base.#identity, ::Function, ::String) at /home/vagrant/.julia/v0.6/NBInclude/src/NBInclude.jl:112
 [7] nbinclude(::String) at /home/vagrant/.julia/v0.6/NBInclude/src/NBInclude.jl:76
 [8] run_examples() at /home/vagrant/.julia/v0.6/ScikitLearn/test/runtests.jl:36
 [9] include_from_node1(::String) at ./loading.jl:569
 [10] include(::String) at ./sysimg.jl:14
 [11] process_options(::Base.JLOptions) at ./client.jl:305
 [12] _start() at ./client.jl:371
while loading /home/vagrant/.julia/v0.6/ScikitLearn/test/../examples/Gaussian_Processes_Julia.ipynb:In[7], in expression starting on line 14
WARNING: Array{T}(::Type{T}, m::Int) is deprecated, use Array{T}(m) instead.
Stacktrace:
 [1] depwarn(::String, ::Symbol) at ./deprecated.jl:70
 [2] Array(::Type{Float64}, ::Int64) at ./deprecated.jl:57
 [3] #predict#17(::Bool, ::Function, ::GaussianProcesses.GP, ::Array{Float64,2}) at /home/vagrant/.julia/v0.6/GaussianProcesses/src/GP.jl:206
 [4] (::GaussianProcesses.#kw##predict)(::Array{Any,1}, ::GaussianProcesses.#predict, ::GaussianProcesses.GP, ::Array{Float64,2}) at ./<missing>:0
 [5] #predict#29(::Bool, ::Function, ::GaussianProcesses.GP, ::Array{Float64,2}) at /home/vagrant/.julia/v0.6/GaussianProcesses/src/glue/ScikitLearn.jl:10
 [6] score at /home/vagrant/.julia/v0.6/GaussianProcesses/src/glue/ScikitLearn.jl:24 [inlined]
 [7] _score(::GaussianProcesses.GP, ::Array{Float64,2}, ::Array{Float64,1}, ::ScikitLearnBase.#score) at /home/vagrant/.julia/v0.6/ScikitLearn/src/cross_validation.jl:651
 [8] #_fit_and_score#96(::Bool, ::Bool, ::String, ::Function, ::GaussianProcesses.GP, ::Array{Float64,2}, ::Array{Float64,1}, ::Function, ::Array{Int64,1}, ::Array{Int64,1}, ::Int64, ::Void, ::Void) at /home/vagrant/.julia/v0.6/ScikitLearn/src/cross_validation.jl:574
 [9] (::ScikitLearn.Skcore.##84#85{Int64,Void,GaussianProcesses.GP,Array{Float64,2},Array{Float64,1}})(::Tuple{Array{Int64,1},Array{Int64,1}}) at ./<missing>:0
 [10] copy!(::Array{Float64,1}, ::Base.Generator{Array{Tuple{Array{Int64,1},Array{Int64,1}},1},ScikitLearn.Skcore.##84#85{Int64,Void,GaussianProcesses.GP,Array{Float64,2},Array{Float64,1}}}) at ./abstractarray.jl:572
 [11] _collect(::Type{Float64}, ::Base.Generator{Array{Tuple{Array{Int64,1},Array{Int64,1}},1},ScikitLearn.Skcore.##84#85{Int64,Void,GaussianProcesses.GP,Array{Float64,2},Array{Float64,1}}}, ::Base.HasShape) at ./array.jl:363
 [12] #cross_val_score#83(::Void, ::Int64, ::Int64, ::Int64, ::Void, ::Function, ::GaussianProcesses.GP, ::Array{Float64,2}, ::Array{Float64,1}) at /home/vagrant/.julia/v0.6/ScikitLearn/src/cross_validation.jl:279
 [13] (::ScikitLearn.Skcore.#kw##cross_val_score)(::Array{Any,1}, ::ScikitLearn.Skcore.#cross_val_score, ::GaussianProcesses.GP, ::Array{Float64,2}, ::Array{Float64,1}) at ./<missing>:0
 [14] include_string(::String, ::String) at ./loading.jl:515
 [15] my_include_string(::String, ::String, ::String) at /home/vagrant/.julia/v0.6/NBInclude/src/NBInclude.jl:31
 [16] #nbinclude#1(::Bool, ::UnitRange{Int64}, ::Regex, ::Base.#identity, ::Function, ::String) at /home/vagrant/.julia/v0.6/NBInclude/src/NBInclude.jl:112
 [17] nbinclude(::String) at /home/vagrant/.julia/v0.6/NBInclude/src/NBInclude.jl:76
 [18] run_examples() at /home/vagrant/.julia/v0.6/ScikitLearn/test/runtests.jl:36
 [19] include_from_node1(::String) at ./loading.jl:569
 [20] include(::String) at ./sysimg.jl:14
 [21] process_options(::Base.JLOptions) at ./client.jl:305
 [22] _start() at ./client.jl:371
while loading /home/vagrant/.julia/v0.6/ScikitLearn/test/../examples/Gaussian_Processes_Julia.ipynb:In[8], in expression starting on line 1
Testing ../examples/Outlier_Detection.ipynb
WARNING: replacing module Testing
Testing ../examples/Pipeline_PCA_Logistic.ipynb
WARNING: replacing module Testing
Testing ../examples/Plot_Kmeans_Digits.ipynb
WARNING: replacing module Testing
n_digits: 10, 	 n_samples 1797, 	 n_features 64
____________________________________________________________________________
init    time  inertia    homo   compl  v-meas     ARI AMI  silhouette
k-means++   0.18s    69477   0.613   0.660   0.636   0.482   0.609    0.124
   random   0.19s    69763   0.661   0.708   0.684   0.546   0.658    0.139
PCA-based   0.03s    70769   0.669   0.696   0.683   0.558   0.666    0.134
____________________________________________________________________________Testing ../examples/Randomized_Search.ipynb
WARNING: replacing module Testing
RandomizedSearchCV took 3.85 seconds for 20 candidates, parameter settings.
Model with rank:1
Mean validation score: 0.927 (std: 0.012)
Parameters: Dict{Symbol,Any}(Pair{Symbol,Any}(:bootstrap, false),Pair{Symbol,Any}(:max_features, 6),Pair{Symbol,Any}(:min_samples_split, 7),Pair{Symbol,Any}(:min_samples_leaf, 4),Pair{Symbol,Any}(:criterion, "gini"),Pair{Symbol,Any}(:max_depth, nothing))

Model with rank:2
Mean validation score: 0.922 (std: 0.007)
Parameters: Dict{Symbol,Any}(Pair{Symbol,Any}(:bootstrap, false),Pair{Symbol,Any}(:max_features, 4),Pair{Symbol,Any}(:min_samples_split, 8),Pair{Symbol,Any}(:min_samples_leaf, 6),Pair{Symbol,Any}(:criterion, "entropy"),Pair{Symbol,Any}(:max_depth, nothing))

Model with rank:3
Mean validation score: 0.916 (std: 0.023)
Parameters: Dict{Symbol,Any}(Pair{Symbol,Any}(:bootstrap, false),Pair{Symbol,Any}(:max_features, 10),Pair{Symbol,Any}(:min_samples_split, 8),Pair{Symbol,Any}(:min_samples_leaf, 8),Pair{Symbol,Any}(:criterion, "gini"),Pair{Symbol,Any}(:max_depth, nothing))

GridSearchCV took 37.24 seconds for 216 candidate parameter settings.
Model with rank:1
Mean validation score: 0.933 (std: 0.009)
Parameters: Dict{Symbol,Any}(Pair{Symbol,Any}(:bootstrap, false),Pair{Symbol,Any}(:max_features, 10),Pair{Symbol,Any}(:min_samples_split, 3),Pair{Symbol,Any}(:min_samples_leaf, 1),Pair{Symbol,Any}(:criterion, "entropy"),Pair{Symbol,Any}(:max_depth, nothing))

Model with rank:2
Mean validation score: 0.932 (std: 0.014)
Parameters: Dict{Symbol,Any}(Pair{Symbol,Any}(:bootstrap, false),Pair{Symbol,Any}(:max_features, 10),Pair{Symbol,Any}(:min_samples_split, 2),Pair{Symbol,Any}(:min_samples_leaf, 3),Pair{Symbol,Any}(:criterion, "entropy"),Pair{Symbol,Any}(:max_depth, nothing))

Model with rank:3
Mean validation score: 0.932 (std: 0.014)
Parameters: Dict{Symbol,Any}(Pair{Symbol,Any}(:bootstrap, false),Pair{Symbol,Any}(:max_features, 10),Pair{Symbol,Any}(:min_samples_split, 3),Pair{Symbol,Any}(:min_samples_leaf, 3),Pair{Symbol,Any}(:criterion, "entropy"),Pair{Symbol,Any}(:max_depth, nothing))

(predict(random_search, X))[1:10] = [0, 1, 2, 3, 4, 5, 6, 7, 8, 9]
(predict_proba(random_search, X))[1:10] = [1.0, 0.0, 0.02, 0.0, 0.144167, 0.0, 0.0125, 0.0, 0.0, 0.0]
score(random_search, X, y) = 0.9994435169727324
Testing ../examples/RBM.ipynb
WARNING: replacing module Testing
Logistic regression using RBM features:
             precision    recall  f1-score   support

          0       0.99      0.98      0.99       174
          1       0.94      0.95      0.94       184
          2       0.96      0.98      0.97       166
          3       0.96      0.88      0.92       194
          4       0.96      0.95      0.96       186
          5       0.90      0.92      0.91       181
          6       0.99      0.97      0.98       207
          7       0.94      0.98      0.96       154
          8       0.89      0.90      0.89       182
          9       0.90      0.92      0.91       169

avg / total       0.94      0.94      0.94      1797

Logistic regression using raw pixel features:
             precision    recall  f1-score   support

          0       0.86      0.94      0.90       174
          1       0.55      0.53      0.54       184
          2       0.79      0.86      0.82       166
          3       0.78      0.73      0.75       194
          4       0.86      0.83      0.85       186
          5       0.79      0.77      0.78       181
          6       0.89      0.89      0.89       207
          7       0.85      0.93      0.89       154
          8       0.65      0.60      0.63       182
          9       0.71      0.72      0.72       169

avg / total       0.77      0.78      0.78      1797

Testing ../examples/Text_Feature_Extraction.ipynb
WARNING: replacing module Testing
Loading 20 newsgroups dataset for categories:String["alt.atheism", "talk.religion.misc"]Downloading 20news dataset. This may take a few minutes.
Downloading dataset from https://ndownloader.figshare.com/files/5975967 (14 MB)
857 documents
2 categories

/home/vagrant/.julia/v0.6/Conda/deps/usr/lib/python2.7/site-packages/sklearn/linear_model/stochastic_gradient.py:84: FutureWarning: max_iter and tol parameters have been added in <class 'sklearn.linear_model.stochastic_gradient.SGDClassifier'> in 0.19. If both are left unset, they default to max_iter=5 and tol=None. If tol is not None, max_iter defaults to max_iter=1000. From 0.21, default max_iter will be 1000, and default tol will be 1e-3.
  "and default tol will be 1e-3." % type(self), FutureWarning)
Performing grid search...
pipeline:String["vect", "tfidf", "clf"]
parameters:
Dict{String,Any}(Pair{String,Any}("vect__max_df", (0.5, 0.75, 1.0)),Pair{String,Any}("clf__penalty", ("l2", "elasticnet")),Pair{String,Any}("clf__alpha", (1.0e-5, 1.0e-6)),Pair{String,Any}("vect__ngram_range", ((1, 1), (1, 2))))
Fitting 3 folds for each of 24 candidates, totalling 72 fits
done in 7.163s
Best score: 0.860
Best parameters set:
	vect__max_df: 0.75
	clf__penalty: l2
	clf__alpha: 1.0e-5
	vect__ngram_range: (1, 2)
Testing ../examples/Two_Class_Adaboost.ipynb
WARNING: replacing module Testing
Testing ../examples/Underfitting_vs_Overfitting.ipynb
WARNING: replacing module Testing
[BernoulliRBM] Iteration 1, pseudo-likelihood = -25.54, time = 0.17s
[BernoulliRBM] Iteration 2, pseudo-likelihood = -23.94, time = 0.24s
[BernoulliRBM] Iteration 3, pseudo-likelihood = -22.98, time = 0.24s
[BernoulliRBM] Iteration 4, pseudo-likelihood = -21.98, time = 0.24s
[BernoulliRBM] Iteration 5, pseudo-likelihood = -21.48, time = 0.24s
[BernoulliRBM] Iteration 6, pseudo-likelihood = -21.06, time = 0.23s
[BernoulliRBM] Iteration 7, pseudo-likelihood = -20.93, time = 0.23s
[BernoulliRBM] Iteration 8, pseudo-likelihood = -20.49, time = 0.23s
[BernoulliRBM] Iteration 9, pseudo-likelihood = -20.27, time = 0.23s
[BernoulliRBM] Iteration 10, pseudo-likelihood = -20.18, time = 0.23s
[BernoulliRBM] Iteration 11, pseudo-likelihood = -20.02, time = 0.23s
[BernoulliRBM] Iteration 12, pseudo-likelihood = -19.73, time = 0.23s
[BernoulliRBM] Iteration 13, pseudo-likelihood = -19.86, time = 0.23s
[BernoulliRBM] Iteration 14, pseudo-likelihood = -19.64, time = 0.23s
[BernoulliRBM] Iteration 15, pseudo-likelihood = -19.61, time = 0.23s
[BernoulliRBM] Iteration 16, pseudo-likelihood = -19.40, time = 0.23s
[BernoulliRBM] Iteration 17, pseudo-likelihood = -19.19, time = 0.23s
[BernoulliRBM] Iteration 18, pseudo-likelihood = -19.16, time = 0.23s
[BernoulliRBM] Iteration 19, pseudo-likelihood = -19.13, time = 0.23s
[BernoulliRBM] Iteration 20, pseudo-likelihood = -19.08, time = 0.23s
INFO: ScikitLearn tests passed
INFO: Removing ArrayViews v0.6.4
INFO: Removing Blosc v0.3.0
INFO: Removing Calculus v0.2.2
INFO: Removing Clustering v0.8.0
INFO: Removing ColorTypes v0.6.1
INFO: Removing Colors v0.8.1
INFO: Removing CommonSubexpressions v0.0.1
INFO: Removing DecisionTree v0.6.2
INFO: Removing DiffBase v0.2.0
INFO: Removing Distances v0.5.0
INFO: Removing Distributions v0.14.2
INFO: Removing FixedPointNumbers v0.4.0
INFO: Removing ForwardDiff v0.5.0
INFO: Removing GaussianMixtures v0.1.0
INFO: Removing GaussianProcesses v0.4.0
INFO: Removing HDF5 v0.8.5
INFO: Removing JLD v0.8.1
INFO: Removing LaTeXStrings v0.2.1
INFO: Removing LegacyStrings v0.2.2
INFO: Removing LineSearches v2.2.1
INFO: Removing LowRankModels v0.2.0
INFO: Removing NBInclude v1.2.0
INFO: Removing NLSolversBase v2.1.3
INFO: Removing NMF v0.2.5
INFO: Removing NaNMath v0.2.6
INFO: Removing NearestNeighbors v0.3.0
INFO: Removing Optim v0.9.3
INFO: Removing PDMats v0.7.0
INFO: Removing PositiveFactorizations v0.0.4
INFO: Removing PyPlot v2.3.2
INFO: Removing QuadGK v0.1.3
INFO: Removing RData v0.1.0
INFO: Removing RDatasets v0.2.0
INFO: Removing RealInterface v0.0.3
INFO: Removing Rmath v0.3.0
INFO: Removing Roots v0.4.1
INFO: Removing StaticArrays v0.6.2
INFO: Removing StatsFuns v0.5.0

>>> End of log
